Case ID,DeeplinkUrl,GerechtelijkProductType,InformatieNietGepubliceerdMessage,InterneUrl,IsInactief,Proceduresoorten,Publicatiedatum,PublicatiedatumDate,Publicatiestatus,Rechtsgebieden,RelatieVerwijzingen,Tekstfragment,Titel,TitelEmphasis,Uitspraakdatum,UitspraakdatumType,Vindplaatsen
ECLI-NL-RBDHA-2020-1755,http://deeplink.rechtspraak.nl/uitspraak?id=ECLI:NL:RBDHA:2020:1755,uitspraak,De publicatie van de uitspraak staat gepland op 02-03-2020 om 14:14 uur,https://uitspraken.rechtspraak.nl/inziendocument?id=ECLI:NL:RBDHA:2020:1755&showbutton=true&keyword=mensenhandel,0.0,['Eerste aanleg - enkelvoudig'],02-03-2020,2020-03-02T14:14:23Z,gepubliceerd,['Bestuursrecht; Vreemdelingenrecht'],[],"Mensenhandel, aangifte mensenhandel, sepot, WBV2019/10","Rechtbank Den Haag, 20-02-2020, AWB 19/8168",ECLI:NL:RBDHA:2020:1755,20-02-2020,uitspraak,"[{'Vindplaats': 'Rechtspraak.nl', 'VindplaatsAnnotator': '', 'VindplaatsUrl': ''}]"
ECLI-NL-RBNHO-2014-5860,http://deeplink.rechtspraak.nl/uitspraak?id=ECLI:NL:RBNHO:2014:5860,uitspraak,De publicatie van de uitspraak staat gepland op 25-06-2014 om 11:40 uur,https://uitspraken.rechtspraak.nl/inziendocument?id=ECLI:NL:RBNHO:2014:5860&showbutton=true&keyword=mensenhandel,0.0,['Eerste aanleg - meervoudig'],25-06-2014,2014-06-25T11:40:15Z,gepubliceerd,['Strafrecht'],[],Onderzoek Zwaluw (mensenhandel). Integrale vrijspraak mensenhandel en deelneming aan een criminele organisatie.,"Rechtbank Noord-Holland, 28-04-2014, 15/743003-13",ECLI:NL:RBNHO:2014:5860,28-04-2014,uitspraak,"[{'Vindplaats': 'Rechtspraak.nl', 'VindplaatsAnnotator': '', 'VindplaatsUrl': ''}]"
ECLI-NL-GHARN-2010-BO8406,http://deeplink.rechtspraak.nl/uitspraak?id=ECLI:NL:GHARN:2010:BO8406,uitspraak,De publicatie van de uitspraak staat gepland op 22-12-2010 om 15:38 uur,https://uitspraken.rechtspraak.nl/inziendocument?id=ECLI:NL:GHARN:2010:BO8406&showbutton=true&keyword=mensenhandel,0.0,['Hoger beroep'],22-12-2010,2010-12-22T15:38:08Z,gepubliceerd,['Strafrecht'],[],Sneep-zaak. Mensenhandel. Misdadige organisatie. Toetsingskader mensenhandel. Bewijswaardering. Geheimhoudersgesprekken en strafvermindering. Beoordeling rechtsmacht op grond van art. 2 Sr.,"Gerechtshof Arnhem, 20-12-2010, 21-003146-08",ECLI:NL:GHARN:2010:BO8406,20-12-2010,uitspraak,"[{'Vindplaats': 'Rechtspraak.nl', 'VindplaatsAnnotator': '', 'VindplaatsUrl': ''}]"
ECLI-NL-RBSHE-2010-BL5303,http://deeplink.rechtspraak.nl/uitspraak?id=ECLI:NL:RBSHE:2010:BL5303,uitspraak,De publicatie van de uitspraak staat gepland op 25-02-2010 om 13:22 uur,https://uitspraken.rechtspraak.nl/inziendocument?id=ECLI:NL:RBSHE:2010:BL5303&showbutton=true&keyword=mensenhandel,0.0,['Eerste aanleg - meervoudig'],25-02-2010,2010-02-25T13:22:47Z,gepubliceerd,['Strafrecht'],[],"Vrijspraak voor primair onder 1 tenlastegelegde  mensenhandel, omdat met name niet bewezen is dat er enige vorm van dwang of geweld heeft plaatsgevonden.
Wel veroordeling voor poging tot mensenhandel en mensenhandel (voor wat betreft het onder 2 tenlastegelegde).
Hiervoor heeft de rechtbank een deels voorwaardelijke gevangenisstraf en een werkstraf opgelegd, omdat er sprake is van een van de minst ernstige vormen van mensenhandel.","Rechtbank 's-Hertogenbosch, 19-02-2010, 01.839147-08",ECLI:NL:RBSHE:2010:BL5303,19-02-2010,uitspraak,"[{'Vindplaats': 'Rechtspraak.nl', 'VindplaatsAnnotator': '', 'VindplaatsUrl': ''}]"
ECLI-NL-RBDHA-2019-1894,http://deeplink.rechtspraak.nl/uitspraak?id=ECLI:NL:RBDHA:2019:1894,uitspraak,De publicatie van de uitspraak staat gepland op 01-03-2019 om 16:40 uur,https://uitspraken.rechtspraak.nl/inziendocument?id=ECLI:NL:RBDHA:2019:1894&showbutton=true&keyword=mensenhandel,0.0,['Eerste aanleg - meervoudig'],01-03-2019,2019-03-01T16:40:58Z,gepubliceerd,['Strafrecht'],[],Mensenhandel. Gevangenisstraf van 32 maanden voor mensenhandel en mishandelingen. Verwerping verweer ten aanzien van de geldigheid van de dagvaarding. Vrijspraak verkrachtingen.,"Rechtbank Den Haag, 01-03-2019, 09/767169-18",ECLI:NL:RBDHA:2019:1894,01-03-2019,uitspraak,"[{'Vindplaats': 'Rechtspraak.nl', 'VindplaatsAnnotator': '', 'VindplaatsUrl': ''}]"
ECLI-NL-GHARN-2010-BO8394,http://deeplink.rechtspraak.nl/uitspraak?id=ECLI:NL:GHARN:2010:BO8394,uitspraak,De publicatie van de uitspraak staat gepland op 22-12-2010 om 15:05 uur,https://uitspraken.rechtspraak.nl/inziendocument?id=ECLI:NL:GHARN:2010:BO8394&showbutton=true&keyword=mensenhandel,0.0,['Hoger beroep'],22-12-2010,2010-12-22T15:05:54Z,gepubliceerd,['Strafrecht'],[],Sneep-zaak. Mensenhandel. Misdadige organisatie. Toetsingskader mensenhandel. Bewijswaardering. Geheimhoudersgesprekken en strafvermindering. Beoordeling rechtsmacht op grond van art. 6 Sr. Oplegging geldboete naast gevangenisstraf,"Gerechtshof Arnhem, 20-12-2010, 21-003157-08",ECLI:NL:GHARN:2010:BO8394,20-12-2010,uitspraak,"[{'Vindplaats': 'Rechtspraak.nl', 'VindplaatsAnnotator': '', 'VindplaatsUrl': ''}]"
ECLI-NL-GHARN-2010-BO8400,http://deeplink.rechtspraak.nl/uitspraak?id=ECLI:NL:GHARN:2010:BO8400,uitspraak,De publicatie van de uitspraak staat gepland op 22-12-2010 om 15:14 uur,https://uitspraken.rechtspraak.nl/inziendocument?id=ECLI:NL:GHARN:2010:BO8400&showbutton=true&keyword=mensenhandel,0.0,['Hoger beroep'],22-12-2010,2010-12-22T15:14:39Z,gepubliceerd,['Strafrecht'],[],Sneep-zaak. Mensenhandel. Misdadige organisatie. Toetsingskader mensenhandel. Gebruik samenvattingen taps voor bewijs. Bewijswaardering. Dvd-opnamen getuigenverhoren. Geheimhoudersgesprekken en strafvermindering. Oplegging geldboete naast gevangenisstraf,"Gerechtshof Arnhem, 20-12-2010, 21-003168-08",ECLI:NL:GHARN:2010:BO8400,20-12-2010,uitspraak,"[{'Vindplaats': 'Rechtspraak.nl', 'VindplaatsAnnotator': '', 'VindplaatsUrl': ''}]"
ECLI-NL-OGEAC-2019-358,http://deeplink.rechtspraak.nl/uitspraak?id=ECLI:NL:OGEAC:2019:358,uitspraak,De publicatie van de uitspraak staat gepland op 26-05-2020 om 10:23 uur,https://uitspraken.rechtspraak.nl/inziendocument?id=ECLI:NL:OGEAC:2019:358&showbutton=true&keyword=mensenhandel,0.0,['Eerste aanleg - enkelvoudig'],26-05-2020,2020-05-26T10:23:59Z,gepubliceerd,['Strafrecht'],[],mensenhandel,"Gerecht in eerste aanleg van Curaçao, 27-09-2019, 500.00412/18",ECLI:NL:OGEAC:2019:358,27-09-2019,uitspraak,"[{'Vindplaats': 'Rechtspraak.nl', 'VindplaatsAnnotator': '', 'VindplaatsUrl': ''}]"
ECLI-NL-RBNHO-2019-6071,http://deeplink.rechtspraak.nl/uitspraak?id=ECLI:NL:RBNHO:2019:6071,uitspraak,De publicatie van de uitspraak staat gepland op 24-03-2020 om 11:40 uur,https://uitspraken.rechtspraak.nl/inziendocument?id=ECLI:NL:RBNHO:2019:6071&showbutton=true&keyword=mensenhandel,0.0,['Eerste aanleg - meervoudig'],24-03-2020,2020-03-24T11:40:46Z,gepubliceerd,['Strafrecht'],[],Mensenhandel.,"Rechtbank Noord-Holland, 11-07-2019, 15/871958-17",ECLI:NL:RBNHO:2019:6071,11-07-2019,uitspraak,"[{'Vindplaats': 'Rechtspraak.nl', 'VindplaatsAnnotator': '', 'VindplaatsUrl': ''}]"
ECLI-NL-RBNHO-2019-6072,http://deeplink.rechtspraak.nl/uitspraak?id=ECLI:NL:RBNHO:2019:6072,uitspraak,De publicatie van de uitspraak staat gepland op 24-03-2020 om 10:47 uur,https://uitspraken.rechtspraak.nl/inziendocument?id=ECLI:NL:RBNHO:2019:6072&showbutton=true&keyword=mensenhandel,0.0,['Eerste aanleg - meervoudig'],24-03-2020,2020-03-24T10:47:16Z,gepubliceerd,['Strafrecht'],[],Mensenhandel.,"Rechtbank Noord-Holland, 11-07-2019, 15/810184-17",ECLI:NL:RBNHO:2019:6072,11-07-2019,uitspraak,"[{'Vindplaats': 'Rechtspraak.nl', 'VindplaatsAnnotator': '', 'VindplaatsUrl': ''}]"
ECLI-NL-GHAMS-2019-5043,http://deeplink.rechtspraak.nl/uitspraak?id=ECLI:NL:GHAMS:2019:5043,uitspraak,De publicatie van de uitspraak staat gepland op 29-07-2020 om 11:58 uur,https://uitspraken.rechtspraak.nl/inziendocument?id=ECLI:NL:GHAMS:2019:5043&showbutton=true&keyword=mensenhandel,0.0,['Hoger beroep'],29-07-2020,2020-07-29T11:58:28Z,gepubliceerd,['Strafrecht'],[],Mensenhandel.,"Gerechtshof Amsterdam, 12-04-2019, 23-004755-15",ECLI:NL:GHAMS:2019:5043,12-04-2019,uitspraak,"[{'Vindplaats': 'Rechtspraak.nl', 'VindplaatsAnnotator': '', 'VindplaatsUrl': ''}]"
ECLI-NL-RBDHA-2019-2335,http://deeplink.rechtspraak.nl/uitspraak?id=ECLI:NL:RBDHA:2019:2335,uitspraak,De publicatie van de uitspraak staat gepland op 13-03-2019 om 13:34 uur,https://uitspraken.rechtspraak.nl/inziendocument?id=ECLI:NL:RBDHA:2019:2335&showbutton=true&keyword=mensenhandel,0.0,['Eerste aanleg - meervoudig'],13-03-2019,2019-03-13T13:34:46Z,gepubliceerd,['Strafrecht'],[],mensenhandel,"Rechtbank Den Haag, 13-03-2019, 09/767267-15",ECLI:NL:RBDHA:2019:2335,13-03-2019,uitspraak,"[{'Vindplaats': 'Rechtspraak.nl', 'VindplaatsAnnotator': '', 'VindplaatsUrl': ''}]"
ECLI-NL-RBDHA-2019-1119,http://deeplink.rechtspraak.nl/uitspraak?id=ECLI:NL:RBDHA:2019:1119,uitspraak,De publicatie van de uitspraak staat gepland op 11-02-2019 om 15:38 uur,https://uitspraken.rechtspraak.nl/inziendocument?id=ECLI:NL:RBDHA:2019:1119&showbutton=true&keyword=mensenhandel,0.0,['Eerste aanleg - meervoudig'],11-02-2019,2019-02-11T15:38:00Z,gepubliceerd,['Strafrecht'],[],mensenhandel,"Rechtbank Den Haag, 11-02-2019, 09/842073-18, 09/852087-18, 09/777121-15",ECLI:NL:RBDHA:2019:1119,11-02-2019,uitspraak,"[{'Vindplaats': 'Rechtspraak.nl', 'VindplaatsAnnotator': '', 'VindplaatsUrl': ''}]"
ECLI-NL-GHARL-2019-11293,http://deeplink.rechtspraak.nl/uitspraak?id=ECLI:NL:GHARL:2019:11293,uitspraak,De publicatie van de uitspraak staat gepland op 30-01-2020 om 11:24 uur,https://uitspraken.rechtspraak.nl/inziendocument?id=ECLI:NL:GHARL:2019:11293&showbutton=true&keyword=mensenhandel,0.0,['Hoger beroep'],30-01-2020,2020-01-30T11:24:34Z,gepubliceerd,['Strafrecht'],[],Mensenhandel.,"Gerechtshof Arnhem-Leeuwarden, 16-01-2019, 21-006359-15",ECLI:NL:GHARL:2019:11293,16-01-2019,uitspraak,"[{'Vindplaats': 'Rechtspraak.nl', 'VindplaatsAnnotator': '', 'VindplaatsUrl': ''}]"
ECLI-NL-OGEAC-2017-270,http://deeplink.rechtspraak.nl/uitspraak?id=ECLI:NL:OGEAC:2017:270,uitspraak,De publicatie van de uitspraak staat gepland op 24-07-2018 om 17:08 uur,https://uitspraken.rechtspraak.nl/inziendocument?id=ECLI:NL:OGEAC:2017:270&showbutton=true&keyword=mensenhandel,0.0,['Eerste aanleg - enkelvoudig'],24-07-2018,2018-07-24T17:08:14Z,gepubliceerd,['Strafrecht'],[],mensenhandel,"Gerecht in eerste aanleg van Curaçao, 20-10-2017, 500.00460/16",ECLI:NL:OGEAC:2017:270,20-10-2017,uitspraak,"[{'Vindplaats': 'Rechtspraak.nl', 'VindplaatsAnnotator': '', 'VindplaatsUrl': ''}]"
ECLI-NL-GHARL-2017-11548,http://deeplink.rechtspraak.nl/uitspraak?id=ECLI:NL:GHARL:2017:11548,uitspraak,De publicatie van de uitspraak staat gepland op 29-01-2020 om 17:01 uur,https://uitspraken.rechtspraak.nl/inziendocument?id=ECLI:NL:GHARL:2017:11548&showbutton=true&keyword=mensenhandel,0.0,['Hoger beroep'],29-01-2020,2020-01-29T17:01:25Z,gepubliceerd,['Strafrecht'],[],Mensenhandel.,"Gerechtshof Arnhem-Leeuwarden, 22-08-2017, 21-002976-12",ECLI:NL:GHARL:2017:11548,22-08-2017,uitspraak,"[{'Vindplaats': 'Rechtspraak.nl', 'VindplaatsAnnotator': '', 'VindplaatsUrl': ''}]"
ECLI-NL-GHAMS-2015-4399,http://deeplink.rechtspraak.nl/uitspraak?id=ECLI:NL:GHAMS:2015:4399,uitspraak,De publicatie van de uitspraak staat gepland op 31-07-2018 om 15:34 uur,https://uitspraken.rechtspraak.nl/inziendocument?id=ECLI:NL:GHAMS:2015:4399&showbutton=true&keyword=mensenhandel,0.0,['Hoger beroep'],31-07-2018,2018-07-31T15:34:47Z,gepubliceerd,['Strafrecht'],[],Mensenhandel,"Gerechtshof Amsterdam, 15-09-2015, 23-001201-14",ECLI:NL:GHAMS:2015:4399,15-09-2015,uitspraak,"[{'Vindplaats': 'Rechtspraak.nl', 'VindplaatsAnnotator': '', 'VindplaatsUrl': ''}]"
ECLI-NL-RBMNE-2015-2956,http://deeplink.rechtspraak.nl/uitspraak?id=ECLI:NL:RBMNE:2015:2956,uitspraak,De publicatie van de uitspraak staat gepland op 27-05-2015 om 13:25 uur,https://uitspraken.rechtspraak.nl/inziendocument?id=ECLI:NL:RBMNE:2015:2956&showbutton=true&keyword=mensenhandel,0.0,['Eerste aanleg - meervoudig'],27-05-2015,2015-05-27T13:25:06Z,gepubliceerd,['Strafrecht'],[],mensenhandel,"Rechtbank Midden-Nederland, 24-04-2015, 16.700309-14 (P)",ECLI:NL:RBMNE:2015:2956,24-04-2015,uitspraak,"[{'Vindplaats': 'Rechtspraak.nl', 'VindplaatsAnnotator': '', 'VindplaatsUrl': ''}]"
ECLI-NL-GHARL-2014-9417,http://deeplink.rechtspraak.nl/uitspraak?id=ECLI:NL:GHARL:2014:9417,uitspraak,De publicatie van de uitspraak staat gepland op 17-12-2014 om 11:49 uur,https://uitspraken.rechtspraak.nl/inziendocument?id=ECLI:NL:GHARL:2014:9417&showbutton=true&keyword=mensenhandel,0.0,['Hoger beroep'],17-12-2014,2014-12-17T11:49:20Z,gepubliceerd,['Strafrecht'],"[{'RelatieOmschrijving': 'Eerste aanleg: ', 'LinkTekst': 'ECLI:NL:RBGEL:2013:3276', 'Postfix': ', Meerdere afhandelingswijzen', 'WebAdres': 'https://uitspraken.rechtspraak.nl/inziendocument?id=ECLI:NL:RBGEL:2013:3276&showbutton=true&keyword=mensenhandel'}, {'RelatieOmschrijving': 'Cassatie: ', 'LinkTekst': 'ECLI:NL:HR:2016:529', 'Postfix': ', (Gedeeltelijke) vernietiging met terugwijzen', 'WebAdres': 'https://uitspraken.rechtspraak.nl/inziendocument?id=ECLI:NL:HR:2016:529&showbutton=true&keyword=mensenhandel'}]",Mensenhandel.,"Gerechtshof Arnhem-Leeuwarden, 04-12-2014, 21-007629-13",ECLI:NL:GHARL:2014:9417,04-12-2014,uitspraak,"[{'Vindplaats': 'Rechtspraak.nl', 'VindplaatsAnnotator': '', 'VindplaatsUrl': ''}]"
ECLI-NL-RBAMS-2014-4619,http://deeplink.rechtspraak.nl/uitspraak?id=ECLI:NL:RBAMS:2014:4619,uitspraak,De publicatie van de uitspraak staat gepland op 04-09-2014 om 13:45 uur,https://uitspraken.rechtspraak.nl/inziendocument?id=ECLI:NL:RBAMS:2014:4619&showbutton=true&keyword=mensenhandel,0.0,"['Eerste aanleg - meervoudig', 'Mondelinge uitspraak']",04-09-2014,2014-09-04T13:45:06Z,gepubliceerd,['Strafrecht'],[],Mensenhandel,"Rechtbank Amsterdam, 28-07-2014, 13.730004-14",ECLI:NL:RBAMS:2014:4619,28-07-2014,uitspraak,"[{'Vindplaats': 'Rechtspraak.nl', 'VindplaatsAnnotator': '', 'VindplaatsUrl': ''}]"
ECLI-NL-GHSHE-2019-4056,http://deeplink.rechtspraak.nl/uitspraak?id=ECLI:NL:GHSHE:2019:4056,uitspraak,De publicatie van de uitspraak staat gepland op 05-11-2019 om 11:22 uur,https://uitspraken.rechtspraak.nl/inziendocument?id=ECLI:NL:GHSHE:2019:4056&showbutton=true&keyword=mensenhandel,0.0,['Hoger beroep'],05-11-2019,2019-11-05T11:22:51Z,gepubliceerd,['Strafrecht'],"[{'RelatieOmschrijving': 'Eerste aanleg: ', 'LinkTekst': 'ECLI:NL:RBZWB:2016:8714', 'Postfix': ', Bekrachtiging/bevestiging', 'WebAdres': 'https://uitspraken.rechtspraak.nl/inziendocument?id=ECLI:NL:RBZWB:2016:8714&showbutton=true&keyword=mensenhandel'}]",Vrijspraak van mensenhandel. Verdachte wordt vrijgesproken van mensenhandel. Het hof acht niet wettig en overtuigend bewezen dat sprake is geweest van (het oogmerk van) uitbuiting.,"Gerechtshof 's-Hertogenbosch, 05-11-2019, 20-002033-16",ECLI:NL:GHSHE:2019:4056,05-11-2019,uitspraak,"[{'Vindplaats': 'Rechtspraak.nl', 'VindplaatsAnnotator': '', 'VindplaatsUrl': ''}]"
ECLI-NL-RBAMS-2019-9019,http://deeplink.rechtspraak.nl/uitspraak?id=ECLI:NL:RBAMS:2019:9019,uitspraak,De publicatie van de uitspraak staat gepland op 10-12-2019 om 09:37 uur,https://uitspraken.rechtspraak.nl/inziendocument?id=ECLI:NL:RBAMS:2019:9019&showbutton=true&keyword=mensenhandel,0.0,['Eerste aanleg - meervoudig'],10-12-2019,2019-12-10T09:37:08Z,gepubliceerd,['Strafrecht'],[],ontneming mensenhandel,"Rechtbank Amsterdam, 24-10-2019, 13/728089-13",ECLI:NL:RBAMS:2019:9019,24-10-2019,uitspraak,"[{'Vindplaats': 'Rechtspraak.nl', 'VindplaatsAnnotator': '', 'VindplaatsUrl': ''}]"
ECLI-NL-OGEAC-2019-156,http://deeplink.rechtspraak.nl/uitspraak?id=ECLI:NL:OGEAC:2019:156,uitspraak,De publicatie van de uitspraak staat gepland op 02-08-2019 om 15:36 uur,https://uitspraken.rechtspraak.nl/inziendocument?id=ECLI:NL:OGEAC:2019:156&showbutton=true&keyword=mensenhandel,0.0,['Eerste aanleg - enkelvoudig'],02-08-2019,2019-08-02T15:36:39Z,gepubliceerd,['Strafrecht'],[],"mensenhandel, -smokkel","Gerecht in eerste aanleg van Curaçao, 19-06-2019, 500.00309/198",ECLI:NL:OGEAC:2019:156,19-06-2019,uitspraak,"[{'Vindplaats': 'Rechtspraak.nl', 'VindplaatsAnnotator': '', 'VindplaatsUrl': ''}]"
ECLI-NL-OGEAC-2019-157,http://deeplink.rechtspraak.nl/uitspraak?id=ECLI:NL:OGEAC:2019:157,uitspraak,De publicatie van de uitspraak staat gepland op 02-08-2019 om 15:38 uur,https://uitspraken.rechtspraak.nl/inziendocument?id=ECLI:NL:OGEAC:2019:157&showbutton=true&keyword=mensenhandel,0.0,['Eerste aanleg - enkelvoudig'],02-08-2019,2019-08-02T15:38:09Z,gepubliceerd,['Strafrecht'],[],"mensenhandel, -smokkel","Gerecht in eerste aanleg van Curaçao, 19-06-2019, 500.00314/18 en 500.00167/19",ECLI:NL:OGEAC:2019:157,19-06-2019,uitspraak,"[{'Vindplaats': 'Rechtspraak.nl', 'VindplaatsAnnotator': '', 'VindplaatsUrl': ''}]"
ECLI-NL-OGEAC-2019-158,http://deeplink.rechtspraak.nl/uitspraak?id=ECLI:NL:OGEAC:2019:158,uitspraak,De publicatie van de uitspraak staat gepland op 02-08-2019 om 15:40 uur,https://uitspraken.rechtspraak.nl/inziendocument?id=ECLI:NL:OGEAC:2019:158&showbutton=true&keyword=mensenhandel,0.0,['Eerste aanleg - enkelvoudig'],02-08-2019,2019-08-02T15:40:09Z,gepubliceerd,['Strafrecht'],[],medeplich. mensenhandel,"Gerecht in eerste aanleg van Curaçao, 19-06-2019, 500.00394/198",ECLI:NL:OGEAC:2019:158,19-06-2019,uitspraak,"[{'Vindplaats': 'Rechtspraak.nl', 'VindplaatsAnnotator': '', 'VindplaatsUrl': ''}]"
ECLI-NL-OGEAC-2019-154,http://deeplink.rechtspraak.nl/uitspraak?id=ECLI:NL:OGEAC:2019:154,uitspraak,De publicatie van de uitspraak staat gepland op 02-08-2019 om 15:23 uur,https://uitspraken.rechtspraak.nl/inziendocument?id=ECLI:NL:OGEAC:2019:154&showbutton=true&keyword=mensenhandel,0.0,['Eerste aanleg - enkelvoudig'],02-08-2019,2019-08-02T15:23:40Z,gepubliceerd,['Strafrecht'],[],medeplich. mensenhandel,"Gerecht in eerste aanleg van Curaçao, 19-06-2019, 500.00098/19",ECLI:NL:OGEAC:2019:154,19-06-2019,uitspraak,"[{'Vindplaats': 'Rechtspraak.nl', 'VindplaatsAnnotator': '', 'VindplaatsUrl': ''}]"
ECLI-NL-OGEAC-2019-155,http://deeplink.rechtspraak.nl/uitspraak?id=ECLI:NL:OGEAC:2019:155,uitspraak,De publicatie van de uitspraak staat gepland op 02-08-2019 om 15:34 uur,https://uitspraken.rechtspraak.nl/inziendocument?id=ECLI:NL:OGEAC:2019:155&showbutton=true&keyword=mensenhandel,0.0,['Eerste aanleg - enkelvoudig'],02-08-2019,2019-08-02T15:34:39Z,gepubliceerd,['Strafrecht'],[],"mensenhandel, -smokkel","Gerecht in eerste aanleg van Curaçao, 19-06-2019, 500.00308/198",ECLI:NL:OGEAC:2019:155,19-06-2019,uitspraak,"[{'Vindplaats': 'Rechtspraak.nl', 'VindplaatsAnnotator': '', 'VindplaatsUrl': ''}]"
ECLI-NL-RBNHO-2018-11903,http://deeplink.rechtspraak.nl/uitspraak?id=ECLI:NL:RBNHO:2018:11903,uitspraak,De publicatie van de uitspraak staat gepland op 24-03-2020 om 12:05 uur,https://uitspraken.rechtspraak.nl/inziendocument?id=ECLI:NL:RBNHO:2018:11903&showbutton=true&keyword=mensenhandel,0.0,['Eerste aanleg - meervoudig'],24-03-2020,2020-03-24T12:05:47Z,gepubliceerd,['Strafrecht'],[],vrijspraak mensenhandel.,"Rechtbank Noord-Holland, 06-07-2018, 15/810185-16",ECLI:NL:RBNHO:2018:11903,06-07-2018,uitspraak,"[{'Vindplaats': 'Rechtspraak.nl', 'VindplaatsAnnotator': '', 'VindplaatsUrl': ''}]"
ECLI-NL-RBNHO-2018-11901,http://deeplink.rechtspraak.nl/uitspraak?id=ECLI:NL:RBNHO:2018:11901,uitspraak,De publicatie van de uitspraak staat gepland op 20-03-2020 om 11:04 uur,https://uitspraken.rechtspraak.nl/inziendocument?id=ECLI:NL:RBNHO:2018:11901&showbutton=true&keyword=mensenhandel,0.0,['Eerste aanleg - meervoudig'],20-03-2020,2020-03-20T11:04:34Z,gepubliceerd,['Strafrecht'],[],Vrijspraak mensenhandel,"Rechtbank Noord-Holland, 03-05-2018, 15/710002-18",ECLI:NL:RBNHO:2018:11901,03-05-2018,uitspraak,"[{'Vindplaats': 'Rechtspraak.nl', 'VindplaatsAnnotator': '', 'VindplaatsUrl': ''}]"
ECLI-NL-RBNHO-2018-11902,http://deeplink.rechtspraak.nl/uitspraak?id=ECLI:NL:RBNHO:2018:11902,uitspraak,De publicatie van de uitspraak staat gepland op 20-03-2020 om 11:30 uur,https://uitspraken.rechtspraak.nl/inziendocument?id=ECLI:NL:RBNHO:2018:11902&showbutton=true&keyword=mensenhandel,0.0,['Eerste aanleg - meervoudig'],20-03-2020,2020-03-20T11:30:35Z,gepubliceerd,['Strafrecht'],[],Veroordeling mensenhandel,"Rechtbank Noord-Holland, 03-05-2018, 15/870949-17",ECLI:NL:RBNHO:2018:11902,03-05-2018,uitspraak,"[{'Vindplaats': 'Rechtspraak.nl', 'VindplaatsAnnotator': '', 'VindplaatsUrl': ''}]"
ECLI-NL-OGEAC-2017-271,http://deeplink.rechtspraak.nl/uitspraak?id=ECLI:NL:OGEAC:2017:271,uitspraak,De publicatie van de uitspraak staat gepland op 24-07-2018 om 17:12 uur,https://uitspraken.rechtspraak.nl/inziendocument?id=ECLI:NL:OGEAC:2017:271&showbutton=true&keyword=mensenhandel,0.0,['Eerste aanleg - enkelvoudig'],24-07-2018,2018-07-24T17:12:14Z,gepubliceerd,['Strafrecht'],[],"mensenhandel, bedreiging","Gerecht in eerste aanleg van Curaçao, 20-10-2017, 500.00459/16",ECLI:NL:OGEAC:2017:271,20-10-2017,uitspraak,"[{'Vindplaats': 'Rechtspraak.nl', 'VindplaatsAnnotator': '', 'VindplaatsUrl': ''}]"
ECLI-NL-RBLIM-2017-7499,http://deeplink.rechtspraak.nl/uitspraak?id=ECLI:NL:RBLIM:2017:7499,uitspraak,De publicatie van de uitspraak staat gepland op 01-08-2017 om 11:58 uur,https://uitspraken.rechtspraak.nl/inziendocument?id=ECLI:NL:RBLIM:2017:7499&showbutton=true&keyword=mensenhandel,0.0,['Eerste aanleg - meervoudig'],01-08-2017,2017-08-01T11:58:20Z,gepubliceerd,['Strafrecht'],[],vrijspraak mensenhandel,"Rechtbank Limburg, 28-07-2017, 03/703157-12",ECLI:NL:RBLIM:2017:7499,28-07-2017,uitspraak,"[{'Vindplaats': 'Rechtspraak.nl', 'VindplaatsAnnotator': '', 'VindplaatsUrl': ''}]"
ECLI-NL-RBMNE-2015-5690,http://deeplink.rechtspraak.nl/uitspraak?id=ECLI:NL:RBMNE:2015:5690,uitspraak,De publicatie van de uitspraak staat gepland op 17-08-2015 om 09:33 uur,https://uitspraken.rechtspraak.nl/inziendocument?id=ECLI:NL:RBMNE:2015:5690&showbutton=true&keyword=mensenhandel,0.0,"['Eerste aanleg - meervoudig', 'Op tegenspraak']",17-08-2015,2015-08-17T09:33:05Z,gepubliceerd,['Strafrecht'],[],vrijspraak mensenhandel,"Rechtbank Midden-Nederland, 14-07-2015, 16-994267-14 (P)",ECLI:NL:RBMNE:2015:5690,14-07-2015,uitspraak,"[{'Vindplaats': 'Rechtspraak.nl', 'VindplaatsAnnotator': '', 'VindplaatsUrl': ''}]"
ECLI-NL-RBLIM-2015-4965,http://deeplink.rechtspraak.nl/uitspraak?id=ECLI:NL:RBLIM:2015:4965,uitspraak,De publicatie van de uitspraak staat gepland op 12-06-2015 om 17:08 uur,https://uitspraken.rechtspraak.nl/inziendocument?id=ECLI:NL:RBLIM:2015:4965&showbutton=true&keyword=mensenhandel,0.0,['Eerste aanleg - meervoudig'],12-06-2015,2015-06-12T17:08:21Z,gepubliceerd,['Strafrecht'],[],Vrijspraak mensenhandel.,"Rechtbank Limburg, 12-06-2015, 03/720885-15",ECLI:NL:RBLIM:2015:4965,12-06-2015,uitspraak,"[{'Vindplaats': 'Rechtspraak.nl', 'VindplaatsAnnotator': '', 'VindplaatsUrl': ''}]"
ECLI-NL-RBNHO-2014-8560,http://deeplink.rechtspraak.nl/uitspraak?id=ECLI:NL:RBNHO:2014:8560,uitspraak,De publicatie van de uitspraak staat gepland op 05-09-2014 om 15:48 uur,https://uitspraken.rechtspraak.nl/inziendocument?id=ECLI:NL:RBNHO:2014:8560&showbutton=true&keyword=mensenhandel,0.0,['Eerste aanleg - meervoudig'],05-09-2014,2014-09-05T15:48:36Z,gepubliceerd,['Strafrecht'],[],Promis; mensenhandel.,"Rechtbank Noord-Holland, 30-01-2014, 14/810344-12",ECLI:NL:RBNHO:2014:8560,30-01-2014,uitspraak,"[{'Vindplaats': 'Rechtspraak.nl', 'VindplaatsAnnotator': '', 'VindplaatsUrl': ''}]"
ECLI-NL-GHSGR-2011-BR1678,http://deeplink.rechtspraak.nl/uitspraak?id=ECLI:NL:GHSGR:2011:BR1678,uitspraak,De publicatie van de uitspraak staat gepland op 15-07-2011 om 10:46 uur,https://uitspraken.rechtspraak.nl/inziendocument?id=ECLI:NL:GHSGR:2011:BR1678&showbutton=true&keyword=mensenhandel,0.0,['Hoger beroep'],15-07-2011,2011-07-15T10:46:13Z,gepubliceerd,['Strafrecht'],"[{'RelatieOmschrijving': 'Eerste aanleg: ', 'LinkTekst': 'ECLI:NL:RBSGR:2010:BL6374', 'Postfix': ', (Gedeeltelijke) vernietiging en zelf afgedaan', 'WebAdres': 'https://uitspraken.rechtspraak.nl/inziendocument?id=ECLI:NL:RBSGR:2010:BL6374&showbutton=true&keyword=mensenhandel'}]",Vrijspraak mensenhandel.,"Gerechtshof 's-Gravenhage, 25-05-2011, 22-001337-10",ECLI:NL:GHSGR:2011:BR1678,25-05-2011,uitspraak,"[{'Vindplaats': 'Rechtspraak.nl', 'VindplaatsAnnotator': '', 'VindplaatsUrl': ''}]"
ECLI-NL-RBUTR-2008-BG1625,http://deeplink.rechtspraak.nl/uitspraak?id=ECLI:NL:RBUTR:2008:BG1625,uitspraak,De publicatie van de uitspraak staat gepland op 27-10-2008 om 12:13 uur,https://uitspraken.rechtspraak.nl/inziendocument?id=ECLI:NL:RBUTR:2008:BG1625&showbutton=true&keyword=mensenhandel,0.0,['Eerste aanleg - meervoudig'],27-10-2008,2008-10-27T12:13:06Z,gepubliceerd,['Strafrecht'],[],vrijspraak mensenhandel,"Rechtbank Utrecht, 03-10-2008, 16-711095-08",ECLI:NL:RBUTR:2008:BG1625,03-10-2008,uitspraak,"[{'Vindplaats': 'Rechtspraak.nl', 'VindplaatsAnnotator': '', 'VindplaatsUrl': ''}]"
ECLI-NL-RBGRO-2008-BC6525,http://deeplink.rechtspraak.nl/uitspraak?id=ECLI:NL:RBGRO:2008:BC6525,uitspraak,De publicatie van de uitspraak staat gepland op 12-03-2008 om 14:52 uur,https://uitspraken.rechtspraak.nl/inziendocument?id=ECLI:NL:RBGRO:2008:BC6525&showbutton=true&keyword=mensenhandel,0.0,['Eerste aanleg - meervoudig'],12-03-2008,2008-03-12T14:52:21Z,gepubliceerd,['Strafrecht'],"[{'RelatieOmschrijving': 'Hoger beroep: ', 'LinkTekst': 'ECLI:NL:GHLEE:2011:BQ3556', 'Postfix': ', (Gedeeltelijke) vernietiging en zelf afgedaan', 'WebAdres': 'https://uitspraken.rechtspraak.nl/inziendocument?id=ECLI:NL:GHLEE:2011:BQ3556&showbutton=true&keyword=mensenhandel'}]","""mensenhandel, loverboys""","Rechtbank Groningen, 12-03-2008, 18/630302-06 en 18/654495-07",ECLI:NL:RBGRO:2008:BC6525,12-03-2008,uitspraak,"[{'Vindplaats': 'Rechtspraak.nl', 'VindplaatsAnnotator': '', 'VindplaatsUrl': ''}]"
ECLI-NL-GHARN-2006-AZ3362,http://deeplink.rechtspraak.nl/uitspraak?id=ECLI:NL:GHARN:2006:AZ3362,uitspraak,De publicatie van de uitspraak staat gepland op 30-11-2006 om 10:57 uur,https://uitspraken.rechtspraak.nl/inziendocument?id=ECLI:NL:GHARN:2006:AZ3362&showbutton=true&keyword=mensenhandel,0.0,['Hoger beroep'],30-11-2006,2006-11-30T10:57:58Z,gepubliceerd,['Strafrecht'],[],"Mensenhandel ten aanzien van één vrouw; Loverboypraktijken. 
Voorts heeft verdachte zich schuldig gemaakt aan  jarenlange handel in cocaïne mensenhandel. Gevangenisstraf van 3 jaar en 6 maanden.","Gerechtshof Arnhem, 28-11-2006, 21-006453-05",ECLI:NL:GHARN:2006:AZ3362,28-11-2006,uitspraak,"[{'Vindplaats': 'Rechtspraak.nl', 'VindplaatsAnnotator': '', 'VindplaatsUrl': ''}]"
ECLI-NL-RBDHA-2016-995,http://deeplink.rechtspraak.nl/uitspraak?id=ECLI:NL:RBDHA:2016:995,uitspraak,De publicatie van de uitspraak staat gepland op 03-02-2016 om 13:42 uur,https://uitspraken.rechtspraak.nl/inziendocument?id=ECLI:NL:RBDHA:2016:995&showbutton=true&keyword=mensenhandel,0.0,['Eerste aanleg - meervoudig'],03-02-2016,2016-02-03T13:42:24Z,gepubliceerd,['Strafrecht'],[],"verdachte heeft zich gedurende een aantal maanden schuldig gemaakt aan mensenhandel en een poging tot mensenhandel. Gevangenisstraf voor de duur van 15 maanden, waarvan 8 maanden voorwaardelijk.","Rechtbank Den Haag, 03-02-2016, 09/767175-13",ECLI:NL:RBDHA:2016:995,03-02-2016,uitspraak,"[{'Vindplaats': 'Rechtspraak.nl', 'VindplaatsAnnotator': '', 'VindplaatsUrl': ''}]"
ECLI-NL-RBAMS-2013-BZ7893,http://deeplink.rechtspraak.nl/uitspraak?id=ECLI:NL:RBAMS:2013:BZ7893,uitspraak,De publicatie van de uitspraak staat gepland op 18-04-2013 om 14:30 uur,https://uitspraken.rechtspraak.nl/inziendocument?id=ECLI:NL:RBAMS:2013:BZ7893&showbutton=true&keyword=mensenhandel,0.0,['Eerste aanleg - meervoudig'],18-04-2013,2013-04-18T14:30:51Z,gepubliceerd,['Strafrecht'],[],"Vrijspraak mensenhandel (artikel 273f Sr). Onvoldoende minimum aan bewijsgronden t.a.v. afzonderlijke ten laste gelegde mensenhandel feiten, niet voldaan aan voorwaarde zelfstandig gefundeerd en verklaard feit voor gebruik schakelbewijs, geen aangifte mensenhandel, het bestanddeel van 'het oogmerk die ander in een ander land ertoe te brengen"" (sub 3) niet bewezen.","Rechtbank Amsterdam, 18-04-2013, 13-708132-11 (A) en 13-731013-13 (B)",ECLI:NL:RBAMS:2013:BZ7893,18-04-2013,uitspraak,"[{'Vindplaats': 'NJFS 2013/152', 'VindplaatsAnnotator': '', 'VindplaatsUrl': ''}, {'Vindplaats': 'Rechtspraak.nl', 'VindplaatsAnnotator': '', 'VindplaatsUrl': ''}]"
ECLI-NL-RBNNE-2021-1309,http://deeplink.rechtspraak.nl/uitspraak?id=ECLI:NL:RBNNE:2021:1309,uitspraak,De publicatie van de uitspraak staat gepland op 13-04-2021 om 15:41 uur,https://uitspraken.rechtspraak.nl/inziendocument?id=ECLI:NL:RBNNE:2021:1309&showbutton=true&keyword=mensenhandel,0.0,"['Eerste aanleg - meervoudig', 'Op tegenspraak']",13-04-2021,2021-04-13T15:41:14Z,gepubliceerd,['Strafrecht'],[],Vrijspraak van mensenhandel.,"Rechtbank Noord-Nederland, 13-04-2021, 18/830203-18",ECLI:NL:RBNNE:2021:1309,13-04-2021,uitspraak,"[{'Vindplaats': 'Rechtspraak.nl', 'VindplaatsAnnotator': '', 'VindplaatsUrl': ''}]"
ECLI-NL-GHAMS-2019-4016,http://deeplink.rechtspraak.nl/uitspraak?id=ECLI:NL:GHAMS:2019:4016,uitspraak,De publicatie van de uitspraak staat gepland op 11-11-2019 om 10:09 uur,https://uitspraken.rechtspraak.nl/inziendocument?id=ECLI:NL:GHAMS:2019:4016&showbutton=true&keyword=mensenhandel,0.0,['Hoger beroep'],11-11-2019,2019-11-11T10:09:35Z,gepubliceerd,['Strafrecht'],[],"Mega Arezzo, mensenhandel","Gerechtshof Amsterdam, 08-11-2019, 23-002930-15",ECLI:NL:GHAMS:2019:4016,08-11-2019,uitspraak,"[{'Vindplaats': 'Rechtspraak.nl', 'VindplaatsAnnotator': '', 'VindplaatsUrl': ''}]"
ECLI-NL-GHAMS-2019-3664,http://deeplink.rechtspraak.nl/uitspraak?id=ECLI:NL:GHAMS:2019:3664,uitspraak,De publicatie van de uitspraak staat gepland op 11-10-2019 om 13:56 uur,https://uitspraken.rechtspraak.nl/inziendocument?id=ECLI:NL:GHAMS:2019:3664&showbutton=true&keyword=mensenhandel,0.0,['Hoger beroep'],11-10-2019,2019-10-11T13:56:23Z,gepubliceerd,['Strafrecht'],[],"Zaak Ararat, mensenhandel","Gerechtshof Amsterdam, 11-10-2019, 23-003685-16",ECLI:NL:GHAMS:2019:3664,11-10-2019,uitspraak,"[{'Vindplaats': 'Rechtspraak.nl', 'VindplaatsAnnotator': '', 'VindplaatsUrl': ''}]"
ECLI-NL-RBAMS-2019-7542,http://deeplink.rechtspraak.nl/uitspraak?id=ECLI:NL:RBAMS:2019:7542,uitspraak,De publicatie van de uitspraak staat gepland op 26-02-2020 om 12:30 uur,https://uitspraken.rechtspraak.nl/inziendocument?id=ECLI:NL:RBAMS:2019:7542&showbutton=true&keyword=mensenhandel,0.0,['Eerste aanleg - meervoudig'],26-02-2020,2020-02-26T12:30:40Z,gepubliceerd,['Strafrecht'],[],"Mensenhandel, seksuele uitbuiting","Rechtbank Amsterdam, 10-10-2019, 13/730006-19",ECLI:NL:RBAMS:2019:7542,10-10-2019,uitspraak,"[{'Vindplaats': 'Rechtspraak.nl', 'VindplaatsAnnotator': '', 'VindplaatsUrl': ''}]"
ECLI-NL-OGEAC-2019-316,http://deeplink.rechtspraak.nl/uitspraak?id=ECLI:NL:OGEAC:2019:316,uitspraak,De publicatie van de uitspraak staat gepland op 14-04-2020 om 11:31 uur,https://uitspraken.rechtspraak.nl/inziendocument?id=ECLI:NL:OGEAC:2019:316&showbutton=true&keyword=mensenhandel,0.0,['Eerste aanleg - enkelvoudig'],14-04-2020,2020-04-14T11:31:05Z,gepubliceerd,['Strafrecht; Penitentiair strafrecht'],[],Mensenhandel e.d.,"Gerecht in eerste aanleg van Curaçao, 27-09-2019, 500.00324/18",ECLI:NL:OGEAC:2019:316,27-09-2019,uitspraak,"[{'Vindplaats': 'Rechtspraak.nl', 'VindplaatsAnnotator': '', 'VindplaatsUrl': ''}]"
ECLI-NL-OGEAC-2019-317,http://deeplink.rechtspraak.nl/uitspraak?id=ECLI:NL:OGEAC:2019:317,uitspraak,De publicatie van de uitspraak staat gepland op 14-04-2020 om 12:03 uur,https://uitspraken.rechtspraak.nl/inziendocument?id=ECLI:NL:OGEAC:2019:317&showbutton=true&keyword=mensenhandel,0.0,['Eerste aanleg - enkelvoudig'],14-04-2020,2020-04-14T12:03:05Z,gepubliceerd,['Strafrecht'],[],mensenhandel e.d.,"Gerecht in eerste aanleg van Curaçao, 27-09-2019, 500.00335/18",ECLI:NL:OGEAC:2019:317,27-09-2019,uitspraak,"[{'Vindplaats': 'Rechtspraak.nl', 'VindplaatsAnnotator': '', 'VindplaatsUrl': ''}]"
ECLI-NL-RBAMS-2019-1489,http://deeplink.rechtspraak.nl/uitspraak?id=ECLI:NL:RBAMS:2019:1489,uitspraak,De publicatie van de uitspraak staat gepland op 07-03-2019 om 15:50 uur,https://uitspraken.rechtspraak.nl/inziendocument?id=ECLI:NL:RBAMS:2019:1489&showbutton=true&keyword=mensenhandel,0.0,"['Eerste aanleg - meervoudig', 'Op tegenspraak']",07-03-2019,2019-03-07T15:50:54Z,gepubliceerd,['Strafrecht'],[],"Mensenhandel, seksuele uitbuiting.","Rechtbank Amsterdam, 04-03-2019, 13/730038-17",ECLI:NL:RBAMS:2019:1489,04-03-2019,uitspraak,"[{'Vindplaats': 'Rechtspraak.nl', 'VindplaatsAnnotator': '', 'VindplaatsUrl': ''}]"
ECLI-NL-OGHACMB-2018-303,http://deeplink.rechtspraak.nl/uitspraak?id=ECLI:NL:OGHACMB:2018:303,uitspraak,De publicatie van de uitspraak staat gepland op 03-07-2019 om 14:02 uur,https://uitspraken.rechtspraak.nl/inziendocument?id=ECLI:NL:OGHACMB:2018:303&showbutton=true&keyword=mensenhandel,0.0,['Hoger beroep'],03-07-2019,2019-07-03T14:02:26Z,gepubliceerd,['Strafrecht'],[],(pog. tot mensenhandel),"Gemeenschappelijk Hof van Justitie van Aruba, Curaçao, Sint Maarten en van Bonaire, Sint Eustatius en Saba, 19-07-2018, H 160/2017",ECLI:NL:OGHACMB:2018:303,19-07-2018,uitspraak,"[{'Vindplaats': 'Rechtspraak.nl', 'VindplaatsAnnotator': '', 'VindplaatsUrl': ''}]"
ECLI-NL-OGHACMB-2018-253,http://deeplink.rechtspraak.nl/uitspraak?id=ECLI:NL:OGHACMB:2018:253,uitspraak,De publicatie van de uitspraak staat gepland op 19-02-2019 om 13:21 uur,https://uitspraken.rechtspraak.nl/inziendocument?id=ECLI:NL:OGHACMB:2018:253&showbutton=true&keyword=mensenhandel,0.0,['Hoger beroep'],19-02-2019,2019-02-19T13:21:16Z,gepubliceerd,['Strafrecht'],[],"pog. mensenhandel, bedreiging","Gemeenschappelijk Hof van Justitie van Aruba, Curaçao, Sint Maarten en van Bonaire, Sint Eustatius en Saba, 19-07-2018, H 159/2017",ECLI:NL:OGHACMB:2018:253,19-07-2018,uitspraak,"[{'Vindplaats': 'Rechtspraak.nl', 'VindplaatsAnnotator': '', 'VindplaatsUrl': ''}]"
ECLI-NL-GHARL-2018-5772,http://deeplink.rechtspraak.nl/uitspraak?id=ECLI:NL:GHARL:2018:5772,uitspraak,De publicatie van de uitspraak staat gepland op 22-06-2018 om 14:15 uur,https://uitspraken.rechtspraak.nl/inziendocument?id=ECLI:NL:GHARL:2018:5772&showbutton=true&keyword=mensenhandel,0.0,['Hoger beroep'],22-06-2018,2018-06-22T14:15:24Z,gepubliceerd,['Strafrecht'],"[{'RelatieOmschrijving': 'Eerste aanleg: ', 'LinkTekst': 'ECLI:NL:RBMNE:2017:1091', 'Postfix': ', (Gedeeltelijke) vernietiging en zelf afgedaan', 'WebAdres': 'https://uitspraken.rechtspraak.nl/inziendocument?id=ECLI:NL:RBMNE:2017:1091&showbutton=true&keyword=mensenhandel'}]",Mensenhandel. Straftoemeting. Recidive.,"Gerechtshof Arnhem-Leeuwarden, 22-06-2018, 21-001328-17",ECLI:NL:GHARL:2018:5772,22-06-2018,uitspraak,"[{'Vindplaats': 'Rechtspraak.nl', 'VindplaatsAnnotator': '', 'VindplaatsUrl': ''}]"
ECLI-NL-RBROT-2018-2830,http://deeplink.rechtspraak.nl/uitspraak?id=ECLI:NL:RBROT:2018:2830,uitspraak,De publicatie van de uitspraak staat gepland op 12-04-2018 om 09:52 uur,https://uitspraken.rechtspraak.nl/inziendocument?id=ECLI:NL:RBROT:2018:2830&showbutton=true&keyword=mensenhandel,0.0,['Eerste aanleg - meervoudig'],12-04-2018,2018-04-12T09:52:16Z,gepubliceerd,['Strafrecht'],[],Mensenhandel; jeugdige slachtoffers.,"Rechtbank Rotterdam, 05-02-2018, 10/750086-17",ECLI:NL:RBROT:2018:2830,05-02-2018,uitspraak,"[{'Vindplaats': 'Rechtspraak.nl', 'VindplaatsAnnotator': '', 'VindplaatsUrl': ''}]"
ECLI-NL-RBROT-2018-2832,http://deeplink.rechtspraak.nl/uitspraak?id=ECLI:NL:RBROT:2018:2832,uitspraak,De publicatie van de uitspraak staat gepland op 12-04-2018 om 11:02 uur,https://uitspraken.rechtspraak.nl/inziendocument?id=ECLI:NL:RBROT:2018:2832&showbutton=true&keyword=mensenhandel,0.0,['Eerste aanleg - meervoudig'],12-04-2018,2018-04-12T11:02:46Z,gepubliceerd,['Strafrecht'],[],Mensenhandel; jeugdige slachtoffers.,"Rechtbank Rotterdam, 01-02-2018, 10/750036-17",ECLI:NL:RBROT:2018:2832,01-02-2018,uitspraak,"[{'Vindplaats': 'PS-Updates.nl 2018-0332', 'VindplaatsAnnotator': '', 'VindplaatsUrl': ''}, {'Vindplaats': 'Rechtspraak.nl', 'VindplaatsAnnotator': '', 'VindplaatsUrl': ''}]"
ECLI-NL-OGEAC-2017-284,http://deeplink.rechtspraak.nl/uitspraak?id=ECLI:NL:OGEAC:2017:284,uitspraak,De publicatie van de uitspraak staat gepland op 31-07-2018 om 17:25 uur,https://uitspraken.rechtspraak.nl/inziendocument?id=ECLI:NL:OGEAC:2017:284&showbutton=true&keyword=mensenhandel,0.0,['Eerste aanleg - enkelvoudig'],31-07-2018,2018-07-31T17:25:54Z,gepubliceerd,['Strafrecht'],[],"mensenhandel, trago-meisjes","Gerecht in eerste aanleg van Curaçao, 20-10-2017, 500.00461/16",ECLI:NL:OGEAC:2017:284,20-10-2017,uitspraak,"[{'Vindplaats': 'Rechtspraak.nl', 'VindplaatsAnnotator': '', 'VindplaatsUrl': ''}]"
ECLI-NL-RBDHA-2016-10054,http://deeplink.rechtspraak.nl/uitspraak?id=ECLI:NL:RBDHA:2016:10054,uitspraak,De publicatie van de uitspraak staat gepland op 25-08-2016 om 10:44 uur,https://uitspraken.rechtspraak.nl/inziendocument?id=ECLI:NL:RBDHA:2016:10054&showbutton=true&keyword=mensenhandel,0.0,['Eerste aanleg - meervoudig'],25-08-2016,2016-08-25T10:44:36Z,gepubliceerd,['Strafrecht'],[],Gevangenisstraf voor mensenhandel,"Rechtbank Den Haag, 17-08-2016, 09/842232-16",ECLI:NL:RBDHA:2016:10054,17-08-2016,uitspraak,"[{'Vindplaats': 'Rechtspraak.nl', 'VindplaatsAnnotator': '', 'VindplaatsUrl': ''}]"
ECLI-NL-GHAMS-2016-3221,http://deeplink.rechtspraak.nl/uitspraak?id=ECLI:NL:GHAMS:2016:3221,uitspraak,De publicatie van de uitspraak staat gepland op 09-08-2016 om 08:37 uur,https://uitspraken.rechtspraak.nl/inziendocument?id=ECLI:NL:GHAMS:2016:3221&showbutton=true&keyword=mensenhandel,0.0,['Hoger beroep'],09-08-2016,2016-08-09T08:37:42Z,gepubliceerd,['Strafrecht'],[],Vrijspraak mensenhandel. Prostitutie.,"Gerechtshof Amsterdam, 03-08-2016, 23-004748-14",ECLI:NL:GHAMS:2016:3221,03-08-2016,uitspraak,"[{'Vindplaats': 'Rechtspraak.nl', 'VindplaatsAnnotator': '', 'VindplaatsUrl': ''}]"
ECLI-NL-RBOBR-2015-2609,http://deeplink.rechtspraak.nl/uitspraak?id=ECLI:NL:RBOBR:2015:2609,uitspraak,De publicatie van de uitspraak staat gepland op 04-05-2015 om 13:08 uur,https://uitspraken.rechtspraak.nl/inziendocument?id=ECLI:NL:RBOBR:2015:2609&showbutton=true&keyword=mensenhandel,0.0,['Eerste aanleg - meervoudig'],04-05-2015,2015-05-04T13:08:07Z,gepubliceerd,['Strafrecht'],[],Vrijspraak van mensenhandel,"Rechtbank Oost-Brabant, 04-05-2015, 01/860045-14",ECLI:NL:RBOBR:2015:2609,04-05-2015,uitspraak,"[{'Vindplaats': 'Rechtspraak.nl', 'VindplaatsAnnotator': '', 'VindplaatsUrl': ''}]"
ECLI-NL-RBMNE-2014-2278,http://deeplink.rechtspraak.nl/uitspraak?id=ECLI:NL:RBMNE:2014:2278,uitspraak,De publicatie van de uitspraak staat gepland op 18-06-2014 om 09:57 uur,https://uitspraken.rechtspraak.nl/inziendocument?id=ECLI:NL:RBMNE:2014:2278&showbutton=true&keyword=mensenhandel,0.0,['Eerste aanleg - meervoudig'],18-06-2014,2014-06-18T09:57:25Z,gepubliceerd,['Strafrecht'],[],Veroordeling voor mensenhandel,"Rechtbank Midden-Nederland, 28-05-2014, 16-701067-13",ECLI:NL:RBMNE:2014:2278,28-05-2014,uitspraak,"[{'Vindplaats': 'Rechtspraak.nl', 'VindplaatsAnnotator': '', 'VindplaatsUrl': ''}]"
ECLI-NL-GHARL-2014-3064,http://deeplink.rechtspraak.nl/uitspraak?id=ECLI:NL:GHARL:2014:3064,uitspraak,De publicatie van de uitspraak staat gepland op 15-04-2014 om 14:30 uur,https://uitspraken.rechtspraak.nl/inziendocument?id=ECLI:NL:GHARL:2014:3064&showbutton=true&keyword=mensenhandel,0.0,['Hoger beroep'],15-04-2014,2014-04-15T14:30:13Z,gepubliceerd,['Strafrecht'],"[{'RelatieOmschrijving': 'Eerste aanleg: ', 'LinkTekst': 'ECLI:NL:RBZUT:2012:BV2125', 'Postfix': ', (Gedeeltelijke) vernietiging en zelf afgedaan', 'WebAdres': 'https://uitspraken.rechtspraak.nl/inziendocument?id=ECLI:NL:RBZUT:2012:BV2125&showbutton=true&keyword=mensenhandel'}]",Vrijspraak van mensenhandel,"Gerechtshof Arnhem-Leeuwarden, 15-04-2014, 21-000541-12",ECLI:NL:GHARL:2014:3064,15-04-2014,uitspraak,"[{'Vindplaats': 'Rechtspraak.nl', 'VindplaatsAnnotator': '', 'VindplaatsUrl': ''}]"
ECLI-NL-RBNHO-2013-10729,http://deeplink.rechtspraak.nl/uitspraak?id=ECLI:NL:RBNHO:2013:10729,uitspraak,De publicatie van de uitspraak staat gepland op 13-11-2013 om 15:50 uur,https://uitspraken.rechtspraak.nl/inziendocument?id=ECLI:NL:RBNHO:2013:10729&showbutton=true&keyword=mensenhandel,0.0,['Eerste aanleg - meervoudig'],13-11-2013,2013-11-13T15:50:20Z,gepubliceerd,['Strafrecht'],[],Promis; vrijspraak mensenhandel.,"Rechtbank Noord-Holland, 08-11-2013, 15/743099-13",ECLI:NL:RBNHO:2013:10729,08-11-2013,uitspraak,"[{'Vindplaats': 'Rechtspraak.nl', 'VindplaatsAnnotator': '', 'VindplaatsUrl': ''}]"
ECLI-NL-RBGEL-2013-3276,http://deeplink.rechtspraak.nl/uitspraak?id=ECLI:NL:RBGEL:2013:3276,uitspraak,De publicatie van de uitspraak staat gepland op 25-09-2013 om 13:00 uur,https://uitspraken.rechtspraak.nl/inziendocument?id=ECLI:NL:RBGEL:2013:3276&showbutton=true&keyword=mensenhandel,0.0,['Eerste aanleg - meervoudig'],25-09-2013,2013-09-25T13:00:44Z,gepubliceerd,['Strafrecht'],"[{'RelatieOmschrijving': 'Hoger beroep: ', 'LinkTekst': 'ECLI:NL:GHARL:2014:9417', 'Postfix': ', Meerdere afhandelingswijzen', 'WebAdres': 'https://uitspraken.rechtspraak.nl/inziendocument?id=ECLI:NL:GHARL:2014:9417&showbutton=true&keyword=mensenhandel'}, {'RelatieOmschrijving': 'Hoger beroep: ', 'LinkTekst': 'ECLI:NL:GHARL:2017:11491', 'Postfix': ', Meerdere afhandelingswijzen', 'WebAdres': 'https://uitspraken.rechtspraak.nl/inziendocument?id=ECLI:NL:GHARL:2017:11491&showbutton=true&keyword=mensenhandel'}]",Gevangenisstraf voor mensenhandel,"Rechtbank Gelderland, 23-09-2013, 05/860748-13, 05/780065-13",ECLI:NL:RBGEL:2013:3276,23-09-2013,uitspraak,"[{'Vindplaats': 'Rechtspraak.nl', 'VindplaatsAnnotator': '', 'VindplaatsUrl': ''}]"
ECLI-NL-GHAMS-2013-BZ8534,http://deeplink.rechtspraak.nl/uitspraak?id=ECLI:NL:GHAMS:2013:BZ8534,uitspraak,De publicatie van de uitspraak staat gepland op 24-04-2013 om 15:16 uur,https://uitspraken.rechtspraak.nl/inziendocument?id=ECLI:NL:GHAMS:2013:BZ8534&showbutton=true&keyword=mensenhandel,0.0,['Hoger beroep'],24-04-2013,2013-04-24T15:16:17Z,gepubliceerd,['Strafrecht'],[],"Mega Sierra, mensenhandel","Gerechtshof Amsterdam, 11-04-2013, 23-002819-12",ECLI:NL:GHAMS:2013:BZ8534,11-04-2013,uitspraak,"[{'Vindplaats': 'Rechtspraak.nl', 'VindplaatsAnnotator': '', 'VindplaatsUrl': ''}]"
ECLI-NL-GHAMS-2013-BZ8537,http://deeplink.rechtspraak.nl/uitspraak?id=ECLI:NL:GHAMS:2013:BZ8537,uitspraak,De publicatie van de uitspraak staat gepland op 24-04-2013 om 15:21 uur,https://uitspraken.rechtspraak.nl/inziendocument?id=ECLI:NL:GHAMS:2013:BZ8537&showbutton=true&keyword=mensenhandel,0.0,['Hoger beroep'],24-04-2013,2013-04-24T15:21:15Z,gepubliceerd,['Strafrecht'],[],"Mega Sierra, mensenhandel","Gerechtshof Amsterdam, 11-04-2013, 23-002818-12",ECLI:NL:GHAMS:2013:BZ8537,11-04-2013,uitspraak,"[{'Vindplaats': 'Rechtspraak.nl', 'VindplaatsAnnotator': '', 'VindplaatsUrl': ''}]"
ECLI-NL-RBUTR-2012-BV2375,http://deeplink.rechtspraak.nl/uitspraak?id=ECLI:NL:RBUTR:2012:BV2375,uitspraak,De publicatie van de uitspraak staat gepland op 01-02-2012 om 09:44 uur,https://uitspraken.rechtspraak.nl/inziendocument?id=ECLI:NL:RBUTR:2012:BV2375&showbutton=true&keyword=mensenhandel,0.0,['Eerste aanleg - meervoudig'],01-02-2012,2012-02-01T09:44:29Z,gepubliceerd,['Strafrecht'],[],poging tot mensenhandel,"Rechtbank Utrecht, 19-01-2012, 16-600279-11  ",ECLI:NL:RBUTR:2012:BV2375,19-01-2012,uitspraak,"[{'Vindplaats': 'Rechtspraak.nl', 'VindplaatsAnnotator': '', 'VindplaatsUrl': ''}]"
ECLI-NL-RBZLY-2011-BV2809,http://deeplink.rechtspraak.nl/uitspraak?id=ECLI:NL:RBZLY:2011:BV2809,uitspraak,De publicatie van de uitspraak staat gepland op 03-02-2012 om 15:26 uur,https://uitspraken.rechtspraak.nl/inziendocument?id=ECLI:NL:RBZLY:2011:BV2809&showbutton=true&keyword=mensenhandel,0.0,['Eerste aanleg - meervoudig'],03-02-2012,2012-02-03T15:26:56Z,gepubliceerd,['Strafrecht'],[],mensenhandel; gemotiveerde vrijspraak.,"Rechtbank Zwolle-Lelystad, 01-12-2011, 07/976431-07",ECLI:NL:RBZLY:2011:BV2809,01-12-2011,uitspraak,"[{'Vindplaats': 'Rechtspraak.nl', 'VindplaatsAnnotator': '', 'VindplaatsUrl': ''}]"
ECLI-NL-RBZLY-2011-BV7611,http://deeplink.rechtspraak.nl/uitspraak?id=ECLI:NL:RBZLY:2011:BV7611,uitspraak,De publicatie van de uitspraak staat gepland op 02-03-2012 om 15:02 uur,https://uitspraken.rechtspraak.nl/inziendocument?id=ECLI:NL:RBZLY:2011:BV7611&showbutton=true&keyword=mensenhandel,0.0,['Eerste aanleg - meervoudig'],02-03-2012,2012-03-02T15:02:38Z,gepubliceerd,['Strafrecht'],[],mensenhandel; gemotiveerde vrijspraak.,"Rechtbank Zwolle-Lelystad, 01-12-2011, 07. 976431-07",ECLI:NL:RBZLY:2011:BV7611,01-12-2011,uitspraak,"[{'Vindplaats': 'Rechtspraak.nl', 'VindplaatsAnnotator': '', 'VindplaatsUrl': ''}]"
ECLI-NL-RBLEE-2011-BQ4979,http://deeplink.rechtspraak.nl/uitspraak?id=ECLI:NL:RBLEE:2011:BQ4979,uitspraak,De publicatie van de uitspraak staat gepland op 18-05-2011 om 15:09 uur,https://uitspraken.rechtspraak.nl/inziendocument?id=ECLI:NL:RBLEE:2011:BQ4979&showbutton=true&keyword=mensenhandel,0.0,['Eerste aanleg - meervoudig'],18-05-2011,2011-05-18T15:09:12Z,gepubliceerd,['Strafrecht'],[],"Mensenhandel, bewijsverweren, veroordeling","Rechtbank Leeuwarden, 17-05-2011, 17/880031-11 VON",ECLI:NL:RBLEE:2011:BQ4979,17-05-2011,uitspraak,"[{'Vindplaats': 'Rechtspraak.nl', 'VindplaatsAnnotator': '', 'VindplaatsUrl': ''}]"
ECLI-NL-RBZLY-2010-BN4430,http://deeplink.rechtspraak.nl/uitspraak?id=ECLI:NL:RBZLY:2010:BN4430,uitspraak,De publicatie van de uitspraak staat gepland op 19-08-2010 om 10:00 uur,https://uitspraken.rechtspraak.nl/inziendocument?id=ECLI:NL:RBZLY:2010:BN4430&showbutton=true&keyword=mensenhandel,0.0,['Eerste aanleg - meervoudig'],19-08-2010,2010-08-19T10:00:06Z,gepubliceerd,['Strafrecht'],[],- gemotiveerde vrijspraak mensenhandel,"Rechtbank Zwolle-Lelystad, 15-07-2010, 07/662029-10",ECLI:NL:RBZLY:2010:BN4430,15-07-2010,uitspraak,"[{'Vindplaats': 'Rechtspraak.nl', 'VindplaatsAnnotator': '', 'VindplaatsUrl': ''}]"
ECLI-NL-RBZLY-2010-BN1826,http://deeplink.rechtspraak.nl/uitspraak?id=ECLI:NL:RBZLY:2010:BN1826,uitspraak,De publicatie van de uitspraak staat gepland op 21-07-2010 om 08:49 uur,https://uitspraken.rechtspraak.nl/inziendocument?id=ECLI:NL:RBZLY:2010:BN1826&showbutton=true&keyword=mensenhandel,0.0,['Eerste aanleg - enkelvoudig'],21-07-2010,2010-07-21T08:49:00Z,gepubliceerd,['Strafrecht'],[],"- mensenhandel
- gemotiveerde vrijspraak","Rechtbank Zwolle-Lelystad, 08-07-2010, 07/663092-10",ECLI:NL:RBZLY:2010:BN1826,08-07-2010,uitspraak,"[{'Vindplaats': 'Rechtspraak.nl', 'VindplaatsAnnotator': '', 'VindplaatsUrl': ''}]"
ECLI-NL-GHAMS-2010-BL7890,http://deeplink.rechtspraak.nl/uitspraak?id=ECLI:NL:GHAMS:2010:BL7890,uitspraak,De publicatie van de uitspraak staat gepland op 17-03-2010 om 14:40 uur,https://uitspraken.rechtspraak.nl/inziendocument?id=ECLI:NL:GHAMS:2010:BL7890&showbutton=true&keyword=mensenhandel,0.0,['Hoger beroep'],17-03-2010,2010-03-17T14:40:22Z,gepubliceerd,['Strafrecht'],"[{'RelatieOmschrijving': 'Cassatie: ', 'LinkTekst': 'ECLI:NL:HR:2011:BQ3787', 'Postfix': ', (Gedeeltelijke) vernietiging met terugwijzen', 'WebAdres': 'https://uitspraken.rechtspraak.nl/inziendocument?id=ECLI:NL:HR:2011:BQ3787&showbutton=true&keyword=mensenhandel'}, {'RelatieOmschrijving': 'Conclusie in cassatie: ', 'LinkTekst': 'ECLI:NL:PHR:2011:BQ3787', 'Postfix': None, 'WebAdres': 'https://uitspraken.rechtspraak.nl/inziendocument?id=ECLI:NL:PHR:2011:BQ3787&showbutton=true&keyword=mensenhandel'}]",schuldigverklaring aan mensenhandel,"Gerechtshof Amsterdam, 17-03-2010, 23-006349-08",ECLI:NL:GHAMS:2010:BL7890,17-03-2010,uitspraak,"[{'Vindplaats': 'Rechtspraak.nl', 'VindplaatsAnnotator': '', 'VindplaatsUrl': ''}]"
ECLI-NL-RBSHE-2010-BL5311,http://deeplink.rechtspraak.nl/uitspraak?id=ECLI:NL:RBSHE:2010:BL5311,uitspraak,De publicatie van de uitspraak staat gepland op 25-02-2010 om 13:38 uur,https://uitspraken.rechtspraak.nl/inziendocument?id=ECLI:NL:RBSHE:2010:BL5311&showbutton=true&keyword=mensenhandel,0.0,['Eerste aanleg - meervoudig'],25-02-2010,2010-02-25T13:38:26Z,gepubliceerd,['Strafrecht'],[],Vrijspraak voor mensenhandel.,"Rechtbank 's-Hertogenbosch, 19-02-2010, 01/839217-08",ECLI:NL:RBSHE:2010:BL5311,19-02-2010,uitspraak,"[{'Vindplaats': 'Rechtspraak.nl', 'VindplaatsAnnotator': '', 'VindplaatsUrl': ''}]"
ECLI-NL-RBLEE-2008-BC7314,http://deeplink.rechtspraak.nl/uitspraak?id=ECLI:NL:RBLEE:2008:BC7314,uitspraak,De publicatie van de uitspraak staat gepland op 20-03-2008 om 16:09 uur,https://uitspraken.rechtspraak.nl/inziendocument?id=ECLI:NL:RBLEE:2008:BC7314&showbutton=true&keyword=mensenhandel,0.0,['Eerste aanleg - meervoudig'],20-03-2008,2008-03-20T16:09:33Z,gepubliceerd,['Strafrecht'],[],"rechtsmacht, uitbuiting, mensenhandel","Rechtbank Leeuwarden, 20-03-2008, 17/880420-07 VEV",ECLI:NL:RBLEE:2008:BC7314,20-03-2008,uitspraak,"[{'Vindplaats': 'Rechtspraak.nl', 'VindplaatsAnnotator': '', 'VindplaatsUrl': ''}]"
ECLI-NL-RBLEE-2004-AQ9971,http://deeplink.rechtspraak.nl/uitspraak?id=ECLI:NL:RBLEE:2004:AQ9971,uitspraak,De publicatie van de uitspraak staat gepland op 08-09-2004 om 16:13 uur,https://uitspraken.rechtspraak.nl/inziendocument?id=ECLI:NL:RBLEE:2004:AQ9971&showbutton=true&keyword=mensenhandel,0.0,['Eerste aanleg - meervoudig'],08-09-2004,2004-09-08T16:13:33Z,gepubliceerd,['Strafrecht'],[],"Mensenhandel, prostitutie, veroordeling","Rechtbank Leeuwarden, 02-09-2004, 17/080143-04 VEV",ECLI:NL:RBLEE:2004:AQ9971,02-09-2004,uitspraak,"[{'Vindplaats': 'Rechtspraak.nl', 'VindplaatsAnnotator': '', 'VindplaatsUrl': ''}]"
ECLI-NL-RBDHA-2018-14569,http://deeplink.rechtspraak.nl/uitspraak?id=ECLI:NL:RBDHA:2018:14569,uitspraak,De publicatie van de uitspraak staat gepland op 11-01-2019 om 11:16 uur,https://uitspraken.rechtspraak.nl/inziendocument?id=ECLI:NL:RBDHA:2018:14569&showbutton=true&keyword=mensenhandel,0.0,['Eerste aanleg - enkelvoudig'],11-01-2019,2019-01-11T11:16:14Z,gepubliceerd,['Bestuursrecht; Vreemdelingenrecht'],[],"Intrekking vbv humanitair tijdelijk+ afwijzing aanvraag niet-tijdelijk humanitair. Mensenhandel niet aannemelijk gemaakt. Niet voldaan aan paspoortvereiste, brieven Mongoolse ambassade niet voldoende. Geen bijz. individuele omstheden ivm mensenhandel.","Rechtbank Den Haag, 06-12-2018, AWB - 18 _ 4504",ECLI:NL:RBDHA:2018:14569,06-12-2018,uitspraak,"[{'Vindplaats': 'Rechtspraak.nl', 'VindplaatsAnnotator': '', 'VindplaatsUrl': ''}]"
ECLI-NL-RBSHE-2010-BL5310,http://deeplink.rechtspraak.nl/uitspraak?id=ECLI:NL:RBSHE:2010:BL5310,uitspraak,De publicatie van de uitspraak staat gepland op 25-02-2010 om 13:17 uur,https://uitspraken.rechtspraak.nl/inziendocument?id=ECLI:NL:RBSHE:2010:BL5310&showbutton=true&keyword=mensenhandel,0.0,['Eerste aanleg - meervoudig'],25-02-2010,2010-02-25T13:17:38Z,gepubliceerd,['Strafrecht'],[],"Vrijspraak voor mensenhandel, omdat met name niet bewezen is dat er enige vorm van dwang of geweld heeft plaatsgevonden.
Deels voorwaardelijke gevangenisstraf en werkstraf voor poging tot mensenhandel.","Rechtbank 's-Hertogenbosch, 19-02-2010, 01/839154-08",ECLI:NL:RBSHE:2010:BL5310,19-02-2010,uitspraak,"[{'Vindplaats': 'Rechtspraak.nl', 'VindplaatsAnnotator': '', 'VindplaatsUrl': ''}]"
ECLI-NL-GHLEE-2003-AN8781,http://deeplink.rechtspraak.nl/uitspraak?id=ECLI:NL:GHLEE:2003:AN8781,uitspraak,De publicatie van de uitspraak staat gepland op 26-11-2003 om 11:47 uur,https://uitspraken.rechtspraak.nl/inziendocument?id=ECLI:NL:GHLEE:2003:AN8781&showbutton=true&keyword=mensenhandel,0.0,['Hoger beroep'],26-11-2003,2003-11-26T11:47:01Z,gepubliceerd,['Strafrecht'],[],"Verdachte heeft zich schuldig gemaakt aan mensenhandel en deelname aan een criminele organisatie. Deze organisatie, een duurzaam en gestructureerd samenwerkingsverband, had eveneens tot oogmerk het plegen van mensenhandel.","Gerechtshof Leeuwarden, 13-11-2003, 24-000861-01",ECLI:NL:GHLEE:2003:AN8781,13-11-2003,uitspraak,"[{'Vindplaats': 'Rechtspraak.nl', 'VindplaatsAnnotator': '', 'VindplaatsUrl': ''}]"
ECLI-NL-RBDHA-2021-8058,http://deeplink.rechtspraak.nl/uitspraak?id=ECLI:NL:RBDHA:2021:8058,uitspraak,De publicatie van de uitspraak staat gepland op 26-07-2021 om 13:28 uur,https://uitspraken.rechtspraak.nl/inziendocument?id=ECLI:NL:RBDHA:2021:8058&showbutton=true&keyword=mensenhandel,0.0,['Eerste aanleg - enkelvoudig'],26-07-2021,2021-07-26T13:28:45.806Z,gepubliceerd,['Bestuursrecht; Vreemdelingenrecht'],[],"gezinshereniging, mensenhandel, regulier, rechtsmacht","Rechtbank Den Haag, 21-07-2021, AWB 21/1478",ECLI:NL:RBDHA:2021:8058,21-07-2021,uitspraak,"[{'Vindplaats': 'Rechtspraak.nl', 'VindplaatsAnnotator': '', 'VindplaatsUrl': ''}]"
ECLI-NL-RBDHA-2021-5725,http://deeplink.rechtspraak.nl/uitspraak?id=ECLI:NL:RBDHA:2021:5725,uitspraak,De publicatie van de uitspraak staat gepland op 07-06-2021 om 10:41 uur,https://uitspraken.rechtspraak.nl/inziendocument?id=ECLI:NL:RBDHA:2021:5725&showbutton=true&keyword=mensenhandel,0.0,['Eerste aanleg - enkelvoudig'],07-06-2021,2021-06-07T10:41:05.651Z,gepubliceerd,['Bestuursrecht; Vreemdelingenrecht'],[],"aangifte mensenhandel, geseponeerd, ongegrond.","Rechtbank Den Haag, 02-06-2021, AWB 20/4578",ECLI:NL:RBDHA:2021:5725,02-06-2021,uitspraak,"[{'Vindplaats': 'Rechtspraak.nl', 'VindplaatsAnnotator': '', 'VindplaatsUrl': ''}]"
ECLI-NL-RBROT-2019-5090,http://deeplink.rechtspraak.nl/uitspraak?id=ECLI:NL:RBROT:2019:5090,uitspraak,De publicatie van de uitspraak staat gepland op 27-06-2019 om 11:00 uur,https://uitspraken.rechtspraak.nl/inziendocument?id=ECLI:NL:RBROT:2019:5090&showbutton=true&keyword=mensenhandel,0.0,['Eerste aanleg - meervoudig'],27-06-2019,2019-06-27T11:00:08Z,gepubliceerd,['Strafrecht'],[],Vrijspraak medeplegen / medeplichtigheid mensenhandel,"Rechtbank Rotterdam, 27-06-2019, 10/751010-18",ECLI:NL:RBROT:2019:5090,27-06-2019,uitspraak,"[{'Vindplaats': 'Rechtspraak.nl', 'VindplaatsAnnotator': '', 'VindplaatsUrl': ''}]"
ECLI-NL-RBROT-2019-5096,http://deeplink.rechtspraak.nl/uitspraak?id=ECLI:NL:RBROT:2019:5096,uitspraak,De publicatie van de uitspraak staat gepland op 27-06-2019 om 11:00 uur,https://uitspraken.rechtspraak.nl/inziendocument?id=ECLI:NL:RBROT:2019:5096&showbutton=true&keyword=mensenhandel,0.0,['Eerste aanleg - meervoudig'],27-06-2019,2019-06-27T11:00:10Z,gepubliceerd,['Strafrecht'],[],Vrijspraak medeplegen / medeplichtigheid mensenhandel.,"Rechtbank Rotterdam, 27-06-2019, 10/751006-18",ECLI:NL:RBROT:2019:5096,27-06-2019,uitspraak,"[{'Vindplaats': 'Rechtspraak.nl', 'VindplaatsAnnotator': '', 'VindplaatsUrl': ''}]"
ECLI-NL-RBROT-2019-5098,http://deeplink.rechtspraak.nl/uitspraak?id=ECLI:NL:RBROT:2019:5098,uitspraak,De publicatie van de uitspraak staat gepland op 27-06-2019 om 11:10 uur,https://uitspraken.rechtspraak.nl/inziendocument?id=ECLI:NL:RBROT:2019:5098&showbutton=true&keyword=mensenhandel,0.0,['Eerste aanleg - meervoudig'],27-06-2019,2019-06-27T11:10:38Z,gepubliceerd,['Strafrecht'],[],Vrijspraak medeplegen/medeplichtigheid mensenhandel.,"Rechtbank Rotterdam, 27-06-2019, 10/750027-18",ECLI:NL:RBROT:2019:5098,27-06-2019,uitspraak,"[{'Vindplaats': 'Rechtspraak.nl', 'VindplaatsAnnotator': '', 'VindplaatsUrl': ''}]"
ECLI-NL-GHAMS-2018-3635,http://deeplink.rechtspraak.nl/uitspraak?id=ECLI:NL:GHAMS:2018:3635,uitspraak,De publicatie van de uitspraak staat gepland op 20-11-2018 om 09:43 uur,https://uitspraken.rechtspraak.nl/inziendocument?id=ECLI:NL:GHAMS:2018:3635&showbutton=true&keyword=mensenhandel,0.0,['Hoger beroep'],20-11-2018,2018-11-20T09:43:53Z,gepubliceerd,['Strafrecht; Materieel strafrecht'],[],"Ontneming, Mensenhandel. Aftrekbare kosten.","Gerechtshof Amsterdam, 05-10-2018, 23-002122-12",ECLI:NL:GHAMS:2018:3635,05-10-2018,uitspraak,"[{'Vindplaats': 'Rechtspraak.nl', 'VindplaatsAnnotator': '', 'VindplaatsUrl': ''}]"
ECLI-NL-GHAMS-2018-3636,http://deeplink.rechtspraak.nl/uitspraak?id=ECLI:NL:GHAMS:2018:3636,uitspraak,De publicatie van de uitspraak staat gepland op 20-11-2018 om 09:56 uur,https://uitspraken.rechtspraak.nl/inziendocument?id=ECLI:NL:GHAMS:2018:3636&showbutton=true&keyword=mensenhandel,0.0,['Hoger beroep'],20-11-2018,2018-11-20T09:56:23Z,gepubliceerd,['Strafrecht; Materieel strafrecht'],[],"Ontneming, Mensenhandel. Aftrekbare kosten","Gerechtshof Amsterdam, 05-10-2018, 23-002123-12",ECLI:NL:GHAMS:2018:3636,05-10-2018,uitspraak,"[{'Vindplaats': 'Rechtspraak.nl', 'VindplaatsAnnotator': '', 'VindplaatsUrl': ''}]"
ECLI-NL-GHAMS-2018-2420,http://deeplink.rechtspraak.nl/uitspraak?id=ECLI:NL:GHAMS:2018:2420,uitspraak,De publicatie van de uitspraak staat gepland op 12-07-2018 om 17:08 uur,https://uitspraken.rechtspraak.nl/inziendocument?id=ECLI:NL:GHAMS:2018:2420&showbutton=true&keyword=mensenhandel,0.0,['Hoger beroep'],12-07-2018,2018-07-12T17:08:06Z,gepubliceerd,['Strafrecht'],[],Zak Voetveer. Mensenhandel. Vrijspraak,"Gerechtshof Amsterdam, 12-07-2018, 23-000851-16",ECLI:NL:GHAMS:2018:2420,12-07-2018,uitspraak,"[{'Vindplaats': 'Rechtspraak.nl', 'VindplaatsAnnotator': '', 'VindplaatsUrl': ''}]"
ECLI-NL-GHAMS-2018-2421,http://deeplink.rechtspraak.nl/uitspraak?id=ECLI:NL:GHAMS:2018:2421,uitspraak,De publicatie van de uitspraak staat gepland op 12-07-2018 om 17:19 uur,https://uitspraken.rechtspraak.nl/inziendocument?id=ECLI:NL:GHAMS:2018:2421&showbutton=true&keyword=mensenhandel,0.0,['Hoger beroep'],12-07-2018,2018-07-12T17:19:06Z,gepubliceerd,['Strafrecht'],[],Zaak Voetveer. Mensenhandel. Vrijspraak,"Gerechtshof Amsterdam, 12-07-2018, 23-000855-16",ECLI:NL:GHAMS:2018:2421,12-07-2018,uitspraak,"[{'Vindplaats': 'Rechtspraak.nl', 'VindplaatsAnnotator': '', 'VindplaatsUrl': ''}]"
ECLI-NL-RBROT-2018-2831,http://deeplink.rechtspraak.nl/uitspraak?id=ECLI:NL:RBROT:2018:2831,uitspraak,De publicatie van de uitspraak staat gepland op 12-04-2018 om 10:28 uur,https://uitspraken.rechtspraak.nl/inziendocument?id=ECLI:NL:RBROT:2018:2831&showbutton=true&keyword=mensenhandel,0.0,['Eerste aanleg - meervoudig'],12-04-2018,2018-04-12T10:28:46Z,gepubliceerd,['Strafrecht'],[],Ontneming in mensenhandel; jeugd.,"Rechtbank Rotterdam, 22-02-2018, 10/750086-17 vonnis ontneming",ECLI:NL:RBROT:2018:2831,22-02-2018,uitspraak,"[{'Vindplaats': 'Rechtspraak.nl', 'VindplaatsAnnotator': '', 'VindplaatsUrl': ''}]"
ECLI-NL-RBROT-2018-2833,http://deeplink.rechtspraak.nl/uitspraak?id=ECLI:NL:RBROT:2018:2833,uitspraak,De publicatie van de uitspraak staat gepland op 12-04-2018 om 12:05 uur,https://uitspraken.rechtspraak.nl/inziendocument?id=ECLI:NL:RBROT:2018:2833&showbutton=true&keyword=mensenhandel,0.0,['Eerste aanleg - meervoudig'],12-04-2018,2018-04-12T12:05:16Z,gepubliceerd,['Strafrecht'],[],Ontneming in mensenhandel; jeugd.,"Rechtbank Rotterdam, 22-02-2018, 10/750036-17 vonnis ontneming",ECLI:NL:RBROT:2018:2833,22-02-2018,uitspraak,"[{'Vindplaats': 'Rechtspraak.nl', 'VindplaatsAnnotator': '', 'VindplaatsUrl': ''}]"
ECLI-NL-RBNHO-2017-2168,http://deeplink.rechtspraak.nl/uitspraak?id=ECLI:NL:RBNHO:2017:2168,uitspraak,De publicatie van de uitspraak staat gepland op 17-03-2017 om 09:03 uur,https://uitspraken.rechtspraak.nl/inziendocument?id=ECLI:NL:RBNHO:2017:2168&showbutton=true&keyword=mensenhandel,0.0,['Eerste aanleg - meervoudig'],17-03-2017,2017-03-17T09:03:41Z,gepubliceerd,['Strafrecht'],[],"Mensenhandel, prostitutie minderjarig meisje.","Rechtbank Noord-Holland, 16-03-2017, 15/800180-16",ECLI:NL:RBNHO:2017:2168,16-03-2017,uitspraak,"[{'Vindplaats': 'Rechtspraak.nl', 'VindplaatsAnnotator': '', 'VindplaatsUrl': ''}]"
ECLI-NL-RBMNE-2016-368,http://deeplink.rechtspraak.nl/uitspraak?id=ECLI:NL:RBMNE:2016:368,uitspraak,De publicatie van de uitspraak staat gepland op 02-02-2016 om 10:28 uur,https://uitspraken.rechtspraak.nl/inziendocument?id=ECLI:NL:RBMNE:2016:368&showbutton=true&keyword=mensenhandel,0.0,['Eerste aanleg - meervoudig'],02-02-2016,2016-02-02T10:28:54Z,gepubliceerd,['Strafrecht'],"[{'RelatieOmschrijving': 'Hoger beroep: ', 'LinkTekst': 'ECLI:NL:GHARL:2017:3203', 'Postfix': ', (Gedeeltelijke) vernietiging en zelf afgedaan', 'WebAdres': 'https://uitspraken.rechtspraak.nl/inziendocument?id=ECLI:NL:GHARL:2017:3203&showbutton=true&keyword=mensenhandel'}]","Mensenhandel, webcamseks, herroeping VI","Rechtbank Midden-Nederland, 21-01-2016, 16/661486-15",ECLI:NL:RBMNE:2016:368,21-01-2016,uitspraak,"[{'Vindplaats': 'Rechtspraak.nl', 'VindplaatsAnnotator': '', 'VindplaatsUrl': ''}]"
ECLI-NL-RBZWB-2015-5112,http://deeplink.rechtspraak.nl/uitspraak?id=ECLI:NL:RBZWB:2015:5112,uitspraak,De publicatie van de uitspraak staat gepland op 30-07-2015 om 12:55 uur,https://uitspraken.rechtspraak.nl/inziendocument?id=ECLI:NL:RBZWB:2015:5112&showbutton=true&keyword=mensenhandel,0.0,['Eerste aanleg - meervoudig'],30-07-2015,2015-07-30T12:55:43Z,gepubliceerd,['Strafrecht'],"[{'RelatieOmschrijving': 'Hoger beroep: ', 'LinkTekst': 'ECLI:NL:GHSHE:2018:2933', 'Postfix': ', (Gedeeltelijke) vernietiging en zelf afgedaan', 'WebAdres': 'https://uitspraken.rechtspraak.nl/inziendocument?id=ECLI:NL:GHSHE:2018:2933&showbutton=true&keyword=mensenhandel'}]",Mensenhandel. Loverboy-zaak. Straftoemeting.,"Rechtbank Zeeland-West-Brabant, 30-07-2015, 02/700224-13",ECLI:NL:RBZWB:2015:5112,30-07-2015,uitspraak,"[{'Vindplaats': 'Rechtspraak.nl', 'VindplaatsAnnotator': '', 'VindplaatsUrl': ''}]"
ECLI-NL-RBLIM-2014-3743,http://deeplink.rechtspraak.nl/uitspraak?id=ECLI:NL:RBLIM:2014:3743,uitspraak,De publicatie van de uitspraak staat gepland op 23-04-2014 om 12:15 uur,https://uitspraken.rechtspraak.nl/inziendocument?id=ECLI:NL:RBLIM:2014:3743&showbutton=true&keyword=mensenhandel,0.0,['Eerste aanleg - meervoudig'],23-04-2014,2014-04-23T12:15:04Z,gepubliceerd,['Strafrecht'],[],Verdachte vrijgesproken van mensenhandel,"Rechtbank Limburg, 18-04-2014, 03/700542-12",ECLI:NL:RBLIM:2014:3743,18-04-2014,uitspraak,"[{'Vindplaats': 'Rechtspraak.nl', 'VindplaatsAnnotator': '', 'VindplaatsUrl': ''}]"
ECLI-NL-RBLEE-2011-BQ4976,http://deeplink.rechtspraak.nl/uitspraak?id=ECLI:NL:RBLEE:2011:BQ4976,uitspraak,De publicatie van de uitspraak staat gepland op 18-05-2011 om 15:07 uur,https://uitspraken.rechtspraak.nl/inziendocument?id=ECLI:NL:RBLEE:2011:BQ4976&showbutton=true&keyword=mensenhandel,0.0,['Eerste aanleg - meervoudig'],18-05-2011,2011-05-18T15:07:47Z,gepubliceerd,['Strafrecht'],[],"Mensenhandel, geen medeplegen, vrijspraak.","Rechtbank Leeuwarden, 17-05-2011, 17/880032-11 VON",ECLI:NL:RBLEE:2011:BQ4976,17-05-2011,uitspraak,"[{'Vindplaats': 'NJFS 2011/186', 'VindplaatsAnnotator': '', 'VindplaatsUrl': ''}, {'Vindplaats': 'Rechtspraak.nl', 'VindplaatsAnnotator': '', 'VindplaatsUrl': ''}]"
ECLI-NL-RBUTR-2011-BP5092,http://deeplink.rechtspraak.nl/uitspraak?id=ECLI:NL:RBUTR:2011:BP5092,uitspraak,De publicatie van de uitspraak staat gepland op 18-02-2011 om 15:14 uur,https://uitspraken.rechtspraak.nl/inziendocument?id=ECLI:NL:RBUTR:2011:BP5092&showbutton=true&keyword=mensenhandel,0.0,['Eerste aanleg - meervoudig'],18-02-2011,2011-02-18T15:14:44Z,gepubliceerd,['Strafrecht'],"[{'RelatieOmschrijving': 'Hoger beroep: ', 'LinkTekst': 'ECLI:NL:GHARL:2013:8972', 'Postfix': ', Meerdere afhandelingswijzen', 'WebAdres': 'https://uitspraken.rechtspraak.nl/inziendocument?id=ECLI:NL:GHARL:2013:8972&showbutton=true&keyword=mensenhandel'}]",Mensenhandel. Criminele organisatie. Sneep.,"Rechtbank Utrecht, 18-02-2011, 08/963014-07",ECLI:NL:RBUTR:2011:BP5092,18-02-2011,uitspraak,"[{'Vindplaats': 'Rechtspraak.nl', 'VindplaatsAnnotator': '', 'VindplaatsUrl': ''}]"
ECLI-NL-RBUTR-2011-BP6723,http://deeplink.rechtspraak.nl/uitspraak?id=ECLI:NL:RBUTR:2011:BP6723,uitspraak,De publicatie van de uitspraak staat gepland op 04-03-2011 om 15:03 uur,https://uitspraken.rechtspraak.nl/inziendocument?id=ECLI:NL:RBUTR:2011:BP6723&showbutton=true&keyword=mensenhandel,0.0,['Eerste aanleg - meervoudig'],04-03-2011,2011-03-04T15:03:28Z,gepubliceerd,['Strafrecht'],[],Mensenhandel-criminele organisatie-Sneepzaak,"Rechtbank Utrecht, 18-02-2011, 08/963011-07",ECLI:NL:RBUTR:2011:BP6723,18-02-2011,uitspraak,"[{'Vindplaats': 'Rechtspraak.nl', 'VindplaatsAnnotator': '', 'VindplaatsUrl': ''}]"
ECLI-NL-RBUTR-2011-BP6953,http://deeplink.rechtspraak.nl/uitspraak?id=ECLI:NL:RBUTR:2011:BP6953,uitspraak,De publicatie van de uitspraak staat gepland op 07-03-2011 om 15:14 uur,https://uitspraken.rechtspraak.nl/inziendocument?id=ECLI:NL:RBUTR:2011:BP6953&showbutton=true&keyword=mensenhandel,0.0,['Eerste aanleg - meervoudig'],07-03-2011,2011-03-07T15:14:00Z,gepubliceerd,['Strafrecht'],[],Mensenhandel - Criminele organisatie-Sneepzaak,"Rechtbank Utrecht, 18-02-2011, 08/963017-07",ECLI:NL:RBUTR:2011:BP6953,18-02-2011,uitspraak,"[{'Vindplaats': 'Rechtspraak.nl', 'VindplaatsAnnotator': '', 'VindplaatsUrl': ''}]"
ECLI-NL-RBUTR-2011-BP7252,http://deeplink.rechtspraak.nl/uitspraak?id=ECLI:NL:RBUTR:2011:BP7252,uitspraak,De publicatie van de uitspraak staat gepland op 09-03-2011 om 15:53 uur,https://uitspraken.rechtspraak.nl/inziendocument?id=ECLI:NL:RBUTR:2011:BP7252&showbutton=true&keyword=mensenhandel,0.0,['Eerste aanleg - meervoudig'],09-03-2011,2011-03-09T15:53:09Z,gepubliceerd,['Strafrecht'],[],Mensenhandel - Criminele organisatie-Sneepzaak -,"Rechtbank Utrecht, 18-02-2011, 08/963000-09",ECLI:NL:RBUTR:2011:BP7252,18-02-2011,uitspraak,"[{'Vindplaats': 'Rechtspraak.nl', 'VindplaatsAnnotator': '', 'VindplaatsUrl': ''}]"
ECLI-NL-RBUTR-2011-BP7377,http://deeplink.rechtspraak.nl/uitspraak?id=ECLI:NL:RBUTR:2011:BP7377,uitspraak,De publicatie van de uitspraak staat gepland op 10-03-2011 om 16:22 uur,https://uitspraken.rechtspraak.nl/inziendocument?id=ECLI:NL:RBUTR:2011:BP7377&showbutton=true&keyword=mensenhandel,0.0,['Eerste aanleg - meervoudig'],10-03-2011,2011-03-10T16:22:53Z,gepubliceerd,['Strafrecht'],[],Mensenhandel - Criminele organisatie-Sneepzaak,"Rechtbank Utrecht, 18-02-2011, 08/963006-07",ECLI:NL:RBUTR:2011:BP7377,18-02-2011,uitspraak,"[{'Vindplaats': 'Rechtspraak.nl', 'VindplaatsAnnotator': '', 'VindplaatsUrl': ''}]"
ECLI-NL-RBUTR-2011-BP7662,http://deeplink.rechtspraak.nl/uitspraak?id=ECLI:NL:RBUTR:2011:BP7662,uitspraak,De publicatie van de uitspraak staat gepland op 15-03-2011 om 13:39 uur,https://uitspraken.rechtspraak.nl/inziendocument?id=ECLI:NL:RBUTR:2011:BP7662&showbutton=true&keyword=mensenhandel,0.0,['Eerste aanleg - meervoudig'],15-03-2011,2011-03-15T13:39:19Z,gepubliceerd,['Strafrecht'],"[{'RelatieOmschrijving': 'Hoger beroep: ', 'LinkTekst': 'ECLI:NL:GHARL:2013:8902', 'Postfix': ', Meerdere afhandelingswijzen', 'WebAdres': 'https://uitspraken.rechtspraak.nl/inziendocument?id=ECLI:NL:GHARL:2013:8902&showbutton=true&keyword=mensenhandel'}]",Mensenhandel-Criminele organisatie-Sneepzaak,"Rechtbank Utrecht, 18-02-2011, 08/963005-07",ECLI:NL:RBUTR:2011:BP7662,18-02-2011,uitspraak,"[{'Vindplaats': 'Rechtspraak.nl', 'VindplaatsAnnotator': '', 'VindplaatsUrl': ''}]"
ECLI-NL-RBZLY-2010-BN1830,http://deeplink.rechtspraak.nl/uitspraak?id=ECLI:NL:RBZLY:2010:BN1830,uitspraak,De publicatie van de uitspraak staat gepland op 21-07-2010 om 09:05 uur,https://uitspraken.rechtspraak.nl/inziendocument?id=ECLI:NL:RBZLY:2010:BN1830&showbutton=true&keyword=mensenhandel,0.0,['Eerste aanleg - meervoudig'],21-07-2010,2010-07-21T09:05:21Z,gepubliceerd,['Strafrecht'],[],"- mensenhandel
- bewijs- en strafmotivering","Rechtbank Zwolle-Lelystad, 08-07-2010, 07/630345-09",ECLI:NL:RBZLY:2010:BN1830,08-07-2010,uitspraak,"[{'Vindplaats': 'Rechtspraak.nl', 'VindplaatsAnnotator': '', 'VindplaatsUrl': ''}]"
ECLI-NL-RBUTR-2010-BM5987,http://deeplink.rechtspraak.nl/uitspraak?id=ECLI:NL:RBUTR:2010:BM5987,uitspraak,De publicatie van de uitspraak staat gepland op 27-05-2010 om 16:10 uur,https://uitspraken.rechtspraak.nl/inziendocument?id=ECLI:NL:RBUTR:2010:BM5987&showbutton=true&keyword=mensenhandel,0.0,['Eerste aanleg - meervoudig'],27-05-2010,2010-05-27T16:10:13Z,gepubliceerd,['Strafrecht'],[],Schorsing voorlopige hechtenis mensenhandel.,"Rechtbank Utrecht, 27-05-2010, 16/711450-09",ECLI:NL:RBUTR:2010:BM5987,27-05-2010,uitspraak,"[{'Vindplaats': 'Rechtspraak.nl', 'VindplaatsAnnotator': '', 'VindplaatsUrl': ''}]"
ECLI-NL-RBZLY-2008-BD6186,http://deeplink.rechtspraak.nl/uitspraak?id=ECLI:NL:RBZLY:2008:BD6186,uitspraak,De publicatie van de uitspraak staat gepland op 03-07-2008 om 12:46 uur,https://uitspraken.rechtspraak.nl/inziendocument?id=ECLI:NL:RBZLY:2008:BD6186&showbutton=true&keyword=mensenhandel,0.0,['Eerste aanleg - meervoudig'],03-07-2008,2008-07-03T12:46:04Z,gepubliceerd,['Strafrecht'],[],"mensenhandel, tenlastelegging, gemotiveerde vrijspraak","Rechtbank Zwolle-Lelystad, 12-06-2008, 07/440238-06",ECLI:NL:RBZLY:2008:BD6186,12-06-2008,uitspraak,"[{'Vindplaats': 'Rechtspraak.nl', 'VindplaatsAnnotator': '', 'VindplaatsUrl': ''}]"
ECLI-NL-RBZWO-2003-AH8774,http://deeplink.rechtspraak.nl/uitspraak?id=ECLI:NL:RBZWO:2003:AH8774,uitspraak,De publicatie van de uitspraak staat gepland op 30-06-2003 om 13:07 uur,https://uitspraken.rechtspraak.nl/inziendocument?id=ECLI:NL:RBZWO:2003:AH8774&showbutton=true&keyword=mensenhandel,0.0,['Eerste aanleg - meervoudig'],30-06-2003,2003-06-30T13:07:10Z,gepubliceerd,['Strafrecht'],[],"Mensenhandel, ontvankelijkheid OM / bewijsuitsluiting.","Rechtbank Zwolle, 26-06-2003, 07.840005-02",ECLI:NL:RBZWO:2003:AH8774,26-06-2003,uitspraak,"[{'Vindplaats': 'Rechtspraak.nl', 'VindplaatsAnnotator': '', 'VindplaatsUrl': ''}]"
ECLI-NL-GHARL-2013-4611,http://deeplink.rechtspraak.nl/uitspraak?id=ECLI:NL:GHARL:2013:4611,uitspraak,De publicatie van de uitspraak staat gepland op 01-07-2013 om 14:33 uur,https://uitspraken.rechtspraak.nl/inziendocument?id=ECLI:NL:GHARL:2013:4611&showbutton=true&keyword=mensenhandel,0.0,['Hoger beroep'],01-07-2013,2013-07-01T14:33:46Z,gepubliceerd,['Strafrecht'],[],"Mensenhandel. Ontkennende verdachte. Bewijsverweren worden verworpen. Veroordeling ter zake mensenhandel tot een gevangenisstraf voor de duur van 4 jaren.
Gevangenneming van verdachte. Toewijzing van de vorderingen van de benadeelde partijen.","Gerechtshof Arnhem-Leeuwarden, 01-07-2013, 24-002670-09",ECLI:NL:GHARL:2013:4611,01-07-2013,uitspraak,"[{'Vindplaats': 'Rechtspraak.nl', 'VindplaatsAnnotator': '', 'VindplaatsUrl': ''}]"
ECLI-NL-RBAMS-2018-6932,http://deeplink.rechtspraak.nl/uitspraak?id=ECLI:NL:RBAMS:2018:6932,uitspraak,De publicatie van de uitspraak staat gepland op 11-10-2018 om 15:42 uur,https://uitspraken.rechtspraak.nl/inziendocument?id=ECLI:NL:RBAMS:2018:6932&showbutton=true&keyword=mensenhandel,0.0,['Eerste aanleg - meervoudig'],11-10-2018,2018-10-11T15:42:34Z,gepubliceerd,['Strafrecht'],[],"Onderzoek naar mensenhandel op Europees niveau.
Verdachte wordt vrijgesproken van mensenhandel.
Hij wordt veroordeeld tot een gevangenisstraf gelijk aan het voorarrest voor mishandeling en voor het gebruiken van een vervalst rijbewijs.","Rechtbank Amsterdam, 28-09-2018, 13-730084-16",ECLI:NL:RBAMS:2018:6932,28-09-2018,uitspraak,"[{'Vindplaats': 'Rechtspraak.nl', 'VindplaatsAnnotator': '', 'VindplaatsUrl': ''}]"
ECLI-NL-RBZUT-2012-BX5202,http://deeplink.rechtspraak.nl/uitspraak?id=ECLI:NL:RBZUT:2012:BX5202,uitspraak,De publicatie van de uitspraak staat gepland op 21-08-2012 om 16:16 uur,https://uitspraken.rechtspraak.nl/inziendocument?id=ECLI:NL:RBZUT:2012:BX5202&showbutton=true&keyword=mensenhandel,0.0,['Eerste aanleg - meervoudig'],21-08-2012,2012-08-21T16:16:25Z,gepubliceerd,['Strafrecht'],[],"Loverboy veroordeelt tot een gevangenisstraf voor de duur van 2 jaar inzake mensenhandel. Uitgebreid niet-ontvankelijkheidsverweer van raadsman. Vrijspraak witwassen, (groeps)verkrachting en een poging tot mensenhandel van een minderjarig meisje.","Rechtbank Zutphen, 21-08-2012, 06/950298-11",ECLI:NL:RBZUT:2012:BX5202,21-08-2012,uitspraak,"[{'Vindplaats': 'Rechtspraak.nl', 'VindplaatsAnnotator': '', 'VindplaatsUrl': ''}]"
ECLI-NL-OGEAC-2021-147,http://deeplink.rechtspraak.nl/uitspraak?id=ECLI:NL:OGEAC:2021:147,uitspraak,De publicatie van de uitspraak staat gepland op 18-08-2021 om 17:52 uur,https://uitspraken.rechtspraak.nl/inziendocument?id=ECLI:NL:OGEAC:2021:147&showbutton=true&keyword=mensenhandel,0.0,"['Eerste aanleg - enkelvoudig', 'Op tegenspraak']",18-08-2021,2021-08-18T17:52:44Z,gepubliceerd,['Strafrecht'],[],mensenhandel mensensmokkel valsheid in geschrifte,"Gerecht in eerste aanleg van Curaçao, 19-07-2021, 500.00275/20",ECLI:NL:OGEAC:2021:147,19-07-2021,uitspraak,"[{'Vindplaats': 'Rechtspraak.nl', 'VindplaatsAnnotator': '', 'VindplaatsUrl': ''}]"
ECLI-NL-OGEAC-2021-131,http://deeplink.rechtspraak.nl/uitspraak?id=ECLI:NL:OGEAC:2021:131,uitspraak,De publicatie van de uitspraak staat gepland op 21-07-2021 om 10:30 uur,https://uitspraken.rechtspraak.nl/inziendocument?id=ECLI:NL:OGEAC:2021:131&showbutton=true&keyword=mensenhandel,0.0,['Eerste aanleg - enkelvoudig'],21-07-2021,2021-07-21T10:30:01Z,gepubliceerd,['Strafrecht; Penitentiair strafrecht'],[],mensenhandel mensensmokkel valsheid in geschrifte,"Gerecht in eerste aanleg van Curaçao, 11-06-2021, 500.00003/20",ECLI:NL:OGEAC:2021:131,11-06-2021,uitspraak,"[{'Vindplaats': 'Rechtspraak.nl', 'VindplaatsAnnotator': '', 'VindplaatsUrl': ''}]"
ECLI-NL-RBAMS-2019-10112,http://deeplink.rechtspraak.nl/uitspraak?id=ECLI:NL:RBAMS:2019:10112,uitspraak,De publicatie van de uitspraak staat gepland op 04-03-2020 om 08:39 uur,https://uitspraken.rechtspraak.nl/inziendocument?id=ECLI:NL:RBAMS:2019:10112&showbutton=true&keyword=mensenhandel,0.0,['Eerste aanleg - meervoudig'],04-03-2020,2020-03-04T08:39:40Z,gepubliceerd,['Strafrecht'],[],Medeplegen van mensenhandel en gewoontewitwassen,"Rechtbank Amsterdam, 31-10-2019, 13/730020-15 (13Overloon)",ECLI:NL:RBAMS:2019:10112,31-10-2019,uitspraak,"[{'Vindplaats': 'Rechtspraak.nl', 'VindplaatsAnnotator': '', 'VindplaatsUrl': ''}]"
ECLI-NL-RBDHA-2019-10421,http://deeplink.rechtspraak.nl/uitspraak?id=ECLI:NL:RBDHA:2019:10421,uitspraak,De publicatie van de uitspraak staat gepland op 07-10-2019 om 11:53 uur,https://uitspraken.rechtspraak.nl/inziendocument?id=ECLI:NL:RBDHA:2019:10421&showbutton=true&keyword=mensenhandel,0.0,['Eerste aanleg - enkelvoudig'],07-10-2019,2019-10-07T11:53:27Z,gepubliceerd,['Bestuursrecht; Vreemdelingenrecht'],[],"Dublin Spanje, mensenhandel, aangifte politie","Rechtbank Den Haag, 26-09-2019, NL19.18360",ECLI:NL:RBDHA:2019:10421,26-09-2019,uitspraak,"[{'Vindplaats': 'Rechtspraak.nl', 'VindplaatsAnnotator': '', 'VindplaatsUrl': ''}]"
ECLI-NL-RBDHA-2019-7309,http://deeplink.rechtspraak.nl/uitspraak?id=ECLI:NL:RBDHA:2019:7309,uitspraak,De publicatie van de uitspraak staat gepland op 19-07-2019 om 10:22 uur,https://uitspraken.rechtspraak.nl/inziendocument?id=ECLI:NL:RBDHA:2019:7309&showbutton=true&keyword=mensenhandel,0.0,['Voorlopige voorziening'],19-07-2019,2019-07-19T10:22:31Z,gepubliceerd,['Bestuursrecht; Vreemdelingenrecht'],[],feitelijke overdracht; aangifte mensenhandel; Italië,"Rechtbank Den Haag, 12-07-2019, AWB 19/5251",ECLI:NL:RBDHA:2019:7309,12-07-2019,uitspraak,"[{'Vindplaats': 'Rechtspraak.nl', 'VindplaatsAnnotator': '', 'VindplaatsUrl': ''}]"
ECLI-NL-RBDHA-2019-3297,http://deeplink.rechtspraak.nl/uitspraak?id=ECLI:NL:RBDHA:2019:3297,uitspraak,De publicatie van de uitspraak staat gepland op 05-04-2019 om 10:25 uur,https://uitspraken.rechtspraak.nl/inziendocument?id=ECLI:NL:RBDHA:2019:3297&showbutton=true&keyword=mensenhandel,0.0,"['Eerste aanleg - enkelvoudig', 'Mondelinge uitspraak', 'Voorlopige voorziening+bodemzaak']",05-04-2019,2019-04-05T10:25:30Z,gepubliceerd,['Bestuursrecht; Vreemdelingenrecht'],[],"dublin, herhaalde aanvraag, aangifte mensenhandel","Rechtbank Den Haag, 14-03-2019, nl19.3090",ECLI:NL:RBDHA:2019:3297,14-03-2019,uitspraak,"[{'Vindplaats': 'Rechtspraak.nl', 'VindplaatsAnnotator': '', 'VindplaatsUrl': ''}]"
ECLI-NL-GHARL-2018-11734,http://deeplink.rechtspraak.nl/uitspraak?id=ECLI:NL:GHARL:2018:11734,uitspraak,De publicatie van de uitspraak staat gepland op 30-01-2020 om 12:05 uur,https://uitspraken.rechtspraak.nl/inziendocument?id=ECLI:NL:GHARL:2018:11734&showbutton=true&keyword=mensenhandel,0.0,['Hoger beroep'],30-01-2020,2020-01-30T12:05:04Z,gepubliceerd,['Strafrecht'],[],Mensenhandel. Minderjarige in de prostitutie.,"Gerechtshof Arnhem-Leeuwarden, 15-06-2018, 21-007236-15",ECLI:NL:GHARL:2018:11734,15-06-2018,uitspraak,"[{'Vindplaats': 'Rechtspraak.nl', 'VindplaatsAnnotator': '', 'VindplaatsUrl': ''}]"
ECLI-NL-GHARL-2018-1974,http://deeplink.rechtspraak.nl/uitspraak?id=ECLI:NL:GHARL:2018:1974,uitspraak,De publicatie van de uitspraak staat gepland op 01-03-2018 om 16:41 uur,https://uitspraken.rechtspraak.nl/inziendocument?id=ECLI:NL:GHARL:2018:1974&showbutton=true&keyword=mensenhandel,0.0,['Hoger beroep'],01-03-2018,2018-03-01T16:41:22Z,gepubliceerd,['Strafrecht'],"[{'RelatieOmschrijving': 'Eerste aanleg: ', 'LinkTekst': 'ECLI:NL:RBGEL:2016:4100', 'Postfix': ', (Gedeeltelijke) vernietiging en zelf afgedaan', 'WebAdres': 'https://uitspraken.rechtspraak.nl/inziendocument?id=ECLI:NL:RBGEL:2016:4100&showbutton=true&keyword=mensenhandel'}]","Hoger beroep, OM-appel. Mensenhandel.","Gerechtshof Arnhem-Leeuwarden, 28-02-2018, 21-004383-16",ECLI:NL:GHARL:2018:1974,28-02-2018,uitspraak,"[{'Vindplaats': 'Rechtspraak.nl', 'VindplaatsAnnotator': '', 'VindplaatsUrl': ''}]"
ECLI-NL-OGEAM-2018-137,http://deeplink.rechtspraak.nl/uitspraak?id=ECLI:NL:OGEAM:2018:137,uitspraak,De publicatie van de uitspraak staat gepland op 02-07-2019 om 15:51 uur,https://uitspraken.rechtspraak.nl/inziendocument?id=ECLI:NL:OGEAM:2018:137&showbutton=true&keyword=mensenhandel,0.0,['Eerste aanleg - enkelvoudig'],02-07-2019,2019-07-02T15:51:42Z,gepubliceerd,['Strafrecht'],[],mensenhandel en mensensmokkel in prostitutiebranche,"Gerecht in eerste aanleg van Sint Maarten, 07-02-2018, 100.00043/16 en 100.00442/16 (gev. ttz)",ECLI:NL:OGEAM:2018:137,07-02-2018,uitspraak,"[{'Vindplaats': 'Rechtspraak.nl', 'VindplaatsAnnotator': '', 'VindplaatsUrl': ''}]"
ECLI-NL-RBZWB-2016-8090,http://deeplink.rechtspraak.nl/uitspraak?id=ECLI:NL:RBZWB:2016:8090,uitspraak,De publicatie van de uitspraak staat gepland op 20-12-2016 om 11:36 uur,https://uitspraken.rechtspraak.nl/inziendocument?id=ECLI:NL:RBZWB:2016:8090&showbutton=true&keyword=mensenhandel,0.0,['Op tegenspraak'],20-12-2016,2016-12-20T11:36:33Z,gepubliceerd,['Strafrecht'],[],"Medeplegen mensenhandel, prostitutie minderjarig slachtoffer","Rechtbank Zeeland-West-Brabant, 19-12-2016, 02-821195-15",ECLI:NL:RBZWB:2016:8090,19-12-2016,uitspraak,"[{'Vindplaats': 'Rechtspraak.nl', 'VindplaatsAnnotator': '', 'VindplaatsUrl': ''}]"
ECLI-NL-RBZWB-2016-8092,http://deeplink.rechtspraak.nl/uitspraak?id=ECLI:NL:RBZWB:2016:8092,uitspraak,De publicatie van de uitspraak staat gepland op 20-12-2016 om 12:46 uur,https://uitspraken.rechtspraak.nl/inziendocument?id=ECLI:NL:RBZWB:2016:8092&showbutton=true&keyword=mensenhandel,0.0,['Op tegenspraak'],20-12-2016,2016-12-20T12:46:03Z,gepubliceerd,['Strafrecht'],[],"Medeplegen mensenhandel, prostitutie minderjarig slachtoffer","Rechtbank Zeeland-West-Brabant, 19-12-2016, 02-821194-15",ECLI:NL:RBZWB:2016:8092,19-12-2016,uitspraak,"[{'Vindplaats': 'Rechtspraak.nl', 'VindplaatsAnnotator': '', 'VindplaatsUrl': ''}]"
ECLI-NL-RBZWB-2016-8091,http://deeplink.rechtspraak.nl/uitspraak?id=ECLI:NL:RBZWB:2016:8091,uitspraak,De publicatie van de uitspraak staat gepland op 20-12-2016 om 12:53 uur,https://uitspraken.rechtspraak.nl/inziendocument?id=ECLI:NL:RBZWB:2016:8091&showbutton=true&keyword=mensenhandel,0.0,['Op tegenspraak'],20-12-2016,2016-12-20T12:53:03Z,gepubliceerd,['Strafrecht'],[],"Medeplegen mensenhandel, prostitutie minderjarig slachtoffer","Rechtbank Zeeland-West-Brabant, 19-12-2016, 02-820566-15",ECLI:NL:RBZWB:2016:8091,19-12-2016,uitspraak,"[{'Vindplaats': 'Rechtspraak.nl', 'VindplaatsAnnotator': '', 'VindplaatsUrl': ''}]"
ECLI-NL-RBAMS-2016-5852,http://deeplink.rechtspraak.nl/uitspraak?id=ECLI:NL:RBAMS:2016:5852,uitspraak,De publicatie van de uitspraak staat gepland op 26-09-2016 om 09:57 uur,https://uitspraken.rechtspraak.nl/inziendocument?id=ECLI:NL:RBAMS:2016:5852&showbutton=true&keyword=mensenhandel,0.0,"['Eerste aanleg - meervoudig', 'Op tegenspraak']",26-09-2016,2016-09-26T09:57:45Z,gepubliceerd,['Strafrecht'],[],Minderjarige verdachte veroordeeld voor mensenhandel,"Rechtbank Amsterdam, 25-08-2016, 13/730107-15 (Promis) en 13/684027-14 (TUL)",ECLI:NL:RBAMS:2016:5852,25-08-2016,uitspraak,"[{'Vindplaats': 'Rechtspraak.nl', 'VindplaatsAnnotator': '', 'VindplaatsUrl': ''}]"
ECLI-NL-GHAMS-2016-708,http://deeplink.rechtspraak.nl/uitspraak?id=ECLI:NL:GHAMS:2016:708,uitspraak,De publicatie van de uitspraak staat gepland op 23-03-2016 om 14:36 uur,https://uitspraken.rechtspraak.nl/inziendocument?id=ECLI:NL:GHAMS:2016:708&showbutton=true&keyword=mensenhandel,0.0,['Hoger beroep'],23-03-2016,2016-03-23T14:36:42Z,gepubliceerd,['Strafrecht'],[],"Mensenhandel, deelnemen aan criminele organisatie","Gerechtshof Amsterdam, 28-01-2016, 23-001939-14",ECLI:NL:GHAMS:2016:708,28-01-2016,uitspraak,"[{'Vindplaats': 'Rechtspraak.nl', 'VindplaatsAnnotator': '', 'VindplaatsUrl': ''}]"
ECLI-NL-RBDHA-2015-11282,http://deeplink.rechtspraak.nl/uitspraak?id=ECLI:NL:RBDHA:2015:11282,uitspraak,De publicatie van de uitspraak staat gepland op 01-10-2015 om 13:42 uur,https://uitspraken.rechtspraak.nl/inziendocument?id=ECLI:NL:RBDHA:2015:11282&showbutton=true&keyword=mensenhandel,0.0,"['Bodemzaak', 'Eerste aanleg - enkelvoudig']",01-10-2015,2015-10-01T13:42:52Z,gepubliceerd,['Civiel recht; Verbintenissenrecht'],[],(immateriele) schadevergoeding na mensenhandel/prostitutie,"Rechtbank Den Haag, 30-09-2015, C/09/480498 / HA ZA 15-38",ECLI:NL:RBDHA:2015:11282,30-09-2015,uitspraak,"[{'Vindplaats': 'RAV 2016/17', 'VindplaatsAnnotator': '', 'VindplaatsUrl': ''}, {'Vindplaats': 'JA 2015/166', 'VindplaatsAnnotator': '', 'VindplaatsUrl': ''}, {'Vindplaats': 'Rechtspraak.nl', 'VindplaatsAnnotator': '', 'VindplaatsUrl': ''}]"
ECLI-NL-RBROT-2015-3784,http://deeplink.rechtspraak.nl/uitspraak?id=ECLI:NL:RBROT:2015:3784,uitspraak,De publicatie van de uitspraak staat gepland op 01-06-2015 om 14:39 uur,https://uitspraken.rechtspraak.nl/inziendocument?id=ECLI:NL:RBROT:2015:3784&showbutton=true&keyword=mensenhandel,0.0,['Eerste aanleg - meervoudig'],01-06-2015,2015-06-01T14:39:16Z,gepubliceerd,['Strafrecht'],[],Vrijspraak mensenhandel (arbeidsuitbuiting): geen medeplegen,"Rechtbank Rotterdam, 01-06-2015, 10/996527-10",ECLI:NL:RBROT:2015:3784,01-06-2015,uitspraak,"[{'Vindplaats': 'Rechtspraak.nl', 'VindplaatsAnnotator': '', 'VindplaatsUrl': ''}]"
ECLI-NL-RBNNE-2014-2799,http://deeplink.rechtspraak.nl/uitspraak?id=ECLI:NL:RBNNE:2014:2799,uitspraak,De publicatie van de uitspraak staat gepland op 05-06-2014 om 13:30 uur,https://uitspraken.rechtspraak.nl/inziendocument?id=ECLI:NL:RBNNE:2014:2799&showbutton=true&keyword=mensenhandel,0.0,"['Eerste aanleg - meervoudig', 'Op tegenspraak']",05-06-2014,2014-06-05T13:30:26Z,gepubliceerd,['Strafrecht'],[],onvoldoende bewijs van (medeplegen) mensenhandel,"Rechtbank Noord-Nederland, 05-06-2014, 18/670632-11",ECLI:NL:RBNNE:2014:2799,05-06-2014,uitspraak,"[{'Vindplaats': 'Rechtspraak.nl', 'VindplaatsAnnotator': '', 'VindplaatsUrl': ''}]"
ECLI-NL-RBGEL-2014-2187,http://deeplink.rechtspraak.nl/uitspraak?id=ECLI:NL:RBGEL:2014:2187,uitspraak,De publicatie van de uitspraak staat gepland op 01-04-2014 om 09:59 uur,https://uitspraken.rechtspraak.nl/inziendocument?id=ECLI:NL:RBGEL:2014:2187&showbutton=true&keyword=mensenhandel,0.0,['Eerste aanleg - meervoudig'],01-04-2014,2014-04-01T09:59:31Z,gepubliceerd,['Strafrecht'],[],Gevangenisstraf voor mensenhandel en steunfraude.,"Rechtbank Gelderland, 31-03-2014, 05/861632-13",ECLI:NL:RBGEL:2014:2187,31-03-2014,uitspraak,"[{'Vindplaats': 'Rechtspraak.nl', 'VindplaatsAnnotator': '', 'VindplaatsUrl': ''}]"
ECLI-NL-GHAMS-2013-BZ8541,http://deeplink.rechtspraak.nl/uitspraak?id=ECLI:NL:GHAMS:2013:BZ8541,uitspraak,De publicatie van de uitspraak staat gepland op 24-04-2013 om 15:27 uur,https://uitspraken.rechtspraak.nl/inziendocument?id=ECLI:NL:GHAMS:2013:BZ8541&showbutton=true&keyword=mensenhandel,0.0,['Hoger beroep'],24-04-2013,2013-04-24T15:27:28Z,gepubliceerd,['Strafrecht'],[],"Mega Sierra, mensenhandel en schijnhuwelijken","Gerechtshof Amsterdam, 11-04-2013, 23-002816-12",ECLI:NL:GHAMS:2013:BZ8541,11-04-2013,uitspraak,"[{'Vindplaats': 'Rechtspraak.nl', 'VindplaatsAnnotator': '', 'VindplaatsUrl': ''}]"
ECLI-NL-GHAMS-2012-BV9608,http://deeplink.rechtspraak.nl/uitspraak?id=ECLI:NL:GHAMS:2012:BV9608,uitspraak,De publicatie van de uitspraak staat gepland op 21-03-2012 om 16:57 uur,https://uitspraken.rechtspraak.nl/inziendocument?id=ECLI:NL:GHAMS:2012:BV9608&showbutton=true&keyword=mensenhandel,0.0,['Hoger beroep'],21-03-2012,2012-03-21T16:57:25Z,gepubliceerd,['Strafrecht'],[],Bewijsminimum en schakelbewijs inzake mensenhandel.,"Gerechtshof Amsterdam, 19-03-2012, 23-004614-10",ECLI:NL:GHAMS:2012:BV9608,19-03-2012,uitspraak,"[{'Vindplaats': 'Rechtspraak.nl', 'VindplaatsAnnotator': '', 'VindplaatsUrl': ''}]"
ECLI-NL-RBUTR-2011-BP5190,http://deeplink.rechtspraak.nl/uitspraak?id=ECLI:NL:RBUTR:2011:BP5190,uitspraak,De publicatie van de uitspraak staat gepland op 21-02-2011 om 14:53 uur,https://uitspraken.rechtspraak.nl/inziendocument?id=ECLI:NL:RBUTR:2011:BP5190&showbutton=true&keyword=mensenhandel,0.0,['Eerste aanleg - meervoudig'],21-02-2011,2011-02-21T14:53:16Z,gepubliceerd,['Strafrecht'],[],Mensenhandel. Criminele organisatie. Sneep-zaak.,"Rechtbank Utrecht, 18-02-2011, 08/963005-08",ECLI:NL:RBUTR:2011:BP5190,18-02-2011,uitspraak,"[{'Vindplaats': 'Rechtspraak.nl', 'VindplaatsAnnotator': '', 'VindplaatsUrl': ''}]"
ECLI-NL-RBUTR-2011-BP5215,http://deeplink.rechtspraak.nl/uitspraak?id=ECLI:NL:RBUTR:2011:BP5215,uitspraak,De publicatie van de uitspraak staat gepland op 21-02-2011 om 16:10 uur,https://uitspraken.rechtspraak.nl/inziendocument?id=ECLI:NL:RBUTR:2011:BP5215&showbutton=true&keyword=mensenhandel,0.0,['Eerste aanleg - meervoudig'],21-02-2011,2011-02-21T16:10:35Z,gepubliceerd,['Strafrecht'],[],Mensenhandel. Criminele organisatie. Sneep-zaak.,"Rechtbank Utrecht, 18-02-2011, 08/963020-07 en 08/963007-08",ECLI:NL:RBUTR:2011:BP5215,18-02-2011,uitspraak,"[{'Vindplaats': 'Rechtspraak.nl', 'VindplaatsAnnotator': '', 'VindplaatsUrl': ''}]"
ECLI-NL-RBUTR-2011-BP5363,http://deeplink.rechtspraak.nl/uitspraak?id=ECLI:NL:RBUTR:2011:BP5363,uitspraak,De publicatie van de uitspraak staat gepland op 22-02-2011 om 13:31 uur,https://uitspraken.rechtspraak.nl/inziendocument?id=ECLI:NL:RBUTR:2011:BP5363&showbutton=true&keyword=mensenhandel,0.0,['Eerste aanleg - meervoudig'],22-02-2011,2011-02-22T13:31:02Z,gepubliceerd,['Strafrecht'],[],Mensenhandel-Criminele Organisatie-Sneep-zaak,"Rechtbank Utrecht, 18-02-2011, 08/963003-0",ECLI:NL:RBUTR:2011:BP5363,18-02-2011,uitspraak,"[{'Vindplaats': 'Rechtspraak.nl', 'VindplaatsAnnotator': '', 'VindplaatsUrl': ''}]"
ECLI-NL-RBUTR-2011-BP5384,http://deeplink.rechtspraak.nl/uitspraak?id=ECLI:NL:RBUTR:2011:BP5384,uitspraak,De publicatie van de uitspraak staat gepland op 22-02-2011 om 14:41 uur,https://uitspraken.rechtspraak.nl/inziendocument?id=ECLI:NL:RBUTR:2011:BP5384&showbutton=true&keyword=mensenhandel,0.0,['Eerste aanleg - meervoudig'],22-02-2011,2011-02-22T14:41:58Z,gepubliceerd,['Strafrecht'],[],Mensenhandel-Criminele Organisatie-Sneep-zaak,"Rechtbank Utrecht, 18-02-2011, 08/963007-07",ECLI:NL:RBUTR:2011:BP5384,18-02-2011,uitspraak,"[{'Vindplaats': 'Rechtspraak.nl', 'VindplaatsAnnotator': '', 'VindplaatsUrl': ''}]"
ECLI-NL-RBUTR-2011-BP5492,http://deeplink.rechtspraak.nl/uitspraak?id=ECLI:NL:RBUTR:2011:BP5492,uitspraak,De publicatie van de uitspraak staat gepland op 23-02-2011 om 10:35 uur,https://uitspraken.rechtspraak.nl/inziendocument?id=ECLI:NL:RBUTR:2011:BP5492&showbutton=true&keyword=mensenhandel,0.0,['Eerste aanleg - meervoudig'],23-02-2011,2011-02-23T10:35:35Z,gepubliceerd,['Strafrecht'],[],Mensenhandel. Criminele organisatie. Sneep-zaak.,"Rechtbank Utrecht, 18-02-2011, 08/963001-09",ECLI:NL:RBUTR:2011:BP5492,18-02-2011,uitspraak,"[{'Vindplaats': 'Rechtspraak.nl', 'VindplaatsAnnotator': '', 'VindplaatsUrl': ''}]"
ECLI-NL-RBUTR-2011-BP6711,http://deeplink.rechtspraak.nl/uitspraak?id=ECLI:NL:RBUTR:2011:BP6711,uitspraak,De publicatie van de uitspraak staat gepland op 04-03-2011 om 14:08 uur,https://uitspraken.rechtspraak.nl/inziendocument?id=ECLI:NL:RBUTR:2011:BP6711&showbutton=true&keyword=mensenhandel,0.0,['Eerste aanleg - meervoudig'],04-03-2011,2011-03-04T14:08:20Z,gepubliceerd,['Strafrecht'],[],Mensenhandel. Criminele organisatie. Sneep-zaak.,"Rechtbank Utrecht, 18-02-2011, 08/963012-07",ECLI:NL:RBUTR:2011:BP6711,18-02-2011,uitspraak,"[{'Vindplaats': 'Rechtspraak.nl', 'VindplaatsAnnotator': '', 'VindplaatsUrl': ''}]"
ECLI-NL-RBUTR-2011-BP7250,http://deeplink.rechtspraak.nl/uitspraak?id=ECLI:NL:RBUTR:2011:BP7250,uitspraak,De publicatie van de uitspraak staat gepland op 09-03-2011 om 15:33 uur,https://uitspraken.rechtspraak.nl/inziendocument?id=ECLI:NL:RBUTR:2011:BP7250&showbutton=true&keyword=mensenhandel,0.0,['Eerste aanleg - meervoudig'],09-03-2011,2011-03-09T15:33:57Z,gepubliceerd,['Strafrecht'],"[{'RelatieOmschrijving': 'Hoger beroep: ', 'LinkTekst': 'ECLI:NL:GHARL:2013:8810', 'Postfix': ', Bekrachtiging/bevestiging', 'WebAdres': 'https://uitspraken.rechtspraak.nl/inziendocument?id=ECLI:NL:GHARL:2013:8810&showbutton=true&keyword=mensenhandel'}]",Mensenhandel. Criminele organisatie. Sneep-zaak.,"Rechtbank Utrecht, 18-02-2011, 08/963019-07",ECLI:NL:RBUTR:2011:BP7250,18-02-2011,uitspraak,"[{'Vindplaats': 'Rechtspraak.nl', 'VindplaatsAnnotator': '', 'VindplaatsUrl': ''}]"
ECLI-NL-RBZLY-2008-BD0846,http://deeplink.rechtspraak.nl/uitspraak?id=ECLI:NL:RBZLY:2008:BD0846,uitspraak,De publicatie van de uitspraak staat gepland op 29-04-2008 om 14:31 uur,https://uitspraken.rechtspraak.nl/inziendocument?id=ECLI:NL:RBZLY:2008:BD0846&showbutton=true&keyword=mensenhandel,0.0,['Eerste aanleg - meervoudig'],29-04-2008,2008-04-29T14:31:35Z,gepubliceerd,['Strafrecht'],"[{'RelatieOmschrijving': 'Hoger beroep: ', 'LinkTekst': 'ECLI:NL:GHARN:2011:BQ9861', 'Postfix': ', (Gedeeltelijke) vernietiging en zelf afgedaan', 'WebAdres': 'https://uitspraken.rechtspraak.nl/inziendocument?id=ECLI:NL:GHARN:2011:BQ9861&showbutton=true&keyword=mensenhandel'}]","mensenhandel
mensensmokkel
belasting-premie fraude","Rechtbank Zwolle-Lelystad, 29-04-2008, 07.976405-06",ECLI:NL:RBZLY:2008:BD0846,29-04-2008,uitspraak,"[{'Vindplaats': 'Rechtspraak.nl', 'VindplaatsAnnotator': '', 'VindplaatsUrl': ''}]"
ECLI-NL-RBZLY-2008-BD0857,http://deeplink.rechtspraak.nl/uitspraak?id=ECLI:NL:RBZLY:2008:BD0857,uitspraak,De publicatie van de uitspraak staat gepland op 29-04-2008 om 14:32 uur,https://uitspraken.rechtspraak.nl/inziendocument?id=ECLI:NL:RBZLY:2008:BD0857&showbutton=true&keyword=mensenhandel,0.0,['Eerste aanleg - meervoudig'],29-04-2008,2008-04-29T14:32:38Z,gepubliceerd,['Strafrecht'],[],"mensensmokkel
mensenhandel
belasting premie fraude","Rechtbank Zwolle-Lelystad, 29-04-2008, 07.976404-06",ECLI:NL:RBZLY:2008:BD0857,29-04-2008,uitspraak,"[{'Vindplaats': 'Rechtspraak.nl', 'VindplaatsAnnotator': '', 'VindplaatsUrl': ''}]"
ECLI-NL-RBZLY-2008-BD0860,http://deeplink.rechtspraak.nl/uitspraak?id=ECLI:NL:RBZLY:2008:BD0860,uitspraak,De publicatie van de uitspraak staat gepland op 29-04-2008 om 14:32 uur,https://uitspraken.rechtspraak.nl/inziendocument?id=ECLI:NL:RBZLY:2008:BD0860&showbutton=true&keyword=mensenhandel,0.0,['Eerste aanleg - meervoudig'],29-04-2008,2008-04-29T14:32:55Z,gepubliceerd,['Strafrecht'],[],"mensenhandel
mensensmokkel
belasting-premie fraude","Rechtbank Zwolle-Lelystad, 29-04-2008, 07.976403-06",ECLI:NL:RBZLY:2008:BD0860,29-04-2008,uitspraak,"[{'Vindplaats': 'Rechtspraak.nl', 'VindplaatsAnnotator': '', 'VindplaatsUrl': ''}]"
ECLI-NL-RBLIM-2020-4438,http://deeplink.rechtspraak.nl/uitspraak?id=ECLI:NL:RBLIM:2020:4438,uitspraak,De publicatie van de uitspraak staat gepland op 24-06-2020 om 15:30 uur,https://uitspraken.rechtspraak.nl/inziendocument?id=ECLI:NL:RBLIM:2020:4438&showbutton=true&keyword=mensenhandel,0.0,['Eerste aanleg - meervoudig'],24-06-2020,2020-06-24T15:30:05Z,gepubliceerd,['Strafrecht'],[],Vrijspraak voor mensenhandel. Veroordeling voor mensensmokkel.,"Rechtbank Limburg, 24-06-2020, 03/703247-12 en 03/700325-14",ECLI:NL:RBLIM:2020:4438,24-06-2020,uitspraak,"[{'Vindplaats': 'Rechtspraak.nl', 'VindplaatsAnnotator': '', 'VindplaatsUrl': ''}]"
ECLI-NL-RBGEL-2019-3449,http://deeplink.rechtspraak.nl/uitspraak?id=ECLI:NL:RBGEL:2019:3449,uitspraak,De publicatie van de uitspraak staat gepland op 30-07-2019 om 10:03 uur,https://uitspraken.rechtspraak.nl/inziendocument?id=ECLI:NL:RBGEL:2019:3449&showbutton=true&keyword=mensenhandel,0.0,['Eerste aanleg - meervoudig'],30-07-2019,2019-07-30T10:03:29Z,gepubliceerd,['Strafrecht'],[],"Vrijspraak voor mensenhandel, veroordeling voor uitkeringsfraude","Rechtbank Gelderland, 16-07-2019, 05/881320-16",ECLI:NL:RBGEL:2019:3449,16-07-2019,uitspraak,"[{'Vindplaats': 'NBSTRAF 2019/271', 'VindplaatsAnnotator': '', 'VindplaatsUrl': ''}, {'Vindplaats': 'NbSr 2019/271', 'VindplaatsAnnotator': '', 'VindplaatsUrl': ''}, {'Vindplaats': 'Rechtspraak.nl', 'VindplaatsAnnotator': '', 'VindplaatsUrl': ''}]"
ECLI-NL-RBDHA-2019-5960,http://deeplink.rechtspraak.nl/uitspraak?id=ECLI:NL:RBDHA:2019:5960,uitspraak,De publicatie van de uitspraak staat gepland op 12-07-2019 om 14:29 uur,https://uitspraken.rechtspraak.nl/inziendocument?id=ECLI:NL:RBDHA:2019:5960&showbutton=true&keyword=mensenhandel,0.0,['Eerste aanleg - enkelvoudig'],12-07-2019,2019-07-12T14:29:14Z,gepubliceerd,['Bestuursrecht; Vreemdelingenrecht'],[],Dublin Italië / nog geen aangifte mensenhandel /,"Rechtbank Den Haag, 11-06-2019, NL19.11306",ECLI:NL:RBDHA:2019:5960,11-06-2019,uitspraak,"[{'Vindplaats': 'Rechtspraak.nl', 'VindplaatsAnnotator': '', 'VindplaatsUrl': ''}]"
ECLI-NL-GHAMS-2018-3647,http://deeplink.rechtspraak.nl/uitspraak?id=ECLI:NL:GHAMS:2018:3647,uitspraak,De publicatie van de uitspraak staat gepland op 20-11-2018 om 13:18 uur,https://uitspraken.rechtspraak.nl/inziendocument?id=ECLI:NL:GHAMS:2018:3647&showbutton=true&keyword=mensenhandel,0.0,"['Hoger beroep', 'Raadkamer']",20-11-2018,2018-11-20T13:18:59Z,gepubliceerd,['Strafrecht; Strafprocesrecht'],[],"Voorlopige hechtenis, vluchtgevaar aanwezig, verdenking mensenhandel","Gerechtshof Amsterdam, 19-09-2018, 13/730034-18",ECLI:NL:GHAMS:2018:3647,19-09-2018,uitspraak,"[{'Vindplaats': 'Rechtspraak.nl', 'VindplaatsAnnotator': '', 'VindplaatsUrl': ''}]"
ECLI-NL-GHAMS-2017-2888,http://deeplink.rechtspraak.nl/uitspraak?id=ECLI:NL:GHAMS:2017:2888,uitspraak,De publicatie van de uitspraak staat gepland op 20-07-2017 om 17:24 uur,https://uitspraken.rechtspraak.nl/inziendocument?id=ECLI:NL:GHAMS:2017:2888&showbutton=true&keyword=mensenhandel,0.0,['Hoger beroep'],20-07-2017,2017-07-20T17:24:38Z,gepubliceerd,['Strafrecht'],[],"Mensenhandel, betrouwbaarheid aangeefsters, gewoontewitwassen en strafmaat","Gerechtshof Amsterdam, 20-07-2017, 23-000271-14",ECLI:NL:GHAMS:2017:2888,20-07-2017,uitspraak,"[{'Vindplaats': 'Rechtspraak.nl', 'VindplaatsAnnotator': '', 'VindplaatsUrl': ''}]"
ECLI-NL-RBROT-2015-7773,http://deeplink.rechtspraak.nl/uitspraak?id=ECLI:NL:RBROT:2015:7773,uitspraak,De publicatie van de uitspraak staat gepland op 02-11-2015 om 17:02 uur,https://uitspraken.rechtspraak.nl/inziendocument?id=ECLI:NL:RBROT:2015:7773&showbutton=true&keyword=mensenhandel,0.0,['Eerste aanleg - meervoudig'],02-11-2015,2015-11-02T17:02:31Z,gepubliceerd,['Strafrecht'],[],Ontneming van uit mensenhandel verkregen voordeel.,"Rechtbank Rotterdam, 29-10-2015, 11/870399-12.ov",ECLI:NL:RBROT:2015:7773,29-10-2015,uitspraak,"[{'Vindplaats': 'Rechtspraak.nl', 'VindplaatsAnnotator': '', 'VindplaatsUrl': ''}]"
ECLI-NL-GHARL-2014-1557,http://deeplink.rechtspraak.nl/uitspraak?id=ECLI:NL:GHARL:2014:1557,uitspraak,De publicatie van de uitspraak staat gepland op 07-03-2014 om 15:09 uur,https://uitspraken.rechtspraak.nl/inziendocument?id=ECLI:NL:GHARL:2014:1557&showbutton=true&keyword=mensenhandel,0.0,['Hoger beroep'],07-03-2014,2014-03-07T15:09:37Z,gepubliceerd,['Strafrecht'],[],Mensenhandel ten aanzien van een minderjarige.,"Gerechtshof Arnhem-Leeuwarden, 24-02-2014, 21-004035-13",ECLI:NL:GHARL:2014:1557,24-02-2014,uitspraak,"[{'Vindplaats': 'Rechtspraak.nl', 'VindplaatsAnnotator': '', 'VindplaatsUrl': ''}]"
ECLI-NL-RBGEL-2013-4039,http://deeplink.rechtspraak.nl/uitspraak?id=ECLI:NL:RBGEL:2013:4039,uitspraak,De publicatie van de uitspraak staat gepland op 23-10-2013 om 14:05 uur,https://uitspraken.rechtspraak.nl/inziendocument?id=ECLI:NL:RBGEL:2013:4039&showbutton=true&keyword=mensenhandel,0.0,['Eerste aanleg - meervoudig'],23-10-2013,2013-10-23T14:05:44Z,gepubliceerd,['Strafrecht'],[],Zutphen- Verdachte is vrijgesproken van mensenhandel,"Rechtbank Gelderland, 22-10-2013, 05/860948-13",ECLI:NL:RBGEL:2013:4039,22-10-2013,uitspraak,"[{'Vindplaats': 'Rechtspraak.nl', 'VindplaatsAnnotator': '', 'VindplaatsUrl': ''}]"
ECLI-NL-RBUTR-2012-BY7138,http://deeplink.rechtspraak.nl/uitspraak?id=ECLI:NL:RBUTR:2012:BY7138,uitspraak,De publicatie van de uitspraak staat gepland op 21-12-2012 om 15:08 uur,https://uitspraken.rechtspraak.nl/inziendocument?id=ECLI:NL:RBUTR:2012:BY7138&showbutton=true&keyword=mensenhandel,0.0,['Eerste aanleg - meervoudig'],21-12-2012,2012-12-21T15:08:26Z,gepubliceerd,['Strafrecht'],[],Ontnemingsvordering vanwege bewezen mensenhandel grotendeels toegewezen.,"Rechtbank Utrecht, 21-12-2012, 16-600964-11 (ontneming)",ECLI:NL:RBUTR:2012:BY7138,21-12-2012,uitspraak,"[{'Vindplaats': 'Rechtspraak.nl', 'VindplaatsAnnotator': '', 'VindplaatsUrl': ''}]"
ECLI-NL-RBARN-2012-BW3216,http://deeplink.rechtspraak.nl/uitspraak?id=ECLI:NL:RBARN:2012:BW3216,uitspraak,De publicatie van de uitspraak staat gepland op 25-04-2012 om 18:10 uur,https://uitspraken.rechtspraak.nl/inziendocument?id=ECLI:NL:RBARN:2012:BW3216&showbutton=true&keyword=mensenhandel,0.0,['Eerste aanleg - meervoudig'],25-04-2012,2012-04-25T18:10:26Z,gepubliceerd,['Strafrecht'],"[{'RelatieOmschrijving': 'Hoger beroep: ', 'LinkTekst': 'ECLI:NL:GHARL:2013:9800', 'Postfix': ', Meerdere afhandelingswijzen', 'WebAdres': 'https://uitspraken.rechtspraak.nl/inziendocument?id=ECLI:NL:GHARL:2013:9800&showbutton=true&keyword=mensenhandel'}]",Mensenhandel en verkrachting; 9 jaar gevangenisstraf,"Rechtbank Arnhem, 04-04-2012, 05/900880-10",ECLI:NL:RBARN:2012:BW3216,04-04-2012,uitspraak,"[{'Vindplaats': 'Rechtspraak.nl', 'VindplaatsAnnotator': '', 'VindplaatsUrl': ''}]"
ECLI-NL-RBUTR-2011-BP5490,http://deeplink.rechtspraak.nl/uitspraak?id=ECLI:NL:RBUTR:2011:BP5490,uitspraak,De publicatie van de uitspraak staat gepland op 23-02-2011 om 10:32 uur,https://uitspraken.rechtspraak.nl/inziendocument?id=ECLI:NL:RBUTR:2011:BP5490&showbutton=true&keyword=mensenhandel,0.0,['Eerste aanleg - meervoudig'],23-02-2011,2011-02-23T10:32:36Z,gepubliceerd,['Strafrecht'],[],Mensenhandel. Criminele organisatie. Sneep-zaak II,"Rechtbank Utrecht, 18-02-2011, 08/963009-07",ECLI:NL:RBUTR:2011:BP5490,18-02-2011,uitspraak,"[{'Vindplaats': 'Rechtspraak.nl', 'VindplaatsAnnotator': '', 'VindplaatsUrl': ''}]"
ECLI-NL-RBLEE-2009-BH5358,http://deeplink.rechtspraak.nl/uitspraak?id=ECLI:NL:RBLEE:2009:BH5358,uitspraak,De publicatie van de uitspraak staat gepland op 10-03-2009 om 15:11 uur,https://uitspraken.rechtspraak.nl/inziendocument?id=ECLI:NL:RBLEE:2009:BH5358&showbutton=true&keyword=mensenhandel,0.0,['Eerste aanleg - meervoudig'],10-03-2009,2009-03-10T15:11:00Z,gepubliceerd,['Strafrecht'],[],"Mensenhandel, tegenstrijdigheden, exploitatie van prostitutie, uitbuiting","Rechtbank Leeuwarden, 10-03-2009, 17/880468-08 VEV",ECLI:NL:RBLEE:2009:BH5358,10-03-2009,uitspraak,"[{'Vindplaats': 'Rechtspraak.nl', 'VindplaatsAnnotator': '', 'VindplaatsUrl': ''}]"
ECLI-NL-RBLEE-2009-BH2373,http://deeplink.rechtspraak.nl/uitspraak?id=ECLI:NL:RBLEE:2009:BH2373,uitspraak,De publicatie van de uitspraak staat gepland op 10-02-2009 om 14:04 uur,https://uitspraken.rechtspraak.nl/inziendocument?id=ECLI:NL:RBLEE:2009:BH2373&showbutton=true&keyword=mensenhandel,0.0,['Eerste aanleg - meervoudig'],10-02-2009,2009-02-10T14:04:46Z,gepubliceerd,['Strafrecht'],[],"Ontucht, ontzetting ambt, mensenhandel, uitbuiting, aanranding","Rechtbank Leeuwarden, 10-02-2009, 17/880348-08 VEV",ECLI:NL:RBLEE:2009:BH2373,10-02-2009,uitspraak,"[{'Vindplaats': 'Rechtspraak.nl', 'VindplaatsAnnotator': '', 'VindplaatsUrl': ''}]"
ECLI-NL-RBSHE-2007-BA0141,http://deeplink.rechtspraak.nl/uitspraak?id=ECLI:NL:RBSHE:2007:BA0141,uitspraak,De publicatie van de uitspraak staat gepland op 08-03-2007 om 10:31 uur,https://uitspraken.rechtspraak.nl/inziendocument?id=ECLI:NL:RBSHE:2007:BA0141&showbutton=true&keyword=mensenhandel,0.0,['Eerste aanleg - meervoudig'],08-03-2007,2007-03-08T10:31:34Z,gepubliceerd,['Strafrecht'],[],Vrijspraak ter zake mensenhandel en mensensmokkel.,"Rechtbank 's-Hertogenbosch, 08-03-2007, 01/839263-06",ECLI:NL:RBSHE:2007:BA0141,08-03-2007,uitspraak,"[{'Vindplaats': 'Rechtspraak.nl', 'VindplaatsAnnotator': '', 'VindplaatsUrl': ''}]"
ECLI-NL-RBROT-2016-10271,http://deeplink.rechtspraak.nl/uitspraak?id=ECLI:NL:RBROT:2016:10271,uitspraak,De publicatie van de uitspraak staat gepland op 22-02-2017 om 17:20 uur,https://uitspraken.rechtspraak.nl/inziendocument?id=ECLI:NL:RBROT:2016:10271&showbutton=true&keyword=mensenhandel,0.0,['Eerste aanleg - meervoudig'],22-02-2017,2017-02-22T17:20:26Z,gepubliceerd,['Strafrecht'],[],"Vrijspraak mensenhandel t.a.v. 19-jarige slachtoffer. Geen ‘misbruik van uit feitelijke omstandigheden voortvloeiend overwicht’ of ‘misbruik van een kwetsbare positie’. 

Veroordeling mensenhandel t.a.v. 17-jarige slachtoffer. 6 maanden gevangenisstraf. 

Veroordeling WWM.","Rechtbank Rotterdam, 12-12-2016, 10/750025-15 en 10/750290-16",ECLI:NL:RBROT:2016:10271,12-12-2016,uitspraak,"[{'Vindplaats': 'Rechtspraak.nl', 'VindplaatsAnnotator': '', 'VindplaatsUrl': ''}]"
ECLI-NL-GHARN-2010-BO8390,http://deeplink.rechtspraak.nl/uitspraak?id=ECLI:NL:GHARN:2010:BO8390,uitspraak,De publicatie van de uitspraak staat gepland op 22-12-2010 om 14:56 uur,https://uitspraken.rechtspraak.nl/inziendocument?id=ECLI:NL:GHARN:2010:BO8390&showbutton=true&keyword=mensenhandel,0.0,['Hoger beroep'],22-12-2010,2010-12-22T14:56:53Z,gepubliceerd,['Strafrecht'],[],Sneep-zaak. Mensenhandel. Misdadige organisatie. Toetsingskader mensenhandel. Medeplegen. Ontvankelijkheid OM in verband met niet-vervolging hoofddader. Gebruik samenvattingen taps voor bewijs. Tapmachtigingen en formulieren. Bewijswaardering. Dvd-opnamen getuigenverhoren. Geheimhoudersgesprekken en strafvermindering. Oplegging geldboete naast gevangenisstraf.,"Gerechtshof Arnhem, 20-12-2010, 21-003009-08",ECLI:NL:GHARN:2010:BO8390,20-12-2010,uitspraak,"[{'Vindplaats': 'Rechtspraak.nl', 'VindplaatsAnnotator': '', 'VindplaatsUrl': ''}]"
ECLI-NL-RBUTR-2008-BD0120,http://deeplink.rechtspraak.nl/uitspraak?id=ECLI:NL:RBUTR:2008:BD0120,uitspraak,De publicatie van de uitspraak staat gepland op 22-04-2008 om 13:56 uur,https://uitspraken.rechtspraak.nl/inziendocument?id=ECLI:NL:RBUTR:2008:BD0120&showbutton=true&keyword=mensenhandel,0.0,['Eerste aanleg - meervoudig'],22-04-2008,2008-04-22T13:56:41Z,gepubliceerd,['Strafrecht'],[],Medeplichtigheid aan het plegen van seksuele handelingen met minderjarige meisjes. Mensenhandel en mensenhandel in vereniging jegens een persoon van beneden de zestien jaren. Verdachte ronselde meisjes die tegen betaling seksuele handelingen verrichten met een medeverdachte.,"Rechtbank Utrecht, 22-04-2008, 16-600966-07",ECLI:NL:RBUTR:2008:BD0120,22-04-2008,uitspraak,"[{'Vindplaats': 'Rechtspraak.nl', 'VindplaatsAnnotator': '', 'VindplaatsUrl': ''}]"
ECLI-NL-RBLIM-2015-9903,http://deeplink.rechtspraak.nl/uitspraak?id=ECLI:NL:RBLIM:2015:9903,uitspraak,De publicatie van de uitspraak staat gepland op 27-11-2015 om 14:30 uur,https://uitspraken.rechtspraak.nl/inziendocument?id=ECLI:NL:RBLIM:2015:9903&showbutton=true&keyword=mensenhandel,0.0,['Eerste aanleg - meervoudig'],27-11-2015,2015-11-27T14:30:18Z,gepubliceerd,['Strafrecht'],[],"Dagvaarding partieel nietig, nu de officier van justitie heeft verzuimd de medeplichtigheid aan mensenhandel op een juiste manier ten laste te leggen. De rechtbank heeft verdachte, die in Nederland als chauffeur optrad voor meerderjarige, uit Hongarije afkomstige prostituees, vrijgesproken van mensenhandel. Verdachte heeft geen bijdrage geleverd aan de beknotting van de vrijheid van de prostituees, met als gevolg dat niet van mensenhandel kan worden gesproken.","Rechtbank Limburg, 27-11-2015, 03/721320-13",ECLI:NL:RBLIM:2015:9903,27-11-2015,uitspraak,"[{'Vindplaats': 'Rechtspraak.nl', 'VindplaatsAnnotator': '', 'VindplaatsUrl': ''}]"
ECLI-NL-OGEAC-2021-130,http://deeplink.rechtspraak.nl/uitspraak?id=ECLI:NL:OGEAC:2021:130,uitspraak,De publicatie van de uitspraak staat gepland op 21-07-2021 om 09:56 uur,https://uitspraken.rechtspraak.nl/inziendocument?id=ECLI:NL:OGEAC:2021:130&showbutton=true&keyword=mensenhandel,0.0,['Eerste aanleg - enkelvoudig'],21-07-2021,2021-07-21T09:56:23Z,gepubliceerd,['Strafrecht; Penitentiair strafrecht'],[],mensenhandel mensensmokkel valsheid in geschrifte overtreding arbeidsduur,"Gerecht in eerste aanleg van Curaçao, 11-06-2021, 500.00392/19",ECLI:NL:OGEAC:2021:130,11-06-2021,uitspraak,"[{'Vindplaats': 'Rechtspraak.nl', 'VindplaatsAnnotator': '', 'VindplaatsUrl': ''}]"
ECLI-NL-RBAMS-2020-5983,http://deeplink.rechtspraak.nl/uitspraak?id=ECLI:NL:RBAMS:2020:5983,uitspraak,De publicatie van de uitspraak staat gepland op 09-12-2020 om 15:00 uur,https://uitspraken.rechtspraak.nl/inziendocument?id=ECLI:NL:RBAMS:2020:5983&showbutton=true&keyword=mensenhandel,0.0,"['Eerste aanleg - meervoudig', 'Op tegenspraak']",09-12-2020,2020-12-09T15:00:40Z,gepubliceerd,['Strafrecht'],[],"Vrijspraak mensenhandel, ontucht met minderjarige en witwassen","Rechtbank Amsterdam, 02-12-2020, 13-159814-20",ECLI:NL:RBAMS:2020:5983,02-12-2020,uitspraak,"[{'Vindplaats': 'Rechtspraak.nl', 'VindplaatsAnnotator': '', 'VindplaatsUrl': ''}]"
ECLI-NL-RBDHA-2020-4291,http://deeplink.rechtspraak.nl/uitspraak?id=ECLI:NL:RBDHA:2020:4291,uitspraak,De publicatie van de uitspraak staat gepland op 16-05-2020 om 18:00 uur,https://uitspraken.rechtspraak.nl/inziendocument?id=ECLI:NL:RBDHA:2020:4291&showbutton=true&keyword=mensenhandel,0.0,['Eerste aanleg - enkelvoudig'],16-05-2020,2020-05-16T18:00:17Z,gepubliceerd,['Bestuursrecht; Vreemdelingenrecht'],[],Beroep afwijzing slachtoffer mensenhandel ongegrond. Sepot OM.,"Rechtbank Den Haag, 15-05-2020, AWB 20/156",ECLI:NL:RBDHA:2020:4291,15-05-2020,uitspraak,"[{'Vindplaats': 'Rechtspraak.nl', 'VindplaatsAnnotator': '', 'VindplaatsUrl': ''}]"
ECLI-NL-RBGEL-2017-6596,http://deeplink.rechtspraak.nl/uitspraak?id=ECLI:NL:RBGEL:2017:6596,uitspraak,De publicatie van de uitspraak staat gepland op 20-12-2017 om 08:48 uur,https://uitspraken.rechtspraak.nl/inziendocument?id=ECLI:NL:RBGEL:2017:6596&showbutton=true&keyword=mensenhandel,0.0,['Eerste aanleg - meervoudig'],20-12-2017,2017-12-20T08:48:46Z,gepubliceerd,['Strafrecht'],[],Veroordeling mensenhandel ten aanzien van een minderjarige.,"Rechtbank Gelderland, 19-12-2017, 05/780083-16",ECLI:NL:RBGEL:2017:6596,19-12-2017,uitspraak,"[{'Vindplaats': 'Rechtspraak.nl', 'VindplaatsAnnotator': '', 'VindplaatsUrl': ''}]"
ECLI-NL-GHAMS-2016-5035,http://deeplink.rechtspraak.nl/uitspraak?id=ECLI:NL:GHAMS:2016:5035,uitspraak,De publicatie van de uitspraak staat gepland op 25-11-2016 om 16:08 uur,https://uitspraken.rechtspraak.nl/inziendocument?id=ECLI:NL:GHAMS:2016:5035&showbutton=true&keyword=mensenhandel,0.0,['Hoger beroep'],25-11-2016,2016-11-25T16:08:30Z,gepubliceerd,['Strafrecht'],[],mensenhandel: arbeidsuitbuiting van hulp in de huishouding.,"Gerechtshof Amsterdam, 16-11-2016, 23-000879-14",ECLI:NL:GHAMS:2016:5035,16-11-2016,uitspraak,"[{'Vindplaats': 'Rechtspraak.nl', 'VindplaatsAnnotator': '', 'VindplaatsUrl': ''}]"
ECLI-NL-GHARL-2016-10785,http://deeplink.rechtspraak.nl/uitspraak?id=ECLI:NL:GHARL:2016:10785,uitspraak,De publicatie van de uitspraak staat gepland op 29-01-2020 om 16:46 uur,https://uitspraken.rechtspraak.nl/inziendocument?id=ECLI:NL:GHARL:2016:10785&showbutton=true&keyword=mensenhandel,0.0,['Hoger beroep'],29-01-2020,2020-01-29T16:46:25Z,gepubliceerd,['Strafrecht'],[],Mensenhandel meermalen gepleegd. Gevangenisstraf van zes jaren.,"Gerechtshof Arnhem-Leeuwarden, 09-09-2016, 21-001160-16",ECLI:NL:GHARL:2016:10785,09-09-2016,uitspraak,"[{'Vindplaats': 'Rechtspraak.nl', 'VindplaatsAnnotator': '', 'VindplaatsUrl': ''}]"
ECLI-NL-GHAMS-2016-2122,http://deeplink.rechtspraak.nl/uitspraak?id=ECLI:NL:GHAMS:2016:2122,uitspraak,De publicatie van de uitspraak staat gepland op 08-06-2016 om 15:02 uur,https://uitspraken.rechtspraak.nl/inziendocument?id=ECLI:NL:GHAMS:2016:2122&showbutton=true&keyword=mensenhandel,0.0,['Hoger beroep'],08-06-2016,2016-06-08T15:02:53Z,gepubliceerd,['Strafrecht'],[],‘Mensenhandel – wetenschap prostitutiewerkzaamheden – bewijsoverweging – vordering benadeelde partij’,"Gerechtshof Amsterdam, 07-06-2016, 23-002630-13",ECLI:NL:GHAMS:2016:2122,07-06-2016,uitspraak,"[{'Vindplaats': 'Rechtspraak.nl', 'VindplaatsAnnotator': '', 'VindplaatsUrl': ''}]"
ECLI-NL-GHAMS-2016-709,http://deeplink.rechtspraak.nl/uitspraak?id=ECLI:NL:GHAMS:2016:709,uitspraak,De publicatie van de uitspraak staat gepland op 23-03-2016 om 14:17 uur,https://uitspraken.rechtspraak.nl/inziendocument?id=ECLI:NL:GHAMS:2016:709&showbutton=true&keyword=mensenhandel,0.0,['Hoger beroep'],23-03-2016,2016-03-23T14:17:42Z,gepubliceerd,['Strafrecht'],[],Mensenhandel (in vereniging). Deelnemen aan criminele organisatie.,"Gerechtshof Amsterdam, 28-01-2016, 23-001797-14",ECLI:NL:GHAMS:2016:709,28-01-2016,uitspraak,"[{'Vindplaats': 'Rechtspraak.nl', 'VindplaatsAnnotator': '', 'VindplaatsUrl': ''}]"
ECLI-NL-RBNNE-2015-4725,http://deeplink.rechtspraak.nl/uitspraak?id=ECLI:NL:RBNNE:2015:4725,uitspraak,De publicatie van de uitspraak staat gepland op 12-10-2015 om 14:20 uur,https://uitspraken.rechtspraak.nl/inziendocument?id=ECLI:NL:RBNNE:2015:4725&showbutton=true&keyword=mensenhandel,0.0,"['Eerste aanleg - meervoudig', 'Op tegenspraak']",12-10-2015,2015-10-12T14:20:31Z,gepubliceerd,['Strafrecht'],[],Vrijspraak van mensenhandel (gedwongen webcamwerkzaamheden) en heling.,"Rechtbank Noord-Nederland, 14-09-2015, 18.930010-15",ECLI:NL:RBNNE:2015:4725,14-09-2015,uitspraak,"[{'Vindplaats': 'NJFS 2016/18', 'VindplaatsAnnotator': '', 'VindplaatsUrl': ''}, {'Vindplaats': 'Rechtspraak.nl', 'VindplaatsAnnotator': '', 'VindplaatsUrl': ''}]"
ECLI-NL-RBAMS-2015-2541,http://deeplink.rechtspraak.nl/uitspraak?id=ECLI:NL:RBAMS:2015:2541,uitspraak,De publicatie van de uitspraak staat gepland op 07-05-2015 om 09:54 uur,https://uitspraken.rechtspraak.nl/inziendocument?id=ECLI:NL:RBAMS:2015:2541&showbutton=true&keyword=mensenhandel,0.0,"['Eerste aanleg - meervoudig', 'Mondelinge uitspraak', 'Op tegenspraak']",07-05-2015,2015-05-07T09:54:36Z,gepubliceerd,['Strafrecht'],"[{'RelatieOmschrijving': 'Hoger beroep: ', 'LinkTekst': 'ECLI:NL:GHAMS:2016:3764', 'Postfix': ', (Gedeeltelijke) vernietiging en zelf afgedaan', 'WebAdres': 'https://uitspraken.rechtspraak.nl/inziendocument?id=ECLI:NL:GHAMS:2016:3764&showbutton=true&keyword=mensenhandel'}]","Mensenhandel tav minderjarige slachtoffers, gewoontewitwassen, bevel gevangenneming","Rechtbank Amsterdam, 21-04-2015, 13/730040-14 (Promis)",ECLI:NL:RBAMS:2015:2541,21-04-2015,uitspraak,"[{'Vindplaats': 'Rechtspraak.nl', 'VindplaatsAnnotator': '', 'VindplaatsUrl': ''}]"
ECLI-NL-RBAMS-2015-2543,http://deeplink.rechtspraak.nl/uitspraak?id=ECLI:NL:RBAMS:2015:2543,uitspraak,De publicatie van de uitspraak staat gepland op 07-05-2015 om 10:02 uur,https://uitspraken.rechtspraak.nl/inziendocument?id=ECLI:NL:RBAMS:2015:2543&showbutton=true&keyword=mensenhandel,0.0,"['Eerste aanleg - meervoudig', 'Op tegenspraak']",07-05-2015,2015-05-07T10:02:36Z,gepubliceerd,['Strafrecht'],[],"Mensenhandel tav een minderjarig slachtoffer, bevel gevangenneming","Rechtbank Amsterdam, 21-04-2015, 13/730023-14 (Promis)",ECLI:NL:RBAMS:2015:2543,21-04-2015,uitspraak,"[{'Vindplaats': 'Rechtspraak.nl', 'VindplaatsAnnotator': '', 'VindplaatsUrl': ''}]"
ECLI-NL-GHARL-2014-9415,http://deeplink.rechtspraak.nl/uitspraak?id=ECLI:NL:GHARL:2014:9415,uitspraak,De publicatie van de uitspraak staat gepland op 17-12-2014 om 11:31 uur,https://uitspraken.rechtspraak.nl/inziendocument?id=ECLI:NL:GHARL:2014:9415&showbutton=true&keyword=mensenhandel,0.0,['Hoger beroep'],17-12-2014,2014-12-17T11:31:50Z,gepubliceerd,['Strafrecht'],"[{'RelatieOmschrijving': 'Eerste aanleg: ', 'LinkTekst': 'ECLI:NL:RBGEL:2013:CA2936', 'Postfix': ', (Gedeeltelijke) vernietiging en zelf afgedaan', 'WebAdres': 'https://uitspraken.rechtspraak.nl/inziendocument?id=ECLI:NL:RBGEL:2013:CA2936&showbutton=true&keyword=mensenhandel'}, {'RelatieOmschrijving': 'Cassatie: ', 'LinkTekst': 'ECLI:NL:HR:2016:556', 'Postfix': ', Bekrachtiging/bevestiging', 'WebAdres': 'https://uitspraken.rechtspraak.nl/inziendocument?id=ECLI:NL:HR:2016:556&showbutton=true&keyword=mensenhandel'}]","Zwendel met telefoonabonnementen geen mensenhandel, wel oplichting.","Gerechtshof Arnhem-Leeuwarden, 04-12-2014, 21-005927-13",ECLI:NL:GHARL:2014:9415,04-12-2014,uitspraak,"[{'Vindplaats': 'NJFS 2015/126', 'VindplaatsAnnotator': '', 'VindplaatsUrl': ''}, {'Vindplaats': 'Rechtspraak.nl', 'VindplaatsAnnotator': '', 'VindplaatsUrl': ''}]"
ECLI-NL-GHARL-2014-9416,http://deeplink.rechtspraak.nl/uitspraak?id=ECLI:NL:GHARL:2014:9416,uitspraak,De publicatie van de uitspraak staat gepland op 17-12-2014 om 11:39 uur,https://uitspraken.rechtspraak.nl/inziendocument?id=ECLI:NL:GHARL:2014:9416&showbutton=true&keyword=mensenhandel,0.0,['Hoger beroep'],17-12-2014,2014-12-17T11:39:50Z,gepubliceerd,['Strafrecht'],"[{'RelatieOmschrijving': 'Eerste aanleg: ', 'LinkTekst': 'ECLI:NL:RBGEL:2013:1485', 'Postfix': ', (Gedeeltelijke) vernietiging en zelf afgedaan', 'WebAdres': 'https://uitspraken.rechtspraak.nl/inziendocument?id=ECLI:NL:RBGEL:2013:1485&showbutton=true&keyword=mensenhandel'}, {'RelatieOmschrijving': 'Cassatie: ', 'LinkTekst': 'ECLI:NL:HR:2016:554', 'Postfix': ', Bekrachtiging/bevestiging', 'WebAdres': 'https://uitspraken.rechtspraak.nl/inziendocument?id=ECLI:NL:HR:2016:554&showbutton=true&keyword=mensenhandel'}]","Zwendel met telefoonabonnementen geen mensenhandel, wel oplichting.","Gerechtshof Arnhem-Leeuwarden, 04-12-2014, 21-005710-13",ECLI:NL:GHARL:2014:9416,04-12-2014,uitspraak,"[{'Vindplaats': 'Rechtspraak.nl', 'VindplaatsAnnotator': '', 'VindplaatsUrl': ''}]"
ECLI-NL-RBROT-2014-9779,http://deeplink.rechtspraak.nl/uitspraak?id=ECLI:NL:RBROT:2014:9779,uitspraak,De publicatie van de uitspraak staat gepland op 01-12-2014 om 15:46 uur,https://uitspraken.rechtspraak.nl/inziendocument?id=ECLI:NL:RBROT:2014:9779&showbutton=true&keyword=mensenhandel,0.0,['Eerste aanleg - meervoudig'],01-12-2014,2014-12-01T15:46:20Z,gepubliceerd,['Strafrecht'],[],Ontneming van wederrechtelijk verkregen voordeel uit mensenhandel.,"Rechtbank Rotterdam, 27-11-2014, 10/963076-10 (ontneming)",ECLI:NL:RBROT:2014:9779,27-11-2014,uitspraak,"[{'Vindplaats': 'Rechtspraak.nl', 'VindplaatsAnnotator': '', 'VindplaatsUrl': ''}]"
ECLI-NL-GHARL-2014-1558,http://deeplink.rechtspraak.nl/uitspraak?id=ECLI:NL:GHARL:2014:1558,uitspraak,De publicatie van de uitspraak staat gepland op 10-03-2014 om 11:33 uur,https://uitspraken.rechtspraak.nl/inziendocument?id=ECLI:NL:GHARL:2014:1558&showbutton=true&keyword=mensenhandel,0.0,['Hoger beroep'],10-03-2014,2014-03-10T11:33:37Z,gepubliceerd,['Strafrecht'],[],Poging mensenhandel ten aanzien van een minderjarige.,"Gerechtshof Arnhem-Leeuwarden, 24-02-2014, 21-005923-13",ECLI:NL:GHARL:2014:1558,24-02-2014,uitspraak,"[{'Vindplaats': 'Rechtspraak.nl', 'VindplaatsAnnotator': '', 'VindplaatsUrl': ''}]"
ECLI-NL-RBNNE-2014-1005,http://deeplink.rechtspraak.nl/uitspraak?id=ECLI:NL:RBNNE:2014:1005,uitspraak,De publicatie van de uitspraak staat gepland op 28-02-2014 om 09:34 uur,https://uitspraken.rechtspraak.nl/inziendocument?id=ECLI:NL:RBNNE:2014:1005&showbutton=true&keyword=mensenhandel,0.0,['Eerste aanleg - meervoudig'],28-02-2014,2014-02-28T09:34:55Z,gepubliceerd,['Strafrecht'],[],Mensenhandel. Verdachte veroordeeld tot 36 maanden gevangenisstraf.,"Rechtbank Noord-Nederland, 17-02-2014, 18/830399-12",ECLI:NL:RBNNE:2014:1005,17-02-2014,uitspraak,"[{'Vindplaats': 'Rechtspraak.nl', 'VindplaatsAnnotator': '', 'VindplaatsUrl': ''}]"
ECLI-NL-GHARL-2013-9800,http://deeplink.rechtspraak.nl/uitspraak?id=ECLI:NL:GHARL:2013:9800,uitspraak,De publicatie van de uitspraak staat gepland op 24-12-2013 om 14:14 uur,https://uitspraken.rechtspraak.nl/inziendocument?id=ECLI:NL:GHARL:2013:9800&showbutton=true&keyword=mensenhandel,0.0,['Hoger beroep'],24-12-2013,2013-12-24T14:14:57Z,gepubliceerd,['Strafrecht'],"[{'RelatieOmschrijving': 'Eerste aanleg: ', 'LinkTekst': 'ECLI:NL:RBARN:2012:BW3216', 'Postfix': ', Meerdere afhandelingswijzen', 'WebAdres': 'https://uitspraken.rechtspraak.nl/inziendocument?id=ECLI:NL:RBARN:2012:BW3216&showbutton=true&keyword=mensenhandel'}]",Zeven jaar gevangenisstraf voor mensenhandel en verkrachting.,"Gerechtshof Arnhem-Leeuwarden, 20-12-2013, 21-001567-12",ECLI:NL:GHARL:2013:9800,20-12-2013,uitspraak,"[{'Vindplaats': 'Rechtspraak.nl', 'VindplaatsAnnotator': '', 'VindplaatsUrl': ''}]"
ECLI-NL-GHARL-2013-7396,http://deeplink.rechtspraak.nl/uitspraak?id=ECLI:NL:GHARL:2013:7396,uitspraak,De publicatie van de uitspraak staat gepland op 08-10-2013 om 14:30 uur,https://uitspraken.rechtspraak.nl/inziendocument?id=ECLI:NL:GHARL:2013:7396&showbutton=true&keyword=mensenhandel,0.0,['Hoger beroep'],08-10-2013,2013-10-08T14:30:27Z,gepubliceerd,['Strafrecht'],"[{'RelatieOmschrijving': 'Cassatie: ', 'LinkTekst': 'ECLI:NL:HR:2015:939', 'Postfix': ', Bekrachtiging/bevestiging', 'WebAdres': 'https://uitspraken.rechtspraak.nl/inziendocument?id=ECLI:NL:HR:2015:939&showbutton=true&keyword=mensenhandel'}]",Onderzoek Sneep. Steekincident internetwinkel en poging mensenhandel.,"Gerechtshof Arnhem-Leeuwarden, 08-10-2013, 21-000137-10",ECLI:NL:GHARL:2013:7396,08-10-2013,uitspraak,"[{'Vindplaats': 'Rechtspraak.nl', 'VindplaatsAnnotator': '', 'VindplaatsUrl': ''}]"
ECLI-NL-RBLIM-2013-BZ0078,http://deeplink.rechtspraak.nl/uitspraak?id=ECLI:NL:RBLIM:2013:BZ0078,uitspraak,De publicatie van de uitspraak staat gepland op 30-01-2013 om 16:38 uur,https://uitspraken.rechtspraak.nl/inziendocument?id=ECLI:NL:RBLIM:2013:BZ0078&showbutton=true&keyword=mensenhandel,0.0,['Eerste aanleg - meervoudig'],30-01-2013,2013-01-30T16:38:27Z,gepubliceerd,['Strafrecht'],[],mensenhandel: oplegging van 40 maanden onvoorwaardelijke gevangenisstraf,"Rechtbank Limburg, 30-01-2013, 03-703223-11",ECLI:NL:RBLIM:2013:BZ0078,30-01-2013,uitspraak,"[{'Vindplaats': 'Rechtspraak.nl', 'VindplaatsAnnotator': '', 'VindplaatsUrl': ''}]"
ECLI-NL-GHLEE-2011-BP3606,http://deeplink.rechtspraak.nl/uitspraak?id=ECLI:NL:GHLEE:2011:BP3606,uitspraak,De publicatie van de uitspraak staat gepland op 08-02-2011 om 16:44 uur,https://uitspraken.rechtspraak.nl/inziendocument?id=ECLI:NL:GHLEE:2011:BP3606&showbutton=true&keyword=mensenhandel,0.0,['Hoger beroep'],08-02-2011,2011-02-08T16:44:02Z,gepubliceerd,['Strafrecht'],[],Verdachte wordt ter zake van mensenhandel vrijgesproken.,"Gerechtshof Leeuwarden, 08-02-2011, 24-001753-08",ECLI:NL:GHLEE:2011:BP3606,08-02-2011,uitspraak,"[{'Vindplaats': 'Rechtspraak.nl', 'VindplaatsAnnotator': '', 'VindplaatsUrl': ''}]"
ECLI-NL-RBLEE-2010-BO9043,http://deeplink.rechtspraak.nl/uitspraak?id=ECLI:NL:RBLEE:2010:BO9043,uitspraak,De publicatie van de uitspraak staat gepland op 28-12-2010 om 14:23 uur,https://uitspraken.rechtspraak.nl/inziendocument?id=ECLI:NL:RBLEE:2010:BO9043&showbutton=true&keyword=mensenhandel,0.0,['Eerste aanleg - meervoudig'],28-12-2010,2010-12-28T14:23:12Z,gepubliceerd,['Strafrecht'],"[{'RelatieOmschrijving': 'Hoger beroep: ', 'LinkTekst': 'ECLI:NL:GHLEE:2011:BQ2356', 'Postfix': ', Meerdere afhandelingswijzen', 'WebAdres': 'https://uitspraken.rechtspraak.nl/inziendocument?id=ECLI:NL:GHLEE:2011:BQ2356&showbutton=true&keyword=mensenhandel'}]","Prostitutie brengen, escortservice, mensenhandel, vrijspraak, benadeelde partij.","Rechtbank Leeuwarden, 28-12-2010, 17/880336-10VEV",ECLI:NL:RBLEE:2010:BO9043,28-12-2010,uitspraak,"[{'Vindplaats': 'NJFS 2011/77', 'VindplaatsAnnotator': '', 'VindplaatsUrl': ''}, {'Vindplaats': 'Rechtspraak.nl', 'VindplaatsAnnotator': '', 'VindplaatsUrl': ''}]"
ECLI-NL-RBALK-2010-BN9788,http://deeplink.rechtspraak.nl/uitspraak?id=ECLI:NL:RBALK:2010:BN9788,uitspraak,De publicatie van de uitspraak staat gepland op 08-10-2010 om 10:58 uur,https://uitspraken.rechtspraak.nl/inziendocument?id=ECLI:NL:RBALK:2010:BN9788&showbutton=true&keyword=mensenhandel,0.0,['Eerste aanleg - meervoudig'],08-10-2010,2010-10-08T10:58:48Z,gepubliceerd,['Strafrecht'],[],"vrijspraak mensenhandel, onvoldoende wettig en overtuigend bewijs","Rechtbank Alkmaar, 07-10-2010, 14.810141-07",ECLI:NL:RBALK:2010:BN9788,07-10-2010,uitspraak,"[{'Vindplaats': 'Rechtspraak.nl', 'VindplaatsAnnotator': '', 'VindplaatsUrl': ''}]"
ECLI-NL-RBLEE-2010-BN1233,http://deeplink.rechtspraak.nl/uitspraak?id=ECLI:NL:RBLEE:2010:BN1233,uitspraak,De publicatie van de uitspraak staat gepland op 15-07-2010 om 12:02 uur,https://uitspraken.rechtspraak.nl/inziendocument?id=ECLI:NL:RBLEE:2010:BN1233&showbutton=true&keyword=mensenhandel,0.0,['Eerste aanleg - meervoudig'],15-07-2010,2010-07-15T12:02:56Z,gepubliceerd,['Strafrecht'],[],"Mensenhandel, Roemeense bouwvakkers, uitbuiting, prostitutie, valselijk opmaken","Rechtbank Leeuwarden, 13-07-2010, 17/880101-09 PROM",ECLI:NL:RBLEE:2010:BN1233,13-07-2010,uitspraak,"[{'Vindplaats': 'Rechtspraak.nl', 'VindplaatsAnnotator': '', 'VindplaatsUrl': ''}]"
ECLI-NL-GHARL-2016-1008,http://deeplink.rechtspraak.nl/uitspraak?id=ECLI:NL:GHARL:2016:1008,uitspraak,De publicatie van de uitspraak staat gepland op 12-02-2016 om 14:30 uur,https://uitspraken.rechtspraak.nl/inziendocument?id=ECLI:NL:GHARL:2016:1008&showbutton=true&keyword=mensenhandel,0.0,['Hoger beroep'],12-02-2016,2016-02-12T14:30:07Z,gepubliceerd,['Strafrecht'],[],"Het hof veroordeelt verdachte ter zake van mensenhandel en pogingen tot mensenhandel tot een gevangenisstraf van 24 maanden, waarvan 15 maanden voorwaardelijk met een proeftijd van vijf jaren en een contactverbod ten aanzien van drie slachtoffers.","Gerechtshof Arnhem-Leeuwarden, 12-02-2016, 21-009043-13",ECLI:NL:GHARL:2016:1008,12-02-2016,uitspraak,"[{'Vindplaats': 'PS-Updates.nl 2016-0039', 'VindplaatsAnnotator': '', 'VindplaatsUrl': ''}, {'Vindplaats': 'Rechtspraak.nl', 'VindplaatsAnnotator': '', 'VindplaatsUrl': ''}]"
ECLI-NL-RBALK-2012-BV2848,http://deeplink.rechtspraak.nl/uitspraak?id=ECLI:NL:RBALK:2012:BV2848,uitspraak,De publicatie van de uitspraak staat gepland op 06-02-2012 om 10:50 uur,https://uitspraken.rechtspraak.nl/inziendocument?id=ECLI:NL:RBALK:2012:BV2848&showbutton=true&keyword=mensenhandel,0.0,['Eerste aanleg - meervoudig'],06-02-2012,2012-02-06T10:50:46Z,gepubliceerd,['Strafrecht'],[],"Onderzoek Sierra. Mensenhandel.

De meervoudige kamer van de rechtbank Alkmaar heeft verdachte veroordeeld voor mensenhandel, meermalen gepleegd en deelname aan een criminele organisatie. 
Ontvankelijkheid openbaar ministerie. Internationale rechtshulp. Tunnelvisie. Overschrijding redelijke termijn.

Zie ook BK3440.","Rechtbank Alkmaar, 03-02-2012, 14.810312-07",ECLI:NL:RBALK:2012:BV2848,03-02-2012,uitspraak,"[{'Vindplaats': 'Rechtspraak.nl', 'VindplaatsAnnotator': '', 'VindplaatsUrl': ''}]"
ECLI-NL-GHARN-2010-BO8383,http://deeplink.rechtspraak.nl/uitspraak?id=ECLI:NL:GHARN:2010:BO8383,uitspraak,De publicatie van de uitspraak staat gepland op 22-12-2010 om 14:43 uur,https://uitspraken.rechtspraak.nl/inziendocument?id=ECLI:NL:GHARN:2010:BO8383&showbutton=true&keyword=mensenhandel,0.0,['Hoger beroep'],22-12-2010,2010-12-22T14:43:01Z,gepubliceerd,['Strafrecht'],[],Mensenhandel. Misdadige organisatie. Toetsingskader mensenhandel.  Gebruik samenvattingen taps voor bewijs. Bewijswaardering. Gebruik van verklaring onvindbare getuige. Gebruik verklaring getuige die voor de rechter voor het eerst belastend heeft verklaard. Geheimhoudersgesprekken en strafvermindering. Oplegging geldboete naast gevangenisstraf.,"Gerechtshof Arnhem, 20-12-2010, 21-003055-08",ECLI:NL:GHARN:2010:BO8383,20-12-2010,uitspraak,"[{'Vindplaats': 'NJFS 2011/80', 'VindplaatsAnnotator': '', 'VindplaatsUrl': ''}, {'Vindplaats': 'Rechtspraak.nl', 'VindplaatsAnnotator': '', 'VindplaatsUrl': ''}]"
ECLI-NL-GHARN-2006-AX4208,http://deeplink.rechtspraak.nl/uitspraak?id=ECLI:NL:GHARN:2006:AX4208,uitspraak,De publicatie van de uitspraak staat gepland op 23-05-2006 om 15:35 uur,https://uitspraken.rechtspraak.nl/inziendocument?id=ECLI:NL:GHARN:2006:AX4208&showbutton=true&keyword=mensenhandel,0.0,['Hoger beroep'],23-05-2006,2006-05-23T15:35:37Z,gepubliceerd,['Strafrecht'],[],"Veroordeling voor o.a. deelname aan een criminele organisatie, alsmede voor meerdere gevallen van mensenhandel. Uitleg van de reikwijdte van het begrip ‘mensenhandel’ in de zin van artikel 250a Sr. Verwerping van de gevoerde verweren.","Gerechtshof Arnhem, 23-05-2006, 21-002904-05",ECLI:NL:GHARN:2006:AX4208,23-05-2006,uitspraak,"[{'Vindplaats': 'NJFS 2006, 192', 'VindplaatsAnnotator': '', 'VindplaatsUrl': ''}, {'Vindplaats': 'Rechtspraak.nl', 'VindplaatsAnnotator': '', 'VindplaatsUrl': ''}]"
ECLI-NL-GHARN-2006-AX4214,http://deeplink.rechtspraak.nl/uitspraak?id=ECLI:NL:GHARN:2006:AX4214,uitspraak,De publicatie van de uitspraak staat gepland op 23-05-2006 om 15:39 uur,https://uitspraken.rechtspraak.nl/inziendocument?id=ECLI:NL:GHARN:2006:AX4214&showbutton=true&keyword=mensenhandel,0.0,['Hoger beroep'],23-05-2006,2006-05-23T15:39:54Z,gepubliceerd,['Strafrecht'],[],"Veroordeling voor o.a. deelname aan een criminele organisatie, alsmede voor meerdere gevallen van mensenhandel. Uitleg van de reikwijdte van het begrip ‘mensenhandel’ in de zin van artikel 250a Sr. Verwerping van de gevoerde verweren.","Gerechtshof Arnhem, 23-05-2006, 21-002905-05",ECLI:NL:GHARN:2006:AX4214,23-05-2006,uitspraak,"[{'Vindplaats': 'Rechtspraak.nl', 'VindplaatsAnnotator': '', 'VindplaatsUrl': ''}]"
ECLI-NL-RBUTR-2010-BO8073,http://deeplink.rechtspraak.nl/uitspraak?id=ECLI:NL:RBUTR:2010:BO8073,uitspraak,De publicatie van de uitspraak staat gepland op 20-12-2010 om 16:34 uur,https://uitspraken.rechtspraak.nl/inziendocument?id=ECLI:NL:RBUTR:2010:BO8073&showbutton=true&keyword=mensenhandel,0.0,['Eerste aanleg - meervoudig'],20-12-2010,2010-12-20T16:34:39Z,gepubliceerd,['Strafrecht'],[],"Veroordeling van twee broers uit Zeist ter zake mensenhandel.  De oudste broer heeft een gevangenisstraf van 26 maanden, waarvan 12 maanden voorwaardelijk proeftijd van twee jaren met aftrek opgelegd gekregen voor mensenhandel met 5 meisjes en oplichting.","Rechtbank Utrecht, 13-12-2010, 16/711454-09 en 16/600430-10 (gev. ttz)",ECLI:NL:RBUTR:2010:BO8073,13-12-2010,uitspraak,"[{'Vindplaats': 'Rechtspraak.nl', 'VindplaatsAnnotator': '', 'VindplaatsUrl': ''}]"
ECLI-NL-RBUTR-2010-BO9376,http://deeplink.rechtspraak.nl/uitspraak?id=ECLI:NL:RBUTR:2010:BO9376,uitspraak,De publicatie van de uitspraak staat gepland op 30-12-2010 om 13:56 uur,https://uitspraken.rechtspraak.nl/inziendocument?id=ECLI:NL:RBUTR:2010:BO9376&showbutton=true&keyword=mensenhandel,0.0,['Eerste aanleg - meervoudig'],30-12-2010,2010-12-30T13:56:52Z,gepubliceerd,['Strafrecht'],[],"Veroordeling van twee broers uit Zeist ter zake mensenhandel.  De oudste broer heeft een gevangenisstraf van 26 maanden , waarvan 12 maanden voorwaardelijk proeftijd van twee jaren met aftrek opgelegd gekregen voor mensenhandel met 5 meisjes en oplichting .","Rechtbank Utrecht, 13-12-2010, 16/711450-09 en 16/600429-10 (gev. ttz) [P]",ECLI:NL:RBUTR:2010:BO9376,13-12-2010,uitspraak,"[{'Vindplaats': 'Rechtspraak.nl', 'VindplaatsAnnotator': '', 'VindplaatsUrl': ''}]"
ECLI-NL-OGEAC-2021-129,http://deeplink.rechtspraak.nl/uitspraak?id=ECLI:NL:OGEAC:2021:129,uitspraak,De publicatie van de uitspraak staat gepland op 20-07-2021 om 15:11 uur,https://uitspraken.rechtspraak.nl/inziendocument?id=ECLI:NL:OGEAC:2021:129&showbutton=true&keyword=mensenhandel,0.0,['Eerste aanleg - enkelvoudig'],20-07-2021,2021-07-20T15:11:17Z,gepubliceerd,['Strafrecht; Penitentiair strafrecht'],[],mensenhandel mensensmokkel valsheid in geschrifte overtreding arbeidsduur politieambtenaar,"Gerecht in eerste aanleg van Curaçao, 11-06-2021, 500.00368/19",ECLI:NL:OGEAC:2021:129,11-06-2021,uitspraak,"[{'Vindplaats': 'Rechtspraak.nl', 'VindplaatsAnnotator': '', 'VindplaatsUrl': ''}]"
ECLI-NL-RBDHA-2020-11209,http://deeplink.rechtspraak.nl/uitspraak?id=ECLI:NL:RBDHA:2020:11209,uitspraak,De publicatie van de uitspraak staat gepland op 09-11-2020 om 13:56 uur,https://uitspraken.rechtspraak.nl/inziendocument?id=ECLI:NL:RBDHA:2020:11209&showbutton=true&keyword=mensenhandel,0.0,['Eerste aanleg - enkelvoudig'],09-11-2020,2020-11-09T13:56:15.212Z,gepubliceerd,['Bestuursrecht; Vreemdelingenrecht'],[],"Dublin, Zwitserland, slachtoffer mensenhandel, beklag en bezwaar, ongegrond.","Rechtbank Den Haag, 18-08-2020, NL20.14116",ECLI:NL:RBDHA:2020:11209,18-08-2020,uitspraak,"[{'Vindplaats': 'Rechtspraak.nl', 'VindplaatsAnnotator': '', 'VindplaatsUrl': ''}]"
ECLI-NL-RBDHA-2019-10086,http://deeplink.rechtspraak.nl/uitspraak?id=ECLI:NL:RBDHA:2019:10086,uitspraak,De publicatie van de uitspraak staat gepland op 30-09-2019 om 09:43 uur,https://uitspraken.rechtspraak.nl/inziendocument?id=ECLI:NL:RBDHA:2019:10086&showbutton=true&keyword=mensenhandel,0.0,"['Bodemzaak', 'Eerste aanleg - enkelvoudig']",30-09-2019,2019-09-30T09:43:03Z,gepubliceerd,['Bestuursrecht; Vreemdelingenrecht'],[],"Rvb, financiële toelage, Unieburger, aangifte mensenhandel, beroep gegrond.","Rechtbank Den Haag, 09-09-2019, AWB 18 / 7147",ECLI:NL:RBDHA:2019:10086,09-09-2019,uitspraak,"[{'Vindplaats': 'Rechtspraak.nl', 'VindplaatsAnnotator': '', 'VindplaatsUrl': ''}]"
ECLI-NL-RBDHA-2019-9782,http://deeplink.rechtspraak.nl/uitspraak?id=ECLI:NL:RBDHA:2019:9782,uitspraak,De publicatie van de uitspraak staat gepland op 24-09-2019 om 15:19 uur,https://uitspraken.rechtspraak.nl/inziendocument?id=ECLI:NL:RBDHA:2019:9782&showbutton=true&keyword=mensenhandel,0.0,"['Bodemzaak', 'Eerste aanleg - enkelvoudig']",24-09-2019,2019-09-24T15:19:43Z,gepubliceerd,['Bestuursrecht; Vreemdelingenrecht'],[],Dublin Italie. Beleid aangifte mensenhandel. Ondeugdelijk gemotiveerd. Gegrond.,"Rechtbank Den Haag, 26-08-2019, NL19.16639",ECLI:NL:RBDHA:2019:9782,26-08-2019,uitspraak,"[{'Vindplaats': 'Rechtspraak.nl', 'VindplaatsAnnotator': '', 'VindplaatsUrl': ''}]"
ECLI-NL-RBDHA-2018-1566,http://deeplink.rechtspraak.nl/uitspraak?id=ECLI:NL:RBDHA:2018:1566,uitspraak,De publicatie van de uitspraak staat gepland op 08-03-2018 om 11:21 uur,https://uitspraken.rechtspraak.nl/inziendocument?id=ECLI:NL:RBDHA:2018:1566&showbutton=true&keyword=mensenhandel,0.0,"['Bodemzaak', 'Eerste aanleg - enkelvoudig']",08-03-2018,2018-03-08T11:21:46Z,gepubliceerd,['Bestuursrecht; Vreemdelingenrecht'],[],Dublin Duitsland; aangifte mensenhandel;sociaal netwerk;beroep ongegrond,"Rechtbank Den Haag, 01-02-2018, NL18.750",ECLI:NL:RBDHA:2018:1566,01-02-2018,uitspraak,"[{'Vindplaats': 'Rechtspraak.nl', 'VindplaatsAnnotator': '', 'VindplaatsUrl': ''}]"
ECLI-NL-RBAMS-2018-390,http://deeplink.rechtspraak.nl/uitspraak?id=ECLI:NL:RBAMS:2018:390,uitspraak,De publicatie van de uitspraak staat gepland op 30-01-2018 om 13:56 uur,https://uitspraken.rechtspraak.nl/inziendocument?id=ECLI:NL:RBAMS:2018:390&showbutton=true&keyword=mensenhandel,0.0,['Eerste aanleg - meervoudig'],30-01-2018,2018-01-30T13:56:01Z,gepubliceerd,['Strafrecht'],[],"Mensenhandel, uitbuiting in de prostitutie. 13 maanden gevangenisstraf.","Rechtbank Amsterdam, 25-01-2018, 13/708115-12",ECLI:NL:RBAMS:2018:390,25-01-2018,uitspraak,"[{'Vindplaats': 'NJFS 2018/71', 'VindplaatsAnnotator': '', 'VindplaatsUrl': ''}, {'Vindplaats': 'Rechtspraak.nl', 'VindplaatsAnnotator': '', 'VindplaatsUrl': ''}]"
ECLI-NL-RBNNE-2017-5035,http://deeplink.rechtspraak.nl/uitspraak?id=ECLI:NL:RBNNE:2017:5035,uitspraak,De publicatie van de uitspraak staat gepland op 28-12-2017 om 17:07 uur,https://uitspraken.rechtspraak.nl/inziendocument?id=ECLI:NL:RBNNE:2017:5035&showbutton=true&keyword=mensenhandel,0.0,['Eerste aanleg - meervoudig'],28-12-2017,2017-12-28T17:07:29Z,gepubliceerd,['Civiel recht'],[],Aansprakelijkheid schade mensenhandel. Verjaringsperikelen. Begroting schade door gevalsvergelijking.,"Rechtbank Noord-Nederland, 22-11-2017, C/18/148690 / HA ZA 14-163",ECLI:NL:RBNNE:2017:5035,22-11-2017,uitspraak,"[{'Vindplaats': 'JA 2018/30', 'VindplaatsAnnotator': '', 'VindplaatsUrl': ''}, {'Vindplaats': 'AR 2017/6812', 'VindplaatsAnnotator': '', 'VindplaatsUrl': ''}, {'Vindplaats': 'PS-Updates.nl 2018-0012', 'VindplaatsAnnotator': '', 'VindplaatsUrl': ''}, {'Vindplaats': 'Rechtspraak.nl', 'VindplaatsAnnotator': '', 'VindplaatsUrl': ''}]"
ECLI-NL-RBAMS-2017-10551,http://deeplink.rechtspraak.nl/uitspraak?id=ECLI:NL:RBAMS:2017:10551,uitspraak,De publicatie van de uitspraak staat gepland op 24-05-2018 om 11:41 uur,https://uitspraken.rechtspraak.nl/inziendocument?id=ECLI:NL:RBAMS:2017:10551&showbutton=true&keyword=mensenhandel,0.0,"['Eerste aanleg - meervoudig', 'Op tegenspraak']",24-05-2018,2018-05-24T11:41:27Z,gepubliceerd,['Strafrecht'],[],Mensenhandel | uitbuiting in de prostitutie | specialiteitsbeginsel | redelijke termijn,"Rechtbank Amsterdam, 25-10-2017, 13/730031-16",ECLI:NL:RBAMS:2017:10551,25-10-2017,uitspraak,"[{'Vindplaats': 'PS-Updates.nl 2018-0463', 'VindplaatsAnnotator': '', 'VindplaatsUrl': ''}, {'Vindplaats': 'Rechtspraak.nl', 'VindplaatsAnnotator': '', 'VindplaatsUrl': ''}]"
ECLI-NL-RBAMS-2017-3807,http://deeplink.rechtspraak.nl/uitspraak?id=ECLI:NL:RBAMS:2017:3807,uitspraak,De publicatie van de uitspraak staat gepland op 02-06-2017 om 13:42 uur,https://uitspraken.rechtspraak.nl/inziendocument?id=ECLI:NL:RBAMS:2017:3807&showbutton=true&keyword=mensenhandel,0.0,['Eerste aanleg - meervoudig'],02-06-2017,2017-06-02T13:42:11Z,gepubliceerd,['Strafrecht'],[],"mensenhandel, arbeidsuitbuiting illegale vreemdelingen in een wasserij, gewoontewitwassen.","Rechtbank Amsterdam, 02-06-2017, 13/845059-11 (A), 13/845011-13 (B)",ECLI:NL:RBAMS:2017:3807,02-06-2017,uitspraak,"[{'Vindplaats': 'Rechtspraak.nl', 'VindplaatsAnnotator': '', 'VindplaatsUrl': ''}]"
ECLI-NL-RBAMS-2017-3911,http://deeplink.rechtspraak.nl/uitspraak?id=ECLI:NL:RBAMS:2017:3911,uitspraak,De publicatie van de uitspraak staat gepland op 06-06-2017 om 12:57 uur,https://uitspraken.rechtspraak.nl/inziendocument?id=ECLI:NL:RBAMS:2017:3911&showbutton=true&keyword=mensenhandel,0.0,['Eerste aanleg - meervoudig'],06-06-2017,2017-06-06T12:57:33Z,gepubliceerd,['Strafrecht'],[],"mensenhandel, arbeidsuitbuiting illegale vreemdelingen in een wasserij, gewoontewitwassen.","Rechtbank Amsterdam, 02-06-2017, 13/993007-16",ECLI:NL:RBAMS:2017:3911,02-06-2017,uitspraak,"[{'Vindplaats': 'Rechtspraak.nl', 'VindplaatsAnnotator': '', 'VindplaatsUrl': ''}]"
ECLI-NL-OGEAA-2017-93,http://deeplink.rechtspraak.nl/uitspraak?id=ECLI:NL:OGEAA:2017:93,uitspraak,De publicatie van de uitspraak staat gepland op 20-02-2017 om 09:59 uur,https://uitspraken.rechtspraak.nl/inziendocument?id=ECLI:NL:OGEAA:2017:93&showbutton=true&keyword=mensenhandel,0.0,['Eerste aanleg - enkelvoudig'],20-02-2017,2017-02-20T09:59:16Z,gepubliceerd,['Strafrecht'],[],Mensenhandel. Overschrijding redelijke termijn. Gevangenisstraf van 21 maanden.,"Gerecht in Eerste Aanleg van Aruba, 03-02-2017, 3257 van 2010",ECLI:NL:OGEAA:2017:93,03-02-2017,uitspraak,"[{'Vindplaats': 'Rechtspraak.nl', 'VindplaatsAnnotator': '', 'VindplaatsUrl': ''}]"
ECLI-NL-GHAMS-2016-5039,http://deeplink.rechtspraak.nl/uitspraak?id=ECLI:NL:GHAMS:2016:5039,uitspraak,De publicatie van de uitspraak staat gepland op 25-11-2016 om 16:26 uur,https://uitspraken.rechtspraak.nl/inziendocument?id=ECLI:NL:GHAMS:2016:5039&showbutton=true&keyword=mensenhandel,0.0,['Hoger beroep'],25-11-2016,2016-11-25T16:26:00Z,gepubliceerd,['Strafrecht'],[],Mensenhandel: arbeidsuitbuiting van hulp in de huishouding. Strafmaatoverweging.,"Gerechtshof Amsterdam, 16-11-2016, 23-000880-14",ECLI:NL:GHAMS:2016:5039,16-11-2016,uitspraak,"[{'Vindplaats': 'Rechtspraak.nl', 'VindplaatsAnnotator': '', 'VindplaatsUrl': ''}]"
ECLI-NL-GHAMS-2016-3979,http://deeplink.rechtspraak.nl/uitspraak?id=ECLI:NL:GHAMS:2016:3979,uitspraak,De publicatie van de uitspraak staat gepland op 06-10-2016 om 09:58 uur,https://uitspraken.rechtspraak.nl/inziendocument?id=ECLI:NL:GHAMS:2016:3979&showbutton=true&keyword=mensenhandel,0.0,['Hoger beroep'],06-10-2016,2016-10-06T09:58:57Z,gepubliceerd,['Strafrecht'],[],"Vrijspraak mensenhandel, naast de aangifte geen objectief steunbewijs.","Gerechtshof Amsterdam, 05-10-2016, 23-005429-13",ECLI:NL:GHAMS:2016:3979,05-10-2016,uitspraak,"[{'Vindplaats': 'Rechtspraak.nl', 'VindplaatsAnnotator': '', 'VindplaatsUrl': ''}]"
ECLI-NL-RBROT-2014-9780,http://deeplink.rechtspraak.nl/uitspraak?id=ECLI:NL:RBROT:2014:9780,uitspraak,De publicatie van de uitspraak staat gepland op 01-12-2014 om 16:52 uur,https://uitspraken.rechtspraak.nl/inziendocument?id=ECLI:NL:RBROT:2014:9780&showbutton=true&keyword=mensenhandel,0.0,['Eerste aanleg - meervoudig'],01-12-2014,2014-12-01T16:52:20Z,gepubliceerd,['Strafrecht'],[],"Integrale vrijspraak van mensenhandel, mensensmokkel, kinder- en dierenporno.","Rechtbank Rotterdam, 27-11-2014, 10/963035-11",ECLI:NL:RBROT:2014:9780,27-11-2014,uitspraak,"[{'Vindplaats': 'Rechtspraak.nl', 'VindplaatsAnnotator': '', 'VindplaatsUrl': ''}]"
ECLI-NL-GHAMS-2014-5775,http://deeplink.rechtspraak.nl/uitspraak?id=ECLI:NL:GHAMS:2014:5775,uitspraak,De publicatie van de uitspraak staat gepland op 23-01-2015 om 10:25 uur,https://uitspraken.rechtspraak.nl/inziendocument?id=ECLI:NL:GHAMS:2014:5775&showbutton=true&keyword=mensenhandel,0.0,['Hoger beroep'],23-01-2015,2015-01-23T10:25:25Z,gepubliceerd,['Strafrecht'],[],Ontnemingszaak mensenhandel. Overschrijding redelijke termijn leidt tot mindering.,"Gerechtshof Amsterdam, 31-10-2014, 23-005232-13",ECLI:NL:GHAMS:2014:5775,31-10-2014,uitspraak,"[{'Vindplaats': 'Rechtspraak.nl', 'VindplaatsAnnotator': '', 'VindplaatsUrl': ''}]"
ECLI-NL-GHARL-2013-8902,http://deeplink.rechtspraak.nl/uitspraak?id=ECLI:NL:GHARL:2013:8902,uitspraak,De publicatie van de uitspraak staat gepland op 25-11-2013 om 15:20 uur,https://uitspraken.rechtspraak.nl/inziendocument?id=ECLI:NL:GHARL:2013:8902&showbutton=true&keyword=mensenhandel,0.0,['Hoger beroep'],25-11-2013,2013-11-25T15:20:20Z,gepubliceerd,['Strafrecht'],"[{'RelatieOmschrijving': 'Eerste aanleg: ', 'LinkTekst': 'ECLI:NL:RBUTR:2011:BP7662', 'Postfix': ', Meerdere afhandelingswijzen', 'WebAdres': 'https://uitspraken.rechtspraak.nl/inziendocument?id=ECLI:NL:RBUTR:2011:BP7662&showbutton=true&keyword=mensenhandel'}, {'RelatieOmschrijving': 'Cassatie: ', 'LinkTekst': 'ECLI:NL:HR:2015:2468', 'Postfix': ', Bekrachtiging/bevestiging', 'WebAdres': 'https://uitspraken.rechtspraak.nl/inziendocument?id=ECLI:NL:HR:2015:2468&showbutton=true&keyword=mensenhandel'}]",Uitspraak Sneep 2. Veroordeling mensenhandel en criminele organisatie,"Gerechtshof Arnhem-Leeuwarden, 22-11-2013, 21-000880-11",ECLI:NL:GHARL:2013:8902,22-11-2013,uitspraak,"[{'Vindplaats': 'Rechtspraak.nl', 'VindplaatsAnnotator': '', 'VindplaatsUrl': ''}]"
ECLI-NL-RBUTR-2011-BV7900,http://deeplink.rechtspraak.nl/uitspraak?id=ECLI:NL:RBUTR:2011:BV7900,uitspraak,De publicatie van de uitspraak staat gepland op 06-03-2012 om 11:51 uur,https://uitspraken.rechtspraak.nl/inziendocument?id=ECLI:NL:RBUTR:2011:BV7900&showbutton=true&keyword=mensenhandel,0.0,['Eerste aanleg - meervoudig'],06-03-2012,2012-03-06T11:51:26Z,gepubliceerd,['Strafrecht'],[],"mensenhandel, gepleegd door twee of meer verenigde personen","Rechtbank Utrecht, 09-06-2011, 16/804801-10 en 16/804809-10 (ter terechtzitting gevoegd) [P]",ECLI:NL:RBUTR:2011:BV7900,09-06-2011,uitspraak,"[{'Vindplaats': 'Rechtspraak.nl', 'VindplaatsAnnotator': '', 'VindplaatsUrl': ''}]"
ECLI-NL-RBGRO-2010-BM9806,http://deeplink.rechtspraak.nl/uitspraak?id=ECLI:NL:RBGRO:2010:BM9806,uitspraak,De publicatie van de uitspraak staat gepland op 30-06-2010 om 15:23 uur,https://uitspraken.rechtspraak.nl/inziendocument?id=ECLI:NL:RBGRO:2010:BM9806&showbutton=true&keyword=mensenhandel,0.0,['Eerste aanleg - meervoudig'],30-06-2010,2010-06-30T15:23:56Z,gepubliceerd,['Strafrecht'],[],Mensenhandel. Beoordeling betrouwbaarheid verklaring aangeefster. Gevangenisstraf 4 jaar.,"Rechtbank Groningen, 28-06-2010, 18/630347-09",ECLI:NL:RBGRO:2010:BM9806,28-06-2010,uitspraak,"[{'Vindplaats': 'Rechtspraak.nl', 'VindplaatsAnnotator': '', 'VindplaatsUrl': ''}]"
ECLI-NL-RBHAA-2008-BG2006,http://deeplink.rechtspraak.nl/uitspraak?id=ECLI:NL:RBHAA:2008:BG2006,uitspraak,De publicatie van de uitspraak staat gepland op 29-10-2008 om 16:12 uur,https://uitspraken.rechtspraak.nl/inziendocument?id=ECLI:NL:RBHAA:2008:BG2006&showbutton=true&keyword=mensenhandel,0.0,['Eerste aanleg - meervoudig'],29-10-2008,2008-10-29T16:12:17Z,gepubliceerd,['Strafrecht'],[],Mensenhandel. Raadsman heeft getuige niet kunnen ondervragen. Vrijspraak.,"Rechtbank Haarlem, 01-10-2008, 15/700068-08",ECLI:NL:RBHAA:2008:BG2006,01-10-2008,uitspraak,"[{'Vindplaats': 'Rechtspraak.nl', 'VindplaatsAnnotator': '', 'VindplaatsUrl': ''}]"
ECLI-NL-RBSGR-2012-BX0032,http://deeplink.rechtspraak.nl/uitspraak?id=ECLI:NL:RBSGR:2012:BX0032,uitspraak,De publicatie van de uitspraak staat gepland op 29-06-2012 om 18:31 uur,https://uitspraken.rechtspraak.nl/inziendocument?id=ECLI:NL:RBSGR:2012:BX0032&showbutton=true&keyword=mensenhandel,0.0,['Eerste aanleg - meervoudig'],29-06-2012,2012-06-29T18:31:55Z,gepubliceerd,['Strafrecht'],[],"Mensenhandel, mishandeling en woninginbraak. Verdachte heeft zich schuldig gemaakt aan verschillende vormen van mensenhandel en daarmee meerdere vrouwen tot slachtoffer van seksuele uitbuiting gemaakt. Verdachte heeft zich, blijkens het uittreksel uit zijn justitiële documentatie twee keer eerder schuldig gemaakt aan mensenhandel en tal van andere strafbare feiten. Gevangenisstraf voor de duur van 7 jaren, met aftrek van voorarrest. Zie ook LJN: BX0393, BX0466, BX0718 en BX1312 (medeverdachten).","Rechtbank 's-Gravenhage, 29-06-2012, 09/650071-11 en 09/650021-12",ECLI:NL:RBSGR:2012:BX0032,29-06-2012,uitspraak,"[{'Vindplaats': 'Rechtspraak.nl', 'VindplaatsAnnotator': '', 'VindplaatsUrl': ''}]"
ECLI-NL-RBARN-2012-BW9488,http://deeplink.rechtspraak.nl/uitspraak?id=ECLI:NL:RBARN:2012:BW9488,uitspraak,De publicatie van de uitspraak staat gepland op 27-06-2012 om 10:01 uur,https://uitspraken.rechtspraak.nl/inziendocument?id=ECLI:NL:RBARN:2012:BW9488&showbutton=true&keyword=mensenhandel,0.0,['Eerste aanleg - meervoudig'],27-06-2012,2012-06-27T10:01:42Z,gepubliceerd,['Strafrecht'],[],"Ontvankelijkheid OM; mensenhandel; poging; begin van uitvoering. Geen niet-ontvankelijkheid van het openbaar ministerie, omdat het zoekraken van een aangifte naar het oordeel van de rechtbank geen vormverzuim in het voorbereidend onderzoek oplevert. Verdachtes recht op een eerlijk proces is niet is geschonden. Poging mensenhandel niet bewezen omdat er geen sprake is van een begin van uitvoering. Veroordeling voor mensenhandel tot een gevangenisstraf voor de duur van 2 jaren.","Rechtbank Arnhem, 27-06-2012, 05/700450-10",ECLI:NL:RBARN:2012:BW9488,27-06-2012,uitspraak,"[{'Vindplaats': 'Rechtspraak.nl', 'VindplaatsAnnotator': '', 'VindplaatsUrl': ''}]"
ECLI-NL-RBDHA-2014-995,http://deeplink.rechtspraak.nl/uitspraak?id=ECLI:NL:RBDHA:2014:995,uitspraak,De publicatie van de uitspraak staat gepland op 17-02-2014 om 15:19 uur,https://uitspraken.rechtspraak.nl/inziendocument?id=ECLI:NL:RBDHA:2014:995&showbutton=true&keyword=mensenhandel,0.0,"['Bodemzaak', 'Eerste aanleg - meervoudig']",17-02-2014,2014-02-17T15:19:53Z,gepubliceerd,['Bestuursrecht; Vreemdelingenrecht'],[],"Terugkeerbesluit en inreisverbod voor de duur van 10 jaar. Eiseres is slachtoffer mensenhandel, maar ook zelf veroordeeld voor onder meer doodslag. Gronden aangevoerd met betrekking tot de bekendmaking van het inreisverbod, beroep op non-punishmentbeginsel als slachtoffer van mensenhandel.","Rechtbank Den Haag, 29-01-2014, AWB 13-20388",ECLI:NL:RBDHA:2014:995,29-01-2014,uitspraak,"[{'Vindplaats': 'Rechtspraak.nl', 'VindplaatsAnnotator': '', 'VindplaatsUrl': ''}]"
ECLI-NL-RBDHA-2020-9555,http://deeplink.rechtspraak.nl/uitspraak?id=ECLI:NL:RBDHA:2020:9555,uitspraak,De publicatie van de uitspraak staat gepland op 30-09-2020 om 13:55 uur,https://uitspraken.rechtspraak.nl/inziendocument?id=ECLI:NL:RBDHA:2020:9555&showbutton=true&keyword=mensenhandel,0.0,['Eerste aanleg - enkelvoudig'],30-09-2020,2020-09-30T13:55:05.298Z,gepubliceerd,['Bestuursrecht; Vreemdelingenrecht'],[],"Dublinvo, Duitsland verantwoordelijk, aangifte mensenhandel, vrijwillg vertrek, beroep ongegrond .","Rechtbank Den Haag, 23-07-2020, NL20.10531",ECLI:NL:RBDHA:2020:9555,23-07-2020,uitspraak,"[{'Vindplaats': 'Rechtspraak.nl', 'VindplaatsAnnotator': '', 'VindplaatsUrl': ''}]"
ECLI-NL-RBDHA-2020-6122,http://deeplink.rechtspraak.nl/uitspraak?id=ECLI:NL:RBDHA:2020:6122,uitspraak,De publicatie van de uitspraak staat gepland op 07-07-2020 om 09:15 uur,https://uitspraken.rechtspraak.nl/inziendocument?id=ECLI:NL:RBDHA:2020:6122&showbutton=true&keyword=mensenhandel,0.0,['Eerste aanleg - enkelvoudig'],07-07-2020,2020-07-07T09:15:39Z,gepubliceerd,['Bestuursrecht; Vreemdelingenrecht'],[],"Regulier, mensenhandel, implementatie Richtlijn 2004/81/EG, beroep ongegrond.","Rechtbank Den Haag, 26-06-2020, AWB 20/1450",ECLI:NL:RBDHA:2020:6122,26-06-2020,uitspraak,"[{'Vindplaats': 'Rechtspraak.nl', 'VindplaatsAnnotator': '', 'VindplaatsUrl': ''}]"
ECLI-NL-RBZWB-2019-1346,http://deeplink.rechtspraak.nl/uitspraak?id=ECLI:NL:RBZWB:2019:1346,uitspraak,De publicatie van de uitspraak staat gepland op 03-04-2019 om 09:55 uur,https://uitspraken.rechtspraak.nl/inziendocument?id=ECLI:NL:RBZWB:2019:1346&showbutton=true&keyword=mensenhandel,0.0,['Op tegenspraak'],03-04-2019,2019-04-03T09:55:02Z,gepubliceerd,['Strafrecht'],[],Medeplegen van mensenhandel en uitlokking van ontucht. Veroordeling. Gevangenisstraf.,"Rechtbank Zeeland-West-Brabant, 02-04-2019, 02-820438-18",ECLI:NL:RBZWB:2019:1346,02-04-2019,uitspraak,"[{'Vindplaats': 'Rechtspraak.nl', 'VindplaatsAnnotator': '', 'VindplaatsUrl': ''}]"
ECLI-NL-RBNNE-2017-4662,http://deeplink.rechtspraak.nl/uitspraak?id=ECLI:NL:RBNNE:2017:4662,uitspraak,De publicatie van de uitspraak staat gepland op 06-12-2017 om 11:28 uur,https://uitspraken.rechtspraak.nl/inziendocument?id=ECLI:NL:RBNNE:2017:4662&showbutton=true&keyword=mensenhandel,0.0,"['Eerste aanleg - meervoudig', 'Op tegenspraak']",06-12-2017,2017-12-06T11:28:40Z,gepubliceerd,['Strafrecht'],[],Gedeeltelijke toewijzing ontnemingsvordering van uit mensenhandel wederrechtelijk verkregen voordeel.,"Rechtbank Noord-Nederland, 05-12-2017, 18/830123-17 ontneming",ECLI:NL:RBNNE:2017:4662,05-12-2017,uitspraak,"[{'Vindplaats': 'Rechtspraak.nl', 'VindplaatsAnnotator': '', 'VindplaatsUrl': ''}]"
ECLI-NL-RBOVE-2015-5784,http://deeplink.rechtspraak.nl/uitspraak?id=ECLI:NL:RBOVE:2015:5784,uitspraak,De publicatie van de uitspraak staat gepland op 15-01-2016 om 18:59 uur,https://uitspraken.rechtspraak.nl/inziendocument?id=ECLI:NL:RBOVE:2015:5784&showbutton=true&keyword=mensenhandel,0.0,['Eerste aanleg - meervoudig'],15-01-2016,2016-01-15T18:59:37Z,gepubliceerd,['Strafrecht'],[],De rechtbank spreekt een 23-jarige vrouw van mensenhandel.,"Rechtbank Overijssel, 27-10-2015, 08.951463.13",ECLI:NL:RBOVE:2015:5784,27-10-2015,uitspraak,"[{'Vindplaats': 'Rechtspraak.nl', 'VindplaatsAnnotator': '', 'VindplaatsUrl': ''}]"
ECLI-NL-GHARL-2015-4094,http://deeplink.rechtspraak.nl/uitspraak?id=ECLI:NL:GHARL:2015:4094,uitspraak,De publicatie van de uitspraak staat gepland op 09-06-2015 om 10:06 uur,https://uitspraken.rechtspraak.nl/inziendocument?id=ECLI:NL:GHARL:2015:4094&showbutton=true&keyword=mensenhandel,0.0,['Hoger beroep'],09-06-2015,2015-06-09T10:06:21Z,gepubliceerd,['Strafrecht'],"[{'RelatieOmschrijving': 'Eerste aanleg: ', 'LinkTekst': 'ECLI:NL:RBGEL:2014:594', 'Postfix': ', Meerdere afhandelingswijzen', 'WebAdres': 'https://uitspraken.rechtspraak.nl/inziendocument?id=ECLI:NL:RBGEL:2014:594&showbutton=true&keyword=mensenhandel'}]",Veroordeling ter zake van mensenhandel tot 42 maanden gevangenisstraf,"Gerechtshof Arnhem-Leeuwarden, 05-06-2015, 21-000839-14",ECLI:NL:GHARL:2015:4094,05-06-2015,uitspraak,"[{'Vindplaats': 'Rechtspraak.nl', 'VindplaatsAnnotator': '', 'VindplaatsUrl': ''}]"
ECLI-NL-GHARL-2015-3608,http://deeplink.rechtspraak.nl/uitspraak?id=ECLI:NL:GHARL:2015:3608,uitspraak,De publicatie van de uitspraak staat gepland op 22-05-2015 om 14:45 uur,https://uitspraken.rechtspraak.nl/inziendocument?id=ECLI:NL:GHARL:2015:3608&showbutton=true&keyword=mensenhandel,0.0,['Hoger beroep'],22-05-2015,2015-05-22T14:45:06Z,gepubliceerd,['Strafrecht'],"[{'RelatieOmschrijving': 'Cassatie: ', 'LinkTekst': 'ECLI:NL:HR:2016:692', 'Postfix': ', Bekrachtiging/bevestiging', 'WebAdres': 'https://uitspraken.rechtspraak.nl/inziendocument?id=ECLI:NL:HR:2016:692&showbutton=true&keyword=mensenhandel'}]",veroordeling ter zake van mensenhandel tot vier jaar gevangenisstraf.,"Gerechtshof Arnhem-Leeuwarden, 22-05-2015, 21-001887-14",ECLI:NL:GHARL:2015:3608,22-05-2015,uitspraak,"[{'Vindplaats': 'Rechtspraak.nl', 'VindplaatsAnnotator': '', 'VindplaatsUrl': ''}]"
ECLI-NL-RBAMS-2015-2539,http://deeplink.rechtspraak.nl/uitspraak?id=ECLI:NL:RBAMS:2015:2539,uitspraak,De publicatie van de uitspraak staat gepland op 07-05-2015 om 09:37 uur,https://uitspraken.rechtspraak.nl/inziendocument?id=ECLI:NL:RBAMS:2015:2539&showbutton=true&keyword=mensenhandel,0.0,"['Eerste aanleg - meervoudig', 'Op tegenspraak']",07-05-2015,2015-05-07T09:37:36Z,gepubliceerd,['Strafrecht'],"[{'RelatieOmschrijving': 'Hoger beroep: ', 'LinkTekst': 'ECLI:NL:GHAMS:2016:3765', 'Postfix': ', (Gedeeltelijke) vernietiging en zelf afgedaan', 'WebAdres': 'https://uitspraken.rechtspraak.nl/inziendocument?id=ECLI:NL:GHAMS:2016:3765&showbutton=true&keyword=mensenhandel'}]","Mensenhandel tav een meer- en minderjarig slachtoffer, bevel gevangenneming","Rechtbank Amsterdam, 21-04-2015, 13/730010-14 (Promis)",ECLI:NL:RBAMS:2015:2539,21-04-2015,uitspraak,"[{'Vindplaats': 'Rechtspraak.nl', 'VindplaatsAnnotator': '', 'VindplaatsUrl': ''}]"
ECLI-NL-RBAMS-2015-2474,http://deeplink.rechtspraak.nl/uitspraak?id=ECLI:NL:RBAMS:2015:2474,uitspraak,De publicatie van de uitspraak staat gepland op 07-05-2015 om 09:14 uur,https://uitspraken.rechtspraak.nl/inziendocument?id=ECLI:NL:RBAMS:2015:2474&showbutton=true&keyword=mensenhandel,0.0,"['Eerste aanleg - meervoudig', 'Op tegenspraak']",07-05-2015,2015-05-07T09:14:37Z,gepubliceerd,['Strafrecht'],"[{'RelatieOmschrijving': 'Hoger beroep: ', 'LinkTekst': 'ECLI:NL:GHAMS:2016:3766', 'Postfix': ', (Gedeeltelijke) vernietiging en zelf afgedaan', 'WebAdres': 'https://uitspraken.rechtspraak.nl/inziendocument?id=ECLI:NL:GHAMS:2016:3766&showbutton=true&keyword=mensenhandel'}]","Mensenhandel tav minderjarige slachtoffers, gewoontewitwassen, media aandacht, bevel gevangenneming","Rechtbank Amsterdam, 21-04-2015, 13/730039-14 (Promis)",ECLI:NL:RBAMS:2015:2474,21-04-2015,uitspraak,"[{'Vindplaats': 'Rechtspraak.nl', 'VindplaatsAnnotator': '', 'VindplaatsUrl': ''}]"
ECLI-NL-GHARL-2014-3065,http://deeplink.rechtspraak.nl/uitspraak?id=ECLI:NL:GHARL:2014:3065,uitspraak,De publicatie van de uitspraak staat gepland op 15-04-2014 om 14:30 uur,https://uitspraken.rechtspraak.nl/inziendocument?id=ECLI:NL:GHARL:2014:3065&showbutton=true&keyword=mensenhandel,0.0,['Hoger beroep'],15-04-2014,2014-04-15T14:30:13Z,gepubliceerd,['Strafrecht'],[],Vrijspraak van mensenhandel (artikel 273f sub 3 Sr),"Gerechtshof Arnhem-Leeuwarden, 15-04-2014, 21-004733-11",ECLI:NL:GHARL:2014:3065,15-04-2014,uitspraak,"[{'Vindplaats': 'Rechtspraak.nl', 'VindplaatsAnnotator': '', 'VindplaatsUrl': ''}]"
ECLI-NL-GHARL-2014-1559,http://deeplink.rechtspraak.nl/uitspraak?id=ECLI:NL:GHARL:2014:1559,uitspraak,De publicatie van de uitspraak staat gepland op 10-03-2014 om 11:21 uur,https://uitspraken.rechtspraak.nl/inziendocument?id=ECLI:NL:GHARL:2014:1559&showbutton=true&keyword=mensenhandel,0.0,['Hoger beroep'],10-03-2014,2014-03-10T11:21:37Z,gepubliceerd,['Strafrecht'],[],Medeplichtigheid aan poging mensenhandel ten aanzien van een minderjarige.,"Gerechtshof Arnhem-Leeuwarden, 24-02-2014, 21-004132-13",ECLI:NL:GHARL:2014:1559,24-02-2014,uitspraak,"[{'Vindplaats': 'Rechtspraak.nl', 'VindplaatsAnnotator': '', 'VindplaatsUrl': ''}]"
ECLI-NL-RBLIM-2013-CA0294,http://deeplink.rechtspraak.nl/uitspraak?id=ECLI:NL:RBLIM:2013:CA0294,uitspraak,De publicatie van de uitspraak staat gepland op 16-05-2013 om 13:08 uur,https://uitspraken.rechtspraak.nl/inziendocument?id=ECLI:NL:RBLIM:2013:CA0294&showbutton=true&keyword=mensenhandel,0.0,['Eerste aanleg - meervoudig'],16-05-2013,2013-05-16T13:08:06Z,gepubliceerd,['Strafrecht'],[],Vrijspraak medeplegen mensenhandel; veroordeling voor opzettelijk bezit verdovende middelen.,"Rechtbank Limburg, 07-05-2013, 03-700208-11",ECLI:NL:RBLIM:2013:CA0294,07-05-2013,uitspraak,"[{'Vindplaats': 'Rechtspraak.nl', 'VindplaatsAnnotator': '', 'VindplaatsUrl': ''}]"
ECLI-NL-RBLEE-2010-BN1234,http://deeplink.rechtspraak.nl/uitspraak?id=ECLI:NL:RBLEE:2010:BN1234,uitspraak,De publicatie van de uitspraak staat gepland op 15-07-2010 om 12:13 uur,https://uitspraken.rechtspraak.nl/inziendocument?id=ECLI:NL:RBLEE:2010:BN1234&showbutton=true&keyword=mensenhandel,0.0,['Eerste aanleg - meervoudig'],15-07-2010,2010-07-15T12:13:43Z,gepubliceerd,['Strafrecht'],[],"Mensenhandel, Roemeense bouwvakkers, schorsing voorlopige hechtenis, uitbuiting, valselijk opmaken","Rechtbank Leeuwarden, 13-07-2010, 17/880553-09 PROM",ECLI:NL:RBLEE:2010:BN1234,13-07-2010,uitspraak,"[{'Vindplaats': 'Rechtspraak.nl', 'VindplaatsAnnotator': '', 'VindplaatsUrl': ''}]"
ECLI-NL-RBZLY-2009-BK5349,http://deeplink.rechtspraak.nl/uitspraak?id=ECLI:NL:RBZLY:2009:BK5349,uitspraak,De publicatie van de uitspraak staat gepland op 04-12-2009 om 11:29 uur,https://uitspraken.rechtspraak.nl/inziendocument?id=ECLI:NL:RBZLY:2009:BK5349&showbutton=true&keyword=mensenhandel,0.0,['Eerste aanleg - meervoudig'],04-12-2009,2009-12-04T11:29:55Z,gepubliceerd,['Strafrecht'],"[{'RelatieOmschrijving': 'Hoger beroep: ', 'LinkTekst': 'ECLI:NL:GHARN:2012:BV8521', 'Postfix': ', (Gedeeltelijke) vernietiging en zelf afgedaan', 'WebAdres': 'https://uitspraken.rechtspraak.nl/inziendocument?id=ECLI:NL:GHARN:2012:BV8521&showbutton=true&keyword=mensenhandel'}]","mensenhandel, mensensmokkel, voodoo, Nigeria, dominee, ervaringsdeskundige, verhoorprotocol, ontvankelijkheid OM","Rechtbank Zwolle-Lelystad, 03-12-2009, 07/630201-06",ECLI:NL:RBZLY:2009:BK5349,03-12-2009,uitspraak,"[{'Vindplaats': 'Rechtspraak.nl', 'VindplaatsAnnotator': '', 'VindplaatsUrl': ''}]"
ECLI-NL-RBZLY-2009-BK5660,http://deeplink.rechtspraak.nl/uitspraak?id=ECLI:NL:RBZLY:2009:BK5660,uitspraak,De publicatie van de uitspraak staat gepland op 08-12-2009 om 10:41 uur,https://uitspraken.rechtspraak.nl/inziendocument?id=ECLI:NL:RBZLY:2009:BK5660&showbutton=true&keyword=mensenhandel,0.0,['Eerste aanleg - meervoudig'],08-12-2009,2009-12-08T10:41:21Z,gepubliceerd,['Strafrecht'],[],"mensenhandel, mensensmokkel, voodoo, Nigeria, dominee, ervaringsdeskundige, verhoorprotocol, ontvankelijkheid OM.","Rechtbank Zwolle-Lelystad, 03-12-2009, 07/976419-07",ECLI:NL:RBZLY:2009:BK5660,03-12-2009,uitspraak,"[{'Vindplaats': 'Rechtspraak.nl', 'VindplaatsAnnotator': '', 'VindplaatsUrl': ''}]"
ECLI-NL-RBZLY-2009-BK5398,http://deeplink.rechtspraak.nl/uitspraak?id=ECLI:NL:RBZLY:2009:BK5398,uitspraak,De publicatie van de uitspraak staat gepland op 04-12-2009 om 15:25 uur,https://uitspraken.rechtspraak.nl/inziendocument?id=ECLI:NL:RBZLY:2009:BK5398&showbutton=true&keyword=mensenhandel,0.0,['Eerste aanleg - meervoudig'],04-12-2009,2009-12-04T15:25:13Z,gepubliceerd,['Strafrecht'],[],"mensenhandel, mensensmokkel, voodoo, Nigeria, dominee, ervaringsdeskundige, verhoorprotocol, ontvankelijkheid OM.","Rechtbank Zwolle-Lelystad, 03-12-2009, 07/9764010-08",ECLI:NL:RBZLY:2009:BK5398,03-12-2009,uitspraak,"[{'Vindplaats': 'NJ 2010, 278', 'VindplaatsAnnotator': '', 'VindplaatsUrl': ''}, {'Vindplaats': 'NJFS 2010, 89', 'VindplaatsAnnotator': '', 'VindplaatsUrl': ''}, {'Vindplaats': 'Rechtspraak.nl', 'VindplaatsAnnotator': '', 'VindplaatsUrl': ''}]"
ECLI-NL-RBZLY-2009-BK5669,http://deeplink.rechtspraak.nl/uitspraak?id=ECLI:NL:RBZLY:2009:BK5669,uitspraak,De publicatie van de uitspraak staat gepland op 08-12-2009 om 11:16 uur,https://uitspraken.rechtspraak.nl/inziendocument?id=ECLI:NL:RBZLY:2009:BK5669&showbutton=true&keyword=mensenhandel,0.0,['Eerste aanleg - meervoudig'],08-12-2009,2009-12-08T11:16:06Z,gepubliceerd,['Strafrecht'],[],"mensenhandel, mensensmokkel, voodoo, Nigeria, dominee, ervaringsdeskundige, verhoorprotocol, ontvankelijkheid OM","Rechtbank Zwolle-Lelystad, 03-12-2009, 07/976415-07",ECLI:NL:RBZLY:2009:BK5669,03-12-2009,uitspraak,"[{'Vindplaats': 'Rechtspraak.nl', 'VindplaatsAnnotator': '', 'VindplaatsUrl': ''}]"
ECLI-NL-RBZLY-2009-BK5695,http://deeplink.rechtspraak.nl/uitspraak?id=ECLI:NL:RBZLY:2009:BK5695,uitspraak,De publicatie van de uitspraak staat gepland op 08-12-2009 om 12:04 uur,https://uitspraken.rechtspraak.nl/inziendocument?id=ECLI:NL:RBZLY:2009:BK5695&showbutton=true&keyword=mensenhandel,0.0,['Eerste aanleg - meervoudig'],08-12-2009,2009-12-08T12:04:59Z,gepubliceerd,['Strafrecht'],[],"mensenhandel, mensensmokkel, voodoo, Nigeria, dominee, ervaringsdeskundige, verhoorprotocol, ontvankelijkheid OM.","Rechtbank Zwolle-Lelystad, 03-12-2009, 07/976426-07",ECLI:NL:RBZLY:2009:BK5695,03-12-2009,uitspraak,"[{'Vindplaats': 'Rechtspraak.nl', 'VindplaatsAnnotator': '', 'VindplaatsUrl': ''}]"
ECLI-NL-RBZLY-2009-BK5377,http://deeplink.rechtspraak.nl/uitspraak?id=ECLI:NL:RBZLY:2009:BK5377,uitspraak,De publicatie van de uitspraak staat gepland op 04-12-2009 om 13:43 uur,https://uitspraken.rechtspraak.nl/inziendocument?id=ECLI:NL:RBZLY:2009:BK5377&showbutton=true&keyword=mensenhandel,0.0,['Eerste aanleg - meervoudig'],04-12-2009,2009-12-04T13:43:33Z,gepubliceerd,['Strafrecht'],[],"mensenhandel, mensensmokkel, voodoo, Nigeria, dominee, ervaringsdeskundige, verhoorprotocol, ontvankelijkheid OM.","Rechtbank Zwolle-Lelystad, 03-12-2009, 07/976412-07",ECLI:NL:RBZLY:2009:BK5377,03-12-2009,uitspraak,"[{'Vindplaats': 'NBSTRAF 2010/69', 'VindplaatsAnnotator': '', 'VindplaatsUrl': ''}, {'Vindplaats': 'NbSr 2010/69', 'VindplaatsAnnotator': '', 'VindplaatsUrl': ''}, {'Vindplaats': 'Rechtspraak.nl', 'VindplaatsAnnotator': '', 'VindplaatsUrl': ''}]"
ECLI-NL-RBLEE-2007-AZ5824,http://deeplink.rechtspraak.nl/uitspraak?id=ECLI:NL:RBLEE:2007:AZ5824,uitspraak,De publicatie van de uitspraak staat gepland op 10-01-2007 om 08:11 uur,https://uitspraken.rechtspraak.nl/inziendocument?id=ECLI:NL:RBLEE:2007:AZ5824&showbutton=true&keyword=mensenhandel,0.0,['Eerste aanleg - meervoudig'],10-01-2007,2007-01-10T08:11:11Z,gepubliceerd,['Strafrecht'],[],"Mensenhandel, rechtsmacht, verklaring getuige, ondervragingsrecht, prostitutie, voordeel trekken, overwicht","Rechtbank Leeuwarden, 02-01-2007, 17/781274-05 VEV",ECLI:NL:RBLEE:2007:AZ5824,02-01-2007,uitspraak,"[{'Vindplaats': 'Rechtspraak.nl', 'VindplaatsAnnotator': '', 'VindplaatsUrl': ''}]"
ECLI-NL-RBHAA-2006-BD2497,http://deeplink.rechtspraak.nl/uitspraak?id=ECLI:NL:RBHAA:2006:BD2497,uitspraak,De publicatie van de uitspraak staat gepland op 27-05-2008 om 12:50 uur,https://uitspraken.rechtspraak.nl/inziendocument?id=ECLI:NL:RBHAA:2006:BD2497&showbutton=true&keyword=mensenhandel,0.0,['Eerste aanleg - meervoudig'],27-05-2008,2008-05-27T12:50:21Z,gepubliceerd,['Strafrecht'],[],Medeplegen van opzettelijk iemand van de vrijheid beroven; mensenhandel.,"Rechtbank Haarlem, 25-07-2006, 15/040594-04",ECLI:NL:RBHAA:2006:BD2497,25-07-2006,uitspraak,"[{'Vindplaats': 'Rechtspraak.nl', 'VindplaatsAnnotator': '', 'VindplaatsUrl': ''}]"
ECLI-NL-GHARL-2016-8123,http://deeplink.rechtspraak.nl/uitspraak?id=ECLI:NL:GHARL:2016:8123,uitspraak,De publicatie van de uitspraak staat gepland op 13-10-2016 om 13:49 uur,https://uitspraken.rechtspraak.nl/inziendocument?id=ECLI:NL:GHARL:2016:8123&showbutton=true&keyword=mensenhandel,0.0,['Hoger beroep'],13-10-2016,2016-10-13T13:49:57Z,gepubliceerd,['Strafrecht'],[],"Veroordeling ter zake van mensenhandel (prostitutie) gepleegd jegens een minderjarige, Bulgaarse vrouw. Bewijsoverweging ten aanzien van betrouwbaarheid getuigen en overweging ten aanzien van medeplegen. Strafmotivering mensenhandel aan de hand van verschillende factoren. Oplegging van gevangenisstraf van 30 maanden, met aftrek voorarrest.","Gerechtshof Arnhem-Leeuwarden, 13-10-2016, 21-007516-14",ECLI:NL:GHARL:2016:8123,13-10-2016,uitspraak,"[{'Vindplaats': 'Rechtspraak.nl', 'VindplaatsAnnotator': '', 'VindplaatsUrl': ''}]"
ECLI-NL-GHARL-2016-8124,http://deeplink.rechtspraak.nl/uitspraak?id=ECLI:NL:GHARL:2016:8124,uitspraak,De publicatie van de uitspraak staat gepland op 13-10-2016 om 13:50 uur,https://uitspraken.rechtspraak.nl/inziendocument?id=ECLI:NL:GHARL:2016:8124&showbutton=true&keyword=mensenhandel,0.0,['Hoger beroep'],13-10-2016,2016-10-13T13:50:27Z,gepubliceerd,['Strafrecht'],[],"Veroordeling ter zake van mensenhandel (prostitutie) gepleegd jegens een minderjarige, Bulgaarse vrouw. Bewijsoverweging ten aanzien van betrouwbaarheid getuigen en overweging ten aanzien van medeplegen. Strafmotivering mensenhandel aan de hand van verschillende factoren. Oplegging van gevangenisstraf van 30 maanden, met aftrek voorarrest.","Gerechtshof Arnhem-Leeuwarden, 13-10-2016, 21-007517-14",ECLI:NL:GHARL:2016:8124,13-10-2016,uitspraak,"[{'Vindplaats': 'Rechtspraak.nl', 'VindplaatsAnnotator': '', 'VindplaatsUrl': ''}]"
ECLI-NL-RBOBR-2016-2726,http://deeplink.rechtspraak.nl/uitspraak?id=ECLI:NL:RBOBR:2016:2726,uitspraak,De publicatie van de uitspraak staat gepland op 31-05-2016 om 13:35 uur,https://uitspraken.rechtspraak.nl/inziendocument?id=ECLI:NL:RBOBR:2016:2726&showbutton=true&keyword=mensenhandel,0.0,['Eerste aanleg - meervoudig'],31-05-2016,2016-05-31T13:35:53Z,gepubliceerd,['Strafrecht'],[],"Mensenhandel, voorafgegaan, vergezeld of gevolgd van geweld en Mensenhandel, gepleegd door twee of meer verenigde personen, terwijl het feit wordt voorafgegaan, vergezeld of gevolgd van geweld. 
Gevangenisstraf voor de duur van 16 maanden met aftrek ex art. 27 W.v.Sr.","Rechtbank Oost-Brabant, 31-05-2016, 01/865088-15",ECLI:NL:RBOBR:2016:2726,31-05-2016,uitspraak,"[{'Vindplaats': 'Rechtspraak.nl', 'VindplaatsAnnotator': '', 'VindplaatsUrl': ''}]"
ECLI-NL-HR-2016-529,http://deeplink.rechtspraak.nl/uitspraak?id=ECLI:NL:HR:2016:529,uitspraak,De publicatie van de uitspraak staat gepland op 30-03-2016 om 08:34 uur,https://uitspraken.rechtspraak.nl/inziendocument?id=ECLI:NL:HR:2016:529&showbutton=true&keyword=mensenhandel,0.0,['Cassatie'],30-03-2016,2016-03-30T08:34:44Z,gepubliceerd,['Strafrecht'],"[{'RelatieOmschrijving': 'Conclusie: ', 'LinkTekst': 'ECLI:NL:PHR:2015:2590', 'Postfix': ', Contrair', 'WebAdres': 'https://uitspraken.rechtspraak.nl/inziendocument?id=ECLI:NL:PHR:2015:2590&showbutton=true&keyword=mensenhandel'}, {'RelatieOmschrijving': 'In cassatie op : ', 'LinkTekst': 'ECLI:NL:GHARL:2014:9417', 'Postfix': ', (Gedeeltelijke) vernietiging met terugwijzen', 'WebAdres': 'https://uitspraken.rechtspraak.nl/inziendocument?id=ECLI:NL:GHARL:2014:9417&showbutton=true&keyword=mensenhandel'}]",Slagende bewijsklacht mensenhandel. Art. 273f Sr. De HR merkt op dat de opvatting dat van mensenhandel slechts sprake kan zijn als de bewezenverklaarde gedragingen een schending van art. 4 EVRM opleveren geen steun vindt in het recht. Conclusie AG: anders.,"Hoge Raad, 29-03-2016, 14/06384",ECLI:NL:HR:2016:529,29-03-2016,uitspraak,"[{'Vindplaats': 'NJB 2016/769', 'VindplaatsAnnotator': '', 'VindplaatsUrl': ''}, {'Vindplaats': 'RvdW 2016/479', 'VindplaatsAnnotator': '', 'VindplaatsUrl': ''}, {'Vindplaats': 'SR-Updates.nl 2016-0177', 'VindplaatsAnnotator': '', 'VindplaatsUrl': ''}, {'Vindplaats': 'Rechtspraak.nl', 'VindplaatsAnnotator': '', 'VindplaatsUrl': ''}]"
ECLI-NL-PHR-2015-2590,http://deeplink.rechtspraak.nl/uitspraak?id=ECLI:NL:PHR:2015:2590,conclusie,De publicatie van de uitspraak staat gepland op 30-03-2016 om 08:33 uur,https://uitspraken.rechtspraak.nl/inziendocument?id=ECLI:NL:PHR:2015:2590&showbutton=true&keyword=mensenhandel,0.0,[],30-03-2016,2016-03-30T08:33:12Z,gepubliceerd,['Strafrecht'],"[{'RelatieOmschrijving': 'Arrest Hoge Raad: ', 'LinkTekst': 'ECLI:NL:HR:2016:529', 'Postfix': ', Contrair', 'WebAdres': 'https://uitspraken.rechtspraak.nl/inziendocument?id=ECLI:NL:HR:2016:529&showbutton=true&keyword=mensenhandel'}]",Slagende bewijsklacht mensenhandel. Art. 273f Sr. De HR merkt op dat de opvatting dat van mensenhandel slechts sprake kan zijn als de bewezenverklaarde gedragingen een schending van art. 4 EVRM opleveren geen steun vindt in het recht. Conclusie AG: anders.,"Parket bij de Hoge Raad, 13-10-2015, 14/06384",ECLI:NL:PHR:2015:2590,13-10-2015,conclusie,"[{'Vindplaats': 'Rechtspraak.nl', 'VindplaatsAnnotator': '', 'VindplaatsUrl': ''}]"
ECLI-NL-RBOVE-2013-2313,http://deeplink.rechtspraak.nl/uitspraak?id=ECLI:NL:RBOVE:2013:2313,uitspraak,De publicatie van de uitspraak staat gepland op 30-09-2013 om 16:34 uur,https://uitspraken.rechtspraak.nl/inziendocument?id=ECLI:NL:RBOVE:2013:2313&showbutton=true&keyword=mensenhandel,0.0,['Eerste aanleg - meervoudig'],30-09-2013,2013-09-30T16:34:52Z,gepubliceerd,['Strafrecht'],[],"Rechtbank Overijssel veroordeelt verdachte tot vier jaar cel wegens mensenhandel. Verdachte maakte zich schuldig aan mensenhandel, gepleegd jegens twee Hongaarse vrouwen. Mensenhandel, een vorm van moderne slavernij, is een ernstig strafbaar feit. Door het gebruik van dwangmiddelen heeft verdachte de persoonlijke vrijheid van zijn slachtoffers zo sterk ingeperkt dat zij niet in vrijheid konden beslissen of zij wel of niet in de prostitutie wilden (blijven) werken. Ook zijn de vrouwen financieel uitgebuit.","Rechtbank Overijssel, 17-09-2013, 08.963514-13 (P)",ECLI:NL:RBOVE:2013:2313,17-09-2013,uitspraak,"[{'Vindplaats': 'Rechtspraak.nl', 'VindplaatsAnnotator': '', 'VindplaatsUrl': ''}]"
ECLI-NL-RBAMS-2021-346,http://deeplink.rechtspraak.nl/uitspraak?id=ECLI:NL:RBAMS:2021:346,uitspraak,De publicatie van de uitspraak staat gepland op 08-02-2021 om 14:08 uur,https://uitspraken.rechtspraak.nl/inziendocument?id=ECLI:NL:RBAMS:2021:346&showbutton=true&keyword=mensenhandel,0.0,['Eerste aanleg - meervoudig'],08-02-2021,2021-02-08T14:08:50Z,gepubliceerd,['Strafrecht'],[],"mensenhandel, uitbuiting in de prostitutie met betrekking tot drie vrouwen","Rechtbank Amsterdam, 07-01-2021, 13/728083-18",ECLI:NL:RBAMS:2021:346,07-01-2021,uitspraak,"[{'Vindplaats': 'PS-Updates.nl 2021-0138', 'VindplaatsAnnotator': '', 'VindplaatsUrl': ''}, {'Vindplaats': 'Rechtspraak.nl', 'VindplaatsAnnotator': '', 'VindplaatsUrl': ''}]"
ECLI-NL-RBDHA-2020-12863,http://deeplink.rechtspraak.nl/uitspraak?id=ECLI:NL:RBDHA:2020:12863,uitspraak,De publicatie van de uitspraak staat gepland op 30-12-2020 om 09:00 uur,https://uitspraken.rechtspraak.nl/inziendocument?id=ECLI:NL:RBDHA:2020:12863&showbutton=true&keyword=mensenhandel,0.0,['Eerste aanleg - enkelvoudig'],30-12-2020,2020-12-30T09:00:05.645Z,gepubliceerd,['Bestuursrecht; Vreemdelingenrecht'],[],verblijfsvergunning naar aanleiding van aangifte mensenhandel afgewezen door sepot OM,"Rechtbank Den Haag, 16-12-2020, AWB - 20 _ 698",ECLI:NL:RBDHA:2020:12863,16-12-2020,uitspraak,"[{'Vindplaats': 'Rechtspraak.nl', 'VindplaatsAnnotator': '', 'VindplaatsUrl': ''}]"
ECLI-NL-RBAMS-2020-5979,http://deeplink.rechtspraak.nl/uitspraak?id=ECLI:NL:RBAMS:2020:5979,uitspraak,De publicatie van de uitspraak staat gepland op 09-12-2020 om 13:57 uur,https://uitspraken.rechtspraak.nl/inziendocument?id=ECLI:NL:RBAMS:2020:5979&showbutton=true&keyword=mensenhandel,0.0,"['Eerste aanleg - meervoudig', 'Op tegenspraak']",09-12-2020,2020-12-09T13:57:40Z,gepubliceerd,['Strafrecht'],[],Vrijspraak mensenhandel en ontucht met minderjarige. Bewezenverklaring voorhanden hebben vuurwapen.,"Rechtbank Amsterdam, 02-12-2020, 13-097978-20",ECLI:NL:RBAMS:2020:5979,02-12-2020,uitspraak,"[{'Vindplaats': 'Rechtspraak.nl', 'VindplaatsAnnotator': '', 'VindplaatsUrl': ''}]"
ECLI-NL-RBDHA-2020-10840,http://deeplink.rechtspraak.nl/uitspraak?id=ECLI:NL:RBDHA:2020:10840,uitspraak,De publicatie van de uitspraak staat gepland op 29-10-2020 om 10:48 uur,https://uitspraken.rechtspraak.nl/inziendocument?id=ECLI:NL:RBDHA:2020:10840&showbutton=true&keyword=mensenhandel,0.0,['Eerste aanleg - enkelvoudig'],29-10-2020,2020-10-29T10:48:40Z,gepubliceerd,['Bestuursrecht; Vreemdelingenrecht'],[],"Dublinverordening, Italie, kwetsbaar gezin, interstatelijk vertrouwensbeginsel, mensenhandel, interim measures, ongegrond.","Rechtbank Den Haag, 16-10-2020, NL19.21797 en NL19.21804",ECLI:NL:RBDHA:2020:10840,16-10-2020,uitspraak,"[{'Vindplaats': 'Rechtspraak.nl', 'VindplaatsAnnotator': '', 'VindplaatsUrl': ''}]"
ECLI-NL-RBDHA-2019-13014,http://deeplink.rechtspraak.nl/uitspraak?id=ECLI:NL:RBDHA:2019:13014,uitspraak,De publicatie van de uitspraak staat gepland op 12-12-2019 om 11:21 uur,https://uitspraken.rechtspraak.nl/inziendocument?id=ECLI:NL:RBDHA:2019:13014&showbutton=true&keyword=mensenhandel,0.0,"['Bodemzaak', 'Eerste aanleg - enkelvoudig']",12-12-2019,2019-12-12T11:21:44Z,gepubliceerd,['Bestuursrecht; Vreemdelingenrecht'],[],"Dublin, Italië, niet-registertolk, kwetsbaar persoon, aangifte mensenhandel, beroep ongegrond.","Rechtbank Den Haag, 29-11-2019, NL19.26277",ECLI:NL:RBDHA:2019:13014,29-11-2019,uitspraak,"[{'Vindplaats': 'Rechtspraak.nl', 'VindplaatsAnnotator': '', 'VindplaatsUrl': ''}]"
ECLI-NL-RBDHA-2019-9540,http://deeplink.rechtspraak.nl/uitspraak?id=ECLI:NL:RBDHA:2019:9540,uitspraak,De publicatie van de uitspraak staat gepland op 13-09-2019 om 16:47 uur,https://uitspraken.rechtspraak.nl/inziendocument?id=ECLI:NL:RBDHA:2019:9540&showbutton=true&keyword=mensenhandel,0.0,['Eerste aanleg - enkelvoudig'],13-09-2019,2019-09-13T16:47:37Z,gepubliceerd,['Bestuursrecht; Vreemdelingenrecht'],[],"Dublin Italie, interstatelijke vertrouwensbeginsel, aangifte mensenhandel, arrest Jawo. Beroep ongegrond.","Rechtbank Den Haag, 09-09-2019, NL19.19561",ECLI:NL:RBDHA:2019:9540,09-09-2019,uitspraak,"[{'Vindplaats': 'Rechtspraak.nl', 'VindplaatsAnnotator': '', 'VindplaatsUrl': ''}]"
ECLI-NL-RBDHA-2019-4664,http://deeplink.rechtspraak.nl/uitspraak?id=ECLI:NL:RBDHA:2019:4664,uitspraak,De publicatie van de uitspraak staat gepland op 10-05-2019 om 15:15 uur,https://uitspraken.rechtspraak.nl/inziendocument?id=ECLI:NL:RBDHA:2019:4664&showbutton=true&keyword=mensenhandel,0.0,"['Eerste aanleg - enkelvoudig', 'Voorlopige voorziening+bodemzaak']",10-05-2019,2019-05-10T15:15:53Z,gepubliceerd,['Bestuursrecht; Vreemdelingenrecht'],[],"Dublin-Italië, aangifte mensenhandel, minderjarig kind, circular letter, beroep ongegrond.","Rechtbank Den Haag, 24-04-2019, NL19.6638",ECLI:NL:RBDHA:2019:4664,24-04-2019,uitspraak,"[{'Vindplaats': 'Rechtspraak.nl', 'VindplaatsAnnotator': '', 'VindplaatsUrl': ''}]"
ECLI-NL-RBAMS-2019-2062,http://deeplink.rechtspraak.nl/uitspraak?id=ECLI:NL:RBAMS:2019:2062,uitspraak,De publicatie van de uitspraak staat gepland op 01-04-2019 om 08:44 uur,https://uitspraken.rechtspraak.nl/inziendocument?id=ECLI:NL:RBAMS:2019:2062&showbutton=true&keyword=mensenhandel,0.0,['Eerste aanleg - meervoudig'],01-04-2019,2019-04-01T08:44:14Z,gepubliceerd,['Strafrecht'],[],Mensenhandel.  Gedwongen prostitutie van twee slachtoffers waarvan één minderjarig was.,"Rechtbank Amsterdam, 22-02-2019, 13/728041-17",ECLI:NL:RBAMS:2019:2062,22-02-2019,uitspraak,"[{'Vindplaats': 'PS-Updates.nl 2019-0586', 'VindplaatsAnnotator': '', 'VindplaatsUrl': ''}, {'Vindplaats': 'Rechtspraak.nl', 'VindplaatsAnnotator': '', 'VindplaatsUrl': ''}]"
ECLI-NL-RBDHA-2018-9854,http://deeplink.rechtspraak.nl/uitspraak?id=ECLI:NL:RBDHA:2018:9854,uitspraak,De publicatie van de uitspraak staat gepland op 31-08-2018 om 09:00 uur,https://uitspraken.rechtspraak.nl/inziendocument?id=ECLI:NL:RBDHA:2018:9854&showbutton=true&keyword=mensenhandel,0.0,['Eerste aanleg - enkelvoudig'],31-08-2018,2018-08-31T09:00:08Z,gepubliceerd,['Bestuursrecht; Vreemdelingenrecht'],[],"Nigeria, mensenhandel. Geen aannemelijke verklaringen, summier en tegenstrijdig. beroep ongegrond.","Rechtbank Den Haag, 14-08-2018, AWB - 17 _ 11074",ECLI:NL:RBDHA:2018:9854,14-08-2018,uitspraak,"[{'Vindplaats': 'Rechtspraak.nl', 'VindplaatsAnnotator': '', 'VindplaatsUrl': ''}]"
ECLI-NL-RBAMS-2018-1636,http://deeplink.rechtspraak.nl/uitspraak?id=ECLI:NL:RBAMS:2018:1636,uitspraak,De publicatie van de uitspraak staat gepland op 22-03-2018 om 10:17 uur,https://uitspraken.rechtspraak.nl/inziendocument?id=ECLI:NL:RBAMS:2018:1636&showbutton=true&keyword=mensenhandel,0.0,['Eerste aanleg - meervoudig'],22-03-2018,2018-03-22T10:17:00Z,gepubliceerd,['Strafrecht'],[],"Mensenhandel, arbeidsuitbuiting. Tewerkstelling en huisvesting van vluchtelingen in een wasserij.","Rechtbank Amsterdam, 22-03-2018, 13/845232-16 (Promis)",ECLI:NL:RBAMS:2018:1636,22-03-2018,uitspraak,"[{'Vindplaats': 'Rechtspraak.nl', 'VindplaatsAnnotator': '', 'VindplaatsUrl': ''}]"
ECLI-NL-RBAMS-2018-1637,http://deeplink.rechtspraak.nl/uitspraak?id=ECLI:NL:RBAMS:2018:1637,uitspraak,De publicatie van de uitspraak staat gepland op 22-03-2018 om 11:17 uur,https://uitspraken.rechtspraak.nl/inziendocument?id=ECLI:NL:RBAMS:2018:1637&showbutton=true&keyword=mensenhandel,0.0,['Eerste aanleg - meervoudig'],22-03-2018,2018-03-22T11:17:30Z,gepubliceerd,['Strafrecht'],[],"Mensenhandel, arbeidsuitbuiting. Tewerkstelling en huisvesting van vluchtelingen in een wasserij.","Rechtbank Amsterdam, 22-03-2018, 13/845229-16",ECLI:NL:RBAMS:2018:1637,22-03-2018,uitspraak,"[{'Vindplaats': 'Rechtspraak.nl', 'VindplaatsAnnotator': '', 'VindplaatsUrl': ''}]"
ECLI-NL-RBAMS-2018-1638,http://deeplink.rechtspraak.nl/uitspraak?id=ECLI:NL:RBAMS:2018:1638,uitspraak,De publicatie van de uitspraak staat gepland op 22-03-2018 om 12:27 uur,https://uitspraken.rechtspraak.nl/inziendocument?id=ECLI:NL:RBAMS:2018:1638&showbutton=true&keyword=mensenhandel,0.0,['Eerste aanleg - meervoudig'],22-03-2018,2018-03-22T12:27:00Z,gepubliceerd,['Strafrecht'],[],"Mensenhandel, arbeidsuitbuiting. Tewerkstelling en huisvesting van vluchtelingen in een wasserij.","Rechtbank Amsterdam, 22-03-2018, 13/845230-16",ECLI:NL:RBAMS:2018:1638,22-03-2018,uitspraak,"[{'Vindplaats': 'Rechtspraak.nl', 'VindplaatsAnnotator': '', 'VindplaatsUrl': ''}]"
ECLI-NL-RBAMS-2018-1631,http://deeplink.rechtspraak.nl/uitspraak?id=ECLI:NL:RBAMS:2018:1631,uitspraak,De publicatie van de uitspraak staat gepland op 22-03-2018 om 10:16 uur,https://uitspraken.rechtspraak.nl/inziendocument?id=ECLI:NL:RBAMS:2018:1631&showbutton=true&keyword=mensenhandel,0.0,['Eerste aanleg - meervoudig'],22-03-2018,2018-03-22T10:16:30Z,gepubliceerd,['Strafrecht'],[],"Mensenhandel, arbeidsuitbuiting. Tewerkstelling en huisvesting van vluchtelingen in een wasserij.","Rechtbank Amsterdam, 22-03-2018, 13/845231-16 (Promis)",ECLI:NL:RBAMS:2018:1631,22-03-2018,uitspraak,"[{'Vindplaats': 'Rechtspraak.nl', 'VindplaatsAnnotator': '', 'VindplaatsUrl': ''}]"
ECLI-NL-RBDHA-2017-2732,http://deeplink.rechtspraak.nl/uitspraak?id=ECLI:NL:RBDHA:2017:2732,uitspraak,De publicatie van de uitspraak staat gepland op 23-03-2017 om 08:31 uur,https://uitspraken.rechtspraak.nl/inziendocument?id=ECLI:NL:RBDHA:2017:2732&showbutton=true&keyword=mensenhandel,0.0,"['Bodemzaak', 'Eerste aanleg - enkelvoudig']",23-03-2017,2017-03-23T08:31:03Z,gepubliceerd,['Bestuursrecht; Vreemdelingenrecht'],[],"- dublin
- duitsland
- onderzoek mensenhandel
- strafblad
- geen tekortkomingen
- geen bijzondere omstandigheden","Rechtbank Den Haag, 23-02-2017, nl17.610",ECLI:NL:RBDHA:2017:2732,23-02-2017,uitspraak,"[{'Vindplaats': 'Rechtspraak.nl', 'VindplaatsAnnotator': '', 'VindplaatsUrl': ''}]"
ECLI-NL-RBOVE-2016-1480,http://deeplink.rechtspraak.nl/uitspraak?id=ECLI:NL:RBOVE:2016:1480,uitspraak,De publicatie van de uitspraak staat gepland op 26-04-2016 om 14:30 uur,https://uitspraken.rechtspraak.nl/inziendocument?id=ECLI:NL:RBOVE:2016:1480&showbutton=true&keyword=mensenhandel,0.0,['Eerste aanleg - meervoudig'],26-04-2016,2016-04-26T14:30:28Z,gepubliceerd,['Strafrecht'],[],De rechtbank spreekt een 32-jarige man vrij van mensenhandel.,"Rechtbank Overijssel, 26-04-2016, 08.910038-15 (P)",ECLI:NL:RBOVE:2016:1480,26-04-2016,uitspraak,"[{'Vindplaats': 'Rechtspraak.nl', 'VindplaatsAnnotator': '', 'VindplaatsUrl': ''}]"
ECLI-NL-GHAMS-2016-1266,http://deeplink.rechtspraak.nl/uitspraak?id=ECLI:NL:GHAMS:2016:1266,uitspraak,De publicatie van de uitspraak staat gepland op 08-04-2016 om 15:32 uur,https://uitspraken.rechtspraak.nl/inziendocument?id=ECLI:NL:GHAMS:2016:1266&showbutton=true&keyword=mensenhandel,0.0,['Hoger beroep'],08-04-2016,2016-04-08T15:32:24Z,gepubliceerd,['Strafrecht'],"[{'RelatieOmschrijving': 'Cassatie: ', 'LinkTekst': 'ECLI:NL:HR:2019:1027', 'Postfix': ', Niet ontvankelijk', 'WebAdres': 'https://uitspraken.rechtspraak.nl/inziendocument?id=ECLI:NL:HR:2019:1027&showbutton=true&keyword=mensenhandel'}]",Medeplegen mensenhandel. De verdachte had een relatie met het slachtoffer.,"Gerechtshof Amsterdam, 31-03-2016, 23-002112-13",ECLI:NL:GHAMS:2016:1266,31-03-2016,uitspraak,"[{'Vindplaats': 'Rechtspraak.nl', 'VindplaatsAnnotator': '', 'VindplaatsUrl': ''}]"
ECLI-NL-GHAMS-2016-710,http://deeplink.rechtspraak.nl/uitspraak?id=ECLI:NL:GHAMS:2016:710,uitspraak,De publicatie van de uitspraak staat gepland op 23-03-2016 om 14:43 uur,https://uitspraken.rechtspraak.nl/inziendocument?id=ECLI:NL:GHAMS:2016:710&showbutton=true&keyword=mensenhandel,0.0,['Hoger beroep'],23-03-2016,2016-03-23T14:43:42Z,gepubliceerd,['Strafrecht'],"[{'RelatieOmschrijving': 'Cassatie: ', 'LinkTekst': 'ECLI:NL:HR:2017:2648', 'Postfix': ', (Gedeeltelijke) vernietiging en zelf afgedaan', 'WebAdres': 'https://uitspraken.rechtspraak.nl/inziendocument?id=ECLI:NL:HR:2017:2648&showbutton=true&keyword=mensenhandel'}]",Medeplichtigheid aan mensenhandel (in vereniging) en deelnemen aan criminele organisatie.,"Gerechtshof Amsterdam, 28-01-2016, 23001799-14",ECLI:NL:GHAMS:2016:710,28-01-2016,uitspraak,"[{'Vindplaats': 'Rechtspraak.nl', 'VindplaatsAnnotator': '', 'VindplaatsUrl': ''}]"
ECLI-NL-RBAMS-2015-1446,http://deeplink.rechtspraak.nl/uitspraak?id=ECLI:NL:RBAMS:2015:1446,uitspraak,De publicatie van de uitspraak staat gepland op 16-03-2015 om 14:52 uur,https://uitspraken.rechtspraak.nl/inziendocument?id=ECLI:NL:RBAMS:2015:1446&showbutton=true&keyword=mensenhandel,0.0,['Eerste aanleg - meervoudig'],16-03-2015,2015-03-16T14:52:25Z,gepubliceerd,['Strafrecht'],[],"Mensenhandel, Hongarije, rechtsmacht, Vidgen, betrouwbaarheid, gewoontewitwassen, ontslag van alle rechtsvervolging.","Rechtbank Amsterdam, 13-03-2015, 13/693016-11",ECLI:NL:RBAMS:2015:1446,13-03-2015,uitspraak,"[{'Vindplaats': 'Rechtspraak.nl', 'VindplaatsAnnotator': '', 'VindplaatsUrl': ''}]"
ECLI-NL-RBAMS-2015-1441,http://deeplink.rechtspraak.nl/uitspraak?id=ECLI:NL:RBAMS:2015:1441,uitspraak,De publicatie van de uitspraak staat gepland op 16-03-2015 om 14:48 uur,https://uitspraken.rechtspraak.nl/inziendocument?id=ECLI:NL:RBAMS:2015:1441&showbutton=true&keyword=mensenhandel,0.0,"['Eerste aanleg - meervoudig', 'Op tegenspraak']",16-03-2015,2015-03-16T14:48:55Z,gepubliceerd,['Strafrecht'],[],"Mensenhandel, Hongarije, rechtsmacht, Vidgen, betrouwbaarheid, gewoontewitwassen, ontslag van alle rechtsvervolging.","Rechtbank Amsterdam, 13-03-2015, 13/730001-13 (Promis)",ECLI:NL:RBAMS:2015:1441,13-03-2015,uitspraak,"[{'Vindplaats': 'Rechtspraak.nl', 'VindplaatsAnnotator': '', 'VindplaatsUrl': ''}]"
ECLI-NL-RBAMS-2015-1442,http://deeplink.rechtspraak.nl/uitspraak?id=ECLI:NL:RBAMS:2015:1442,uitspraak,De publicatie van de uitspraak staat gepland op 16-03-2015 om 14:49 uur,https://uitspraken.rechtspraak.nl/inziendocument?id=ECLI:NL:RBAMS:2015:1442&showbutton=true&keyword=mensenhandel,0.0,['Eerste aanleg - meervoudig'],16-03-2015,2015-03-16T14:49:25Z,gepubliceerd,['Strafrecht'],[],"Mensenhandel, Hongarije, rechtsmacht, Vidgen, betrouwbaarheid, gewoontewitwassen, ontslag van alle rechtsvervolging.","Rechtbank Amsterdam, 13-03-2015, 13/708049-11",ECLI:NL:RBAMS:2015:1442,13-03-2015,uitspraak,"[{'Vindplaats': 'Rechtspraak.nl', 'VindplaatsAnnotator': '', 'VindplaatsUrl': ''}]"
ECLI-NL-RBAMS-2015-1443,http://deeplink.rechtspraak.nl/uitspraak?id=ECLI:NL:RBAMS:2015:1443,uitspraak,De publicatie van de uitspraak staat gepland op 16-03-2015 om 14:49 uur,https://uitspraken.rechtspraak.nl/inziendocument?id=ECLI:NL:RBAMS:2015:1443&showbutton=true&keyword=mensenhandel,0.0,"['Eerste aanleg - meervoudig', 'Op tegenspraak']",16-03-2015,2015-03-16T14:49:25Z,gepubliceerd,['Strafrecht'],[],"Mensenhandel, Hongarije, rechtsmacht, Vidgen, betrouwbaarheid, gewoontewitwassen, ontslag van alle rechtsvervolging.","Rechtbank Amsterdam, 13-03-2015, 13/730000-13 (Promis)",ECLI:NL:RBAMS:2015:1443,13-03-2015,uitspraak,"[{'Vindplaats': 'Rechtspraak.nl', 'VindplaatsAnnotator': '', 'VindplaatsUrl': ''}]"
ECLI-NL-RBAMS-2015-1445,http://deeplink.rechtspraak.nl/uitspraak?id=ECLI:NL:RBAMS:2015:1445,uitspraak,De publicatie van de uitspraak staat gepland op 16-03-2015 om 14:49 uur,https://uitspraken.rechtspraak.nl/inziendocument?id=ECLI:NL:RBAMS:2015:1445&showbutton=true&keyword=mensenhandel,0.0,"['Eerste aanleg - meervoudig', 'Op tegenspraak']",16-03-2015,2015-03-16T14:49:25Z,gepubliceerd,['Strafrecht'],[],"Mensenhandel, Hongarije, rechtsmacht, Vidgen, betrouwbaarheid, gewoontewitwassen, ontslag van alle rechtsvervolging.","Rechtbank Amsterdam, 13-03-2015, 13/730002-13 (Promis)",ECLI:NL:RBAMS:2015:1445,13-03-2015,uitspraak,"[{'Vindplaats': 'Rechtspraak.nl', 'VindplaatsAnnotator': '', 'VindplaatsUrl': ''}]"
ECLI-NL-RBAMS-2015-1449,http://deeplink.rechtspraak.nl/uitspraak?id=ECLI:NL:RBAMS:2015:1449,uitspraak,De publicatie van de uitspraak staat gepland op 16-03-2015 om 14:56 uur,https://uitspraken.rechtspraak.nl/inziendocument?id=ECLI:NL:RBAMS:2015:1449&showbutton=true&keyword=mensenhandel,0.0,['Eerste aanleg - meervoudig'],16-03-2015,2015-03-16T14:56:55Z,gepubliceerd,['Strafrecht'],[],"Mensenhandel, Hongarije, rechtsmacht, Vidgen, betrouwbaarheid, gewoontewitwassen, ontslag van alle rechtsvervolging.","Rechtbank Amsterdam, 13-03-2015, 13/708050-11",ECLI:NL:RBAMS:2015:1449,13-03-2015,uitspraak,"[{'Vindplaats': 'Rechtspraak.nl', 'VindplaatsAnnotator': '', 'VindplaatsUrl': ''}]"
ECLI-NL-RBLIM-2014-10626,http://deeplink.rechtspraak.nl/uitspraak?id=ECLI:NL:RBLIM:2014:10626,uitspraak,De publicatie van de uitspraak staat gepland op 09-12-2014 om 16:04 uur,https://uitspraken.rechtspraak.nl/inziendocument?id=ECLI:NL:RBLIM:2014:10626&showbutton=true&keyword=mensenhandel,0.0,['Eerste aanleg - meervoudig'],09-12-2014,2014-12-09T16:04:20Z,gepubliceerd,['Strafrecht'],[],Mensenhandel jegens een persoon beneden de zestien jaren. Tijdsverloop. Strafmaat.,"Rechtbank Limburg, 09-12-2014, 03/702586-12",ECLI:NL:RBLIM:2014:10626,09-12-2014,uitspraak,"[{'Vindplaats': 'Rechtspraak.nl', 'VindplaatsAnnotator': '', 'VindplaatsUrl': ''}]"
ECLI-NL-GHARL-2013-8921,http://deeplink.rechtspraak.nl/uitspraak?id=ECLI:NL:GHARL:2013:8921,uitspraak,De publicatie van de uitspraak staat gepland op 25-11-2013 om 13:36 uur,https://uitspraken.rechtspraak.nl/inziendocument?id=ECLI:NL:GHARL:2013:8921&showbutton=true&keyword=mensenhandel,0.0,['Hoger beroep'],25-11-2013,2013-11-25T13:36:50Z,gepubliceerd,['Strafrecht'],"[{'RelatieOmschrijving': 'Eerste aanleg: ', 'LinkTekst': 'ECLI:NL:RBALM:2011:188', 'Postfix': ', (Gedeeltelijke) vernietiging en zelf afgedaan', 'WebAdres': 'https://uitspraken.rechtspraak.nl/inziendocument?id=ECLI:NL:RBALM:2011:188&showbutton=true&keyword=mensenhandel'}]",Uitspraak Sneep 2. Vrijspraak mensenhandel en deelname aan criminele organisatie.,"Gerechtshof Arnhem-Leeuwarden, 22-11-2013, 21-000865-11",ECLI:NL:GHARL:2013:8921,22-11-2013,uitspraak,"[{'Vindplaats': 'Rechtspraak.nl', 'VindplaatsAnnotator': '', 'VindplaatsUrl': ''}]"
ECLI-NL-RBZWB-2013-7375,http://deeplink.rechtspraak.nl/uitspraak?id=ECLI:NL:RBZWB:2013:7375,uitspraak,De publicatie van de uitspraak staat gepland op 10-10-2013 om 13:35 uur,https://uitspraken.rechtspraak.nl/inziendocument?id=ECLI:NL:RBZWB:2013:7375&showbutton=true&keyword=mensenhandel,0.0,['Eerste aanleg - meervoudig'],10-10-2013,2013-10-10T13:35:57Z,gepubliceerd,['Strafrecht'],[],Veroordeling mensenhandel; bewustheid dwang bij slachtoffer niet vereist; vrijspraak verkrachting,"Rechtbank Zeeland-West-Brabant, 10-10-2013, STR-13_705146",ECLI:NL:RBZWB:2013:7375,10-10-2013,uitspraak,"[{'Vindplaats': 'Rechtspraak.nl', 'VindplaatsAnnotator': '', 'VindplaatsUrl': ''}]"
ECLI-NL-GHARL-2013-7269,http://deeplink.rechtspraak.nl/uitspraak?id=ECLI:NL:GHARL:2013:7269,uitspraak,De publicatie van de uitspraak staat gepland op 27-09-2013 om 14:42 uur,https://uitspraken.rechtspraak.nl/inziendocument?id=ECLI:NL:GHARL:2013:7269&showbutton=true&keyword=mensenhandel,0.0,['Hoger beroep'],27-09-2013,2013-09-27T14:42:52Z,gepubliceerd,['Strafrecht'],[],Vrijspraak ter zake van mensenhandel. Bewezenverklaring ter zake van mishandelingen.,"Gerechtshof Arnhem-Leeuwarden, 27-09-2013, 21-003804-12",ECLI:NL:GHARL:2013:7269,27-09-2013,uitspraak,"[{'Vindplaats': 'Rechtspraak.nl', 'VindplaatsAnnotator': '', 'VindplaatsUrl': ''}]"
ECLI-NL-RBUTR-2011-BV7905,http://deeplink.rechtspraak.nl/uitspraak?id=ECLI:NL:RBUTR:2011:BV7905,uitspraak,De publicatie van de uitspraak staat gepland op 06-03-2012 om 11:55 uur,https://uitspraken.rechtspraak.nl/inziendocument?id=ECLI:NL:RBUTR:2011:BV7905&showbutton=true&keyword=mensenhandel,0.0,['Eerste aanleg - meervoudig'],06-03-2012,2012-03-06T11:55:04Z,gepubliceerd,['Strafrecht'],[],"Mensenhandel, gepleegd door twee of meer verenigde personen, meermalen gepleegd","Rechtbank Utrecht, 09-06-2011, 16/804802-10 [P]",ECLI:NL:RBUTR:2011:BV7905,09-06-2011,uitspraak,"[{'Vindplaats': 'Rechtspraak.nl', 'VindplaatsAnnotator': '', 'VindplaatsUrl': ''}]"
ECLI-NL-RBUTR-2011-BV7908,http://deeplink.rechtspraak.nl/uitspraak?id=ECLI:NL:RBUTR:2011:BV7908,uitspraak,De publicatie van de uitspraak staat gepland op 06-03-2012 om 11:58 uur,https://uitspraken.rechtspraak.nl/inziendocument?id=ECLI:NL:RBUTR:2011:BV7908&showbutton=true&keyword=mensenhandel,0.0,['Eerste aanleg - meervoudig'],06-03-2012,2012-03-06T11:58:55Z,gepubliceerd,['Strafrecht'],[],"Mensenhandel, gepleegd door twee of meer verenigde personen, meermalen gepleegd.","Rechtbank Utrecht, 09-06-2011, 16/804805-10 [P]",ECLI:NL:RBUTR:2011:BV7908,09-06-2011,uitspraak,"[{'Vindplaats': 'Rechtspraak.nl', 'VindplaatsAnnotator': '', 'VindplaatsUrl': ''}]"
ECLI-NL-RBDHA-2020-13796,http://deeplink.rechtspraak.nl/uitspraak?id=ECLI:NL:RBDHA:2020:13796,uitspraak,De publicatie van de uitspraak staat gepland op 07-01-2021 om 14:06 uur,https://uitspraken.rechtspraak.nl/inziendocument?id=ECLI:NL:RBDHA:2020:13796&showbutton=true&keyword=mensenhandel,0.0,['Voorlopige voorziening+bodemzaak'],07-01-2021,2021-01-07T14:06:17.587Z,gepubliceerd,['Bestuursrecht'],[],Eisers stellen in Nederland slachtoffer te zijn geweest van mensenhandel. Eisers hebben geen aangifte gedaan van de gestelde mensenhandel en zij hebben niet aannemelijk gemaakt dat ze geen aangifte kunnen of willen doen. Verweerder heeft de aanvraag terecht afgewezen. Het beroep is ongegrond.,"Rechtbank Den Haag, 14-12-2020, AWB 20/3487 en 19/9721",ECLI:NL:RBDHA:2020:13796,14-12-2020,uitspraak,"[{'Vindplaats': 'Rechtspraak.nl', 'VindplaatsAnnotator': '', 'VindplaatsUrl': ''}]"
ECLI-NL-RBROT-2019-5097,http://deeplink.rechtspraak.nl/uitspraak?id=ECLI:NL:RBROT:2019:5097,uitspraak,De publicatie van de uitspraak staat gepland op 27-06-2019 om 11:00 uur,https://uitspraken.rechtspraak.nl/inziendocument?id=ECLI:NL:RBROT:2019:5097&showbutton=true&keyword=mensenhandel,0.0,['Eerste aanleg - meervoudig'],27-06-2019,2019-06-27T11:00:13Z,gepubliceerd,['Strafrecht'],[],"Gedurende korte periode van twee weken medeplegen van mensenhandel ten aanzien van Roemeense prostituees. Mensenhandel is een zeer vergaande manier van uitbuiting, waarbij de lichamelijke en geestelijke integriteit van de slachtoffers geheel ondergeschikt wordt gemaakt aan het geldelijk gewin van de daders.","Rechtbank Rotterdam, 27-06-2019, 10/750244-17",ECLI:NL:RBROT:2019:5097,27-06-2019,uitspraak,"[{'Vindplaats': 'Rechtspraak.nl', 'VindplaatsAnnotator': '', 'VindplaatsUrl': ''}]"
ECLI-NL-RBLIM-2015-9904,http://deeplink.rechtspraak.nl/uitspraak?id=ECLI:NL:RBLIM:2015:9904,uitspraak,De publicatie van de uitspraak staat gepland op 27-11-2015 om 14:30 uur,https://uitspraken.rechtspraak.nl/inziendocument?id=ECLI:NL:RBLIM:2015:9904&showbutton=true&keyword=mensenhandel,0.0,['Eerste aanleg - meervoudig'],27-11-2015,2015-11-27T14:30:18Z,gepubliceerd,['Strafrecht'],[],"De rechtbank heeft verdachte, die in Nederland optrad als chauffeur voor meerderjarige, uit Hongarije afkomstige prostituees, vrijgesproken van mensenhandel. Verdachte heeft geen bijdrage geleverd aan de beknotting van de vrijheid van de prostituees, met als gevolg dat niet van mensenhandel kan worden gesproken.","Rechtbank Limburg, 27-11-2015, 03/721319-13",ECLI:NL:RBLIM:2015:9904,27-11-2015,uitspraak,"[{'Vindplaats': 'Rechtspraak.nl', 'VindplaatsAnnotator': '', 'VindplaatsUrl': ''}]"
ECLI-NL-RBAMS-2013-7810,http://deeplink.rechtspraak.nl/uitspraak?id=ECLI:NL:RBAMS:2013:7810,uitspraak,De publicatie van de uitspraak staat gepland op 02-12-2013 om 11:05 uur,https://uitspraken.rechtspraak.nl/inziendocument?id=ECLI:NL:RBAMS:2013:7810&showbutton=true&keyword=mensenhandel,0.0,['Eerste aanleg - meervoudig'],02-12-2013,2013-12-02T11:05:19Z,gepubliceerd,['Strafrecht'],[],Vrijspraak mensenhandel. De bemoeienissen van de verdachten met het werk van hun vrouw/partner ertoe hebben geleid dat deze vrouw/partner niet in vrijheid de keuze heeft gemaakt die werkzaamheden voort te zetten. Een prostituee enkel aanmoedigen levert nog geen strafbare mensenhandel op.,"Rechtbank Amsterdam, 11-11-2013, 13/708007-12 (Promis)",ECLI:NL:RBAMS:2013:7810,11-11-2013,uitspraak,"[{'Vindplaats': 'Rechtspraak.nl', 'VindplaatsAnnotator': '', 'VindplaatsUrl': ''}]"
ECLI-NL-RBAMS-2013-7811,http://deeplink.rechtspraak.nl/uitspraak?id=ECLI:NL:RBAMS:2013:7811,uitspraak,De publicatie van de uitspraak staat gepland op 02-12-2013 om 11:15 uur,https://uitspraken.rechtspraak.nl/inziendocument?id=ECLI:NL:RBAMS:2013:7811&showbutton=true&keyword=mensenhandel,0.0,['Eerste aanleg - meervoudig'],02-12-2013,2013-12-02T11:15:19Z,gepubliceerd,['Strafrecht'],[],Vrijspraak mensenhandel. De bemoeienissen van de verdachten met het werk van hun vrouw/partner ertoe hebben geleid dat deze vrouw/partner niet in vrijheid de keuze heeft gemaakt die werkzaamheden voort te zetten. Een prostituee enkel aanmoedigen levert nog geen strafbare mensenhandel op.,"Rechtbank Amsterdam, 11-11-2013, 13/708005-12 (Promis)",ECLI:NL:RBAMS:2013:7811,11-11-2013,uitspraak,"[{'Vindplaats': 'Rechtspraak.nl', 'VindplaatsAnnotator': '', 'VindplaatsUrl': ''}]"
ECLI-NL-RBAMS-2013-7813,http://deeplink.rechtspraak.nl/uitspraak?id=ECLI:NL:RBAMS:2013:7813,uitspraak,De publicatie van de uitspraak staat gepland op 02-12-2013 om 11:51 uur,https://uitspraken.rechtspraak.nl/inziendocument?id=ECLI:NL:RBAMS:2013:7813&showbutton=true&keyword=mensenhandel,0.0,"['Eerste aanleg - meervoudig', 'Op tegenspraak']",02-12-2013,2013-12-02T11:51:49Z,gepubliceerd,['Strafrecht'],[],Vrijspraak mensenhandel. De bemoeienissen van de verdachten met het werk van hun vrouw/partner ertoe hebben geleid dat deze vrouw/partner niet in vrijheid de keuze heeft gemaakt die werkzaamheden voort te zetten. Een prostituee enkel aanmoedigen levert nog geen strafbare mensenhandel op.,"Rechtbank Amsterdam, 11-11-2013, 13/708032-12 (Promis)",ECLI:NL:RBAMS:2013:7813,11-11-2013,uitspraak,"[{'Vindplaats': 'Rechtspraak.nl', 'VindplaatsAnnotator': '', 'VindplaatsUrl': ''}]"
ECLI-NL-RBSHE-2010-BL5308,http://deeplink.rechtspraak.nl/uitspraak?id=ECLI:NL:RBSHE:2010:BL5308,uitspraak,De publicatie van de uitspraak staat gepland op 25-02-2010 om 13:36 uur,https://uitspraken.rechtspraak.nl/inziendocument?id=ECLI:NL:RBSHE:2010:BL5308&showbutton=true&keyword=mensenhandel,0.0,['Eerste aanleg - meervoudig'],25-02-2010,2010-02-25T13:36:22Z,gepubliceerd,['Strafrecht'],[],"De rechtbank heeft verdachte veroordeeld voor mensenhandel, meermalen gepleegd en daarvoor een deels voorwaardelijke gevangenisstraf en een werkstraf opgelegd. De rechtbank heeft daarbij met name gelet op het feit dat hier sprake is van een van de minst ernstige vormen van mensenhandel.","Rechtbank 's-Hertogenbosch, 19-02-2010, 01/839165-08",ECLI:NL:RBSHE:2010:BL5308,19-02-2010,uitspraak,"[{'Vindplaats': 'Rechtspraak.nl', 'VindplaatsAnnotator': '', 'VindplaatsUrl': ''}]"
ECLI-NL-RBSHE-2010-BL5400,http://deeplink.rechtspraak.nl/uitspraak?id=ECLI:NL:RBSHE:2010:BL5400,uitspraak,De publicatie van de uitspraak staat gepland op 25-02-2010 om 13:32 uur,https://uitspraken.rechtspraak.nl/inziendocument?id=ECLI:NL:RBSHE:2010:BL5400&showbutton=true&keyword=mensenhandel,0.0,['Eerste aanleg - meervoudig'],25-02-2010,2010-02-25T13:32:36Z,gepubliceerd,['Strafrecht'],[],"Vrijspraak van de primair tenlastegelegde mensenhandel, omdat de rechtbank met name niet bewezen acht dat er enige vorm van dwang of geweld heeft plaatsgevonden.
Voor het subsidiair tenlastegelegde (poging tot mensenhandel) heeft de rechtbank een deels voorwaardelijke gevangenisstraf en een werkstraf opgelegd.","Rechtbank 's-Hertogenbosch, 19-02-2010, 01/839162-08",ECLI:NL:RBSHE:2010:BL5400,19-02-2010,uitspraak,"[{'Vindplaats': 'Rechtspraak.nl', 'VindplaatsAnnotator': '', 'VindplaatsUrl': ''}]"
ECLI-NL-GHSHE-2016-1256,http://deeplink.rechtspraak.nl/uitspraak?id=ECLI:NL:GHSHE:2016:1256,uitspraak,De publicatie van de uitspraak staat gepland op 05-04-2016 om 11:03 uur,https://uitspraken.rechtspraak.nl/inziendocument?id=ECLI:NL:GHSHE:2016:1256&showbutton=true&keyword=mensenhandel,0.0,['Hoger beroep'],05-04-2016,2016-04-05T11:03:51Z,gepubliceerd,['Strafrecht'],"[{'RelatieOmschrijving': 'Eerste aanleg: ', 'LinkTekst': 'ECLI:NL:RBOBR:2013:6667', 'Postfix': None, 'WebAdres': 'https://uitspraken.rechtspraak.nl/inziendocument?id=ECLI:NL:RBOBR:2013:6667&showbutton=true&keyword=mensenhandel'}]","Vrijspraak mensenhandel (art. 273f Sr.). Verdachte heeft wel enige betrokkenheid gehad bij het zich laten prostitueren van het slachtoffer, maar die betrokkenheid is van onvoldoende gewicht voor een bewezenverklaring van het (mede)plegen van mensenhandel. Verdachte heeft de door haar mededaders begane mensenhandel bevorderd en/of vergemakkelijkt, maar die vorm van daderschap - medeplichtigheid - is niet ten laste gelegd. Het hof veroordeelt verdachte voor het medeplegen van het opzettelijk aanwezig hebben van hennep tot een gevangenisstraf van 4 maanden.","Gerechtshof 's-Hertogenbosch, 05-04-2016, 20-003915-13",ECLI:NL:GHSHE:2016:1256,05-04-2016,uitspraak,"[{'Vindplaats': 'Rechtspraak.nl', 'VindplaatsAnnotator': '', 'VindplaatsUrl': ''}]"
ECLI-NL-RBGEL-2020-7009,http://deeplink.rechtspraak.nl/uitspraak?id=ECLI:NL:RBGEL:2020:7009,uitspraak,De publicatie van de uitspraak staat gepland op 08-01-2021 om 11:10 uur,https://uitspraken.rechtspraak.nl/inziendocument?id=ECLI:NL:RBGEL:2020:7009&showbutton=true&keyword=mensenhandel,0.0,['Eerste aanleg - meervoudig'],08-01-2021,2021-01-08T11:10:35Z,gepubliceerd,['Strafrecht'],[],Vrijspraak mensenhandel en diefstal en/of verduistering van de militaire goederen,"Rechtbank Gelderland, 14-12-2020, 05-760000-20",ECLI:NL:RBGEL:2020:7009,14-12-2020,uitspraak,"[{'Vindplaats': 'Rechtspraak.nl', 'VindplaatsAnnotator': '', 'VindplaatsUrl': ''}]"
ECLI-NL-RBROT-2019-5093,http://deeplink.rechtspraak.nl/uitspraak?id=ECLI:NL:RBROT:2019:5093,uitspraak,De publicatie van de uitspraak staat gepland op 27-06-2019 om 11:26 uur,https://uitspraken.rechtspraak.nl/inziendocument?id=ECLI:NL:RBROT:2019:5093&showbutton=true&keyword=mensenhandel,0.0,['Eerste aanleg - meervoudig'],27-06-2019,2019-06-27T11:26:08Z,gepubliceerd,['Strafrecht'],[],Verwerping verweer niet-ontvankelijkheid OM wegens willekeur. Vrijspraak medeplegen/medeplichtigheid mensenhandel.,"Rechtbank Rotterdam, 27-06-2019, 10/751009-18",ECLI:NL:RBROT:2019:5093,27-06-2019,uitspraak,"[{'Vindplaats': 'Rechtspraak.nl', 'VindplaatsAnnotator': '', 'VindplaatsUrl': ''}]"
ECLI-NL-RBZWB-2019-2071,http://deeplink.rechtspraak.nl/uitspraak?id=ECLI:NL:RBZWB:2019:2071,uitspraak,De publicatie van de uitspraak staat gepland op 09-05-2019 om 14:12 uur,https://uitspraken.rechtspraak.nl/inziendocument?id=ECLI:NL:RBZWB:2019:2071&showbutton=true&keyword=mensenhandel,0.0,['Op tegenspraak'],09-05-2019,2019-05-09T14:12:35Z,gepubliceerd,['Strafrecht'],[],"gevangenisstraf, voorhanden hebben vervalst identiteitsbewijs, vrijspraak mensenhandel en deelname criminele organisatie","Rechtbank Zeeland-West-Brabant, 09-05-2019, 02-700167-18",ECLI:NL:RBZWB:2019:2071,09-05-2019,uitspraak,"[{'Vindplaats': 'Rechtspraak.nl', 'VindplaatsAnnotator': '', 'VindplaatsUrl': ''}]"
ECLI-NL-GHAMS-2018-3645,http://deeplink.rechtspraak.nl/uitspraak?id=ECLI:NL:GHAMS:2018:3645,uitspraak,De publicatie van de uitspraak staat gepland op 11-10-2018 om 14:24 uur,https://uitspraken.rechtspraak.nl/inziendocument?id=ECLI:NL:GHAMS:2018:3645&showbutton=true&keyword=mensenhandel,0.0,"['Hoger beroep', 'Op tegenspraak']",11-10-2018,2018-10-11T14:24:34Z,gepubliceerd,['Strafrecht'],[],Mega 13Bandama. Vrijspraak mensenhandel en (gewoonte)witwassen. Onvoldoende (steun)bewijs.,"Gerechtshof Amsterdam, 28-09-2018, 23-005295-15",ECLI:NL:GHAMS:2018:3645,28-09-2018,uitspraak,"[{'Vindplaats': 'Rechtspraak.nl', 'VindplaatsAnnotator': '', 'VindplaatsUrl': ''}]"
ECLI-NL-GHAMS-2016-3143,http://deeplink.rechtspraak.nl/uitspraak?id=ECLI:NL:GHAMS:2016:3143,uitspraak,De publicatie van de uitspraak staat gepland op 03-08-2016 om 12:12 uur,https://uitspraken.rechtspraak.nl/inziendocument?id=ECLI:NL:GHAMS:2016:3143&showbutton=true&keyword=mensenhandel,0.0,['Hoger beroep'],03-08-2016,2016-08-03T12:12:03Z,gepubliceerd,['Strafrecht'],"[{'RelatieOmschrijving': 'Cassatie: ', 'LinkTekst': 'ECLI:NL:HR:2018:1945', 'Postfix': ', Bekrachtiging/bevestiging', 'WebAdres': 'https://uitspraken.rechtspraak.nl/inziendocument?id=ECLI:NL:HR:2018:1945&showbutton=true&keyword=mensenhandel'}]","Geen mensenhandel Chinese kok, want geen (oogmerk van) uitbuiting, wel diefstal.","Gerechtshof Amsterdam, 29-07-2016, 23-001485-13",ECLI:NL:GHAMS:2016:3143,29-07-2016,uitspraak,"[{'Vindplaats': 'Rechtspraak.nl', 'VindplaatsAnnotator': '', 'VindplaatsUrl': ''}]"
ECLI-NL-HR-2016-514,http://deeplink.rechtspraak.nl/uitspraak?id=ECLI:NL:HR:2016:514,uitspraak,De publicatie van de uitspraak staat gepland op 29-03-2016 om 14:46 uur,https://uitspraken.rechtspraak.nl/inziendocument?id=ECLI:NL:HR:2016:514&showbutton=true&keyword=mensenhandel,0.0,"['Artikel 81 RO-zaken', 'Cassatie']",29-03-2016,2016-03-29T14:46:42Z,gepubliceerd,['Strafrecht'],"[{'RelatieOmschrijving': 'Conclusie: ', 'LinkTekst': 'ECLI:NL:PHR:2016:148', 'Postfix': ', Gevolgd', 'WebAdres': 'https://uitspraken.rechtspraak.nl/inziendocument?id=ECLI:NL:PHR:2016:148&showbutton=true&keyword=mensenhandel'}, {'RelatieOmschrijving': 'In cassatie op : ', 'LinkTekst': 'ECLI:NL:GHDHA:2014:3960', 'Postfix': ', Bekrachtiging/bevestiging', 'WebAdres': 'https://uitspraken.rechtspraak.nl/inziendocument?id=ECLI:NL:GHDHA:2014:3960&showbutton=true&keyword=mensenhandel'}]",HR: art. 81.1 RO. Bewijsklachten mensenhandel. Art. 273f Sr.,"Hoge Raad, 29-03-2016, 14/06330",ECLI:NL:HR:2016:514,29-03-2016,uitspraak,"[{'Vindplaats': 'RvdW 2016/477', 'VindplaatsAnnotator': '', 'VindplaatsUrl': ''}, {'Vindplaats': 'Rechtspraak.nl', 'VindplaatsAnnotator': '', 'VindplaatsUrl': ''}]"
ECLI-NL-HR-2016-528,http://deeplink.rechtspraak.nl/uitspraak?id=ECLI:NL:HR:2016:528,uitspraak,De publicatie van de uitspraak staat gepland op 30-03-2016 om 08:04 uur,https://uitspraken.rechtspraak.nl/inziendocument?id=ECLI:NL:HR:2016:528&showbutton=true&keyword=mensenhandel,0.0,"['Artikel 81 RO-zaken', 'Cassatie']",30-03-2016,2016-03-30T08:04:42Z,gepubliceerd,['Strafrecht'],"[{'RelatieOmschrijving': 'Conclusie: ', 'LinkTekst': 'ECLI:NL:PHR:2016:158', 'Postfix': ', Gevolgd', 'WebAdres': 'https://uitspraken.rechtspraak.nl/inziendocument?id=ECLI:NL:PHR:2016:158&showbutton=true&keyword=mensenhandel'}, {'RelatieOmschrijving': 'In cassatie op : ', 'LinkTekst': 'ECLI:NL:GHDHA:2014:3959', 'Postfix': ', Bekrachtiging/bevestiging', 'WebAdres': 'https://uitspraken.rechtspraak.nl/inziendocument?id=ECLI:NL:GHDHA:2014:3959&showbutton=true&keyword=mensenhandel'}]",HR: art. 81.1 RO. Bewijsklachten mensenhandel. Art. 273f Sr.,"Hoge Raad, 29-03-2016, 14/06331",ECLI:NL:HR:2016:528,29-03-2016,uitspraak,"[{'Vindplaats': 'RvdW 2016/478', 'VindplaatsAnnotator': '', 'VindplaatsUrl': ''}, {'Vindplaats': 'Rechtspraak.nl', 'VindplaatsAnnotator': '', 'VindplaatsUrl': ''}]"
ECLI-NL-RBNNE-2016-1848,http://deeplink.rechtspraak.nl/uitspraak?id=ECLI:NL:RBNNE:2016:1848,uitspraak,De publicatie van de uitspraak staat gepland op 05-07-2016 om 11:38 uur,https://uitspraken.rechtspraak.nl/inziendocument?id=ECLI:NL:RBNNE:2016:1848&showbutton=true&keyword=mensenhandel,0.0,"['Eerste aanleg - meervoudig', 'Op tegenspraak']",05-07-2016,2016-07-05T11:38:50Z,gepubliceerd,['Strafrecht'],[],"Veroordeling ter zake van mensenhandel (art. 273F, sub 3, Sr).","Rechtbank Noord-Nederland, 24-03-2016, 18.930237-15",ECLI:NL:RBNNE:2016:1848,24-03-2016,uitspraak,"[{'Vindplaats': 'Rechtspraak.nl', 'VindplaatsAnnotator': '', 'VindplaatsUrl': ''}]"
ECLI-NL-PHR-2016-148,http://deeplink.rechtspraak.nl/uitspraak?id=ECLI:NL:PHR:2016:148,conclusie,De publicatie van de uitspraak staat gepland op 29-03-2016 om 14:48 uur,https://uitspraken.rechtspraak.nl/inziendocument?id=ECLI:NL:PHR:2016:148&showbutton=true&keyword=mensenhandel,0.0,[],29-03-2016,2016-03-29T14:48:42Z,gepubliceerd,['Strafrecht'],"[{'RelatieOmschrijving': 'Arrest Hoge Raad: ', 'LinkTekst': 'ECLI:NL:HR:2016:514', 'Postfix': ', Gevolgd', 'WebAdres': 'https://uitspraken.rechtspraak.nl/inziendocument?id=ECLI:NL:HR:2016:514&showbutton=true&keyword=mensenhandel'}]",HR: art. 81.1 RO. Bewijsklachten mensenhandel. Art. 273f Sr.,"Parket bij de Hoge Raad, 23-02-2016, 14/06330",ECLI:NL:PHR:2016:148,23-02-2016,conclusie,"[{'Vindplaats': 'Rechtspraak.nl', 'VindplaatsAnnotator': '', 'VindplaatsUrl': ''}]"
ECLI-NL-PHR-2016-158,http://deeplink.rechtspraak.nl/uitspraak?id=ECLI:NL:PHR:2016:158,conclusie,De publicatie van de uitspraak staat gepland op 30-03-2016 om 08:03 uur,https://uitspraken.rechtspraak.nl/inziendocument?id=ECLI:NL:PHR:2016:158&showbutton=true&keyword=mensenhandel,0.0,[],30-03-2016,2016-03-30T08:03:12Z,gepubliceerd,['Strafrecht'],"[{'RelatieOmschrijving': 'Arrest Hoge Raad: ', 'LinkTekst': 'ECLI:NL:HR:2016:528', 'Postfix': ', Gevolgd', 'WebAdres': 'https://uitspraken.rechtspraak.nl/inziendocument?id=ECLI:NL:HR:2016:528&showbutton=true&keyword=mensenhandel'}]",HR: art. 81.1 RO. Bewijsklachten mensenhandel. Art. 273f Sr.,"Parket bij de Hoge Raad, 23-02-2016, 14/06331",ECLI:NL:PHR:2016:158,23-02-2016,conclusie,"[{'Vindplaats': 'Rechtspraak.nl', 'VindplaatsAnnotator': '', 'VindplaatsUrl': ''}]"
ECLI-NL-RBROT-2016-1983,http://deeplink.rechtspraak.nl/uitspraak?id=ECLI:NL:RBROT:2016:1983,uitspraak,De publicatie van de uitspraak staat gepland op 17-03-2016 om 10:10 uur,https://uitspraken.rechtspraak.nl/inziendocument?id=ECLI:NL:RBROT:2016:1983&showbutton=true&keyword=mensenhandel,0.0,['Eerste aanleg - meervoudig'],17-03-2016,2016-03-17T10:10:42Z,gepubliceerd,['Strafrecht'],[],"SCHIEDAMSE KELDERBOXZAAK, mensenhandel, minderjarige prostituee, gevangenisstraf, contactverbod, vordering benadeelde partij (immaterieel)","Rechtbank Rotterdam, 27-01-2016, 10/750111-14",ECLI:NL:RBROT:2016:1983,27-01-2016,uitspraak,"[{'Vindplaats': 'Rechtspraak.nl', 'VindplaatsAnnotator': '', 'VindplaatsUrl': ''}]"
ECLI-NL-GHARL-2015-6878,http://deeplink.rechtspraak.nl/uitspraak?id=ECLI:NL:GHARL:2015:6878,uitspraak,De publicatie van de uitspraak staat gepland op 22-09-2015 om 11:10 uur,https://uitspraken.rechtspraak.nl/inziendocument?id=ECLI:NL:GHARL:2015:6878&showbutton=true&keyword=mensenhandel,0.0,['Hoger beroep'],22-09-2015,2015-09-22T11:10:25Z,gepubliceerd,['Strafrecht'],"[{'RelatieOmschrijving': 'Eerste aanleg: ', 'LinkTekst': 'ECLI:NL:RBGEL:2014:7747', 'Postfix': ', (Gedeeltelijke) vernietiging en zelf afgedaan', 'WebAdres': 'https://uitspraken.rechtspraak.nl/inziendocument?id=ECLI:NL:RBGEL:2014:7747&showbutton=true&keyword=mensenhandel'}]",Veroordeling voor mensenhandel tot een gevangenisstraf van 30 maanden. Roemeense straatkrantverkopers.,"Gerechtshof Arnhem-Leeuwarden, 18-09-2015, 21-007505-14",ECLI:NL:GHARL:2015:6878,18-09-2015,uitspraak,"[{'Vindplaats': 'Rechtspraak.nl', 'VindplaatsAnnotator': '', 'VindplaatsUrl': ''}]"
ECLI-NL-RBROT-2015-3785,http://deeplink.rechtspraak.nl/uitspraak?id=ECLI:NL:RBROT:2015:3785,uitspraak,De publicatie van de uitspraak staat gepland op 01-06-2015 om 16:15 uur,https://uitspraken.rechtspraak.nl/inziendocument?id=ECLI:NL:RBROT:2015:3785&showbutton=true&keyword=mensenhandel,0.0,['Eerste aanleg - meervoudig'],01-06-2015,2015-06-01T16:15:15Z,gepubliceerd,['Strafrecht'],[],"Mensenhandel (arbeidsuitbuiting), medeplegen, betrouwbaarheid/bruikbaarheid getuigenverklaringen, witwassen (geen kwalificatie strafbaar feit)","Rechtbank Rotterdam, 01-06-2015, 10/996750-10",ECLI:NL:RBROT:2015:3785,01-06-2015,uitspraak,"[{'Vindplaats': 'Rechtspraak.nl', 'VindplaatsAnnotator': '', 'VindplaatsUrl': ''}]"
ECLI-NL-GHARL-2014-1554,http://deeplink.rechtspraak.nl/uitspraak?id=ECLI:NL:GHARL:2014:1554,uitspraak,De publicatie van de uitspraak staat gepland op 07-03-2014 om 15:09 uur,https://uitspraken.rechtspraak.nl/inziendocument?id=ECLI:NL:GHARL:2014:1554&showbutton=true&keyword=mensenhandel,0.0,['Hoger beroep'],07-03-2014,2014-03-07T15:09:07Z,gepubliceerd,['Strafrecht'],[],Mensenhandel ten aanzien van een minderjarige en onttrekking aan het gezag.,"Gerechtshof Arnhem-Leeuwarden, 24-02-2014, 21-004032-13",ECLI:NL:GHARL:2014:1554,24-02-2014,uitspraak,"[{'Vindplaats': 'Rechtspraak.nl', 'VindplaatsAnnotator': '', 'VindplaatsUrl': ''}]"
ECLI-NL-GHARL-2014-1555,http://deeplink.rechtspraak.nl/uitspraak?id=ECLI:NL:GHARL:2014:1555,uitspraak,De publicatie van de uitspraak staat gepland op 10-03-2014 om 16:15 uur,https://uitspraken.rechtspraak.nl/inziendocument?id=ECLI:NL:GHARL:2014:1555&showbutton=true&keyword=mensenhandel,0.0,['Hoger beroep'],10-03-2014,2014-03-10T16:15:07Z,gepubliceerd,['Strafrecht'],[],Mensenhandel ten aanzien van een minderjarige en onttrekking aan het gezag.,"Gerechtshof Arnhem-Leeuwarden, 24-02-2014, 21-004034-13",ECLI:NL:GHARL:2014:1555,24-02-2014,uitspraak,"[{'Vindplaats': 'Rechtspraak.nl', 'VindplaatsAnnotator': '', 'VindplaatsUrl': ''}]"
ECLI-NL-GHARL-2014-1556,http://deeplink.rechtspraak.nl/uitspraak?id=ECLI:NL:GHARL:2014:1556,uitspraak,De publicatie van de uitspraak staat gepland op 07-03-2014 om 15:00 uur,https://uitspraken.rechtspraak.nl/inziendocument?id=ECLI:NL:GHARL:2014:1556&showbutton=true&keyword=mensenhandel,0.0,['Hoger beroep'],07-03-2014,2014-03-07T15:00:07Z,gepubliceerd,['Strafrecht'],[],Mensenhandel ten aanzien van een minderjarige en onttrekking aan het gezag.,"Gerechtshof Arnhem-Leeuwarden, 24-02-2014, 21-004033-12",ECLI:NL:GHARL:2014:1556,24-02-2014,uitspraak,"[{'Vindplaats': 'Rechtspraak.nl', 'VindplaatsAnnotator': '', 'VindplaatsUrl': ''}]"
ECLI-NL-GHARL-2013-8810,http://deeplink.rechtspraak.nl/uitspraak?id=ECLI:NL:GHARL:2013:8810,uitspraak,De publicatie van de uitspraak staat gepland op 22-11-2013 om 14:21 uur,https://uitspraken.rechtspraak.nl/inziendocument?id=ECLI:NL:GHARL:2013:8810&showbutton=true&keyword=mensenhandel,0.0,['Hoger beroep'],22-11-2013,2013-11-22T14:21:20Z,gepubliceerd,['Strafrecht'],"[{'RelatieOmschrijving': 'Eerste aanleg: ', 'LinkTekst': 'ECLI:NL:RBUTR:2011:BP7250', 'Postfix': ', Bekrachtiging/bevestiging', 'WebAdres': 'https://uitspraken.rechtspraak.nl/inziendocument?id=ECLI:NL:RBUTR:2011:BP7250&showbutton=true&keyword=mensenhandel'}, {'RelatieOmschrijving': 'Cassatie: ', 'LinkTekst': 'ECLI:NL:HR:2015:2469', 'Postfix': ', Niet ontvankelijk', 'WebAdres': 'https://uitspraken.rechtspraak.nl/inziendocument?id=ECLI:NL:HR:2015:2469&showbutton=true&keyword=mensenhandel'}]","Uitspraak Sneep 2. Veroordeling mensenhandel, medeplegen mishandeling en deelname criminele organisatie.","Gerechtshof Arnhem-Leeuwarden, 22-11-2013, 21-000879-11",ECLI:NL:GHARL:2013:8810,22-11-2013,uitspraak,"[{'Vindplaats': 'Rechtspraak.nl', 'VindplaatsAnnotator': '', 'VindplaatsUrl': ''}]"
ECLI-NL-RBNHO-2013-10244,http://deeplink.rechtspraak.nl/uitspraak?id=ECLI:NL:RBNHO:2013:10244,uitspraak,De publicatie van de uitspraak staat gepland op 31-10-2013 om 14:57 uur,https://uitspraken.rechtspraak.nl/inziendocument?id=ECLI:NL:RBNHO:2013:10244&showbutton=true&keyword=mensenhandel,0.0,['Eerste aanleg - meervoudig'],31-10-2013,2013-10-31T14:57:27Z,gepubliceerd,['Strafrecht'],[],Promis; vrijspraak mensenhandel (het oogmerk tot uitbuiting kan niet bewezen worden).,"Rechtbank Noord-Holland, 17-09-2013, 15/974500-13",ECLI:NL:RBNHO:2013:10244,17-09-2013,uitspraak,"[{'Vindplaats': 'Rechtspraak.nl', 'VindplaatsAnnotator': '', 'VindplaatsUrl': ''}]"
ECLI-NL-RBSHE-2012-BW6532,http://deeplink.rechtspraak.nl/uitspraak?id=ECLI:NL:RBSHE:2012:BW6532,uitspraak,De publicatie van de uitspraak staat gepland op 25-05-2012 om 13:18 uur,https://uitspraken.rechtspraak.nl/inziendocument?id=ECLI:NL:RBSHE:2012:BW6532&showbutton=true&keyword=mensenhandel,0.0,['Eerste aanleg - meervoudig'],25-05-2012,2012-05-25T13:18:04Z,gepubliceerd,['Strafrecht'],[],"Verlenging tbs met twee jaar. 
Index-delicten: mensenhandel en pedoseksuele delicten.","Rechtbank 's-Hertogenbosch, 25-05-2012, 01/845071-07",ECLI:NL:RBSHE:2012:BW6532,25-05-2012,uitspraak,"[{'Vindplaats': 'Rechtspraak.nl', 'VindplaatsAnnotator': '', 'VindplaatsUrl': ''}]"
ECLI-NL-RBARN-2007-BB1596,http://deeplink.rechtspraak.nl/uitspraak?id=ECLI:NL:RBARN:2007:BB1596,uitspraak,De publicatie van de uitspraak staat gepland op 13-08-2007 om 14:09 uur,https://uitspraken.rechtspraak.nl/inziendocument?id=ECLI:NL:RBARN:2007:BB1596&showbutton=true&keyword=mensenhandel,0.0,['Eerste aanleg - meervoudig'],13-08-2007,2007-08-13T14:09:07Z,gepubliceerd,['Strafrecht'],[],Tenlastegelegde 'Mensenhandel' leidt niet tot een veroordeling. Poolse verdachte wordt vrijgesproken.,"Rechtbank Arnhem, 13-08-2007, 05/504665-07",ECLI:NL:RBARN:2007:BB1596,13-08-2007,uitspraak,"[{'Vindplaats': 'Rechtspraak.nl', 'VindplaatsAnnotator': '', 'VindplaatsUrl': ''}]"
ECLI-NL-GHARL-2020-6496,http://deeplink.rechtspraak.nl/uitspraak?id=ECLI:NL:GHARL:2020:6496,uitspraak,De publicatie van de uitspraak staat gepland op 19-08-2020 om 14:30 uur,https://uitspraken.rechtspraak.nl/inziendocument?id=ECLI:NL:GHARL:2020:6496&showbutton=true&keyword=mensenhandel,0.0,['Hoger beroep'],19-08-2020,2020-08-19T14:30:23Z,gepubliceerd,['Strafrecht'],"[{'RelatieOmschrijving': 'Eerste aanleg: ', 'LinkTekst': 'ECLI:NL:RBGEL:2018:2791', 'Postfix': ', (Gedeeltelijke) vernietiging en zelf afgedaan', 'WebAdres': 'https://uitspraken.rechtspraak.nl/inziendocument?id=ECLI:NL:RBGEL:2018:2791&showbutton=true&keyword=mensenhandel'}]",Het hof spreekt verdachte vrij van poging tot mensenhandel. De gedragingen van verdachte zijn naar het oordeel van het hof onvoldoende concreet om naar de uiterlijke verschijningsvorm te moeten worden beschouwd als te zijn gericht op voltooiing van de ten laste gelegde poging tot mensenhandel.,"Gerechtshof Arnhem-Leeuwarden, 19-08-2020, 21-003831-18",ECLI:NL:GHARL:2020:6496,19-08-2020,uitspraak,"[{'Vindplaats': 'Rechtspraak.nl', 'VindplaatsAnnotator': '', 'VindplaatsUrl': ''}]"
ECLI-NL-HR-2019-1027,http://deeplink.rechtspraak.nl/uitspraak?id=ECLI:NL:HR:2019:1027,uitspraak,De publicatie van de uitspraak staat gepland op 25-06-2019 om 16:25 uur,https://uitspraken.rechtspraak.nl/inziendocument?id=ECLI:NL:HR:2019:1027&showbutton=true&keyword=mensenhandel,0.0,"['Cassatie', 'Artikel 80a RO-zaken']",25-06-2019,2019-06-25T16:25:22Z,gepubliceerd,['Strafrecht'],"[{'RelatieOmschrijving': 'Conclusie: ', 'LinkTekst': 'ECLI:NL:PHR:2019:685', 'Postfix': None, 'WebAdres': 'https://uitspraken.rechtspraak.nl/inziendocument?id=ECLI:NL:PHR:2019:685&showbutton=true&keyword=mensenhandel'}, {'RelatieOmschrijving': 'In cassatie op : ', 'LinkTekst': 'ECLI:NL:GHAMS:2016:1266', 'Postfix': ', Niet ontvankelijk', 'WebAdres': 'https://uitspraken.rechtspraak.nl/inziendocument?id=ECLI:NL:GHAMS:2016:1266&showbutton=true&keyword=mensenhandel'}]",Medeplegen mensenhandel (art. 273f.1 Sr) en witwassen van personenauto (art. 420bis.1.b Sr). 1. Uos t.a.v. betrouwbaarheid van verklaringen van aangeefster van mensenhandel. 2. Kwalificatieklacht witwassen. HR: art. 80a RO. Samenhang met 16/02079 en 16/05176.,"Hoge Raad, 25-06-2019, 16/03440",ECLI:NL:HR:2019:1027,25-06-2019,uitspraak,"[{'Vindplaats': 'RvdW 2019/799', 'VindplaatsAnnotator': '', 'VindplaatsUrl': ''}, {'Vindplaats': 'Rechtspraak.nl', 'VindplaatsAnnotator': '', 'VindplaatsUrl': ''}]"
ECLI-NL-PHR-2019-685,http://deeplink.rechtspraak.nl/uitspraak?id=ECLI:NL:PHR:2019:685,conclusie,De publicatie van de uitspraak staat gepland op 25-06-2019 om 16:30 uur,https://uitspraken.rechtspraak.nl/inziendocument?id=ECLI:NL:PHR:2019:685&showbutton=true&keyword=mensenhandel,0.0,[],25-06-2019,2019-06-25T16:30:19Z,gepubliceerd,['Strafrecht'],"[{'RelatieOmschrijving': 'Arrest Hoge Raad: ', 'LinkTekst': 'ECLI:NL:HR:2019:1027', 'Postfix': None, 'WebAdres': 'https://uitspraken.rechtspraak.nl/inziendocument?id=ECLI:NL:HR:2019:1027&showbutton=true&keyword=mensenhandel'}]",Medeplegen mensenhandel (art. 273f.1 Sr) en witwassen van personenauto (art. 420bis.1.b Sr). 1. Uos t.a.v. betrouwbaarheid van verklaringen van aangeefster van mensenhandel. 2. Kwalificatieklacht witwassen. HR: art. 80a RO. Samenhang met 16/02079 en 16/05176.,"Parket bij de Hoge Raad, 14-05-2019, 16/03440",ECLI:NL:PHR:2019:685,14-05-2019,conclusie,"[{'Vindplaats': 'Rechtspraak.nl', 'VindplaatsAnnotator': '', 'VindplaatsUrl': ''}]"
ECLI-NL-RBDHA-2021-3444,http://deeplink.rechtspraak.nl/uitspraak?id=ECLI:NL:RBDHA:2021:3444,uitspraak,De publicatie van de uitspraak staat gepland op 09-04-2021 om 13:39 uur,https://uitspraken.rechtspraak.nl/inziendocument?id=ECLI:NL:RBDHA:2021:3444&showbutton=true&keyword=mensenhandel,0.0,['Eerste aanleg - enkelvoudig'],09-04-2021,2021-04-09T13:39:52Z,gepubliceerd,['Bestuursrecht; Vreemdelingenrecht'],[],AKT. Asiel. Ghana veilig land van herkomst. Slachtoffer mensenhandel. Bedenktijd. Beroep ongegrond.,"Rechtbank Den Haag, 01-04-2021, NL21.3673",ECLI:NL:RBDHA:2021:3444,01-04-2021,uitspraak,"[{'Vindplaats': 'Rechtspraak.nl', 'VindplaatsAnnotator': '', 'VindplaatsUrl': ''}]"
ECLI-NL-RBDHA-2021-2396,http://deeplink.rechtspraak.nl/uitspraak?id=ECLI:NL:RBDHA:2021:2396,uitspraak,De publicatie van de uitspraak staat gepland op 16-03-2021 om 15:27 uur,https://uitspraken.rechtspraak.nl/inziendocument?id=ECLI:NL:RBDHA:2021:2396&showbutton=true&keyword=mensenhandel,0.0,['Mondelinge uitspraak'],16-03-2021,2021-03-16T15:27:19.672Z,gepubliceerd,['Bestuursrecht; Vreemdelingenrecht'],[],"aangifte mensenhandel, verblijfsvergunning regulier, geen strafrechtelijk opsporing en vervolging, Rantsev, beroep ongegrond","Rechtbank Den Haag, 26-02-2021, AWB 20/664",ECLI:NL:RBDHA:2021:2396,26-02-2021,uitspraak,"[{'Vindplaats': 'Rechtspraak.nl', 'VindplaatsAnnotator': '', 'VindplaatsUrl': ''}]"
ECLI-NL-RBDHA-2020-5770,http://deeplink.rechtspraak.nl/uitspraak?id=ECLI:NL:RBDHA:2020:5770,uitspraak,De publicatie van de uitspraak staat gepland op 26-06-2020 om 13:44 uur,https://uitspraken.rechtspraak.nl/inziendocument?id=ECLI:NL:RBDHA:2020:5770&showbutton=true&keyword=mensenhandel,0.0,['Eerste aanleg - enkelvoudig'],26-06-2020,2020-06-26T13:44:38Z,gepubliceerd,['Bestuursrecht; Vreemdelingenrecht'],[],"Dublin, Duitsland, interstatelijk vertrouwensbeginsel, art. 17 DVO, slachtoffer mensenhandel, kwetsbaar, beroep ongegrond.","Rechtbank Den Haag, 19-06-2020, NL20.8371",ECLI:NL:RBDHA:2020:5770,19-06-2020,uitspraak,"[{'Vindplaats': 'Rechtspraak.nl', 'VindplaatsAnnotator': '', 'VindplaatsUrl': ''}]"
ECLI-NL-RBAMS-2019-985,http://deeplink.rechtspraak.nl/uitspraak?id=ECLI:NL:RBAMS:2019:985,uitspraak,De publicatie van de uitspraak staat gepland op 19-02-2019 om 08:40 uur,https://uitspraken.rechtspraak.nl/inziendocument?id=ECLI:NL:RBAMS:2019:985&showbutton=true&keyword=mensenhandel,0.0,['Eerste aanleg - meervoudig'],19-02-2019,2019-02-19T08:40:46Z,gepubliceerd,['Strafrecht'],[],Mensenhandel. Medeplegen. Partiële vrijspraak dreiging met geweld door medeverdachte. Gevangenisstraf 6 maanden.,"Rechtbank Amsterdam, 04-02-2019, 13/730031-17",ECLI:NL:RBAMS:2019:985,04-02-2019,uitspraak,"[{'Vindplaats': 'Rechtspraak.nl', 'VindplaatsAnnotator': '', 'VindplaatsUrl': ''}]"
ECLI-NL-RBGEL-2017-6600,http://deeplink.rechtspraak.nl/uitspraak?id=ECLI:NL:RBGEL:2017:6600,uitspraak,De publicatie van de uitspraak staat gepland op 20-12-2017 om 10:25 uur,https://uitspraken.rechtspraak.nl/inziendocument?id=ECLI:NL:RBGEL:2017:6600&showbutton=true&keyword=mensenhandel,0.0,['Eerste aanleg - meervoudig'],20-12-2017,2017-12-20T10:25:16Z,gepubliceerd,['Strafrecht'],[],Veroordeling mensenhandel ten aanzien van een minderjarige en onttrekking aan het gezag.,"Rechtbank Gelderland, 19-12-2017, 05/880486-16",ECLI:NL:RBGEL:2017:6600,19-12-2017,uitspraak,"[{'Vindplaats': 'Rechtspraak.nl', 'VindplaatsAnnotator': '', 'VindplaatsUrl': ''}]"
ECLI-NL-RBLIM-2017-3316,http://deeplink.rechtspraak.nl/uitspraak?id=ECLI:NL:RBLIM:2017:3316,uitspraak,De publicatie van de uitspraak staat gepland op 13-04-2017 om 15:00 uur,https://uitspraken.rechtspraak.nl/inziendocument?id=ECLI:NL:RBLIM:2017:3316&showbutton=true&keyword=mensenhandel,0.0,['Eerste aanleg - meervoudig'],13-04-2017,2017-04-13T15:00:01Z,gepubliceerd,['Strafrecht'],[],Verwerping van niet-ontvankelijkheidsverweer OM (overtreding verbod van willekeur). Vrijspraak van mensenhandel.,"Rechtbank Limburg, 13-04-2017, 03/700630-13",ECLI:NL:RBLIM:2017:3316,13-04-2017,uitspraak,"[{'Vindplaats': 'Rechtspraak.nl', 'VindplaatsAnnotator': '', 'VindplaatsUrl': ''}]"
ECLI-NL-HR-2016-692,http://deeplink.rechtspraak.nl/uitspraak?id=ECLI:NL:HR:2016:692,uitspraak,De publicatie van de uitspraak staat gepland op 20-04-2016 om 13:08 uur,https://uitspraken.rechtspraak.nl/inziendocument?id=ECLI:NL:HR:2016:692&showbutton=true&keyword=mensenhandel,0.0,"['Artikel 81 RO-zaken', 'Cassatie']",20-04-2016,2016-04-20T13:08:28Z,gepubliceerd,['Strafrecht'],"[{'RelatieOmschrijving': 'Conclusie: ', 'LinkTekst': 'ECLI:NL:PHR:2016:280', 'Postfix': ', Gevolgd', 'WebAdres': 'https://uitspraken.rechtspraak.nl/inziendocument?id=ECLI:NL:PHR:2016:280&showbutton=true&keyword=mensenhandel'}, {'RelatieOmschrijving': 'In cassatie op : ', 'LinkTekst': 'ECLI:NL:GHARL:2015:3608', 'Postfix': ', Bekrachtiging/bevestiging', 'WebAdres': 'https://uitspraken.rechtspraak.nl/inziendocument?id=ECLI:NL:GHARL:2015:3608&showbutton=true&keyword=mensenhandel'}]",Mensenhandel 273f Sr. HR: 81.1 RO. Samenhang met 15/02678.,"Hoge Raad, 19-04-2016, 15/02677",ECLI:NL:HR:2016:692,19-04-2016,uitspraak,"[{'Vindplaats': 'RvdW 2016/575', 'VindplaatsAnnotator': '', 'VindplaatsUrl': ''}, {'Vindplaats': 'Rechtspraak.nl', 'VindplaatsAnnotator': '', 'VindplaatsUrl': ''}]"
ECLI-NL-RBOVE-2016-846,http://deeplink.rechtspraak.nl/uitspraak?id=ECLI:NL:RBOVE:2016:846,uitspraak,De publicatie van de uitspraak staat gepland op 10-03-2016 om 15:54 uur,https://uitspraken.rechtspraak.nl/inziendocument?id=ECLI:NL:RBOVE:2016:846&showbutton=true&keyword=mensenhandel,0.0,['Eerste aanleg - meervoudig'],10-03-2016,2016-03-10T15:54:42Z,gepubliceerd,['Strafrecht'],[],Een man uit Kampen is vrijgesproken van mensenhandel met een minderjarige vrouw.,"Rechtbank Overijssel, 10-03-2016, 08.910036-15 (P)",ECLI:NL:RBOVE:2016:846,10-03-2016,uitspraak,"[{'Vindplaats': 'Rechtspraak.nl', 'VindplaatsAnnotator': '', 'VindplaatsUrl': ''}]"
ECLI-NL-PHR-2016-280,http://deeplink.rechtspraak.nl/uitspraak?id=ECLI:NL:PHR:2016:280,conclusie,De publicatie van de uitspraak staat gepland op 20-04-2016 om 13:05 uur,https://uitspraken.rechtspraak.nl/inziendocument?id=ECLI:NL:PHR:2016:280&showbutton=true&keyword=mensenhandel,0.0,[],20-04-2016,2016-04-20T13:05:27Z,gepubliceerd,['Strafrecht'],"[{'RelatieOmschrijving': 'Arrest Hoge Raad: ', 'LinkTekst': 'ECLI:NL:HR:2016:692', 'Postfix': ', Gevolgd', 'WebAdres': 'https://uitspraken.rechtspraak.nl/inziendocument?id=ECLI:NL:HR:2016:692&showbutton=true&keyword=mensenhandel'}]",Mensenhandel 273f Sr. HR: 81.1 RO. Samenhang met 15/02678.,"Parket bij de Hoge Raad, 23-02-2016, 15/02677",ECLI:NL:PHR:2016:280,23-02-2016,conclusie,"[{'Vindplaats': 'Rechtspraak.nl', 'VindplaatsAnnotator': '', 'VindplaatsUrl': ''}]"
ECLI-NL-RBDHA-2016-1662,http://deeplink.rechtspraak.nl/uitspraak?id=ECLI:NL:RBDHA:2016:1662,uitspraak,De publicatie van de uitspraak staat gepland op 19-02-2016 om 10:14 uur,https://uitspraken.rechtspraak.nl/inziendocument?id=ECLI:NL:RBDHA:2016:1662&showbutton=true&keyword=mensenhandel,0.0,['Eerste aanleg - enkelvoudig'],19-02-2016,2016-02-19T10:14:19Z,gepubliceerd,['Bestuursrecht; Vreemdelingenrecht'],[],"Mensenhandel, intrekking, 3.51, eerste lid, aanhef en onder k, Vb, Nigeria","Rechtbank Den Haag, 18-02-2016, 15/14704",ECLI:NL:RBDHA:2016:1662,18-02-2016,uitspraak,"[{'Vindplaats': 'Rechtspraak.nl', 'VindplaatsAnnotator': '', 'VindplaatsUrl': ''}]"
ECLI-NL-RBDHA-2015-9658,http://deeplink.rechtspraak.nl/uitspraak?id=ECLI:NL:RBDHA:2015:9658,uitspraak,De publicatie van de uitspraak staat gepland op 14-08-2015 om 13:28 uur,https://uitspraken.rechtspraak.nl/inziendocument?id=ECLI:NL:RBDHA:2015:9658&showbutton=true&keyword=mensenhandel,0.0,"['Eerste aanleg - enkelvoudig', 'Voorlopige voorziening+bodemzaak']",14-08-2015,2015-08-14T13:28:35Z,gepubliceerd,['Bestuursrecht; Vreemdelingenrecht'],[],"Dublin, aanvraag niet in behandeling genomen, Frankrijk verantwoordelijk, artikel 17, slachtoffer mensenhandel","Rechtbank Den Haag, 13-08-2015, 15/14448 en 15/14446",ECLI:NL:RBDHA:2015:9658,13-08-2015,uitspraak,"[{'Vindplaats': 'Rechtspraak.nl', 'VindplaatsAnnotator': '', 'VindplaatsUrl': ''}]"
ECLI-NL-GHARL-2015-2577,http://deeplink.rechtspraak.nl/uitspraak?id=ECLI:NL:GHARL:2015:2577,uitspraak,De publicatie van de uitspraak staat gepland op 09-04-2015 om 14:30 uur,https://uitspraken.rechtspraak.nl/inziendocument?id=ECLI:NL:GHARL:2015:2577&showbutton=true&keyword=mensenhandel,0.0,['Hoger beroep'],09-04-2015,2015-04-09T14:30:11Z,gepubliceerd,['Strafrecht'],[],Veroordeling ter zake van mensenhandel tot een voorwaardelijke gevangenisstraf en een taakstraf.,"Gerechtshof Arnhem-Leeuwarden, 09-04-2015, 21-008157-13",ECLI:NL:GHARL:2015:2577,09-04-2015,uitspraak,"[{'Vindplaats': 'Rechtspraak.nl', 'VindplaatsAnnotator': '', 'VindplaatsUrl': ''}]"
ECLI-NL-GHSHE-2015-1129,http://deeplink.rechtspraak.nl/uitspraak?id=ECLI:NL:GHSHE:2015:1129,uitspraak,De publicatie van de uitspraak staat gepland op 31-03-2015 om 16:45 uur,https://uitspraken.rechtspraak.nl/inziendocument?id=ECLI:NL:GHSHE:2015:1129&showbutton=true&keyword=mensenhandel,0.0,"['Hoger beroep', 'Op tegenspraak']",31-03-2015,2015-03-31T16:45:17Z,gepubliceerd,['Strafrecht'],"[{'RelatieOmschrijving': 'Eerste aanleg: ', 'LinkTekst': 'ECLI:NL:RBOBR:2013:BZ9547', 'Postfix': ', Niet ontvankelijk', 'WebAdres': 'https://uitspraken.rechtspraak.nl/inziendocument?id=ECLI:NL:RBOBR:2013:BZ9547&showbutton=true&keyword=mensenhandel'}]",Mensenhandel; prostitutie; intrekking hoger beroep na aanvang van het onderzoek ter terechtzitting.,"Gerechtshof 's-Hertogenbosch, 31-03-2015, 20-001665-13",ECLI:NL:GHSHE:2015:1129,31-03-2015,uitspraak,"[{'Vindplaats': 'Rechtspraak.nl', 'VindplaatsAnnotator': '', 'VindplaatsUrl': ''}]"
ECLI-NL-RBLIM-2015-1470,http://deeplink.rechtspraak.nl/uitspraak?id=ECLI:NL:RBLIM:2015:1470,uitspraak,De publicatie van de uitspraak staat gepland op 24-02-2015 om 12:33 uur,https://uitspraken.rechtspraak.nl/inziendocument?id=ECLI:NL:RBLIM:2015:1470&showbutton=true&keyword=mensenhandel,0.0,['Eerste aanleg - meervoudig'],24-02-2015,2015-02-24T12:33:25Z,gepubliceerd,['Strafrecht'],[],Mensenhandel. Niet-ontvankelijkverklaring van het Openbaar Ministerie vanwege het ontbreken van rechtsmacht.,"Rechtbank Limburg, 23-02-2015, 03/091415-14",ECLI:NL:RBLIM:2015:1470,23-02-2015,uitspraak,"[{'Vindplaats': 'NJFS 2015/96', 'VindplaatsAnnotator': '', 'VindplaatsUrl': ''}, {'Vindplaats': 'Rechtspraak.nl', 'VindplaatsAnnotator': '', 'VindplaatsUrl': ''}]"
ECLI-NL-RBLIM-2015-1472,http://deeplink.rechtspraak.nl/uitspraak?id=ECLI:NL:RBLIM:2015:1472,uitspraak,De publicatie van de uitspraak staat gepland op 24-02-2015 om 12:48 uur,https://uitspraken.rechtspraak.nl/inziendocument?id=ECLI:NL:RBLIM:2015:1472&showbutton=true&keyword=mensenhandel,0.0,['Eerste aanleg - meervoudig'],24-02-2015,2015-02-24T12:48:25Z,gepubliceerd,['Strafrecht'],[],Mensenhandel. Niet-ontvankelijkverklaring van het Openbaar Ministerie vanwege het ontbreken van rechtsmacht.,"Rechtbank Limburg, 23-02-2015, 03/091425-14",ECLI:NL:RBLIM:2015:1472,23-02-2015,uitspraak,"[{'Vindplaats': 'Rechtspraak.nl', 'VindplaatsAnnotator': '', 'VindplaatsUrl': ''}]"
ECLI-NL-GHARL-2014-3063,http://deeplink.rechtspraak.nl/uitspraak?id=ECLI:NL:GHARL:2014:3063,uitspraak,De publicatie van de uitspraak staat gepland op 15-04-2014 om 14:30 uur,https://uitspraken.rechtspraak.nl/inziendocument?id=ECLI:NL:GHARL:2014:3063&showbutton=true&keyword=mensenhandel,0.0,['Hoger beroep'],15-04-2014,2014-04-15T14:30:12Z,gepubliceerd,['Strafrecht'],"[{'RelatieOmschrijving': 'Eerste aanleg: ', 'LinkTekst': 'ECLI:NL:RBZUT:2012:BV2116', 'Postfix': ', (Gedeeltelijke) vernietiging en zelf afgedaan', 'WebAdres': 'https://uitspraken.rechtspraak.nl/inziendocument?id=ECLI:NL:RBZUT:2012:BV2116&showbutton=true&keyword=mensenhandel'}]","Bewezenverklaring van mensenhandel ten aanzien van een minderjarige, voor het overige vrijspraak","Gerechtshof Arnhem-Leeuwarden, 15-04-2014, 21-000539-12",ECLI:NL:GHARL:2014:3063,15-04-2014,uitspraak,"[{'Vindplaats': 'Rechtspraak.nl', 'VindplaatsAnnotator': '', 'VindplaatsUrl': ''}]"
ECLI-NL-RBNNE-2014-992,http://deeplink.rechtspraak.nl/uitspraak?id=ECLI:NL:RBNNE:2014:992,uitspraak,De publicatie van de uitspraak staat gepland op 04-03-2014 om 11:13 uur,https://uitspraken.rechtspraak.nl/inziendocument?id=ECLI:NL:RBNNE:2014:992&showbutton=true&keyword=mensenhandel,0.0,['Eerste aanleg - meervoudig'],04-03-2014,2014-03-04T11:13:57Z,gepubliceerd,['Strafrecht'],[],Man veroordeeld tot drie jaar cel voor mensenhandel met minderjarige Nederlandse meisjes.,"Rechtbank Noord-Nederland, 27-02-2014, 18/850215-13",ECLI:NL:RBNNE:2014:992,27-02-2014,uitspraak,"[{'Vindplaats': 'Rechtspraak.nl', 'VindplaatsAnnotator': '', 'VindplaatsUrl': ''}]"
ECLI-NL-RBLIM-2013-BZ0046,http://deeplink.rechtspraak.nl/uitspraak?id=ECLI:NL:RBLIM:2013:BZ0046,uitspraak,De publicatie van de uitspraak staat gepland op 30-01-2013 om 15:39 uur,https://uitspraken.rechtspraak.nl/inziendocument?id=ECLI:NL:RBLIM:2013:BZ0046&showbutton=true&keyword=mensenhandel,0.0,['Eerste aanleg - meervoudig'],30-01-2013,2013-01-30T15:39:47Z,gepubliceerd,['Strafrecht'],[],"Mensenhandel, afpersing, wederrechtelijke vrijheidsberoving en mishandeling: oplegging van 5 jaar onvoorwaardelijke gevangenisstraf.","Rechtbank Limburg, 30-01-2013, 03-703221-11",ECLI:NL:RBLIM:2013:BZ0046,30-01-2013,uitspraak,"[{'Vindplaats': 'Rechtspraak.nl', 'VindplaatsAnnotator': '', 'VindplaatsUrl': ''}]"
ECLI-NL-RBLIM-2013-BZ0051,http://deeplink.rechtspraak.nl/uitspraak?id=ECLI:NL:RBLIM:2013:BZ0051,uitspraak,De publicatie van de uitspraak staat gepland op 30-01-2013 om 15:59 uur,https://uitspraken.rechtspraak.nl/inziendocument?id=ECLI:NL:RBLIM:2013:BZ0051&showbutton=true&keyword=mensenhandel,0.0,['Eerste aanleg - meervoudig'],30-01-2013,2013-01-30T15:59:12Z,gepubliceerd,['Strafrecht'],[],"mensenhandel, afpersing, wederrechtelijke vrijheidsberoving en mishandeling: oplegging van 4 jaar onvoorwaardelijke gevangenisstraf","Rechtbank Limburg, 30-01-2013, 03-703222-11",ECLI:NL:RBLIM:2013:BZ0051,30-01-2013,uitspraak,"[{'Vindplaats': 'Rechtspraak.nl', 'VindplaatsAnnotator': '', 'VindplaatsUrl': ''}]"
ECLI-NL-GHARN-2010-BO8402,http://deeplink.rechtspraak.nl/uitspraak?id=ECLI:NL:GHARN:2010:BO8402,uitspraak,De publicatie van de uitspraak staat gepland op 22-12-2010 om 15:25 uur,https://uitspraken.rechtspraak.nl/inziendocument?id=ECLI:NL:GHARN:2010:BO8402&showbutton=true&keyword=mensenhandel,0.0,['Hoger beroep'],22-12-2010,2010-12-22T15:25:19Z,gepubliceerd,['Strafrecht'],[],Sneep-zaak. Mensenhandel. Misdadige organisatie. Bewijswaardering. Ontvankelijkheid OM in verband met stukken,"Gerechtshof Arnhem, 20-12-2010, 21-003159-08",ECLI:NL:GHARN:2010:BO8402,20-12-2010,uitspraak,"[{'Vindplaats': 'Rechtspraak.nl', 'VindplaatsAnnotator': '', 'VindplaatsUrl': ''}]"
ECLI-NL-GHAMS-2015-5189,http://deeplink.rechtspraak.nl/uitspraak?id=ECLI:NL:GHAMS:2015:5189,uitspraak,De publicatie van de uitspraak staat gepland op 14-12-2015 om 12:54 uur,https://uitspraken.rechtspraak.nl/inziendocument?id=ECLI:NL:GHAMS:2015:5189&showbutton=true&keyword=mensenhandel,0.0,['Hoger beroep'],14-12-2015,2015-12-14T12:54:42Z,gepubliceerd,['Strafrecht'],"[{'RelatieOmschrijving': 'Eerste aanleg: ', 'LinkTekst': 'ECLI:NL:RBAMS:2013:CA3400', 'Postfix': None, 'WebAdres': 'https://uitspraken.rechtspraak.nl/inziendocument?id=ECLI:NL:RBAMS:2013:CA3400&showbutton=true&keyword=mensenhandel'}]",Wederrechtelijke vrijheidsberoving; beïnvloeden van een getuige; medeplichtigheid aan mensenhandel; onttrekking minderjarige aan bevoegd opzicht; mensenhandel ten aanzien van een minderjarige; verwerping verweer ex 359a Sv: geen strijd met Aanwijzing audiovisuele registratie en geen ontoelaatbare sturing tijdens verhoren; verwerping betrouwbaarheidsverweren en bewijsminimum; toewijzing vordering benadeelde partij.,"Gerechtshof Amsterdam, 11-12-2015, 23-002914-13",ECLI:NL:GHAMS:2015:5189,11-12-2015,uitspraak,"[{'Vindplaats': 'Rechtspraak.nl', 'VindplaatsAnnotator': '', 'VindplaatsUrl': ''}]"
ECLI-NL-RBGEL-2014-7746,http://deeplink.rechtspraak.nl/uitspraak?id=ECLI:NL:RBGEL:2014:7746,uitspraak,De publicatie van de uitspraak staat gepland op 15-12-2014 om 10:06 uur,https://uitspraken.rechtspraak.nl/inziendocument?id=ECLI:NL:RBGEL:2014:7746&showbutton=true&keyword=mensenhandel,0.0,['Eerste aanleg - meervoudig'],15-12-2014,2014-12-15T10:06:50Z,gepubliceerd,"['Strafrecht', 'Internationaal publiekrecht']",[],Mensenhandel: De rechtbank Gelderland veroordeelt een 26-jarige vrouw voor mensenhandel van twee Roemeense slachtoffers tot een gevangenisstraf van 27 maanden. Ook moet de vrouw een schadevergoeding betalen aan beide slachtoffers. Strafmaat: de rechtbank motiveert welke punten bij de beoordeling van de stafmaat van belang zijn geweest.,"Rechtbank Gelderland, 15-12-2014, 05/780072-14",ECLI:NL:RBGEL:2014:7746,15-12-2014,uitspraak,"[{'Vindplaats': 'Rechtspraak.nl', 'VindplaatsAnnotator': '', 'VindplaatsUrl': ''}]"
ECLI-NL-RBSHE-2009-BH3297,http://deeplink.rechtspraak.nl/uitspraak?id=ECLI:NL:RBSHE:2009:BH3297,uitspraak,De publicatie van de uitspraak staat gepland op 19-02-2009 om 11:13 uur,https://uitspraken.rechtspraak.nl/inziendocument?id=ECLI:NL:RBSHE:2009:BH3297&showbutton=true&keyword=mensenhandel,0.0,['Eerste aanleg - meervoudig'],19-02-2009,2009-02-19T11:13:59Z,gepubliceerd,['Strafrecht'],[],"Promis-vonnis
Loverboy-zaak. Veroordeling voor twee zaken van mensenhandel. Vrijspraak voor een derde zaak van mensenhandel en voor artikel 285a Sr.
Opgelegd is een gevangenisstraf voor de duur van 10 maanden met aftrek van voorarrest waarvan 3 maanden voorwaardelijk met een proeftijd van twee jaren.","Rechtbank 's-Hertogenbosch, 19-02-2009, 01/849212-08 A",ECLI:NL:RBSHE:2009:BH3297,19-02-2009,uitspraak,"[{'Vindplaats': 'Rechtspraak.nl', 'VindplaatsAnnotator': '', 'VindplaatsUrl': ''}]"
ECLI-NL-RBDHA-2020-14491,http://deeplink.rechtspraak.nl/uitspraak?id=ECLI:NL:RBDHA:2020:14491,uitspraak,De publicatie van de uitspraak staat gepland op 23-03-2021 om 08:42 uur,https://uitspraken.rechtspraak.nl/inziendocument?id=ECLI:NL:RBDHA:2020:14491&showbutton=true&keyword=mensenhandel,0.0,"['Eerste aanleg - enkelvoudig', 'Voorlopige voorziening']",23-03-2021,2021-03-23T08:42:42Z,gepubliceerd,['Bestuursrecht; Vreemdelingenrecht'],[],"Regulier, Niet binnen drie maanden na indiening asielaanvraag aangifte mensenhandel gedaan. Beroep ongegrond.","Rechtbank Den Haag, 09-10-2020, AWB 19/8771 en AWB 19/8772",ECLI:NL:RBDHA:2020:14491,09-10-2020,uitspraak,"[{'Vindplaats': 'Rechtspraak.nl', 'VindplaatsAnnotator': '', 'VindplaatsUrl': ''}]"
ECLI-NL-RBDHA-2020-6827,http://deeplink.rechtspraak.nl/uitspraak?id=ECLI:NL:RBDHA:2020:6827,uitspraak,De publicatie van de uitspraak staat gepland op 21-07-2020 om 15:20 uur,https://uitspraken.rechtspraak.nl/inziendocument?id=ECLI:NL:RBDHA:2020:6827&showbutton=true&keyword=mensenhandel,0.0,['Voorlopige voorziening'],21-07-2020,2020-07-21T15:20:00Z,gepubliceerd,['Bestuursrecht; Vreemdelingenrecht'],[],"Dublin, Duitsland, voorlopige voorziening toegewezen in afwachting van nadere informatie omtrent aangifte mensenhandel.","Rechtbank Den Haag, 01-07-2020, NL20.9215",ECLI:NL:RBDHA:2020:6827,01-07-2020,uitspraak,"[{'Vindplaats': 'Rechtspraak.nl', 'VindplaatsAnnotator': '', 'VindplaatsUrl': ''}]"
ECLI-NL-RBDHA-2019-6018,http://deeplink.rechtspraak.nl/uitspraak?id=ECLI:NL:RBDHA:2019:6018,uitspraak,De publicatie van de uitspraak staat gepland op 18-07-2019 om 12:01 uur,https://uitspraken.rechtspraak.nl/inziendocument?id=ECLI:NL:RBDHA:2019:6018&showbutton=true&keyword=mensenhandel,0.0,['Eerste aanleg - enkelvoudig'],18-07-2019,2019-07-18T12:01:29Z,gepubliceerd,['Bestuursrecht'],[],"Vw, Dublin Duitsland, aangifte mensenhandel nog niet gedaan ten tijde van bestreden besluit.","Rechtbank Den Haag, 07-05-2019, NL19.7613 en NL19.7615",ECLI:NL:RBDHA:2019:6018,07-05-2019,uitspraak,"[{'Vindplaats': 'Rechtspraak.nl', 'VindplaatsAnnotator': '', 'VindplaatsUrl': ''}]"
ECLI-NL-RBAMS-2018-424,http://deeplink.rechtspraak.nl/uitspraak?id=ECLI:NL:RBAMS:2018:424,uitspraak,De publicatie van de uitspraak staat gepland op 22-02-2018 om 11:52 uur,https://uitspraken.rechtspraak.nl/inziendocument?id=ECLI:NL:RBAMS:2018:424&showbutton=true&keyword=mensenhandel,0.0,['Eerste aanleg - meervoudig'],22-02-2018,2018-02-22T11:52:53Z,gepubliceerd,['Strafrecht'],[],veroordeling voor (medeplegen) mensenhandel door minderjarige. Oplegging PIJ maatregel ondanks niet eensluidende adviezen.,"Rechtbank Amsterdam, 30-01-2018, 13/650146-17",ECLI:NL:RBAMS:2018:424,30-01-2018,uitspraak,"[{'Vindplaats': 'Rechtspraak.nl', 'VindplaatsAnnotator': '', 'VindplaatsUrl': ''}]"
ECLI-NL-RBGEL-2017-6598,http://deeplink.rechtspraak.nl/uitspraak?id=ECLI:NL:RBGEL:2017:6598,uitspraak,De publicatie van de uitspraak staat gepland op 20-12-2017 om 09:48 uur,https://uitspraken.rechtspraak.nl/inziendocument?id=ECLI:NL:RBGEL:2017:6598&showbutton=true&keyword=mensenhandel,0.0,['Eerste aanleg - meervoudig'],20-12-2017,2017-12-20T09:48:46Z,gepubliceerd,['Strafrecht'],[],Veroordeling mensenhandel ten aanzien van een minderjarige en vervaardigen/verspreiden/bezit van kinderporno.,"Rechtbank Gelderland, 19-12-2017, 05/881438-15 + 21/004035-13 (TUL)",ECLI:NL:RBGEL:2017:6598,19-12-2017,uitspraak,"[{'Vindplaats': 'Rechtspraak.nl', 'VindplaatsAnnotator': '', 'VindplaatsUrl': ''}]"
ECLI-NL-GHDHA-2017-269,http://deeplink.rechtspraak.nl/uitspraak?id=ECLI:NL:GHDHA:2017:269,uitspraak,De publicatie van de uitspraak staat gepland op 15-01-2018 om 08:26 uur,https://uitspraken.rechtspraak.nl/inziendocument?id=ECLI:NL:GHDHA:2017:269&showbutton=true&keyword=mensenhandel,0.0,['Hoger beroep'],15-01-2018,2018-01-15T08:26:16Z,gepubliceerd,['Strafrecht'],[],"Mensenhandel. Overweging omvang hoger beroep, na terugwijzing van de zaak door de HR.","Gerechtshof Den Haag, 09-02-2017, 22-002474-16.a",ECLI:NL:GHDHA:2017:269,09-02-2017,uitspraak,"[{'Vindplaats': 'NJFS 2018/115', 'VindplaatsAnnotator': '', 'VindplaatsUrl': ''}, {'Vindplaats': 'Rechtspraak.nl', 'VindplaatsAnnotator': '', 'VindplaatsUrl': ''}]"
ECLI-NL-GHAMS-2016-3144,http://deeplink.rechtspraak.nl/uitspraak?id=ECLI:NL:GHAMS:2016:3144,uitspraak,De publicatie van de uitspraak staat gepland op 03-08-2016 om 13:47 uur,https://uitspraken.rechtspraak.nl/inziendocument?id=ECLI:NL:GHAMS:2016:3144&showbutton=true&keyword=mensenhandel,0.0,['Hoger beroep'],03-08-2016,2016-08-03T13:47:33Z,gepubliceerd,['Strafrecht'],[],"Geen mensenhandel Chinese kok, want (oogmerk van) uitbuiting is niet bewezen. Wel diefstal.","Gerechtshof Amsterdam, 02-08-2016, 23-001610-13",ECLI:NL:GHAMS:2016:3144,02-08-2016,uitspraak,"[{'Vindplaats': 'Rechtspraak.nl', 'VindplaatsAnnotator': '', 'VindplaatsUrl': ''}]"
ECLI-NL-RBAMS-2016-9500,http://deeplink.rechtspraak.nl/uitspraak?id=ECLI:NL:RBAMS:2016:9500,uitspraak,De publicatie van de uitspraak staat gepland op 23-02-2017 om 14:03 uur,https://uitspraken.rechtspraak.nl/inziendocument?id=ECLI:NL:RBAMS:2016:9500&showbutton=true&keyword=mensenhandel,0.0,['Eerste aanleg - meervoudig'],23-02-2017,2017-02-23T14:03:26Z,gepubliceerd,['Strafrecht'],[],"Bewezenverklaring mensenhandel 273f sub 4 en 9, vrijspraak sub 1, 3, 6","Rechtbank Amsterdam, 29-04-2016, 13/708069-10",ECLI:NL:RBAMS:2016:9500,29-04-2016,uitspraak,"[{'Vindplaats': 'Rechtspraak.nl', 'VindplaatsAnnotator': '', 'VindplaatsUrl': ''}]"
ECLI-NL-CRVB-2015-4886,http://deeplink.rechtspraak.nl/uitspraak?id=ECLI:NL:CRVB:2015:4886,uitspraak,De publicatie van de uitspraak staat gepland op 05-01-2016 om 10:10 uur,https://uitspraken.rechtspraak.nl/inziendocument?id=ECLI:NL:CRVB:2015:4886&showbutton=true&keyword=mensenhandel,0.0,['Hoger beroep'],05-01-2016,2016-01-05T10:10:42Z,gepubliceerd,['Bestuursrecht; Socialezekerheidsrecht'],[],"Intrekking en terugvordering bijstandsuitkering. Mensenhandel, prostitutie. Gebruik maken van strafrechtelijk bewijs. Bewijs verklaringen.","Centrale Raad van Beroep, 29-12-2015,  14-2611 WWB",ECLI:NL:CRVB:2015:4886,29-12-2015,uitspraak,"[{'Vindplaats': 'ABkort 2016/30', 'VindplaatsAnnotator': '', 'VindplaatsUrl': ''}, {'Vindplaats': 'JB 2016/50', 'VindplaatsAnnotator': '', 'VindplaatsUrl': ''}, {'Vindplaats': 'USZ 2016/36', 'VindplaatsAnnotator': '', 'VindplaatsUrl': ''}, {'Vindplaats': 'Rechtspraak.nl', 'VindplaatsAnnotator': '', 'VindplaatsUrl': ''}]"
ECLI-NL-RBROT-2015-4091,http://deeplink.rechtspraak.nl/uitspraak?id=ECLI:NL:RBROT:2015:4091,uitspraak,De publicatie van de uitspraak staat gepland op 12-06-2015 om 14:20 uur,https://uitspraken.rechtspraak.nl/inziendocument?id=ECLI:NL:RBROT:2015:4091&showbutton=true&keyword=mensenhandel,0.0,['Eerste aanleg - meervoudig'],12-06-2015,2015-06-12T14:20:51Z,gepubliceerd,['Strafrecht'],[],"Verdachte veroordeeld voor mensenhandel, mishandeling, verboden wapenbezit en dierenmishandeling. Gevangenisstraf 30 maanden onvoorwaardelijk.","Rechtbank Rotterdam, 12-06-2015, 10/731091-14",ECLI:NL:RBROT:2015:4091,12-06-2015,uitspraak,"[{'Vindplaats': 'Rechtspraak.nl', 'VindplaatsAnnotator': '', 'VindplaatsUrl': ''}]"
ECLI-NL-GHARL-2014-10095,http://deeplink.rechtspraak.nl/uitspraak?id=ECLI:NL:GHARL:2014:10095,uitspraak,De publicatie van de uitspraak staat gepland op 13-01-2015 om 13:22 uur,https://uitspraken.rechtspraak.nl/inziendocument?id=ECLI:NL:GHARL:2014:10095&showbutton=true&keyword=mensenhandel,0.0,['Hoger beroep'],13-01-2015,2015-01-13T13:22:55Z,gepubliceerd,['Strafrecht'],[],Veroordeling voor mensenhandel. Artikel 273f Wetboek van Strafrecht. Roemeense straatkrantverkopers in Friesland.,"Gerechtshof Arnhem-Leeuwarden, 23-12-2014, 21-006205-13",ECLI:NL:GHARL:2014:10095,23-12-2014,uitspraak,"[{'Vindplaats': 'Rechtspraak.nl', 'VindplaatsAnnotator': '', 'VindplaatsUrl': ''}]"
ECLI-NL-GHARL-2014-10096,http://deeplink.rechtspraak.nl/uitspraak?id=ECLI:NL:GHARL:2014:10096,uitspraak,De publicatie van de uitspraak staat gepland op 13-01-2015 om 13:23 uur,https://uitspraken.rechtspraak.nl/inziendocument?id=ECLI:NL:GHARL:2014:10096&showbutton=true&keyword=mensenhandel,0.0,['Hoger beroep'],13-01-2015,2015-01-13T13:23:25Z,gepubliceerd,['Strafrecht'],[],"Veroordeling voor mensenhandel Artikel 273f Wetboek van Strafrecht. 
Roemeense straatkrantverkopers in Friesland.","Gerechtshof Arnhem-Leeuwarden, 23-12-2014, 21-006202-13",ECLI:NL:GHARL:2014:10096,23-12-2014,uitspraak,"[{'Vindplaats': 'NJFS 2015/79', 'VindplaatsAnnotator': '', 'VindplaatsUrl': ''}, {'Vindplaats': 'Rechtspraak.nl', 'VindplaatsAnnotator': '', 'VindplaatsUrl': ''}]"
ECLI-NL-GHARL-2014-10097,http://deeplink.rechtspraak.nl/uitspraak?id=ECLI:NL:GHARL:2014:10097,uitspraak,De publicatie van de uitspraak staat gepland op 13-01-2015 om 13:23 uur,https://uitspraken.rechtspraak.nl/inziendocument?id=ECLI:NL:GHARL:2014:10097&showbutton=true&keyword=mensenhandel,0.0,['Hoger beroep'],13-01-2015,2015-01-13T13:23:55Z,gepubliceerd,['Strafrecht'],[],Veroordeling voor mensenhandel. Artikel 273f Wetboek van Strafrecht. Roemeense straatkrantverkopers in Friesland.,"Gerechtshof Arnhem-Leeuwarden, 23-12-2014, 21-006203-13",ECLI:NL:GHARL:2014:10097,23-12-2014,uitspraak,"[{'Vindplaats': 'Rechtspraak.nl', 'VindplaatsAnnotator': '', 'VindplaatsUrl': ''}]"
ECLI-NL-GHARL-2014-8688,http://deeplink.rechtspraak.nl/uitspraak?id=ECLI:NL:GHARL:2014:8688,uitspraak,De publicatie van de uitspraak staat gepland op 12-11-2014 om 13:57 uur,https://uitspraken.rechtspraak.nl/inziendocument?id=ECLI:NL:GHARL:2014:8688&showbutton=true&keyword=mensenhandel,0.0,['Hoger beroep'],12-11-2014,2014-11-12T13:57:36Z,gepubliceerd,['Strafrecht'],[],"Mensenhandel gedurende een aantal jaren ten aanzien van drie personen, vier jaar gevangenisstraf.","Gerechtshof Arnhem-Leeuwarden, 05-11-2014, ks 21-004261-14",ECLI:NL:GHARL:2014:8688,05-11-2014,uitspraak,"[{'Vindplaats': 'Rechtspraak.nl', 'VindplaatsAnnotator': '', 'VindplaatsUrl': ''}]"
ECLI-NL-GHARL-2013-8923,http://deeplink.rechtspraak.nl/uitspraak?id=ECLI:NL:GHARL:2013:8923,uitspraak,De publicatie van de uitspraak staat gepland op 25-11-2013 om 15:00 uur,https://uitspraken.rechtspraak.nl/inziendocument?id=ECLI:NL:GHARL:2013:8923&showbutton=true&keyword=mensenhandel,0.0,['Hoger beroep'],25-11-2013,2013-11-25T15:00:22Z,gepubliceerd,['Strafrecht'],"[{'RelatieOmschrijving': 'Eerste aanleg: ', 'LinkTekst': 'ECLI:NL:RBALM:2011:190', 'Postfix': ', Bekrachtiging/bevestiging', 'WebAdres': 'https://uitspraken.rechtspraak.nl/inziendocument?id=ECLI:NL:RBALM:2011:190&showbutton=true&keyword=mensenhandel'}]",Uitspraak Sneep 2. Bevestiging vonnis rechtbank. Vrijspraak mensenhandel en deelname aan criminele organisatie.,"Gerechtshof Arnhem-Leeuwarden, 22-11-2013, 21-000902-11",ECLI:NL:GHARL:2013:8923,22-11-2013,uitspraak,"[{'Vindplaats': 'Rechtspraak.nl', 'VindplaatsAnnotator': '', 'VindplaatsUrl': ''}]"
ECLI-NL-GHARL-2013-8522,http://deeplink.rechtspraak.nl/uitspraak?id=ECLI:NL:GHARL:2013:8522,uitspraak,De publicatie van de uitspraak staat gepland op 19-11-2013 om 13:24 uur,https://uitspraken.rechtspraak.nl/inziendocument?id=ECLI:NL:GHARL:2013:8522&showbutton=true&keyword=mensenhandel,0.0,['Hoger beroep'],19-11-2013,2013-11-19T13:24:50Z,gepubliceerd,['Strafrecht'],"[{'RelatieOmschrijving': 'Eerste aanleg: ', 'LinkTekst': 'ECLI:NL:RBUTR:2011:BQ6884', 'Postfix': ', Meerdere afhandelingswijzen', 'WebAdres': 'https://uitspraken.rechtspraak.nl/inziendocument?id=ECLI:NL:RBUTR:2011:BQ6884&showbutton=true&keyword=mensenhandel'}, {'RelatieOmschrijving': 'Cassatie: ', 'LinkTekst': 'ECLI:NL:HR:2015:1100', 'Postfix': ', (Gedeeltelijke) vernietiging en zelf afgedaan', 'WebAdres': 'https://uitspraken.rechtspraak.nl/inziendocument?id=ECLI:NL:HR:2015:1100&showbutton=true&keyword=mensenhandel'}]",Mensenhandel ten aanzien van twee vrouwen. Hof legt gevangenisstraf van 5 jaren op.,"Gerechtshof Arnhem-Leeuwarden, 08-11-2013, 21-002116-11",ECLI:NL:GHARL:2013:8522,08-11-2013,uitspraak,"[{'Vindplaats': 'Rechtspraak.nl', 'VindplaatsAnnotator': '', 'VindplaatsUrl': ''}]"
ECLI-NL-RBUTR-2011-BU4728,http://deeplink.rechtspraak.nl/uitspraak?id=ECLI:NL:RBUTR:2011:BU4728,uitspraak,De publicatie van de uitspraak staat gepland op 16-11-2011 om 16:50 uur,https://uitspraken.rechtspraak.nl/inziendocument?id=ECLI:NL:RBUTR:2011:BU4728&showbutton=true&keyword=mensenhandel,0.0,['Eerste aanleg - meervoudig'],16-11-2011,2011-11-16T16:50:08Z,gepubliceerd,['Strafrecht'],[],Veroordeling voor verschillende in de wet strafbaar gestelde varianten van mensenhandel en mensensmokkel.,"Rechtbank Utrecht, 11-11-2011, 16/711613-09 [P]",ECLI:NL:RBUTR:2011:BU4728,11-11-2011,uitspraak,"[{'Vindplaats': 'Rechtspraak.nl', 'VindplaatsAnnotator': '', 'VindplaatsUrl': ''}]"
ECLI-NL-RBUTR-2008-BD7426,http://deeplink.rechtspraak.nl/uitspraak?id=ECLI:NL:RBUTR:2008:BD7426,uitspraak,De publicatie van de uitspraak staat gepland op 16-07-2008 om 16:54 uur,https://uitspraken.rechtspraak.nl/inziendocument?id=ECLI:NL:RBUTR:2008:BD7426&showbutton=true&keyword=mensenhandel,0.0,['Eerste aanleg - meervoudig'],16-07-2008,2008-07-16T16:54:19Z,gepubliceerd,"['Civiel recht', 'Strafrecht']",[],"Mensenhandel - het verrichten van arbeid en diensten. Uitleg begrip ""uitbuiting"". Ambtshalve opleggen schadevergoedingsmaatregel.","Rechtbank Utrecht, 17-06-2008, 16-600243-08",ECLI:NL:RBUTR:2008:BD7426,17-06-2008,uitspraak,"[{'Vindplaats': 'Rechtspraak.nl', 'VindplaatsAnnotator': '', 'VindplaatsUrl': ''}]"
ECLI-NL-RBAMS-2018-7834,http://deeplink.rechtspraak.nl/uitspraak?id=ECLI:NL:RBAMS:2018:7834,uitspraak,De publicatie van de uitspraak staat gepland op 02-11-2018 om 12:00 uur,https://uitspraken.rechtspraak.nl/inziendocument?id=ECLI:NL:RBAMS:2018:7834&showbutton=true&keyword=mensenhandel,0.0,['Eerste aanleg - meervoudig'],02-11-2018,2018-11-02T12:00:09Z,gepubliceerd,['Strafrecht'],[],De rechtbank spreekt verdachte vrij van mensenhandel ten aanzien van een meerderjarige vrouw. Verdachte wordt wel veroordeeld voor mensenhandel ten aanzien van een minderjarige vrouw tot een gevangenisstraf gelijk aan de duur van het voorarrest (2 dagen) en een voorwaardelijke gevangenisstraf van een jaar met de nodige bijzondere voorwaarden.,"Rechtbank Amsterdam, 01-11-2018, 13/728110-17",ECLI:NL:RBAMS:2018:7834,01-11-2018,uitspraak,"[{'Vindplaats': 'Rechtspraak.nl', 'VindplaatsAnnotator': '', 'VindplaatsUrl': ''}]"
ECLI-NL-GHARL-2015-8966,http://deeplink.rechtspraak.nl/uitspraak?id=ECLI:NL:GHARL:2015:8966,uitspraak,De publicatie van de uitspraak staat gepland op 31-12-2015 om 08:48 uur,https://uitspraken.rechtspraak.nl/inziendocument?id=ECLI:NL:GHARL:2015:8966&showbutton=true&keyword=mensenhandel,0.0,['Hoger beroep'],31-12-2015,2015-12-31T08:48:13Z,gepubliceerd,['Strafrecht'],[],"Mensenhandel, seksuele uitbuiting. De door de raadsvrouw gevoerde betrouwbaarheids- en bewijsverweren worden verworpen. Verdachte wordt ter zake van mensenhandel gepleegd jegens vijf slachtoffers – in verschillende combinaties van sub 1, 4, 9 en/of 6 van artikel 273f – veroordeeld tot een gevangenisstraf voor de duur van 5 jaren.","Gerechtshof Arnhem-Leeuwarden, 25-11-2015, 21-004324-15",ECLI:NL:GHARL:2015:8966,25-11-2015,uitspraak,"[{'Vindplaats': 'Rechtspraak.nl', 'VindplaatsAnnotator': '', 'VindplaatsUrl': ''}]"
ECLI-NL-HR-2019-40,http://deeplink.rechtspraak.nl/uitspraak?id=ECLI:NL:HR:2019:40,uitspraak,De publicatie van de uitspraak staat gepland op 15-01-2019 om 12:42 uur,https://uitspraken.rechtspraak.nl/inziendocument?id=ECLI:NL:HR:2019:40&showbutton=true&keyword=mensenhandel,0.0,['Cassatie'],15-01-2019,2019-01-15T12:42:33Z,gepubliceerd,['Strafrecht'],"[{'RelatieOmschrijving': 'Conclusie: ', 'LinkTekst': 'ECLI:NL:PHR:2018:1449', 'Postfix': None, 'WebAdres': 'https://uitspraken.rechtspraak.nl/inziendocument?id=ECLI:NL:PHR:2018:1449&showbutton=true&keyword=mensenhandel'}, {'RelatieOmschrijving': 'In cassatie op : ', 'LinkTekst': 'ECLI:NL:GHDHA:2017:1524', 'Postfix': ', Meerdere afhandelingswijzen', 'WebAdres': 'https://uitspraken.rechtspraak.nl/inziendocument?id=ECLI:NL:GHDHA:2017:1524&showbutton=true&keyword=mensenhandel'}]","Voortgezette handeling van medeplegen mensenhandel m.b.t. persoon onder 16 jaren, medeplegen mensenhandel m.b.t. persoon onder 18 jaren en medeplegen mensenhandel door samen met haar man minderjarig nichtje uit Turkije illegaal in huis te nemen en haar jarenlang buitensporig en excessief te belasten met huishoudelijke taken en verzorging van hun kinderen, art. 273f.1. en 273f.3 Sr. Oogmerk van uitbuiting? Op gronden vermeld in ECLI:NL:HR:2019:39 kan middel niet tot cassatie leiden. Volgt verwerping.","Hoge Raad, 15-01-2019, 17/02699",ECLI:NL:HR:2019:40,15-01-2019,uitspraak,"[{'Vindplaats': 'SR-Updates.nl 2019-0008', 'VindplaatsAnnotator': '', 'VindplaatsUrl': ''}, {'Vindplaats': 'RvdW 2019/170', 'VindplaatsAnnotator': '', 'VindplaatsUrl': ''}, {'Vindplaats': 'Rechtspraak.nl', 'VindplaatsAnnotator': '', 'VindplaatsUrl': ''}]"
ECLI-NL-PHR-2018-1449,http://deeplink.rechtspraak.nl/uitspraak?id=ECLI:NL:PHR:2018:1449,conclusie,De publicatie van de uitspraak staat gepland op 16-01-2019 om 10:19 uur,https://uitspraken.rechtspraak.nl/inziendocument?id=ECLI:NL:PHR:2018:1449&showbutton=true&keyword=mensenhandel,0.0,[],16-01-2019,2019-01-16T10:19:51Z,gepubliceerd,['Strafrecht'],"[{'RelatieOmschrijving': 'Arrest Hoge Raad: ', 'LinkTekst': 'ECLI:NL:HR:2019:40', 'Postfix': None, 'WebAdres': 'https://uitspraken.rechtspraak.nl/inziendocument?id=ECLI:NL:HR:2019:40&showbutton=true&keyword=mensenhandel'}]","Voortgezette handeling van medeplegen mensenhandel m.b.t. persoon onder 16 jaren, medeplegen mensenhandel m.b.t. persoon onder 18 jaren en medeplegen mensenhandel door samen met haar man minderjarig nichtje uit Turkije illegaal in huis te nemen en haar jarenlang buitensporig en excessief te belasten met huishoudelijke taken en verzorging van hun kinderen, art. 273f.1. en 273f.3 Sr. Oogmerk van uitbuiting? Op gronden vermeld in ECLI:NL:HR:2019:39 kan middel niet tot cassatie leiden. Volgt verwerping.","Parket bij de Hoge Raad, 06-11-2018, 17/02699",ECLI:NL:PHR:2018:1449,06-11-2018,conclusie,"[{'Vindplaats': 'Rechtspraak.nl', 'VindplaatsAnnotator': '', 'VindplaatsUrl': ''}]"
ECLI-NL-RBUTR-2012-BW2312,http://deeplink.rechtspraak.nl/uitspraak?id=ECLI:NL:RBUTR:2012:BW2312,uitspraak,De publicatie van de uitspraak staat gepland op 13-04-2012 om 14:47 uur,https://uitspraken.rechtspraak.nl/inziendocument?id=ECLI:NL:RBUTR:2012:BW2312&showbutton=true&keyword=mensenhandel,0.0,['Eerste aanleg - meervoudig'],13-04-2012,2012-04-13T14:47:13Z,gepubliceerd,['Strafrecht'],[],"Verdenking van mensenhandel ten aanzien van twee personen. De rechtbank spreekt verdachte vrij van mensenhandel ten aanzien van één persoon. Verdachte heeft zich gedurende een periode van ongeveer vijf maanden ten aanzien van het slachtoffer schuldig gemaakt aan mensenhandel. Het slachtoffer was een kwetsbare en beïnvloedbare vrouw. Verdachte onderhield een relatie met haar en leefde met haar samen in zijn woning en hij heeft haar op die manier emotioneel afhankelijk van hem gemaakt. De rechtbank veroordeelt verdachte tot een gevangenisstraf van 24 maanden, waarvan 4 maanden voorwaardelijk.","Rechtbank Utrecht, 06-04-2012, 16-710739-11",ECLI:NL:RBUTR:2012:BW2312,06-04-2012,uitspraak,"[{'Vindplaats': 'Rechtspraak.nl', 'VindplaatsAnnotator': '', 'VindplaatsUrl': ''}]"
ECLI-NL-RBDHA-2019-6639,http://deeplink.rechtspraak.nl/uitspraak?id=ECLI:NL:RBDHA:2019:6639,uitspraak,De publicatie van de uitspraak staat gepland op 23-07-2019 om 14:35 uur,https://uitspraken.rechtspraak.nl/inziendocument?id=ECLI:NL:RBDHA:2019:6639&showbutton=true&keyword=mensenhandel,0.0,"['Eerste aanleg - enkelvoudig', 'Voorlopige voorziening']",23-07-2019,2019-07-23T14:35:11Z,gepubliceerd,['Bestuursrecht; Vreemdelingenrecht'],[],"Dublin Italie, buiten zitting uitspraak gedaan, eiser heeft nog geen aangifte van mensenhandel gedaan","Rechtbank Den Haag, 27-06-2019, NL19.13210 & NL19.13211",ECLI:NL:RBDHA:2019:6639,27-06-2019,uitspraak,"[{'Vindplaats': 'Rechtspraak.nl', 'VindplaatsAnnotator': '', 'VindplaatsUrl': ''}]"
ECLI-NL-RBDHA-2019-1328,http://deeplink.rechtspraak.nl/uitspraak?id=ECLI:NL:RBDHA:2019:1328,uitspraak,De publicatie van de uitspraak staat gepland op 22-03-2019 om 10:08 uur,https://uitspraken.rechtspraak.nl/inziendocument?id=ECLI:NL:RBDHA:2019:1328&showbutton=true&keyword=mensenhandel,0.0,['Eerste aanleg - enkelvoudig'],22-03-2019,2019-03-22T10:08:52Z,gepubliceerd,['Bestuursrecht; Vreemdelingenrecht'],[],"asiel, verklaringen over mensenhandel en seksuele gerichtheid niet ten onrechte ongeloofwaardig bevonden, beroep ongegrond","Rechtbank Den Haag, 14-02-2019, NL18.5419",ECLI:NL:RBDHA:2019:1328,14-02-2019,uitspraak,"[{'Vindplaats': 'Rechtspraak.nl', 'VindplaatsAnnotator': '', 'VindplaatsUrl': ''}]"
ECLI-NL-GHARL-2018-11733,http://deeplink.rechtspraak.nl/uitspraak?id=ECLI:NL:GHARL:2018:11733,uitspraak,De publicatie van de uitspraak staat gepland op 30-01-2020 om 11:56 uur,https://uitspraken.rechtspraak.nl/inziendocument?id=ECLI:NL:GHARL:2018:11733&showbutton=true&keyword=mensenhandel,0.0,['Hoger beroep'],30-01-2020,2020-01-30T11:56:34Z,gepubliceerd,['Strafrecht'],[],"Mensenhandel. Uitbuiting van Bulgaarse prostituees. Formele verweren ex art. 3, 5 en 6 EVRM.","Gerechtshof Arnhem-Leeuwarden, 01-08-2018, 21-006875-16",ECLI:NL:GHARL:2018:11733,01-08-2018,uitspraak,"[{'Vindplaats': 'Rechtspraak.nl', 'VindplaatsAnnotator': '', 'VindplaatsUrl': ''}]"
ECLI-NL-RBAMS-2018-5010,http://deeplink.rechtspraak.nl/uitspraak?id=ECLI:NL:RBAMS:2018:5010,uitspraak,De publicatie van de uitspraak staat gepland op 17-07-2018 om 14:36 uur,https://uitspraken.rechtspraak.nl/inziendocument?id=ECLI:NL:RBAMS:2018:5010&showbutton=true&keyword=mensenhandel,0.0,"['Eerste aanleg - meervoudig', 'Op tegenspraak']",17-07-2018,2018-07-17T14:36:15Z,gepubliceerd,['Strafrecht'],[],Poging tot medeplegen van mensenhandel. Minderjarig slachtoffer. Gevangenisstraf van 8 maanden waarvan 4 voorwaardelijk.,"Rechtbank Amsterdam, 12-07-2018, 13/680012-16",ECLI:NL:RBAMS:2018:5010,12-07-2018,uitspraak,"[{'Vindplaats': 'Rechtspraak.nl', 'VindplaatsAnnotator': '', 'VindplaatsUrl': ''}]"
ECLI-NL-RBDHA-2018-4482,http://deeplink.rechtspraak.nl/uitspraak?id=ECLI:NL:RBDHA:2018:4482,uitspraak,De publicatie van de uitspraak staat gepland op 18-04-2018 om 10:04 uur,https://uitspraken.rechtspraak.nl/inziendocument?id=ECLI:NL:RBDHA:2018:4482&showbutton=true&keyword=mensenhandel,0.0,['Voorlopige voorziening'],18-04-2018,2018-04-18T10:04:10Z,gepubliceerd,['Bestuursrecht; Vreemdelingenrecht'],[],"Dublin, aangifte mensenhandel, politieonderzoek loopt nog, verweerder verzet zich niet tegen toewijzing voorlopige voorziening","Rechtbank Den Haag, 05-04-2018, NL18.5468",ECLI:NL:RBDHA:2018:4482,05-04-2018,uitspraak,"[{'Vindplaats': 'Rechtspraak.nl', 'VindplaatsAnnotator': '', 'VindplaatsUrl': ''}]"
ECLI-NL-RBLIM-2017-1741,http://deeplink.rechtspraak.nl/uitspraak?id=ECLI:NL:RBLIM:2017:1741,uitspraak,De publicatie van de uitspraak staat gepland op 01-03-2017 om 14:45 uur,https://uitspraken.rechtspraak.nl/inziendocument?id=ECLI:NL:RBLIM:2017:1741&showbutton=true&keyword=mensenhandel,0.0,['Eerste aanleg - meervoudig'],01-03-2017,2017-03-01T14:45:34Z,gepubliceerd,['Strafrecht'],[],"Specialiteitsbeginsel; ontvankelijkheid officier van justitie; Europees Aanhoudingsbevel
mensenhandel: uitbuiting van katvangers afkomstig uit Aruba","Rechtbank Limburg, 21-02-2017, 04/800022-11",ECLI:NL:RBLIM:2017:1741,21-02-2017,uitspraak,"[{'Vindplaats': 'Rechtspraak.nl', 'VindplaatsAnnotator': '', 'VindplaatsUrl': ''}]"
ECLI-NL-GHAMS-2016-409,http://deeplink.rechtspraak.nl/uitspraak?id=ECLI:NL:GHAMS:2016:409,uitspraak,De publicatie van de uitspraak staat gepland op 09-02-2016 om 09:42 uur,https://uitspraken.rechtspraak.nl/inziendocument?id=ECLI:NL:GHAMS:2016:409&showbutton=true&keyword=mensenhandel,0.0,['Hoger beroep'],09-02-2016,2016-02-09T09:42:54Z,gepubliceerd,['Strafrecht'],[],"Mensenhandel, gewoontewitwassen. Verweren omtrent betrouwbaarheid aangeefster en bewijsminimum. Vordering benadeelde partij, berekening materiële schade.","Gerechtshof Amsterdam, 04-02-2016, 23-002995-14",ECLI:NL:GHAMS:2016:409,04-02-2016,uitspraak,"[{'Vindplaats': 'Rechtspraak.nl', 'VindplaatsAnnotator': '', 'VindplaatsUrl': ''}]"
ECLI-NL-GHARL-2015-7181,http://deeplink.rechtspraak.nl/uitspraak?id=ECLI:NL:GHARL:2015:7181,uitspraak,De publicatie van de uitspraak staat gepland op 25-09-2015 om 13:52 uur,https://uitspraken.rechtspraak.nl/inziendocument?id=ECLI:NL:GHARL:2015:7181&showbutton=true&keyword=mensenhandel,0.0,['Hoger beroep'],25-09-2015,2015-09-25T13:52:52Z,gepubliceerd,['Strafrecht'],[],Vrijspraak mensenhandel; geen bewijs voor ‘uit feitelijke omstandigheden voortvloeiend overwicht’ en ‘misbruik van omstandigheden’.,"Gerechtshof Arnhem-Leeuwarden, 25-09-2015, 21-004143-14",ECLI:NL:GHARL:2015:7181,25-09-2015,uitspraak,"[{'Vindplaats': 'Rechtspraak.nl', 'VindplaatsAnnotator': '', 'VindplaatsUrl': ''}]"
ECLI-NL-GHAMS-2014-4019,http://deeplink.rechtspraak.nl/uitspraak?id=ECLI:NL:GHAMS:2014:4019,uitspraak,De publicatie van de uitspraak staat gepland op 13-07-2017 om 12:11 uur,https://uitspraken.rechtspraak.nl/inziendocument?id=ECLI:NL:GHAMS:2014:4019&showbutton=true&keyword=mensenhandel,0.0,['Hoger beroep'],13-07-2017,2017-07-13T12:11:52Z,gepubliceerd,['Strafrecht'],[],"mensenhandel, in vereniging, opzettelijk gebruik maken van een niet op naam vd gesteld reisdocument","Gerechtshof Amsterdam, 20-01-2014, 23-005442-11",ECLI:NL:GHAMS:2014:4019,20-01-2014,uitspraak,"[{'Vindplaats': 'Rechtspraak.nl', 'VindplaatsAnnotator': '', 'VindplaatsUrl': ''}]"
ECLI-NL-GHARL-2013-8972,http://deeplink.rechtspraak.nl/uitspraak?id=ECLI:NL:GHARL:2013:8972,uitspraak,De publicatie van de uitspraak staat gepland op 26-11-2013 om 14:17 uur,https://uitspraken.rechtspraak.nl/inziendocument?id=ECLI:NL:GHARL:2013:8972&showbutton=true&keyword=mensenhandel,0.0,['Hoger beroep'],26-11-2013,2013-11-26T14:17:19Z,gepubliceerd,['Strafrecht'],"[{'RelatieOmschrijving': 'Eerste aanleg: ', 'LinkTekst': 'ECLI:NL:RBUTR:2011:BP5092', 'Postfix': ', Meerdere afhandelingswijzen', 'WebAdres': 'https://uitspraken.rechtspraak.nl/inziendocument?id=ECLI:NL:RBUTR:2011:BP5092&showbutton=true&keyword=mensenhandel'}, {'RelatieOmschrijving': 'Cassatie: ', 'LinkTekst': 'ECLI:NL:HR:2015:2470', 'Postfix': ', Niet ontvankelijk', 'WebAdres': 'https://uitspraken.rechtspraak.nl/inziendocument?id=ECLI:NL:HR:2015:2470&showbutton=true&keyword=mensenhandel'}]",Sneep 2. Bevestiging vonnis rechtbank. Veroordeling mensenhandel en deelname aan criminele organisatie. Vrijspraak afpersing.,"Gerechtshof Arnhem-Leeuwarden, 22-11-2013, 21-000881-11",ECLI:NL:GHARL:2013:8972,22-11-2013,uitspraak,"[{'Vindplaats': 'Rechtspraak.nl', 'VindplaatsAnnotator': '', 'VindplaatsUrl': ''}]"
ECLI-NL-GHAMS-2013-3998,http://deeplink.rechtspraak.nl/uitspraak?id=ECLI:NL:GHAMS:2013:3998,uitspraak,De publicatie van de uitspraak staat gepland op 02-06-2014 om 09:29 uur,https://uitspraken.rechtspraak.nl/inziendocument?id=ECLI:NL:GHAMS:2013:3998&showbutton=true&keyword=mensenhandel,0.0,['Hoger beroep'],02-06-2014,2014-06-02T09:29:25Z,gepubliceerd,['Strafrecht'],"[{'RelatieOmschrijving': 'Eerste aanleg: ', 'LinkTekst': 'ECLI:NL:RBHAA:2011:BR2862', 'Postfix': ', (Gedeeltelijke) vernietiging en zelf afgedaan', 'WebAdres': 'https://uitspraken.rechtspraak.nl/inziendocument?id=ECLI:NL:RBHAA:2011:BR2862&showbutton=true&keyword=mensenhandel'}]",Mensenhandel: drie jonge vrouwen gebracht tot prostitutie en het (gedeeltelijk) afstaan van hun verdiensten.,"Gerechtshof Amsterdam, 13-11-2013, 23-003257-11",ECLI:NL:GHAMS:2013:3998,13-11-2013,uitspraak,"[{'Vindplaats': 'Rechtspraak.nl', 'VindplaatsAnnotator': '', 'VindplaatsUrl': ''}]"
ECLI-NL-RBMAA-2012-BY3177,http://deeplink.rechtspraak.nl/uitspraak?id=ECLI:NL:RBMAA:2012:BY3177,uitspraak,De publicatie van de uitspraak staat gepland op 14-11-2012 om 15:51 uur,https://uitspraken.rechtspraak.nl/inziendocument?id=ECLI:NL:RBMAA:2012:BY3177&showbutton=true&keyword=mensenhandel,0.0,['Eerste aanleg - meervoudig'],14-11-2012,2012-11-14T15:51:07Z,gepubliceerd,['Strafrecht'],[],Onderzoek Krokodilvis. Integrale vrijspraak. Geen bewijs voor het (mede)plegen van mensenhandel of mensensmokkel.,"Rechtbank Maastricht, 14-11-2012, 03/703807-09",ECLI:NL:RBMAA:2012:BY3177,14-11-2012,uitspraak,"[{'Vindplaats': 'Rechtspraak.nl', 'VindplaatsAnnotator': '', 'VindplaatsUrl': ''}]"
ECLI-NL-RBLEE-2011-BR1294,http://deeplink.rechtspraak.nl/uitspraak?id=ECLI:NL:RBLEE:2011:BR1294,uitspraak,De publicatie van de uitspraak staat gepland op 12-07-2011 om 14:15 uur,https://uitspraken.rechtspraak.nl/inziendocument?id=ECLI:NL:RBLEE:2011:BR1294&showbutton=true&keyword=mensenhandel,0.0,['Eerste aanleg - meervoudig'],12-07-2011,2011-07-12T14:15:52Z,gepubliceerd,['Strafrecht'],[],"Mensenhandel, uitingen die de verklaringsvrijheid van personen kunnen belemmeren, valsheid in geschrifte, prostitutie, uitbuiting","Rechtbank Leeuwarden, 12-07-2011, 17/924146-10 PROM",ECLI:NL:RBLEE:2011:BR1294,12-07-2011,uitspraak,"[{'Vindplaats': 'Rechtspraak.nl', 'VindplaatsAnnotator': '', 'VindplaatsUrl': ''}]"
ECLI-NL-RBAMS-2009-BU7805,http://deeplink.rechtspraak.nl/uitspraak?id=ECLI:NL:RBAMS:2009:BU7805,uitspraak,De publicatie van de uitspraak staat gepland op 13-12-2011 om 16:19 uur,https://uitspraken.rechtspraak.nl/inziendocument?id=ECLI:NL:RBAMS:2009:BU7805&showbutton=true&keyword=mensenhandel,0.0,['Eerste aanleg - meervoudig'],13-12-2011,2011-12-13T16:19:22Z,gepubliceerd,['Strafrecht'],[],Verdachte wordt veroordeeld voor mensenhandel tot 200 uur werkstraf en 5 maanden voorwaardelijke gevangenisstraf.,"Rechtbank Amsterdam, 15-04-2009, 13-525018-05",ECLI:NL:RBAMS:2009:BU7805,15-04-2009,uitspraak,"[{'Vindplaats': 'Rechtspraak.nl', 'VindplaatsAnnotator': '', 'VindplaatsUrl': ''}]"
ECLI-NL-RBARN-2008-BD0634,http://deeplink.rechtspraak.nl/uitspraak?id=ECLI:NL:RBARN:2008:BD0634,uitspraak,De publicatie van de uitspraak staat gepland op 29-04-2008 om 09:23 uur,https://uitspraken.rechtspraak.nl/inziendocument?id=ECLI:NL:RBARN:2008:BD0634&showbutton=true&keyword=mensenhandel,0.0,['Eerste aanleg - meervoudig'],29-04-2008,2008-04-29T09:23:14Z,gepubliceerd,['Strafrecht'],[],"Mensenhandel en mishandeling, verdachte veroordeeld tot gevangenisstraf van 30 maanden waarvan 6 maanden voorwaardelijk.","Rechtbank Arnhem, 29-04-2008, 05/500390-08",ECLI:NL:RBARN:2008:BD0634,29-04-2008,uitspraak,"[{'Vindplaats': 'Rechtspraak.nl', 'VindplaatsAnnotator': '', 'VindplaatsUrl': ''}]"
ECLI-NL-GHAMS-2004-AT7235,http://deeplink.rechtspraak.nl/uitspraak?id=ECLI:NL:GHAMS:2004:AT7235,uitspraak,De publicatie van de uitspraak staat gepland op 10-06-2005 om 16:21 uur,https://uitspraken.rechtspraak.nl/inziendocument?id=ECLI:NL:GHAMS:2004:AT7235&showbutton=true&keyword=mensenhandel,0.0,['Hoger beroep'],10-06-2005,2005-06-10T16:21:08Z,gepubliceerd,['Strafrecht'],[],"Veroordeling tot 6 jaar gevangenisstraf wegens (onder meer) zware mishandeling, wederrechtelijke vrijheidsberoving en mensenhandel.","Gerechtshof Amsterdam, 23-09-2004, 23-003430-03",ECLI:NL:GHAMS:2004:AT7235,23-09-2004,uitspraak,"[{'Vindplaats': 'Rechtspraak.nl', 'VindplaatsAnnotator': '', 'VindplaatsUrl': ''}]"
ECLI-NL-RBARN-2004-AO4798,http://deeplink.rechtspraak.nl/uitspraak?id=ECLI:NL:RBARN:2004:AO4798,uitspraak,De publicatie van de uitspraak staat gepland op 02-03-2004 om 15:17 uur,https://uitspraken.rechtspraak.nl/inziendocument?id=ECLI:NL:RBARN:2004:AO4798&showbutton=true&keyword=mensenhandel,0.0,['Eerste aanleg - meervoudig'],02-03-2004,2004-03-02T15:17:28Z,gepubliceerd,['Strafrecht'],[],Drie jaar gevangenisstraf waarvan  één jaar voorwaardelijk voor mensenhandel en strafbare axploitatie van prostitutie.,"Rechtbank Arnhem, 20-02-2004, 05/090330-00",ECLI:NL:RBARN:2004:AO4798,20-02-2004,uitspraak,"[{'Vindplaats': 'Rechtspraak.nl', 'VindplaatsAnnotator': '', 'VindplaatsUrl': ''}]"
ECLI-NL-RBROT-2019-5094,http://deeplink.rechtspraak.nl/uitspraak?id=ECLI:NL:RBROT:2019:5094,uitspraak,De publicatie van de uitspraak staat gepland op 27-06-2019 om 11:00 uur,https://uitspraken.rechtspraak.nl/inziendocument?id=ECLI:NL:RBROT:2019:5094&showbutton=true&keyword=mensenhandel,0.0,['Eerste aanleg - meervoudig'],27-06-2019,2019-06-27T11:00:09Z,gepubliceerd,['Strafrecht'],[],"Medeplichtigheid aan mensenhandel ten aanzien van Roemeense prostituees. Mensenhandel is een zeer vergaande manier van uitbuiting, waarbij de lichamelijke en geestelijke integriteit van de slachtoffers geheel ondergeschikt wordt gemaakt aan het geldelijk gewin van de daders. Kennis van de uitbuiting had verdachte moeten weerhouden om onderdak en chauffeursdiensten te verschaffen.","Rechtbank Rotterdam, 27-06-2019, 10/750020-18",ECLI:NL:RBROT:2019:5094,27-06-2019,uitspraak,"[{'Vindplaats': 'Rechtspraak.nl', 'VindplaatsAnnotator': '', 'VindplaatsUrl': ''}]"
ECLI-NL-RBOBR-2020-5691,http://deeplink.rechtspraak.nl/uitspraak?id=ECLI:NL:RBOBR:2020:5691,uitspraak,De publicatie van de uitspraak staat gepland op 17-11-2020 om 08:18 uur,https://uitspraken.rechtspraak.nl/inziendocument?id=ECLI:NL:RBOBR:2020:5691&showbutton=true&keyword=mensenhandel,0.0,['Eerste aanleg - meervoudig'],17-11-2020,2020-11-17T08:18:10Z,gepubliceerd,['Strafrecht'],[],"Verdachte wordt veroordeeld voor mensenhandel [vriendin dwingen tot prostitutie],  verkrachting van een dertienjarig meisje en mishandeling. De rechtbank legt verdachte een onvoorwaardelijke gevangenisstraf van 42 maanden op en de maatregel van terbeschikkingstelling met verpleging van overheidswege.
Daarnaast legt de rechtbank verdachte een contactverbod op met de slachtoffers van de mensenhandel en de verkrachting. Deze maatregelen zijn dadelijk uitvoerbaar verklaard. De vorderingen die de slachtoffers van de mensenhandel en de verkrachting als benadeelde partijen hebben ingediend worden [gedeeltelijk] toegewezen. Het immateriële gedeelte van de schadevergoeding bedraagt voor elk van hen € 7.500,--.","Rechtbank Oost-Brabant, 11-11-2020, 01-225238-19",ECLI:NL:RBOBR:2020:5691,11-11-2020,uitspraak,"[{'Vindplaats': 'Rechtspraak.nl', 'VindplaatsAnnotator': '', 'VindplaatsUrl': ''}]"
ECLI-NL-RBHAA-2011-BR2945,http://deeplink.rechtspraak.nl/uitspraak?id=ECLI:NL:RBHAA:2011:BR2945,uitspraak,De publicatie van de uitspraak staat gepland op 26-07-2011 om 18:46 uur,https://uitspraken.rechtspraak.nl/inziendocument?id=ECLI:NL:RBHAA:2011:BR2945&showbutton=true&keyword=mensenhandel,0.0,['Eerste aanleg - meervoudig'],26-07-2011,2011-07-26T18:46:53Z,gepubliceerd,['Strafrecht'],[],"Onderzoek Maas: Onderzoek gericht op mensenhandel (loverboy praktijken) in Purmerend.
De rechtbank heeft bewezen verklaard dat verdachte zich wat betreft twee jonge vrouwen heeft schuldig gemaakt aan mensenhandel. Verdachte wordt veroordeeld tot een gevangenisstraf voor de duur van drie jaren. 
Verwerping verweer dat dagvaarding partieel nietig is.
Bewijsoverwegingen, waarbij aandacht wordt besteed aan het toetsingskader bij mensenhandel (artikel 273f van het Wetboek van Strafrecht) en de betrouwbaarheid en de geloofwaardigheid van (de verklaringen van) de slachtoffers in deze zaak.
Beslissing op de vordering van de benadeelde partij.","Rechtbank Haarlem, 21-07-2011, 15/741375-10",ECLI:NL:RBHAA:2011:BR2945,21-07-2011,uitspraak,"[{'Vindplaats': 'Rechtspraak.nl', 'VindplaatsAnnotator': '', 'VindplaatsUrl': ''}]"
ECLI-NL-RBDHA-2021-6502,http://deeplink.rechtspraak.nl/uitspraak?id=ECLI:NL:RBDHA:2021:6502,uitspraak,De publicatie van de uitspraak staat gepland op 02-07-2021 om 09:00 uur,https://uitspraken.rechtspraak.nl/inziendocument?id=ECLI:NL:RBDHA:2021:6502&showbutton=true&keyword=mensenhandel,0.0,['Eerste aanleg - enkelvoudig'],02-07-2021,2021-07-02T09:00:12.647Z,gepubliceerd,['Bestuursrecht; Vreemdelingenrecht'],[],"vreemdelingenrecht regulier, mensenhandel, geen vrees voor represailles, geen risico voor vervolging in land van herkomst","Rechtbank Den Haag, 18-06-2021, AWB - 20 _ 3418",ECLI:NL:RBDHA:2021:6502,18-06-2021,uitspraak,"[{'Vindplaats': 'Rechtspraak.nl', 'VindplaatsAnnotator': '', 'VindplaatsUrl': ''}]"
ECLI-NL-RBDHA-2020-15015,http://deeplink.rechtspraak.nl/uitspraak?id=ECLI:NL:RBDHA:2020:15015,uitspraak,De publicatie van de uitspraak staat gepland op 17-09-2021 om 12:57 uur,https://uitspraken.rechtspraak.nl/inziendocument?id=ECLI:NL:RBDHA:2020:15015&showbutton=true&keyword=mensenhandel,0.0,['Eerste aanleg - enkelvoudig'],17-09-2021,2021-09-17T12:57:46.534Z,gepubliceerd,['Bestuursrecht; Vreemdelingenrecht'],[],"Dublin, Italië, geen uitstel indienen zienswijze, gebruik niet-registertolk, gestelde minderjarigheid, slachtoffer mensenhandel, coronavirus, ongegrond.","Rechtbank Den Haag, 25-11-2020, NL20.19069",ECLI:NL:RBDHA:2020:15015,25-11-2020,uitspraak,"[{'Vindplaats': 'Rechtspraak.nl', 'VindplaatsAnnotator': '', 'VindplaatsUrl': ''}]"
ECLI-NL-RBDHA-2020-14653,http://deeplink.rechtspraak.nl/uitspraak?id=ECLI:NL:RBDHA:2020:14653,uitspraak,De publicatie van de uitspraak staat gepland op 30-04-2021 om 13:45 uur,https://uitspraken.rechtspraak.nl/inziendocument?id=ECLI:NL:RBDHA:2020:14653&showbutton=true&keyword=mensenhandel,0.0,['Eerste aanleg - enkelvoudig'],30-04-2021,2021-04-30T13:45:52Z,gepubliceerd,['Bestuursrecht; Vreemdelingenrecht'],[],"Dublin, Italië, hervat na aanhouding ivm interim measures, verzoek om aanhouding afgewezen, slachtofferschap mensenhandel, ongegrond","Rechtbank Den Haag, 19-11-2020, NL19.22028 en NL19.22030",ECLI:NL:RBDHA:2020:14653,19-11-2020,uitspraak,"[{'Vindplaats': 'Rechtspraak.nl', 'VindplaatsAnnotator': '', 'VindplaatsUrl': ''}]"
ECLI-NL-RBDHA-2020-14516,http://deeplink.rechtspraak.nl/uitspraak?id=ECLI:NL:RBDHA:2020:14516,uitspraak,De publicatie van de uitspraak staat gepland op 26-03-2021 om 11:51 uur,https://uitspraken.rechtspraak.nl/inziendocument?id=ECLI:NL:RBDHA:2020:14516&showbutton=true&keyword=mensenhandel,0.0,"['Eerste aanleg - enkelvoudig', 'Voorlopige voorziening']",26-03-2021,2021-03-26T11:51:32.97Z,gepubliceerd,['Bestuursrecht; Vreemdelingenrecht'],[],"vbv aangifte mensenhandel, OM heeft geen rechtsmacht, aanwezigheid eisers in Nederland niet vereist, beroep ongegrond","Rechtbank Den Haag, 16-10-2020, AWB_19-9904, AWB_19-9905, AWB_19- 9906 en AWB_19- 9907",ECLI:NL:RBDHA:2020:14516,16-10-2020,uitspraak,"[{'Vindplaats': 'Rechtspraak.nl', 'VindplaatsAnnotator': '', 'VindplaatsUrl': ''}]"
ECLI-NL-RBDHA-2020-14338,http://deeplink.rechtspraak.nl/uitspraak?id=ECLI:NL:RBDHA:2020:14338,uitspraak,De publicatie van de uitspraak staat gepland op 03-03-2021 om 08:49 uur,https://uitspraken.rechtspraak.nl/inziendocument?id=ECLI:NL:RBDHA:2020:14338&showbutton=true&keyword=mensenhandel,0.0,"['Eerste aanleg - enkelvoudig', 'Voorlopige voorziening']",03-03-2021,2021-03-03T08:49:35.402Z,gepubliceerd,['Bestuursrecht; Vreemdelingenrecht'],[],"verblijfsvergunning regulier humanitaire gronden, aangifte mensenhandel, artikel 3.48 Vb, paragraaf B8/3 Vc","Rechtbank Den Haag, 02-10-2020, AWB 20/2233 en AWB 20/2234",ECLI:NL:RBDHA:2020:14338,02-10-2020,uitspraak,"[{'Vindplaats': 'Rechtspraak.nl', 'VindplaatsAnnotator': '', 'VindplaatsUrl': ''}]"
ECLI-NL-RBDHA-2020-10074,http://deeplink.rechtspraak.nl/uitspraak?id=ECLI:NL:RBDHA:2020:10074,uitspraak,De publicatie van de uitspraak staat gepland op 08-10-2020 om 14:59 uur,https://uitspraken.rechtspraak.nl/inziendocument?id=ECLI:NL:RBDHA:2020:10074&showbutton=true&keyword=mensenhandel,0.0,['Eerste aanleg - enkelvoudig'],08-10-2020,2020-10-08T14:59:14Z,gepubliceerd,['Bestuursrecht; Vreemdelingenrecht'],[],"Dublin, Letland, visum ingetrokken, artikel 12 lid 4 DV, arrest C.K., aangifte mensenhandel, ongegrond.","Rechtbank Den Haag, 04-08-2020, NL20.11437",ECLI:NL:RBDHA:2020:10074,04-08-2020,uitspraak,"[{'Vindplaats': 'Rechtspraak.nl', 'VindplaatsAnnotator': '', 'VindplaatsUrl': ''}]"
ECLI-NL-RBDHA-2020-5254,http://deeplink.rechtspraak.nl/uitspraak?id=ECLI:NL:RBDHA:2020:5254,uitspraak,De publicatie van de uitspraak staat gepland op 12-06-2020 om 15:27 uur,https://uitspraken.rechtspraak.nl/inziendocument?id=ECLI:NL:RBDHA:2020:5254&showbutton=true&keyword=mensenhandel,0.0,['Eerste aanleg - enkelvoudig'],12-06-2020,2020-06-12T15:27:36Z,gepubliceerd,['Bestuursrecht; Vreemdelingenrecht'],[],"Dublin, Frankrijk. Interstatelijk vertrouwensbeginsel, slachtofferschap van mensenhandel in Nederland en gevolgen van het coronavirus, ongegrond.","Rechtbank Den Haag, 10-06-2020, NL20.4900",ECLI:NL:RBDHA:2020:5254,10-06-2020,uitspraak,"[{'Vindplaats': 'Rechtspraak.nl', 'VindplaatsAnnotator': '', 'VindplaatsUrl': ''}]"
ECLI-NL-RBROT-2019-10529,http://deeplink.rechtspraak.nl/uitspraak?id=ECLI:NL:RBROT:2019:10529,uitspraak,De publicatie van de uitspraak staat gepland op 16-01-2020 om 09:28 uur,https://uitspraken.rechtspraak.nl/inziendocument?id=ECLI:NL:RBROT:2019:10529&showbutton=true&keyword=mensenhandel,0.0,['Eerste aanleg - meervoudig'],16-01-2020,2020-01-16T09:28:36Z,gepubliceerd,['Strafrecht'],[],"Veroordeling mensenhandel, zware mishandeling en voorhanden hebben patroonhouders voor semi-automatisch pistool. Gevangenisstraf 5 jaar.","Rechtbank Rotterdam, 01-04-2019, 10/750038-18; 10/751001-19",ECLI:NL:RBROT:2019:10529,01-04-2019,uitspraak,"[{'Vindplaats': 'PS-Updates.nl 2020-0133', 'VindplaatsAnnotator': '', 'VindplaatsUrl': ''}, {'Vindplaats': 'Rechtspraak.nl', 'VindplaatsAnnotator': '', 'VindplaatsUrl': ''}]"
ECLI-NL-RBROT-2018-8779,http://deeplink.rechtspraak.nl/uitspraak?id=ECLI:NL:RBROT:2018:8779,uitspraak,De publicatie van de uitspraak staat gepland op 24-10-2018 om 16:28 uur,https://uitspraken.rechtspraak.nl/inziendocument?id=ECLI:NL:RBROT:2018:8779&showbutton=true&keyword=mensenhandel,0.0,['Eerste aanleg - meervoudig'],24-10-2018,2018-10-24T16:28:33Z,gepubliceerd,['Strafrecht'],[],"Partieel nietige dagvaarding vanwege niet voldoen aan de eisen van artikel 261 Sv. 
Vrijspraak mensenhandel.","Rechtbank Rotterdam, 23-10-2018, 10/750069-16",ECLI:NL:RBROT:2018:8779,23-10-2018,uitspraak,"[{'Vindplaats': 'Rechtspraak.nl', 'VindplaatsAnnotator': '', 'VindplaatsUrl': ''}]"
ECLI-NL-RBMNE-2017-6671,http://deeplink.rechtspraak.nl/uitspraak?id=ECLI:NL:RBMNE:2017:6671,uitspraak,De publicatie van de uitspraak staat gepland op 30-07-2021 om 12:43 uur,https://uitspraken.rechtspraak.nl/inziendocument?id=ECLI:NL:RBMNE:2017:6671&showbutton=true&keyword=mensenhandel,0.0,['Eerste aanleg - meervoudig'],30-07-2021,2021-07-30T12:43:39.848Z,gepubliceerd,['Strafrecht'],[],Vrijspraak van ontucht. Veroordeling voor mensenhandel door voor het minderjarige slachtoffer een klant te regelen.,"Rechtbank Midden-Nederland, 07-11-2017, 706753-16",ECLI:NL:RBMNE:2017:6671,07-11-2017,uitspraak,"[{'Vindplaats': 'Rechtspraak.nl', 'VindplaatsAnnotator': '', 'VindplaatsUrl': ''}]"
ECLI-NL-RBLIM-2017-3315,http://deeplink.rechtspraak.nl/uitspraak?id=ECLI:NL:RBLIM:2017:3315,uitspraak,De publicatie van de uitspraak staat gepland op 13-04-2017 om 15:00 uur,https://uitspraken.rechtspraak.nl/inziendocument?id=ECLI:NL:RBLIM:2017:3315&showbutton=true&keyword=mensenhandel,0.0,['Eerste aanleg - meervoudig'],13-04-2017,2017-04-13T15:00:02Z,gepubliceerd,['Strafrecht'],[],"Veroordeling wegens het medeplegen van mensenhandel. Gevangenisstraf van 4 maanden, met aftrek van het voorarrest.","Rechtbank Limburg, 13-04-2017, 03/720453-13",ECLI:NL:RBLIM:2017:3315,13-04-2017,uitspraak,"[{'Vindplaats': 'Rechtspraak.nl', 'VindplaatsAnnotator': '', 'VindplaatsUrl': ''}]"
ECLI-NL-RBLIM-2017-3319,http://deeplink.rechtspraak.nl/uitspraak?id=ECLI:NL:RBLIM:2017:3319,uitspraak,De publicatie van de uitspraak staat gepland op 13-04-2017 om 15:00 uur,https://uitspraken.rechtspraak.nl/inziendocument?id=ECLI:NL:RBLIM:2017:3319&showbutton=true&keyword=mensenhandel,0.0,['Eerste aanleg - meervoudig'],13-04-2017,2017-04-13T15:00:02Z,gepubliceerd,['Strafrecht'],[],"Veroordeling wegens het medeplegen van mensenhandel. Gevangenisstraf van 6 maanden, met aftrek van het voorarrest.","Rechtbank Limburg, 13-04-2017, 03/700342-14",ECLI:NL:RBLIM:2017:3319,13-04-2017,uitspraak,"[{'Vindplaats': 'Rechtspraak.nl', 'VindplaatsAnnotator': '', 'VindplaatsUrl': ''}]"
ECLI-NL-RBLIM-2017-3335,http://deeplink.rechtspraak.nl/uitspraak?id=ECLI:NL:RBLIM:2017:3335,uitspraak,De publicatie van de uitspraak staat gepland op 13-04-2017 om 15:00 uur,https://uitspraken.rechtspraak.nl/inziendocument?id=ECLI:NL:RBLIM:2017:3335&showbutton=true&keyword=mensenhandel,0.0,['Eerste aanleg - meervoudig'],13-04-2017,2017-04-13T15:00:00Z,gepubliceerd,['Strafrecht'],[],"Veroordeling wegens het medeplegen van mensenhandel. Gevangenisstraf van 4 maanden, met aftrek van het voorarrest.","Rechtbank Limburg, 13-04-2017, 03/702674-13",ECLI:NL:RBLIM:2017:3335,13-04-2017,uitspraak,"[{'Vindplaats': 'Rechtspraak.nl', 'VindplaatsAnnotator': '', 'VindplaatsUrl': ''}]"
ECLI-NL-RBMNE-2015-8301,http://deeplink.rechtspraak.nl/uitspraak?id=ECLI:NL:RBMNE:2015:8301,uitspraak,De publicatie van de uitspraak staat gepland op 26-11-2015 om 15:29 uur,https://uitspraken.rechtspraak.nl/inziendocument?id=ECLI:NL:RBMNE:2015:8301&showbutton=true&keyword=mensenhandel,0.0,['Eerste aanleg - meervoudig'],26-11-2015,2015-11-26T15:29:36Z,gepubliceerd,['Strafrecht; Materieel strafrecht'],[],"Ontuchtige handelingen met minderjarige, verleiden/bewegen tot plegen/dulden van ontuchtige handelingen, mensenhandel, grooming, kinderporno.","Rechtbank Midden-Nederland, 02-10-2015, 16/705975-15 en 16/659543-15 (ttz gev)",ECLI:NL:RBMNE:2015:8301,02-10-2015,uitspraak,"[{'Vindplaats': 'Rechtspraak.nl', 'VindplaatsAnnotator': '', 'VindplaatsUrl': ''}]"
ECLI-NL-GHARN-2012-BV8569,http://deeplink.rechtspraak.nl/uitspraak?id=ECLI:NL:GHARN:2012:BV8569,uitspraak,De publicatie van de uitspraak staat gepland op 12-03-2012 om 15:47 uur,https://uitspraken.rechtspraak.nl/inziendocument?id=ECLI:NL:GHARN:2012:BV8569&showbutton=true&keyword=mensenhandel,0.0,['Hoger beroep'],12-03-2012,2012-03-12T15:47:15Z,gepubliceerd,['Strafrecht'],[],"Koolvis-zaak. Rechtsmacht. Verhoorprotocol. Vrijspraak van mensenhandel, mensensmokkel en het deelnemen aan een criminele organisatie.","Gerechtshof Arnhem, 12-03-2012, 24-003219-09",ECLI:NL:GHARN:2012:BV8569,12-03-2012,uitspraak,"[{'Vindplaats': 'Rechtspraak.nl', 'VindplaatsAnnotator': '', 'VindplaatsUrl': ''}]"
ECLI-NL-RBUTR-2008-BC9918,http://deeplink.rechtspraak.nl/uitspraak?id=ECLI:NL:RBUTR:2008:BC9918,uitspraak,De publicatie van de uitspraak staat gepland op 18-04-2008 om 16:12 uur,https://uitspraken.rechtspraak.nl/inziendocument?id=ECLI:NL:RBUTR:2008:BC9918&showbutton=true&keyword=mensenhandel,0.0,['Eerste aanleg - meervoudig'],18-04-2008,2008-04-18T16:12:10Z,gepubliceerd,['Strafrecht'],[],Loverboyzaak - Veenendaal - Verdachte is veroordeeld tot een gevangenisstraf van 4 jaar voor mensenhandel (in vereniging).,"Rechtbank Utrecht, 18-04-2008, 16-711094-07",ECLI:NL:RBUTR:2008:BC9918,18-04-2008,uitspraak,"[{'Vindplaats': 'Rechtspraak.nl', 'VindplaatsAnnotator': '', 'VindplaatsUrl': ''}]"
ECLI-NL-RBHAA-2006-BD2482,http://deeplink.rechtspraak.nl/uitspraak?id=ECLI:NL:RBHAA:2006:BD2482,uitspraak,De publicatie van de uitspraak staat gepland op 27-05-2008 om 12:15 uur,https://uitspraken.rechtspraak.nl/inziendocument?id=ECLI:NL:RBHAA:2006:BD2482&showbutton=true&keyword=mensenhandel,0.0,['Eerste aanleg - meervoudig'],27-05-2008,2008-05-27T12:15:37Z,gepubliceerd,['Strafrecht'],[],Mensenhandel; mensensmokkel; bijstandsfraude/valsheid in geschrift; wederrechtelijk verblijk; vervolging op grond van richtlijn Sociale Dienst.,"Rechtbank Haarlem, 09-05-2006, 15/035092-04",ECLI:NL:RBHAA:2006:BD2482,09-05-2006,uitspraak,"[{'Vindplaats': 'Rechtspraak.nl', 'VindplaatsAnnotator': '', 'VindplaatsUrl': ''}]"
ECLI-NL-RBNHO-2014-5866,http://deeplink.rechtspraak.nl/uitspraak?id=ECLI:NL:RBNHO:2014:5866,uitspraak,De publicatie van de uitspraak staat gepland op 25-06-2014 om 12:19 uur,https://uitspraken.rechtspraak.nl/inziendocument?id=ECLI:NL:RBNHO:2014:5866&showbutton=true&keyword=mensenhandel,0.0,['Eerste aanleg - meervoudig'],25-06-2014,2014-06-25T12:19:15Z,gepubliceerd,['Strafrecht'],[],"Onderzoek Zwaluw. Veroordeling voor mensenhandel en deelneming aan een criminele organisatie (mensenhandel); uitbuiting van Roemeense vrouwen die al dan niet onder valse voorwendselen naar Nederland worden gebracht om te werken in de prostitutie. 
Beroep op niet-ontvankelijkheid Openbaar Ministerie wegens onzorgvuldig vooronderzoek verworpen. 
Verweren met betrekking tot betrouwbaarheid verklaringen aangeefsters en getuigen verworpen.","Rechtbank Noord-Holland, 28-04-2014, 15/810049-14",ECLI:NL:RBNHO:2014:5866,28-04-2014,uitspraak,"[{'Vindplaats': 'Rechtspraak.nl', 'VindplaatsAnnotator': '', 'VindplaatsUrl': ''}]"
ECLI-NL-RBNHO-2014-5861,http://deeplink.rechtspraak.nl/uitspraak?id=ECLI:NL:RBNHO:2014:5861,uitspraak,De publicatie van de uitspraak staat gepland op 25-06-2014 om 11:49 uur,https://uitspraken.rechtspraak.nl/inziendocument?id=ECLI:NL:RBNHO:2014:5861&showbutton=true&keyword=mensenhandel,0.0,['Eerste aanleg - meervoudig'],25-06-2014,2014-06-25T11:49:14Z,gepubliceerd,['Strafrecht'],[],"Onderzoek Zwaluw. Veroordeling voor mensenhandel en deelneming aan een criminele organisatie (mensenhandel); uitbuiting van Roemeense vrouwen die al dan niet onder valse voorwendselen naar Nederland worden gebracht om te werken in de prostitutie. 
Beroep op niet-ontvankelijkheid Openbaar Ministerie wegens onzorgvuldig vooronderzoek verworpen. 
Verweren met betrekking tot betrouwbaarheid verklaringen aangeefsters en getuigen verworpen.","Rechtbank Noord-Holland, 28-04-2014, 15/743141-13",ECLI:NL:RBNHO:2014:5861,28-04-2014,uitspraak,"[{'Vindplaats': 'Rechtspraak.nl', 'VindplaatsAnnotator': '', 'VindplaatsUrl': ''}]"
ECLI-NL-RBMNE-2013-5605,http://deeplink.rechtspraak.nl/uitspraak?id=ECLI:NL:RBMNE:2013:5605,uitspraak,De publicatie van de uitspraak staat gepland op 14-11-2013 om 14:07 uur,https://uitspraken.rechtspraak.nl/inziendocument?id=ECLI:NL:RBMNE:2013:5605&showbutton=true&keyword=mensenhandel,0.0,['Eerste aanleg - meervoudig'],14-11-2013,2013-11-14T14:07:20Z,gepubliceerd,['Strafrecht'],[],"De rechtbank veroordeelt verdachte tot een gevangenisstraf van 30 maanden wegens mensenhandel en mensenhandel gepleegd door twee of meer verenigde personen. De rechtbank acht de verklaring van aangeefster betrouwbaar. De weergave van haar verklaringen is weliswaar onzorgvuldig, maar niet zodanig dat de verklaring van aangeefster niet voor het bewijs kan worden gebezigd.","Rechtbank Midden-Nederland, 11-10-2013, 07.662582-12",ECLI:NL:RBMNE:2013:5605,11-10-2013,uitspraak,"[{'Vindplaats': 'Rechtspraak.nl', 'VindplaatsAnnotator': '', 'VindplaatsUrl': ''}]"
ECLI-NL-RBROT-2012-BX0121,http://deeplink.rechtspraak.nl/uitspraak?id=ECLI:NL:RBROT:2012:BX0121,uitspraak,De publicatie van de uitspraak staat gepland op 02-07-2012 om 17:33 uur,https://uitspraken.rechtspraak.nl/inziendocument?id=ECLI:NL:RBROT:2012:BX0121&showbutton=true&keyword=mensenhandel,0.0,['Eerste aanleg - meervoudig'],02-07-2012,2012-07-02T17:33:03Z,gepubliceerd,['Strafrecht'],[],"Mensenhandel. Dagvaarding partieel nietig. Vrijspraak van deelneming aan een criminele organisatie. In dit geval onvoldoende structurele en duurzame samenwerking. Bewezenverklaring mensenhandel (vijf slachtoffers), in bezit zijn van een vals reisdocument en – kort gezegd – mensensmokkel. Redelijke termijn voor berechting is in forse mate overschreden. Opgelegd wordt een gevangenisstraf voor de duur van 15 maanden.","Rechtbank Rotterdam, 11-05-2012, 10/603057-06",ECLI:NL:RBROT:2012:BX0121,11-05-2012,uitspraak,"[{'Vindplaats': 'Rechtspraak.nl', 'VindplaatsAnnotator': '', 'VindplaatsUrl': ''}]"
ECLI-NL-RBZLY-2011-BR5056,http://deeplink.rechtspraak.nl/uitspraak?id=ECLI:NL:RBZLY:2011:BR5056,uitspraak,De publicatie van de uitspraak staat gepland op 16-08-2011 om 14:30 uur,https://uitspraken.rechtspraak.nl/inziendocument?id=ECLI:NL:RBZLY:2011:BR5056&showbutton=true&keyword=mensenhandel,0.0,['Eerste aanleg - meervoudig'],16-08-2011,2011-08-16T14:30:22Z,gepubliceerd,['Strafrecht'],[],De rechtbank veroordeelt de verdachte tot een gevangenisstraf voor de duur van 24 maanden. De verdachte is voordeeld voor mensenhandel. De rechtbank komt tot een lichtere straf dan door de officier van justitie is geeïst. De rechtbank heeft als strafverlichtende omstandigheid mee laten wegen dat verdachte zelf ook slachtoffer is geweest van mensenhandel.,"Rechtbank Zwolle-Lelystad, 16-08-2011, 07.976406-07",ECLI:NL:RBZLY:2011:BR5056,16-08-2011,uitspraak,"[{'Vindplaats': 'Rechtspraak.nl', 'VindplaatsAnnotator': '', 'VindplaatsUrl': ''}]"
ECLI-NL-RBNNE-2021-3044,http://deeplink.rechtspraak.nl/uitspraak?id=ECLI:NL:RBNNE:2021:3044,uitspraak,De publicatie van de uitspraak staat gepland op 16-07-2021 om 15:29 uur,https://uitspraken.rechtspraak.nl/inziendocument?id=ECLI:NL:RBNNE:2021:3044&showbutton=true&keyword=mensenhandel,0.0,"['Eerste aanleg - meervoudig', 'Op tegenspraak']",16-07-2021,2021-07-16T15:29:44Z,gepubliceerd,['Strafrecht'],[],De rechtbank legt een gevangenisstraf van 79 dagen op wegen seksuele uitbuiting van een minderjarige. (mensenhandel),"Rechtbank Noord-Nederland, 16-07-2021, 18/245415-20",ECLI:NL:RBNNE:2021:3044,16-07-2021,uitspraak,"[{'Vindplaats': 'Rechtspraak.nl', 'VindplaatsAnnotator': '', 'VindplaatsUrl': ''}]"
ECLI-NL-RBDHA-2020-14162,http://deeplink.rechtspraak.nl/uitspraak?id=ECLI:NL:RBDHA:2020:14162,uitspraak,De publicatie van de uitspraak staat gepland op 26-01-2021 om 14:52 uur,https://uitspraken.rechtspraak.nl/inziendocument?id=ECLI:NL:RBDHA:2020:14162&showbutton=true&keyword=mensenhandel,0.0,['Eerste aanleg - enkelvoudig'],26-01-2021,2021-01-26T14:52:13.91Z,gepubliceerd,['Bestuursrecht; Vreemdelingenrecht'],[],Afwijzing verblijfsvergunning regulier aangever mensenhandel. Implementatie mensenhandelrichtlijnen. Nieuw beleid voor Dublinclaimanten. Rechtszekerheid. Bedenktijd. Hoorplicht. Beroep ongegrond.,"Rechtbank Den Haag, 23-12-2020, AWB 20/5489",ECLI:NL:RBDHA:2020:14162,23-12-2020,uitspraak,"[{'Vindplaats': 'Rechtspraak.nl', 'VindplaatsAnnotator': '', 'VindplaatsUrl': ''}]"
ECLI-NL-RBDHA-2019-9047,http://deeplink.rechtspraak.nl/uitspraak?id=ECLI:NL:RBDHA:2019:9047,uitspraak,De publicatie van de uitspraak staat gepland op 05-09-2019 om 18:21 uur,https://uitspraken.rechtspraak.nl/inziendocument?id=ECLI:NL:RBDHA:2019:9047&showbutton=true&keyword=mensenhandel,0.0,['Eerste aanleg - enkelvoudig'],05-09-2019,2019-09-05T18:21:12Z,gepubliceerd,['Bestuursrecht; Vreemdelingenrecht'],[],"Dublin Italie, nog geen mogelijkheid gehad aangifte van mensenhandel te doen in Nederland, gestelde medische problemen","Rechtbank Den Haag, 12-07-2019, NL19.13613",ECLI:NL:RBDHA:2019:9047,12-07-2019,uitspraak,"[{'Vindplaats': 'Rechtspraak.nl', 'VindplaatsAnnotator': '', 'VindplaatsUrl': ''}]"
ECLI-NL-GHARL-2018-173,http://deeplink.rechtspraak.nl/uitspraak?id=ECLI:NL:GHARL:2018:173,uitspraak,De publicatie van de uitspraak staat gepland op 08-01-2018 om 15:35 uur,https://uitspraken.rechtspraak.nl/inziendocument?id=ECLI:NL:GHARL:2018:173&showbutton=true&keyword=mensenhandel,0.0,['Hoger beroep'],08-01-2018,2018-01-08T15:35:49Z,gepubliceerd,['Strafrecht'],"[{'RelatieOmschrijving': 'Eerste aanleg: ', 'LinkTekst': 'ECLI:NL:RBGEL:2016:1359', 'Postfix': ', (Gedeeltelijke) vernietiging en zelf afgedaan', 'WebAdres': 'https://uitspraken.rechtspraak.nl/inziendocument?id=ECLI:NL:RBGEL:2016:1359&showbutton=true&keyword=mensenhandel'}]",Man veroordeeld tot een gevangenisstraf van twee jaren voor mensenhandel. OM-appel tegen vrijspraken eerste aanleg.,"Gerechtshof Arnhem-Leeuwarden, 05-01-2018, 21-001600-16",ECLI:NL:GHARL:2018:173,05-01-2018,uitspraak,"[{'Vindplaats': 'Rechtspraak.nl', 'VindplaatsAnnotator': '', 'VindplaatsUrl': ''}]"
ECLI-NL-RBGEL-2015-6541,http://deeplink.rechtspraak.nl/uitspraak?id=ECLI:NL:RBGEL:2015:6541,uitspraak,De publicatie van de uitspraak staat gepland op 23-10-2015 om 15:22 uur,https://uitspraken.rechtspraak.nl/inziendocument?id=ECLI:NL:RBGEL:2015:6541&showbutton=true&keyword=mensenhandel,0.0,['Eerste aanleg - meervoudig'],23-10-2015,2015-10-23T15:22:01Z,gepubliceerd,['Strafrecht'],"[{'RelatieOmschrijving': 'Hoger beroep: ', 'LinkTekst': 'ECLI:NL:GHARL:2016:9442', 'Postfix': None, 'WebAdres': 'https://uitspraken.rechtspraak.nl/inziendocument?id=ECLI:NL:GHARL:2016:9442&showbutton=true&keyword=mensenhandel'}, {'RelatieOmschrijving': 'Hoger beroep: ', 'LinkTekst': 'ECLI:NL:GHARL:2018:3458', 'Postfix': ', (Gedeeltelijke) vernietiging en zelf afgedaan', 'WebAdres': 'https://uitspraken.rechtspraak.nl/inziendocument?id=ECLI:NL:GHARL:2018:3458&showbutton=true&keyword=mensenhandel'}]",Gevangenisstraf voor mensenhandel en faillissementsfraude. Valsheid in geschrift met betrekking tot PGB- en uitkeringsformulieren niet bewezen.,"Rechtbank Gelderland, 23-10-2015, 05/900893-12",ECLI:NL:RBGEL:2015:6541,23-10-2015,uitspraak,"[{'Vindplaats': 'AR 2015/2004', 'VindplaatsAnnotator': '', 'VindplaatsUrl': ''}, {'Vindplaats': 'Rechtspraak.nl', 'VindplaatsAnnotator': '', 'VindplaatsUrl': ''}]"
ECLI-NL-GHAMS-2014-4020,http://deeplink.rechtspraak.nl/uitspraak?id=ECLI:NL:GHAMS:2014:4020,uitspraak,De publicatie van de uitspraak staat gepland op 16-08-2016 om 08:58 uur,https://uitspraken.rechtspraak.nl/inziendocument?id=ECLI:NL:GHAMS:2014:4020&showbutton=true&keyword=mensenhandel,0.0,['Hoger beroep'],16-08-2016,2016-08-16T08:58:54Z,gepubliceerd,['Strafrecht'],[],"mensenhandel, in vereniging, en opzettelijk gebruik maken van een niet op naam van verdachte gesteld paspoort","Gerechtshof Amsterdam, 11-09-2014, 23-005441-11",ECLI:NL:GHAMS:2014:4020,11-09-2014,uitspraak,"[{'Vindplaats': 'Rechtspraak.nl', 'VindplaatsAnnotator': '', 'VindplaatsUrl': ''}]"
ECLI-NL-RBGEL-2013-1445,http://deeplink.rechtspraak.nl/uitspraak?id=ECLI:NL:RBGEL:2013:1445,uitspraak,De publicatie van de uitspraak staat gepland op 04-07-2013 om 12:06 uur,https://uitspraken.rechtspraak.nl/inziendocument?id=ECLI:NL:RBGEL:2013:1445&showbutton=true&keyword=mensenhandel,0.0,['Eerste aanleg - meervoudig'],04-07-2013,2013-07-04T12:06:47Z,gepubliceerd,['Strafrecht'],[],Poging tot mensenhandel. Geen vrijwillige terugtred. De gemaakte afspraken waren voldoende voor een begin van uitvoering.,"Rechtbank Gelderland, 26-06-2013, 05/901069-12",ECLI:NL:RBGEL:2013:1445,26-06-2013,uitspraak,"[{'Vindplaats': 'NJFS 2013/196', 'VindplaatsAnnotator': '', 'VindplaatsUrl': ''}, {'Vindplaats': 'Rechtspraak.nl', 'VindplaatsAnnotator': '', 'VindplaatsUrl': ''}]"
ECLI-NL-RBZLY-2012-BY7662,http://deeplink.rechtspraak.nl/uitspraak?id=ECLI:NL:RBZLY:2012:BY7662,uitspraak,De publicatie van de uitspraak staat gepland op 03-01-2013 om 12:01 uur,https://uitspraken.rechtspraak.nl/inziendocument?id=ECLI:NL:RBZLY:2012:BY7662&showbutton=true&keyword=mensenhandel,0.0,['Eerste aanleg - meervoudig'],03-01-2013,2013-01-03T12:01:05Z,gepubliceerd,['Strafrecht'],[],"verkrachting, mensenhandel, uitbuiting, criminele organisatie, witwassen, gewoontewitwassen, feitelijk leiding geven, verduistering, gebruik maken, valsheid in geschrift.","Rechtbank Zwolle-Lelystad, 14-12-2012, 07/663278-10",ECLI:NL:RBZLY:2012:BY7662,14-12-2012,uitspraak,"[{'Vindplaats': 'Rechtspraak.nl', 'VindplaatsAnnotator': '', 'VindplaatsUrl': ''}]"
ECLI-NL-RBZLY-2012-BX2627,http://deeplink.rechtspraak.nl/uitspraak?id=ECLI:NL:RBZLY:2012:BX2627,uitspraak,De publicatie van de uitspraak staat gepland op 25-07-2012 om 10:46 uur,https://uitspraken.rechtspraak.nl/inziendocument?id=ECLI:NL:RBZLY:2012:BX2627&showbutton=true&keyword=mensenhandel,0.0,['Eerste aanleg - meervoudig'],25-07-2012,2012-07-25T10:46:26Z,gepubliceerd,['Strafrecht'],[],"Mensenhandel door echtgenoot slachtoffer samen met vriend, uitbuiting binnen huwelijksrelatie met kinderen, vrijwilligheid prostitutie, alcoholverslaving slachtoffer","Rechtbank Zwolle-Lelystad, 27-03-2012, 07.663183-11",ECLI:NL:RBZLY:2012:BX2627,27-03-2012,uitspraak,"[{'Vindplaats': 'Rechtspraak.nl', 'VindplaatsAnnotator': '', 'VindplaatsUrl': ''}]"
ECLI-NL-RBZLY-2012-BX2628,http://deeplink.rechtspraak.nl/uitspraak?id=ECLI:NL:RBZLY:2012:BX2628,uitspraak,De publicatie van de uitspraak staat gepland op 25-07-2012 om 10:49 uur,https://uitspraken.rechtspraak.nl/inziendocument?id=ECLI:NL:RBZLY:2012:BX2628&showbutton=true&keyword=mensenhandel,0.0,['Eerste aanleg - meervoudig'],25-07-2012,2012-07-25T10:49:10Z,gepubliceerd,['Strafrecht'],[],"Mensenhandel door echtgenoot slachtoffer samen met vriend, uitbuiting binnen huwelijksrelatie met kinderen, vrijwilligheid prostitutie, alcoholverslaving slachtoffer","Rechtbank Zwolle-Lelystad, 27-03-2012, 07.651088-11",ECLI:NL:RBZLY:2012:BX2628,27-03-2012,uitspraak,"[{'Vindplaats': 'Rechtspraak.nl', 'VindplaatsAnnotator': '', 'VindplaatsUrl': ''}]"
ECLI-NL-RBGRO-2010-BO8125,http://deeplink.rechtspraak.nl/uitspraak?id=ECLI:NL:RBGRO:2010:BO8125,uitspraak,De publicatie van de uitspraak staat gepland op 21-12-2010 om 10:56 uur,https://uitspraken.rechtspraak.nl/inziendocument?id=ECLI:NL:RBGRO:2010:BO8125&showbutton=true&keyword=mensenhandel,0.0,['Eerste aanleg - meervoudig'],21-12-2010,2010-12-21T10:56:21Z,gepubliceerd,['Strafrecht'],[],"Veroordeling wegens mensenhandel; aangiftes, getuigenbewijs en sms-verkeer tussen (mede)dader(s) en slachtoffers en getuigen.","Rechtbank Groningen, 16-12-2010, 18/670215-10",ECLI:NL:RBGRO:2010:BO8125,16-12-2010,uitspraak,"[{'Vindplaats': 'Rechtspraak.nl', 'VindplaatsAnnotator': '', 'VindplaatsUrl': ''}]"
ECLI-NL-RBUTR-2009-BK8230,http://deeplink.rechtspraak.nl/uitspraak?id=ECLI:NL:RBUTR:2009:BK8230,uitspraak,De publicatie van de uitspraak staat gepland op 05-01-2010 om 12:02 uur,https://uitspraken.rechtspraak.nl/inziendocument?id=ECLI:NL:RBUTR:2009:BK8230&showbutton=true&keyword=mensenhandel,0.0,['Eerste aanleg - meervoudig'],05-01-2010,2010-01-05T12:02:40Z,gepubliceerd,['Strafrecht'],[],Vrijspraak mensenhandel geen sprake van oogmerk van uitbuiting in de zin van art.273f Sr,"Rechtbank Utrecht, 28-12-2009, 16/600535-08 [P]",ECLI:NL:RBUTR:2009:BK8230,28-12-2009,uitspraak,"[{'Vindplaats': 'Rechtspraak.nl', 'VindplaatsAnnotator': '', 'VindplaatsUrl': ''}]"
ECLI-NL-RBDHA-2019-10101,http://deeplink.rechtspraak.nl/uitspraak?id=ECLI:NL:RBDHA:2019:10101,uitspraak,De publicatie van de uitspraak staat gepland op 27-09-2019 om 13:56 uur,https://uitspraken.rechtspraak.nl/inziendocument?id=ECLI:NL:RBDHA:2019:10101&showbutton=true&keyword=mensenhandel,0.0,['Eerste aanleg - enkelvoudig'],27-09-2019,2019-09-27T13:56:02Z,gepubliceerd,['Bestuursrecht; Vreemdelingenrecht'],[],"Dublin Italië. Ongegrond. Interstatelijk vertrouwensbeginsel. Aangifte mensenhandel: in de Dublinprocedure wordt op grond van art 3.6a, tweede lid, van het Vb niet toegekomen aan de vraag of eisers in aanmerking zouden komen voor een verblijfsvergunning als slachtoffers van mensenhandel. Daarom hoeven eisers niet in de gelegenheid te worden gesteld om aangifte te doen.","Rechtbank Den Haag, 06-08-2019, NL19.16831 en NL19.16833",ECLI:NL:RBDHA:2019:10101,06-08-2019,uitspraak,"[{'Vindplaats': 'Rechtspraak.nl', 'VindplaatsAnnotator': '', 'VindplaatsUrl': ''}]"
ECLI-NL-GHAMS-2018-1855,http://deeplink.rechtspraak.nl/uitspraak?id=ECLI:NL:GHAMS:2018:1855,uitspraak,De publicatie van de uitspraak staat gepland op 11-06-2018 om 12:31 uur,https://uitspraken.rechtspraak.nl/inziendocument?id=ECLI:NL:GHAMS:2018:1855&showbutton=true&keyword=mensenhandel,0.0,['Hoger beroep'],11-06-2018,2018-06-11T12:31:49Z,gepubliceerd,['Strafrecht'],[],"Criminele organisatie die het plegen van valsheid in geschrift tot oogmerk had. Vrijspraak van de criminele organisatie die het plegen van mensenhandel en gewoonte witwassen tot oogmerk had. Schijnconstructie kamerverhuurbedrijf in de Molensteeg te Amsterdam.
Vrijspraak van het zelfstandig tenlastegelegde misdrijf van mensenhandel gericht tegen 4 vrouwen. 
Uitvoerige verweren strekkende tot niet-ontvankelijkheid en bewijsuitsluiting.","Gerechtshof Amsterdam, 05-06-2018, 23-002009-15",ECLI:NL:GHAMS:2018:1855,05-06-2018,uitspraak,"[{'Vindplaats': 'Rechtspraak.nl', 'VindplaatsAnnotator': '', 'VindplaatsUrl': ''}]"
ECLI-NL-RBNHO-2014-5864,http://deeplink.rechtspraak.nl/uitspraak?id=ECLI:NL:RBNHO:2014:5864,uitspraak,De publicatie van de uitspraak staat gepland op 25-06-2014 om 12:10 uur,https://uitspraken.rechtspraak.nl/inziendocument?id=ECLI:NL:RBNHO:2014:5864&showbutton=true&keyword=mensenhandel,0.0,['Eerste aanleg - meervoudig'],25-06-2014,2014-06-25T12:10:44Z,gepubliceerd,['Strafrecht'],[],"Onderzoek Zwaluw. Veroordeling voor medeplichtigheid aan mensenhandel en deelneming aan een criminele organisatie (mensenhandel); uitbuiting van Roemeense vrouwen die al dan niet onder valse voorwendselen naar Nederland worden gebracht om te werken in de prostitutie. 
Beroep op niet-ontvankelijkheid Openbaar Ministerie wegens onzorgvuldig vooronderzoek verworpen. 
Verweren met betrekking tot betrouwbaarheid verklaringen aangeefsters en getuigen verworpen.","Rechtbank Noord-Holland, 28-04-2014, 15/743180-13",ECLI:NL:RBNHO:2014:5864,28-04-2014,uitspraak,"[{'Vindplaats': 'Rechtspraak.nl', 'VindplaatsAnnotator': '', 'VindplaatsUrl': ''}]"
ECLI-NL-RBAMS-2008-BC8626,http://deeplink.rechtspraak.nl/uitspraak?id=ECLI:NL:RBAMS:2008:BC8626,uitspraak,De publicatie van de uitspraak staat gepland op 14-04-2008 om 16:49 uur,https://uitspraken.rechtspraak.nl/inziendocument?id=ECLI:NL:RBAMS:2008:BC8626&showbutton=true&keyword=mensenhandel,0.0,['Eerste aanleg - meervoudig'],14-04-2008,2008-04-14T16:49:30Z,gepubliceerd,['Strafrecht'],[],"Mensenhandel. 1) Ontvankelijkheid officier van justitie; De “aanwijzing mensenhandel” wordt van toepassing verklaard. De “aanwijzing opsporing en vervolging inzake seksueel misbruik” is niet van toepassing. OM ontvankelijk. 2) Vrijspraak; medeplegen van mensenhandel. 3) Vrijspraak; werven met het oogmerk van uitbuiting. Veeleer was de verdachte uit op financieel gewin dan dat hij de situatie, waarin de slachtoffers verkeerden, met betrekking tot dat doel voor hen had gecreëerd of hen daartoe had overgehaald. 4) Bewezenverklaring;  medeplichtigheid aan mensenhandel. 5) Bewezenverklaring; werven met het oogmerk van uitbuiting en het profijt trekken uit seksuele handelingen 6) Bewezenverklaring; witwassen van gelden afkomstig uit mensenhandel. 7) Bewijsuitsluiting; Niet aannemelijk dat het slachtoffer door verbalisanten bij het informatieve gesprek is gestuurd in haar verklaringen of dat zij niet heeft verklaard uit eigen wetenschap. De omstandigheid dat de politie het slachtoffer veel informatie heeft gegeven hangt sterk samen met de achtergrond van een zaak als deze, nu slachtoffers bewust dienen te worden gemaakt van wat hen is overkomen. Geen consequenties ex 359a Sv. 8) Strafmotivering; loverboys. 9) Kwalificatie; voortgezette handeling.","Rechtbank Amsterdam, 21-02-2008, 13-529178-06",ECLI:NL:RBAMS:2008:BC8626,21-02-2008,uitspraak,"[{'Vindplaats': 'Rechtspraak.nl', 'VindplaatsAnnotator': '', 'VindplaatsUrl': ''}]"
ECLI-NL-RBDHA-2021-5531,http://deeplink.rechtspraak.nl/uitspraak?id=ECLI:NL:RBDHA:2021:5531,uitspraak,De publicatie van de uitspraak staat gepland op 01-06-2021 om 14:20 uur,https://uitspraken.rechtspraak.nl/inziendocument?id=ECLI:NL:RBDHA:2021:5531&showbutton=true&keyword=mensenhandel,0.0,['Eerste aanleg - enkelvoudig'],01-06-2021,2021-06-01T14:20:46.67Z,gepubliceerd,['Bestuursrecht; Vreemdelingenrecht'],[],"Aanvraag verblijfsvergunning regulier 'humanitair tijdelijk', aangifte mensenhandel Model M55, Dublin, beklagprocedure geeft geen recht op verblijf","Rechtbank Den Haag, 19-05-2021, AWB 20/1274",ECLI:NL:RBDHA:2021:5531,19-05-2021,uitspraak,"[{'Vindplaats': 'Rechtspraak.nl', 'VindplaatsAnnotator': '', 'VindplaatsUrl': ''}]"
ECLI-NL-RBDHA-2020-15122,http://deeplink.rechtspraak.nl/uitspraak?id=ECLI:NL:RBDHA:2020:15122,uitspraak,De publicatie van de uitspraak staat gepland op 29-09-2021 om 13:13 uur,https://uitspraken.rechtspraak.nl/inziendocument?id=ECLI:NL:RBDHA:2020:15122&showbutton=true&keyword=mensenhandel,0.0,['Eerste aanleg - enkelvoudig'],29-09-2021,2021-09-29T13:13:57Z,gepubliceerd,['Bestuursrecht; Vreemdelingenrecht'],[],Vreemdelingenwet - intrekking vvr mensenhandel en uitvaardiging terugkeerbesluit - vwr was verplicht een terugkeerbesluit uit te vaardigen - beroep ongegrond.,"Rechtbank Den Haag, 26-11-2020, AWB 20/192",ECLI:NL:RBDHA:2020:15122,26-11-2020,uitspraak,"[{'Vindplaats': 'Rechtspraak.nl', 'VindplaatsAnnotator': '', 'VindplaatsUrl': ''}]"
ECLI-NL-RBDHA-2020-14899,http://deeplink.rechtspraak.nl/uitspraak?id=ECLI:NL:RBDHA:2020:14899,uitspraak,De publicatie van de uitspraak staat gepland op 22-07-2021 om 17:25 uur,https://uitspraken.rechtspraak.nl/inziendocument?id=ECLI:NL:RBDHA:2020:14899&showbutton=true&keyword=mensenhandel,0.0,['Eerste aanleg - enkelvoudig'],22-07-2021,2021-07-22T17:25:56.435Z,gepubliceerd,['Bestuursrecht; Vreemdelingenrecht'],[],"Dublin, Italië, gezin met minderjarig kind, interstatelijk vertrouwensbeginsel, interim measures, slachtoffer mensenhandel, kwetsbaarheid, verplichte coronatest, beroepen ongegrond.","Rechtbank Den Haag, 13-11-2020, NL19.27424 en NL19.27426",ECLI:NL:RBDHA:2020:14899,13-11-2020,uitspraak,"[{'Vindplaats': 'Rechtspraak.nl', 'VindplaatsAnnotator': '', 'VindplaatsUrl': ''}]"
ECLI-NL-RBROT-2020-5085,http://deeplink.rechtspraak.nl/uitspraak?id=ECLI:NL:RBROT:2020:5085,uitspraak,De publicatie van de uitspraak staat gepland op 10-06-2020 om 11:13 uur,https://uitspraken.rechtspraak.nl/inziendocument?id=ECLI:NL:RBROT:2020:5085&showbutton=true&keyword=mensenhandel,0.0,['Eerste aanleg - meervoudig'],10-06-2020,2020-06-10T11:13:47Z,gepubliceerd,['Strafrecht'],[],Veroordeling voor onder meer mensenhandel door minderjarige verdachte (slachtoffer ook minderjarig) en in bezit hebben van kinderporno.,"Rechtbank Rotterdam, 09-06-2020, 10/750503-19",ECLI:NL:RBROT:2020:5085,09-06-2020,uitspraak,"[{'Vindplaats': 'Rechtspraak.nl', 'VindplaatsAnnotator': '', 'VindplaatsUrl': ''}]"
ECLI-NL-GHAMS-2020-1458,http://deeplink.rechtspraak.nl/uitspraak?id=ECLI:NL:GHAMS:2020:1458,uitspraak,De publicatie van de uitspraak staat gepland op 08-06-2020 om 10:21 uur,https://uitspraken.rechtspraak.nl/inziendocument?id=ECLI:NL:GHAMS:2020:1458&showbutton=true&keyword=mensenhandel,0.0,['Hoger beroep'],08-06-2020,2020-06-08T10:21:28Z,gepubliceerd,['Strafrecht'],[],Ontneming. Mensenhandel. Wederrechtelijk verkregen voordeel gelijk aan de materiele schade van de benadeelde partijen in de strafzaak.,"Gerechtshof Amsterdam, 02-06-2020, 23-002843-19",ECLI:NL:GHAMS:2020:1458,02-06-2020,uitspraak,"[{'Vindplaats': 'JOW 2020/38', 'VindplaatsAnnotator': '', 'VindplaatsUrl': ''}, {'Vindplaats': 'Rechtspraak.nl', 'VindplaatsAnnotator': '', 'VindplaatsUrl': ''}]"
ECLI-NL-RBAMS-2018-1659,http://deeplink.rechtspraak.nl/uitspraak?id=ECLI:NL:RBAMS:2018:1659,uitspraak,De publicatie van de uitspraak staat gepland op 09-04-2018 om 09:12 uur,https://uitspraken.rechtspraak.nl/inziendocument?id=ECLI:NL:RBAMS:2018:1659&showbutton=true&keyword=mensenhandel,0.0,"['Eerste aanleg - meervoudig', 'Op tegenspraak']",09-04-2018,2018-04-09T09:12:09Z,gepubliceerd,['Strafrecht'],[],De rechtbank legt verdachte een gevangenisstraf van 30 maanden op voor mensenhandel. De redelijke termijn is overschreden.,"Rechtbank Amsterdam, 18-02-2018, 13/706345-11",ECLI:NL:RBAMS:2018:1659,18-02-2018,uitspraak,"[{'Vindplaats': 'Rechtspraak.nl', 'VindplaatsAnnotator': '', 'VindplaatsUrl': ''}]"
ECLI-NL-RBAMS-2018-738,http://deeplink.rechtspraak.nl/uitspraak?id=ECLI:NL:RBAMS:2018:738,uitspraak,De publicatie van de uitspraak staat gepland op 09-04-2018 om 09:15 uur,https://uitspraken.rechtspraak.nl/inziendocument?id=ECLI:NL:RBAMS:2018:738&showbutton=true&keyword=mensenhandel,0.0,"['Eerste aanleg - meervoudig', 'Op tegenspraak']",09-04-2018,2018-04-09T09:15:09Z,gepubliceerd,['Strafrecht'],[],De rechtbank legt verdachte een gevangenisstraf van 12 maanden op voor mensenhandel. De redelijke termijn is overschreden.,"Rechtbank Amsterdam, 12-02-2018, 13/693008-11",ECLI:NL:RBAMS:2018:738,12-02-2018,uitspraak,"[{'Vindplaats': 'Rechtspraak.nl', 'VindplaatsAnnotator': '', 'VindplaatsUrl': ''}]"
ECLI-NL-RBLIM-2017-3330,http://deeplink.rechtspraak.nl/uitspraak?id=ECLI:NL:RBLIM:2017:3330,uitspraak,De publicatie van de uitspraak staat gepland op 13-04-2017 om 15:00 uur,https://uitspraken.rechtspraak.nl/inziendocument?id=ECLI:NL:RBLIM:2017:3330&showbutton=true&keyword=mensenhandel,0.0,['Eerste aanleg - meervoudig'],13-04-2017,2017-04-13T15:00:01Z,gepubliceerd,['Strafrecht'],[],"Veroordeling wegens mensenhandel in eendaadse samenloop met mishandeling. Gevangenisstraf van 6 maanden, met aftrek van het voorarrest.","Rechtbank Limburg, 13-04-2017, 03/720895-13",ECLI:NL:RBLIM:2017:3330,13-04-2017,uitspraak,"[{'Vindplaats': 'Rechtspraak.nl', 'VindplaatsAnnotator': '', 'VindplaatsUrl': ''}]"
ECLI-NL-GHARL-2015-4639,http://deeplink.rechtspraak.nl/uitspraak?id=ECLI:NL:GHARL:2015:4639,uitspraak,De publicatie van de uitspraak staat gepland op 01-07-2015 om 15:03 uur,https://uitspraken.rechtspraak.nl/inziendocument?id=ECLI:NL:GHARL:2015:4639&showbutton=true&keyword=mensenhandel,0.0,['Hoger beroep'],01-07-2015,2015-07-01T15:03:47Z,gepubliceerd,['Strafrecht'],"[{'RelatieOmschrijving': 'Cassatie: ', 'LinkTekst': 'ECLI:NL:HR:2016:2771', 'Postfix': ', Bekrachtiging/bevestiging', 'WebAdres': 'https://uitspraken.rechtspraak.nl/inziendocument?id=ECLI:NL:HR:2016:2771&showbutton=true&keyword=mensenhandel'}]",Onderzoek Santana. Afwijzing verzoek bewijsuitsluiting ondanks schending artikel 8 EVRM. Veroordeling ter zake van mensenhandel (in vereniging).,"Gerechtshof Arnhem-Leeuwarden, 24-06-2015, 21-001410-14",ECLI:NL:GHARL:2015:4639,24-06-2015,uitspraak,"[{'Vindplaats': 'Rechtspraak.nl', 'VindplaatsAnnotator': '', 'VindplaatsUrl': ''}]"
ECLI-NL-RBLIM-2015-4267,http://deeplink.rechtspraak.nl/uitspraak?id=ECLI:NL:RBLIM:2015:4267,uitspraak,De publicatie van de uitspraak staat gepland op 22-05-2015 om 14:30 uur,https://uitspraken.rechtspraak.nl/inziendocument?id=ECLI:NL:RBLIM:2015:4267&showbutton=true&keyword=mensenhandel,0.0,['Eerste aanleg - meervoudig'],22-05-2015,2015-05-22T14:30:07Z,gepubliceerd,['Strafrecht'],[],Mensenhandel. Onvoldoende bewijs voor het gebezigd zijn van dwangmiddelen. Geen sprake van strafbaar grensoverschrijdend vervoer. Minderjarige. AVAS,"Rechtbank Limburg, 22-05-2015, 03/703546-11 en 03/702678-13 (ttz gev.)",ECLI:NL:RBLIM:2015:4267,22-05-2015,uitspraak,"[{'Vindplaats': 'Rechtspraak.nl', 'VindplaatsAnnotator': '', 'VindplaatsUrl': ''}]"
ECLI-NL-RBLIM-2015-4275,http://deeplink.rechtspraak.nl/uitspraak?id=ECLI:NL:RBLIM:2015:4275,uitspraak,De publicatie van de uitspraak staat gepland op 22-05-2015 om 14:39 uur,https://uitspraken.rechtspraak.nl/inziendocument?id=ECLI:NL:RBLIM:2015:4275&showbutton=true&keyword=mensenhandel,0.0,['Eerste aanleg - meervoudig'],22-05-2015,2015-05-22T14:39:36Z,gepubliceerd,['Strafrecht'],[],Mensenhandel. Onvoldoende bewijs voor het gebezigd zijn van dwangmiddelen. Geen sprake van strafbaar grensoverschrijdend vervoer. Minderjarige. AVAS,"Rechtbank Limburg, 22-05-2015, 03/700531-11",ECLI:NL:RBLIM:2015:4275,22-05-2015,uitspraak,"[{'Vindplaats': 'Rechtspraak.nl', 'VindplaatsAnnotator': '', 'VindplaatsUrl': ''}]"
ECLI-NL-RBLIM-2015-4264,http://deeplink.rechtspraak.nl/uitspraak?id=ECLI:NL:RBLIM:2015:4264,uitspraak,De publicatie van de uitspraak staat gepland op 22-05-2015 om 14:30 uur,https://uitspraken.rechtspraak.nl/inziendocument?id=ECLI:NL:RBLIM:2015:4264&showbutton=true&keyword=mensenhandel,0.0,['Eerste aanleg - meervoudig'],22-05-2015,2015-05-22T14:30:06Z,gepubliceerd,['Strafrecht'],[],Mensenhandel. Onvoldoende bewijs voor het gebezigd zijn van dwangmiddelen. Geen sprake van strafbaar grensoverschrijdend vervoer. Minderjarige. AVAS,"Rechtbank Limburg, 22-05-2015, 03/703579-11",ECLI:NL:RBLIM:2015:4264,22-05-2015,uitspraak,"[{'Vindplaats': 'NJFS 2015/148', 'VindplaatsAnnotator': '', 'VindplaatsUrl': ''}, {'Vindplaats': 'Rechtspraak.nl', 'VindplaatsAnnotator': '', 'VindplaatsUrl': ''}]"
ECLI-NL-RBNHO-2013-14050,http://deeplink.rechtspraak.nl/uitspraak?id=ECLI:NL:RBNHO:2013:14050,uitspraak,De publicatie van de uitspraak staat gepland op 25-06-2014 om 12:32 uur,https://uitspraken.rechtspraak.nl/inziendocument?id=ECLI:NL:RBNHO:2013:14050&showbutton=true&keyword=mensenhandel,0.0,['Eerste aanleg - meervoudig'],25-06-2014,2014-06-25T12:32:45Z,gepubliceerd,['Strafrecht'],[],"Promis; bewezenverklaring mensenhandel, meermalen gepleegd (minderjarigen); vrijspraak mensensmokkel; verweer ontbreken strafbaarheid verdachte wegens verontschuldigbare dwaling verworpen; straftoemeting.","Rechtbank Noord-Holland, 24-12-2013, 15/740698-13",ECLI:NL:RBNHO:2013:14050,24-12-2013,uitspraak,"[{'Vindplaats': 'Rechtspraak.nl', 'VindplaatsAnnotator': '', 'VindplaatsUrl': ''}]"
ECLI-NL-RBDHA-2013-BZ3902,http://deeplink.rechtspraak.nl/uitspraak?id=ECLI:NL:RBDHA:2013:BZ3902,uitspraak,De publicatie van de uitspraak staat gepland op 12-03-2013 om 15:32 uur,https://uitspraken.rechtspraak.nl/inziendocument?id=ECLI:NL:RBDHA:2013:BZ3902&showbutton=true&keyword=mensenhandel,0.0,['Eerste aanleg - meervoudig'],12-03-2013,2013-03-12T15:32:02Z,gepubliceerd,['Strafrecht'],[],"Poging mensenhandel, in vereniging gepleegd, waarbij de slachtoffers de leeftijd van zestien jaar nog niet hebben bereikt.","Rechtbank Den Haag, 21-02-2013, 09/920119-12; 09/920254-12",ECLI:NL:RBDHA:2013:BZ3902,21-02-2013,uitspraak,"[{'Vindplaats': 'Rechtspraak.nl', 'VindplaatsAnnotator': '', 'VindplaatsUrl': ''}]"
ECLI-NL-RBDHA-2013-BZ3920,http://deeplink.rechtspraak.nl/uitspraak?id=ECLI:NL:RBDHA:2013:BZ3920,uitspraak,De publicatie van de uitspraak staat gepland op 12-03-2013 om 16:00 uur,https://uitspraken.rechtspraak.nl/inziendocument?id=ECLI:NL:RBDHA:2013:BZ3920&showbutton=true&keyword=mensenhandel,0.0,['Eerste aanleg - meervoudig'],12-03-2013,2013-03-12T16:00:23Z,gepubliceerd,['Strafrecht'],[],"Poging mensenhandel, in vereniging gepleegd, waarbij de slachtoffers de leeftijd van zestien jaren nog niet hebben bereikt.","Rechtbank Den Haag, 21-02-2013, 09/920120-12; 09/920255-12 (ttz gevoegd); 09/761110-12 (ttz gevoegd)",ECLI:NL:RBDHA:2013:BZ3920,21-02-2013,uitspraak,"[{'Vindplaats': 'Rechtspraak.nl', 'VindplaatsAnnotator': '', 'VindplaatsUrl': ''}]"
ECLI-NL-RBUTR-2009-BJ3128,http://deeplink.rechtspraak.nl/uitspraak?id=ECLI:NL:RBUTR:2009:BJ3128,uitspraak,De publicatie van de uitspraak staat gepland op 20-07-2009 om 16:28 uur,https://uitspraken.rechtspraak.nl/inziendocument?id=ECLI:NL:RBUTR:2009:BJ3128&showbutton=true&keyword=mensenhandel,0.0,['Eerste aanleg - meervoudig'],20-07-2009,2009-07-20T16:28:43Z,gepubliceerd,['Strafrecht'],[],Veroordeling wegens mensenhandel. Gedurende een periode van 45 dagen een meisje gedwongen om in de prostitutie werken.,"Rechtbank Utrecht, 16-07-2009, 16/500177-08 [P]",ECLI:NL:RBUTR:2009:BJ3128,16-07-2009,uitspraak,"[{'Vindplaats': 'Rechtspraak.nl', 'VindplaatsAnnotator': '', 'VindplaatsUrl': ''}]"
ECLI-NL-RBAMS-2007-BA1489,http://deeplink.rechtspraak.nl/uitspraak?id=ECLI:NL:RBAMS:2007:BA1489,uitspraak,De publicatie van de uitspraak staat gepland op 26-03-2007 om 13:31 uur,https://uitspraken.rechtspraak.nl/inziendocument?id=ECLI:NL:RBAMS:2007:BA1489&showbutton=true&keyword=mensenhandel,0.0,['Eerste aanleg - meervoudig'],26-03-2007,2007-03-26T13:31:02Z,gepubliceerd,['Strafrecht'],[],"Zaak is een verzoek tot uitlevering aan België, de opgeeiste persoon zou daar verdacht worden van mensenhandel.","Rechtbank Amsterdam, 06-03-2007, 13.497.610-2006",ECLI:NL:RBAMS:2007:BA1489,06-03-2007,uitspraak,"[{'Vindplaats': 'Rechtspraak.nl', 'VindplaatsAnnotator': '', 'VindplaatsUrl': ''}]"
ECLI-NL-RBOBR-2020-1909,http://deeplink.rechtspraak.nl/uitspraak?id=ECLI:NL:RBOBR:2020:1909,uitspraak,De publicatie van de uitspraak staat gepland op 31-03-2020 om 12:20 uur,https://uitspraken.rechtspraak.nl/inziendocument?id=ECLI:NL:RBOBR:2020:1909&showbutton=true&keyword=mensenhandel,0.0,['Eerste aanleg - meervoudig'],31-03-2020,2020-03-31T12:20:36Z,gepubliceerd,['Strafrecht'],[],"Veroordeling mensenhandel en witwassen (het uitgegeven en daarmee omgezette geld is afkomstig uit de inkomsten uit de prostitutiewerkzaamheden). 
Vrijspraak voor mensenhandel met betrekking tot hetzelfde slachtoffer in een andere, eerdere, periode.
Opgelegd wordt een gevangenisstraf voor de duur van 24 maanden waarvan 10 maanden voorwaardelijk met een proeftijd van 3 jaren en met aftrek van voorarrest.","Rechtbank Oost-Brabant, 11-02-2020, 01/880675-18",ECLI:NL:RBOBR:2020:1909,11-02-2020,uitspraak,"[{'Vindplaats': 'Rechtspraak.nl', 'VindplaatsAnnotator': '', 'VindplaatsUrl': ''}]"
ECLI-NL-RBROT-2019-5095,http://deeplink.rechtspraak.nl/uitspraak?id=ECLI:NL:RBROT:2019:5095,uitspraak,De publicatie van de uitspraak staat gepland op 27-06-2019 om 11:57 uur,https://uitspraken.rechtspraak.nl/inziendocument?id=ECLI:NL:RBROT:2019:5095&showbutton=true&keyword=mensenhandel,0.0,['Eerste aanleg - meervoudig'],27-06-2019,2019-06-27T11:57:15Z,gepubliceerd,['Strafrecht'],[],"Mensenhandel ten aanzien van Roemeense prostituees. Uitbuiting door misleiding, misbruik van overwicht en kwetsbare positie. Vrijspraak van gebruik van geweld of dreiging daarmee. Poging tot afpersing ten aanzien van betrokken chauffeur. Mensenhandel is een zeer vergaande manier van uitbuiting, waarbij de lichamelijke en geestelijke integriteit van de slachtoffers geheel ondergeschikt wordt gemaakt aan het geldelijk gewin van de daders.","Rechtbank Rotterdam, 27-06-2019, 10/750151-17",ECLI:NL:RBROT:2019:5095,27-06-2019,uitspraak,"[{'Vindplaats': 'Rechtspraak.nl', 'VindplaatsAnnotator': '', 'VindplaatsUrl': ''}]"
ECLI-NL-RBMNE-2015-9620,http://deeplink.rechtspraak.nl/uitspraak?id=ECLI:NL:RBMNE:2015:9620,uitspraak,De publicatie van de uitspraak staat gepland op 21-03-2016 om 16:28 uur,https://uitspraken.rechtspraak.nl/inziendocument?id=ECLI:NL:RBMNE:2015:9620&showbutton=true&keyword=mensenhandel,0.0,['Eerste aanleg - meervoudig'],21-03-2016,2016-03-21T16:28:42Z,gepubliceerd,['Strafrecht'],[],"De rechtbank veroordeelt tot 18 maanden gevangenisstraf waarvan 6 maanden voorwaardelijk voor mensenhandel. Verdachte heeft zich gedurende een periode van ongeveer 3 weken schuldig gemaakt aan mensenhandel, door een minderjarige, van vijftien jaar oud, in de prostitutie te brengen en daarvan te profiteren. Daarnaast zijn nog een aantal bijzondere voorwaarden aan verdachte opgelegd zoals een contactverbod.","Rechtbank Midden-Nederland, 15-09-2015, 16/705621-14 (P)",ECLI:NL:RBMNE:2015:9620,15-09-2015,uitspraak,"[{'Vindplaats': 'Rechtspraak.nl', 'VindplaatsAnnotator': '', 'VindplaatsUrl': ''}]"
ECLI-NL-RBGEL-2014-7747,http://deeplink.rechtspraak.nl/uitspraak?id=ECLI:NL:RBGEL:2014:7747,uitspraak,De publicatie van de uitspraak staat gepland op 15-12-2014 om 10:52 uur,https://uitspraken.rechtspraak.nl/inziendocument?id=ECLI:NL:RBGEL:2014:7747&showbutton=true&keyword=mensenhandel,0.0,['Eerste aanleg - meervoudig'],15-12-2014,2014-12-15T10:52:20Z,gepubliceerd,['Strafrecht'],"[{'RelatieOmschrijving': 'Hoger beroep: ', 'LinkTekst': 'ECLI:NL:GHARL:2015:6878', 'Postfix': ', (Gedeeltelijke) vernietiging en zelf afgedaan', 'WebAdres': 'https://uitspraken.rechtspraak.nl/inziendocument?id=ECLI:NL:GHARL:2015:6878&showbutton=true&keyword=mensenhandel'}]",Mensenhandel: De rechtbank Gelderland veroordeelt een 32-jarige man uit Doetinchem voor mensenhandel van twee Roemeense slachtoffers en het verzwijgen van inkomsten voor zijn bewindvoerder tot een gevangenisstraf van 30 maanden. Ook moet de man een schadevergoeding betalen aan beide slachtoffers. Strafmaat: de rechtbank motiveert welke punten bij de beoordeling van de stafmaat van belang zijn geweest.,"Rechtbank Gelderland, 15-12-2014, 05/780072-14 a",ECLI:NL:RBGEL:2014:7747,15-12-2014,uitspraak,"[{'Vindplaats': 'Rechtspraak.nl', 'VindplaatsAnnotator': '', 'VindplaatsUrl': ''}]"
ECLI-NL-RBOVE-2014-6587,http://deeplink.rechtspraak.nl/uitspraak?id=ECLI:NL:RBOVE:2014:6587,uitspraak,De publicatie van de uitspraak staat gepland op 11-12-2014 om 09:53 uur,https://uitspraken.rechtspraak.nl/inziendocument?id=ECLI:NL:RBOVE:2014:6587&showbutton=true&keyword=mensenhandel,0.0,['Eerste aanleg - meervoudig'],11-12-2014,2014-12-11T09:53:50Z,gepubliceerd,['Strafrecht'],[],"De rechtbank Overijssel veroordeelt een man uit Bulgarije tot 18 maanden gevangenisstraf voor mensenhandel gepleegd jegens een Bulgaarse vrouw. De vrouw moest in de prostitutie werken in onder meer Utrecht. Mensenhandel, een vorm van moderne slavernij, is een ernstig strafbaar feit. Verder maakte de man zich schuldig aan bedreiging met enig misdrijf tegen het leven gericht tegen hetzelfde slachtoffer.","Rechtbank Overijssel, 25-11-2014, 08.963517-14",ECLI:NL:RBOVE:2014:6587,25-11-2014,uitspraak,"[{'Vindplaats': 'Rechtspraak.nl', 'VindplaatsAnnotator': '', 'VindplaatsUrl': ''}]"
ECLI-NL-GHARL-2014-2257,http://deeplink.rechtspraak.nl/uitspraak?id=ECLI:NL:GHARL:2014:2257,uitspraak,De publicatie van de uitspraak staat gepland op 20-03-2014 om 15:28 uur,https://uitspraken.rechtspraak.nl/inziendocument?id=ECLI:NL:GHARL:2014:2257&showbutton=true&keyword=mensenhandel,0.0,['Hoger beroep'],20-03-2014,2014-03-20T15:28:08Z,gepubliceerd,['Strafrecht'],"[{'RelatieOmschrijving': 'Eerste aanleg: ', 'LinkTekst': 'ECLI:NL:RBZLY:2012:2188', 'Postfix': None, 'WebAdres': 'https://uitspraken.rechtspraak.nl/inziendocument?id=ECLI:NL:RBZLY:2012:2188&showbutton=true&keyword=mensenhandel'}]","Onderzoek Boerdijk: Ontvankelijkheid OM/incompleet dossier/359a Sv/6EVRM. Mensenhandel. Witwassen/vermogen BV niet ‘besmet’. Valsheid in geschrifte/gebruik maken van/opnemen in administratie. Criminele organisatie/duurzaam gestructureerd samenwerkingsverband onderneming. 
Onzorgvuldige en onvolledige dossiervorming/hersteld in appelfase/strafcompensatie
Vrijspraak ter zake criminele organisatie, witwassen en mensenhandel. 
OVAR ter zake valsheid in geschrifte (opnemen in administratie).","Gerechtshof Arnhem-Leeuwarden, 18-03-2014, ks 21-001424-13",ECLI:NL:GHARL:2014:2257,18-03-2014,uitspraak,"[{'Vindplaats': 'Rechtspraak.nl', 'VindplaatsAnnotator': '', 'VindplaatsUrl': ''}]"
ECLI-NL-RBDHA-2021-727,http://deeplink.rechtspraak.nl/uitspraak?id=ECLI:NL:RBDHA:2021:727,uitspraak,De publicatie van de uitspraak staat gepland op 02-02-2021 om 15:19 uur,https://uitspraken.rechtspraak.nl/inziendocument?id=ECLI:NL:RBDHA:2021:727&showbutton=true&keyword=mensenhandel,0.0,['Eerste aanleg - meervoudig'],02-02-2021,2021-02-02T15:19:30Z,gepubliceerd,['Bestuursrecht; Vreemdelingenrecht'],[],"Dublin, Italië, slachtoffer mensenhandel, implementatie en uitleg artikel 6 Ri 2004/81/EG, aangifte, bedenktijd, overdrachtsbesluit, prejudiciële vragen","Rechtbank Den Haag, 29-01-2021, NL19.18937",ECLI:NL:RBDHA:2021:727,29-01-2021,uitspraak,"[{'Vindplaats': 'JV 2021/46', 'VindplaatsAnnotator': '', 'VindplaatsUrl': ''}, {'Vindplaats': 'Rechtspraak.nl', 'VindplaatsAnnotator': '', 'VindplaatsUrl': ''}]"
ECLI-NL-RBAMS-2019-9633,http://deeplink.rechtspraak.nl/uitspraak?id=ECLI:NL:RBAMS:2019:9633,uitspraak,De publicatie van de uitspraak staat gepland op 20-12-2019 om 15:13 uur,https://uitspraken.rechtspraak.nl/inziendocument?id=ECLI:NL:RBAMS:2019:9633&showbutton=true&keyword=mensenhandel,0.0,['Eerste aanleg - meervoudig'],20-12-2019,2019-12-20T15:13:58Z,gepubliceerd,['Bestuursrecht'],[],De burgemeester mocht van een raamprostitutiebedrijf verwachten dat het vermoedens van mensenhandel onmiddellijk bij de politie zou melden.,"Rechtbank Amsterdam, 19-12-2019, AMS 18/5824",ECLI:NL:RBAMS:2019:9633,19-12-2019,uitspraak,"[{'Vindplaats': 'Rechtspraak.nl', 'VindplaatsAnnotator': '', 'VindplaatsUrl': ''}]"
ECLI-NL-RBAMS-2019-3778,http://deeplink.rechtspraak.nl/uitspraak?id=ECLI:NL:RBAMS:2019:3778,uitspraak,De publicatie van de uitspraak staat gepland op 07-06-2019 om 08:29 uur,https://uitspraken.rechtspraak.nl/inziendocument?id=ECLI:NL:RBAMS:2019:3778&showbutton=true&keyword=mensenhandel,0.0,"['Eerste aanleg - meervoudig', 'Op tegenspraak']",07-06-2019,2019-06-07T08:29:50Z,gepubliceerd,['Strafrecht'],[],Mensenhandel gedurende een periode van in totaal bijna zeven jaar. Twee slachtoffers. Onvoorwaardelijke gevangenisstraf van 6 jaren opgelegd.,"Rechtbank Amsterdam, 02-05-2019, 13/728005-18",ECLI:NL:RBAMS:2019:3778,02-05-2019,uitspraak,"[{'Vindplaats': 'PS-Updates.nl 2019-0866', 'VindplaatsAnnotator': '', 'VindplaatsUrl': ''}, {'Vindplaats': 'Rechtspraak.nl', 'VindplaatsAnnotator': '', 'VindplaatsUrl': ''}]"
ECLI-NL-RBAMS-2019-1619,http://deeplink.rechtspraak.nl/uitspraak?id=ECLI:NL:RBAMS:2019:1619,uitspraak,De publicatie van de uitspraak staat gepland op 14-03-2019 om 15:37 uur,https://uitspraken.rechtspraak.nl/inziendocument?id=ECLI:NL:RBAMS:2019:1619&showbutton=true&keyword=mensenhandel,0.0,['Eerste aanleg - meervoudig'],14-03-2019,2019-03-14T15:37:05Z,gepubliceerd,['Strafrecht'],[],"Veroordeling mensenhandel, art. 273f, eerste lid sub 1, 4 en 6 Sr. Arbeidsuitbuiting Bulgaren in de komkommerkassen.","Rechtbank Amsterdam, 07-03-2019, 13/993028-16",ECLI:NL:RBAMS:2019:1619,07-03-2019,uitspraak,"[{'Vindplaats': 'Rechtspraak.nl', 'VindplaatsAnnotator': '', 'VindplaatsUrl': ''}]"
ECLI-NL-RBAMS-2019-1620,http://deeplink.rechtspraak.nl/uitspraak?id=ECLI:NL:RBAMS:2019:1620,uitspraak,De publicatie van de uitspraak staat gepland op 14-03-2019 om 13:05 uur,https://uitspraken.rechtspraak.nl/inziendocument?id=ECLI:NL:RBAMS:2019:1620&showbutton=true&keyword=mensenhandel,0.0,['Eerste aanleg - meervoudig'],14-03-2019,2019-03-14T13:05:05Z,gepubliceerd,['Strafrecht'],[],"Veroordeling mensenhandel, artikel 273f, eerste lid sub 1, 4 en 6 Sr. Arbeidsuitbuiting Bulgaren in de komkommerkassen.","Rechtbank Amsterdam, 07-03-2019, 13/993036-16",ECLI:NL:RBAMS:2019:1620,07-03-2019,uitspraak,"[{'Vindplaats': 'Rechtspraak.nl', 'VindplaatsAnnotator': '', 'VindplaatsUrl': ''}]"
ECLI-NL-RBNHO-2017-11368,http://deeplink.rechtspraak.nl/uitspraak?id=ECLI:NL:RBNHO:2017:11368,uitspraak,De publicatie van de uitspraak staat gepland op 11-01-2018 om 13:05 uur,https://uitspraken.rechtspraak.nl/inziendocument?id=ECLI:NL:RBNHO:2017:11368&showbutton=true&keyword=mensenhandel,0.0,"['Eerste aanleg - meervoudig', 'Op tegenspraak']",11-01-2018,2018-01-11T13:05:49Z,gepubliceerd,['Strafrecht'],[],"Promis. Bewezenverklaring mensenhandel. Bewijsoverwegingen over minderjarigheid van het slachtoffer, de rol van verdachte, oogmerk van uitbuiting en medeplegen.","Rechtbank Noord-Holland, 15-12-2017, 15/810213-16",ECLI:NL:RBNHO:2017:11368,15-12-2017,uitspraak,"[{'Vindplaats': 'Rechtspraak.nl', 'VindplaatsAnnotator': '', 'VindplaatsUrl': ''}]"
ECLI-NL-GHDHA-2016-2681,http://deeplink.rechtspraak.nl/uitspraak?id=ECLI:NL:GHDHA:2016:2681,uitspraak,De publicatie van de uitspraak staat gepland op 15-09-2016 om 16:07 uur,https://uitspraken.rechtspraak.nl/inziendocument?id=ECLI:NL:GHDHA:2016:2681&showbutton=true&keyword=mensenhandel,0.0,['Hoger beroep'],15-09-2016,2016-09-15T16:07:01Z,gepubliceerd,['Strafrecht'],"[{'RelatieOmschrijving': 'Cassatie: ', 'LinkTekst': 'ECLI:NL:HR:2018:775', 'Postfix': ', Bekrachtiging/bevestiging', 'WebAdres': 'https://uitspraken.rechtspraak.nl/inziendocument?id=ECLI:NL:HR:2018:775&showbutton=true&keyword=mensenhandel'}]",Veroordeling tot 15 jaar gevangenisstraf voor seksueel misbruik en mensenhandel; bewijsminimum en schakelbewijs inzake seksueel misbruik; wettelijke rente,"Gerechtshof Den Haag, 15-09-2016, 2200158714",ECLI:NL:GHDHA:2016:2681,15-09-2016,uitspraak,"[{'Vindplaats': 'Rechtspraak.nl', 'VindplaatsAnnotator': '', 'VindplaatsUrl': ''}]"
ECLI-NL-GHAMS-2016-1267,http://deeplink.rechtspraak.nl/uitspraak?id=ECLI:NL:GHAMS:2016:1267,uitspraak,De publicatie van de uitspraak staat gepland op 08-04-2016 om 10:20 uur,https://uitspraken.rechtspraak.nl/inziendocument?id=ECLI:NL:GHAMS:2016:1267&showbutton=true&keyword=mensenhandel,0.0,['Hoger beroep'],08-04-2016,2016-04-08T10:20:52Z,gepubliceerd,['Strafrecht'],"[{'RelatieOmschrijving': 'Cassatie: ', 'LinkTekst': 'ECLI:NL:HR:2019:1028', 'Postfix': ', Meerdere afhandelingswijzen', 'WebAdres': 'https://uitspraken.rechtspraak.nl/inziendocument?id=ECLI:NL:HR:2019:1028&showbutton=true&keyword=mensenhandel'}]",Medeplegen mensenhandel door het slachtoffer naar Nederland mee te nemen om haar beschikbaar te (laten) stellen voor prostitutie.,"Gerechtshof Amsterdam, 31-03-2016, 23-002114-13",ECLI:NL:GHAMS:2016:1267,31-03-2016,uitspraak,"[{'Vindplaats': 'Rechtspraak.nl', 'VindplaatsAnnotator': '', 'VindplaatsUrl': ''}]"
ECLI-NL-RBGEL-2013-5800,http://deeplink.rechtspraak.nl/uitspraak?id=ECLI:NL:RBGEL:2013:5800,uitspraak,De publicatie van de uitspraak staat gepland op 17-12-2013 om 13:20 uur,https://uitspraken.rechtspraak.nl/inziendocument?id=ECLI:NL:RBGEL:2013:5800&showbutton=true&keyword=mensenhandel,0.0,['Eerste aanleg - meervoudig'],17-12-2013,2013-12-17T13:20:58Z,gepubliceerd,['Strafrecht'],[],"De rechtbank Gelderland, zittingsplaats Arnhem, heeft een 29-jarige man vrijgesproken van de hem ten laste gelegde mensenhandel.","Rechtbank Gelderland, 17-12-2013, 05/780025-13",ECLI:NL:RBGEL:2013:5800,17-12-2013,uitspraak,"[{'Vindplaats': 'Rechtspraak.nl', 'VindplaatsAnnotator': '', 'VindplaatsUrl': ''}]"
ECLI-NL-RBNHO-2013-9660,http://deeplink.rechtspraak.nl/uitspraak?id=ECLI:NL:RBNHO:2013:9660,uitspraak,De publicatie van de uitspraak staat gepland op 17-10-2013 om 12:36 uur,https://uitspraken.rechtspraak.nl/inziendocument?id=ECLI:NL:RBNHO:2013:9660&showbutton=true&keyword=mensenhandel,0.0,['Eerste aanleg - meervoudig'],17-10-2013,2013-10-17T12:36:57Z,gepubliceerd,['Strafrecht'],[],"Promis; vrijspraak mensenhandel, poging afpersing en deelnemen aan criminele organisatie; bewezenverklaring openlijke geweldpleging; benadeelde partijen niet-ontvankelijk; straftoemeting.","Rechtbank Noord-Holland, 30-09-2013, 15/741278-12",ECLI:NL:RBNHO:2013:9660,30-09-2013,uitspraak,"[{'Vindplaats': 'Rechtspraak.nl', 'VindplaatsAnnotator': '', 'VindplaatsUrl': ''}]"
ECLI-NL-RBOBR-2013-2697,http://deeplink.rechtspraak.nl/uitspraak?id=ECLI:NL:RBOBR:2013:2697,uitspraak,De publicatie van de uitspraak staat gepland op 04-07-2013 om 13:44 uur,https://uitspraken.rechtspraak.nl/inziendocument?id=ECLI:NL:RBOBR:2013:2697&showbutton=true&keyword=mensenhandel,0.0,['Eerste aanleg - meervoudig'],04-07-2013,2013-07-04T13:44:46Z,gepubliceerd,['Strafrecht'],[],Een gevangenisstraf van 42 maanden met aftrek voorarrest voor mensenhandel gedurende een periode van twee jaren en witwassen.,"Rechtbank Oost-Brabant, 04-07-2013, 01-889018-12",ECLI:NL:RBOBR:2013:2697,04-07-2013,uitspraak,"[{'Vindplaats': 'Rechtspraak.nl', 'VindplaatsAnnotator': '', 'VindplaatsUrl': ''}]"
ECLI-NL-RBOBR-2013-2696,http://deeplink.rechtspraak.nl/uitspraak?id=ECLI:NL:RBOBR:2013:2696,uitspraak,De publicatie van de uitspraak staat gepland op 04-07-2013 om 13:55 uur,https://uitspraken.rechtspraak.nl/inziendocument?id=ECLI:NL:RBOBR:2013:2696&showbutton=true&keyword=mensenhandel,0.0,['Eerste aanleg - meervoudig'],04-07-2013,2013-07-04T13:55:16Z,gepubliceerd,['Strafrecht'],[],Een gevangenisstraf van 12 maanden met aftrek voorarrest voor mensenhandel gedurende een periode van drie maanden en witwassen.,"Rechtbank Oost-Brabant, 04-07-2013, 01-889076-12",ECLI:NL:RBOBR:2013:2696,04-07-2013,uitspraak,"[{'Vindplaats': 'Rechtspraak.nl', 'VindplaatsAnnotator': '', 'VindplaatsUrl': ''}]"
ECLI-NL-RBAMS-2013-CA3415,http://deeplink.rechtspraak.nl/uitspraak?id=ECLI:NL:RBAMS:2013:CA3415,uitspraak,De publicatie van de uitspraak staat gepland op 17-06-2013 om 16:39 uur,https://uitspraken.rechtspraak.nl/inziendocument?id=ECLI:NL:RBAMS:2013:CA3415&showbutton=true&keyword=mensenhandel,0.0,['Eerste aanleg - meervoudig'],17-06-2013,2013-06-17T16:39:09Z,gepubliceerd,['Strafrecht'],[],De rechtbank heeft de verdachte veroordeeld tot een gevangenisstraf van vier jaar wegens medeplegen van mensenhandel en gewoontewitwassen.,"Rechtbank Amsterdam, 17-06-2013, 13/708136-11",ECLI:NL:RBAMS:2013:CA3415,17-06-2013,uitspraak,"[{'Vindplaats': 'Rechtspraak.nl', 'VindplaatsAnnotator': '', 'VindplaatsUrl': ''}]"
ECLI-NL-RBAMS-2013-CA3711,http://deeplink.rechtspraak.nl/uitspraak?id=ECLI:NL:RBAMS:2013:CA3711,uitspraak,De publicatie van de uitspraak staat gepland op 19-06-2013 om 11:04 uur,https://uitspraken.rechtspraak.nl/inziendocument?id=ECLI:NL:RBAMS:2013:CA3711&showbutton=true&keyword=mensenhandel,0.0,['Eerste aanleg - meervoudig'],19-06-2013,2013-06-19T11:04:45Z,gepubliceerd,['Strafrecht'],[],De rechtbank heeft de verdachte veroordeeld tot een gevangenisstraf van vier jaar wegens medeplegen van mensenhandel en gewoontewitwassen.,"Rechtbank Amsterdam, 17-06-2013, 13/708135-11",ECLI:NL:RBAMS:2013:CA3711,17-06-2013,uitspraak,"[{'Vindplaats': 'Rechtspraak.nl', 'VindplaatsAnnotator': '', 'VindplaatsUrl': ''}]"
ECLI-NL-RBGEL-2013-1485,http://deeplink.rechtspraak.nl/uitspraak?id=ECLI:NL:RBGEL:2013:1485,uitspraak,De publicatie van de uitspraak staat gepland op 05-07-2013 om 13:38 uur,https://uitspraken.rechtspraak.nl/inziendocument?id=ECLI:NL:RBGEL:2013:1485&showbutton=true&keyword=mensenhandel,0.0,['Eerste aanleg - meervoudig'],05-07-2013,2013-07-05T13:38:46Z,gepubliceerd,['Strafrecht'],"[{'RelatieOmschrijving': 'Hoger beroep: ', 'LinkTekst': 'ECLI:NL:GHARL:2014:9416', 'Postfix': ', (Gedeeltelijke) vernietiging en zelf afgedaan', 'WebAdres': 'https://uitspraken.rechtspraak.nl/inziendocument?id=ECLI:NL:GHARL:2014:9416&showbutton=true&keyword=mensenhandel'}]","Zwendel met telefoonabonnementen leidt niet tot veroordelingen wegens mensenhandel, maar in sommige gevallen wel tot veroordelingen wegens oplichting.","Rechtbank Gelderland, 12-06-2013, : 06/850783-12",ECLI:NL:RBGEL:2013:1485,12-06-2013,uitspraak,"[{'Vindplaats': 'Rechtspraak.nl', 'VindplaatsAnnotator': '', 'VindplaatsUrl': ''}]"
ECLI-NL-RBGEL-2013-CA3171,http://deeplink.rechtspraak.nl/uitspraak?id=ECLI:NL:RBGEL:2013:CA3171,uitspraak,De publicatie van de uitspraak staat gepland op 14-06-2013 om 11:44 uur,https://uitspraken.rechtspraak.nl/inziendocument?id=ECLI:NL:RBGEL:2013:CA3171&showbutton=true&keyword=mensenhandel,0.0,['Eerste aanleg - meervoudig'],14-06-2013,2013-06-14T11:44:31Z,gepubliceerd,['Strafrecht'],[],"Zwendel met telefoonabonnementen leidt niet tot veroordelingen wegens mensenhandel, maar in sommige gevallen wel tot veroordelingen wegens oplichting.","Rechtbank Gelderland, 12-06-2013, 06/850953-12",ECLI:NL:RBGEL:2013:CA3171,12-06-2013,uitspraak,"[{'Vindplaats': 'Rechtspraak.nl', 'VindplaatsAnnotator': '', 'VindplaatsUrl': ''}]"
ECLI-NL-RBGEL-2013-CA2936,http://deeplink.rechtspraak.nl/uitspraak?id=ECLI:NL:RBGEL:2013:CA2936,uitspraak,De publicatie van de uitspraak staat gepland op 12-06-2013 om 12:43 uur,https://uitspraken.rechtspraak.nl/inziendocument?id=ECLI:NL:RBGEL:2013:CA2936&showbutton=true&keyword=mensenhandel,0.0,['Eerste aanleg - meervoudig'],12-06-2013,2013-06-12T12:43:14Z,gepubliceerd,['Strafrecht'],"[{'RelatieOmschrijving': 'Hoger beroep: ', 'LinkTekst': 'ECLI:NL:GHARL:2014:9415', 'Postfix': ', (Gedeeltelijke) vernietiging en zelf afgedaan', 'WebAdres': 'https://uitspraken.rechtspraak.nl/inziendocument?id=ECLI:NL:GHARL:2014:9415&showbutton=true&keyword=mensenhandel'}]","Zwendel met telefoonabonnementen leidt niet tot veroordelingen wegens mensenhandel, maar in sommige gevallen wel tot veroordelingen wegens oplichting","Rechtbank Gelderland, 12-06-2013, 06/850904-12",ECLI:NL:RBGEL:2013:CA2936,12-06-2013,uitspraak,"[{'Vindplaats': 'Rechtspraak.nl', 'VindplaatsAnnotator': '', 'VindplaatsUrl': ''}]"
ECLI-NL-RBGEL-2013-CA3161,http://deeplink.rechtspraak.nl/uitspraak?id=ECLI:NL:RBGEL:2013:CA3161,uitspraak,De publicatie van de uitspraak staat gepland op 14-06-2013 om 10:24 uur,https://uitspraken.rechtspraak.nl/inziendocument?id=ECLI:NL:RBGEL:2013:CA3161&showbutton=true&keyword=mensenhandel,0.0,['Eerste aanleg - meervoudig'],14-06-2013,2013-06-14T10:24:28Z,gepubliceerd,['Strafrecht'],[],"Zwendel met telefoonabonnementen leidt niet tot veroordelingen wegens mensenhandel, maar in sommige gevallen wel tot veroordelingen wegens oplichting.","Rechtbank Gelderland, 12-06-2013, 05/780000-13",ECLI:NL:RBGEL:2013:CA3161,12-06-2013,uitspraak,"[{'Vindplaats': 'NJFS 2013/168', 'VindplaatsAnnotator': '', 'VindplaatsUrl': ''}, {'Vindplaats': 'Rechtspraak.nl', 'VindplaatsAnnotator': '', 'VindplaatsUrl': ''}]"
ECLI-NL-RBGEL-2013-CA3166,http://deeplink.rechtspraak.nl/uitspraak?id=ECLI:NL:RBGEL:2013:CA3166,uitspraak,De publicatie van de uitspraak staat gepland op 14-06-2013 om 10:37 uur,https://uitspraken.rechtspraak.nl/inziendocument?id=ECLI:NL:RBGEL:2013:CA3166&showbutton=true&keyword=mensenhandel,0.0,['Eerste aanleg - meervoudig'],14-06-2013,2013-06-14T10:37:58Z,gepubliceerd,['Strafrecht'],[],"Zwendel met telefoonabonnementen leidt niet tot veroordelingen wegens mensenhandel, maar in sommige gevallen wel tot veroordelingen wegens oplichting.","Rechtbank Gelderland, 12-06-2013, 06/850784-12",ECLI:NL:RBGEL:2013:CA3166,12-06-2013,uitspraak,"[{'Vindplaats': 'Rechtspraak.nl', 'VindplaatsAnnotator': '', 'VindplaatsUrl': ''}]"
ECLI-NL-RBGEL-2013-CA3525,http://deeplink.rechtspraak.nl/uitspraak?id=ECLI:NL:RBGEL:2013:CA3525,uitspraak,De publicatie van de uitspraak staat gepland op 18-06-2013 om 15:53 uur,https://uitspraken.rechtspraak.nl/inziendocument?id=ECLI:NL:RBGEL:2013:CA3525&showbutton=true&keyword=mensenhandel,0.0,['Eerste aanleg - meervoudig'],18-06-2013,2013-06-18T15:53:59Z,gepubliceerd,['Strafrecht'],[],"Zwendel met telefoonabonnementen leidt niet tot veroordelingen wegens mensenhandel, maar in sommige gevallen wel tot veroordelingen wegens oplichting.","Rechtbank Gelderland, 12-06-2013, 06/850903-12",ECLI:NL:RBGEL:2013:CA3525,12-06-2013,uitspraak,"[{'Vindplaats': 'Rechtspraak.nl', 'VindplaatsAnnotator': '', 'VindplaatsUrl': ''}]"
ECLI-NL-RBUTR-2012-BY0022,http://deeplink.rechtspraak.nl/uitspraak?id=ECLI:NL:RBUTR:2012:BY0022,uitspraak,De publicatie van de uitspraak staat gepland op 12-10-2012 om 16:48 uur,https://uitspraken.rechtspraak.nl/inziendocument?id=ECLI:NL:RBUTR:2012:BY0022&showbutton=true&keyword=mensenhandel,0.0,['Eerste aanleg - meervoudig'],12-10-2012,2012-10-12T16:48:17Z,gepubliceerd,['Strafrecht'],[],Veroordeling en deels vrijspraak in verband met mishandeling van en mensenhandel ten aanzien van partner en ex-partner.,"Rechtbank Utrecht, 13-09-2012, 16-600601-11",ECLI:NL:RBUTR:2012:BY0022,13-09-2012,uitspraak,"[{'Vindplaats': 'Rechtspraak.nl', 'VindplaatsAnnotator': '', 'VindplaatsUrl': ''}]"
ECLI-NL-RBUTR-2011-BV0759,http://deeplink.rechtspraak.nl/uitspraak?id=ECLI:NL:RBUTR:2011:BV0759,uitspraak,De publicatie van de uitspraak staat gepland op 12-01-2012 om 14:44 uur,https://uitspraken.rechtspraak.nl/inziendocument?id=ECLI:NL:RBUTR:2011:BV0759&showbutton=true&keyword=mensenhandel,0.0,['Eerste aanleg - meervoudig'],12-01-2012,2012-01-12T14:44:33Z,gepubliceerd,['Strafrecht'],"[{'RelatieOmschrijving': 'Hoger beroep: ', 'LinkTekst': 'ECLI:NL:GHARL:2013:BZ8892', 'Postfix': ', (Gedeeltelijke) vernietiging en zelf afgedaan', 'WebAdres': 'https://uitspraken.rechtspraak.nl/inziendocument?id=ECLI:NL:GHARL:2013:BZ8892&showbutton=true&keyword=mensenhandel'}]",Verdachte wordt veroordeeld wegens mensenhandel tot een gevangenisstraf van vier maanden voorwaardelijk met een proeftijd van twee jaren.,"Rechtbank Utrecht, 14-12-2011, 16/440557-10 [P]",ECLI:NL:RBUTR:2011:BV0759,14-12-2011,uitspraak,"[{'Vindplaats': 'Rechtspraak.nl', 'VindplaatsAnnotator': '', 'VindplaatsUrl': ''}]"
ECLI-NL-RBUTR-2011-BU4709,http://deeplink.rechtspraak.nl/uitspraak?id=ECLI:NL:RBUTR:2011:BU4709,uitspraak,De publicatie van de uitspraak staat gepland op 16-11-2011 om 15:34 uur,https://uitspraken.rechtspraak.nl/inziendocument?id=ECLI:NL:RBUTR:2011:BU4709&showbutton=true&keyword=mensenhandel,0.0,['Eerste aanleg - meervoudig'],16-11-2011,2011-11-16T15:34:00Z,gepubliceerd,['Strafrecht'],[],Veroordeling voor het in vereniging opzettelijk voordeel trekken uit de uitbuiting van twaalf jongens van buitenlandse afkomst (mensenhandel).,"Rechtbank Utrecht, 11-11-2011, 16/600971-10 [P]",ECLI:NL:RBUTR:2011:BU4709,11-11-2011,uitspraak,"[{'Vindplaats': 'Rechtspraak.nl', 'VindplaatsAnnotator': '', 'VindplaatsUrl': ''}]"
ECLI-NL-GHARN-2009-BJ7547,http://deeplink.rechtspraak.nl/uitspraak?id=ECLI:NL:GHARN:2009:BJ7547,uitspraak,De publicatie van de uitspraak staat gepland op 14-09-2009 om 14:16 uur,https://uitspraken.rechtspraak.nl/inziendocument?id=ECLI:NL:GHARN:2009:BJ7547&showbutton=true&keyword=mensenhandel,0.0,['Hoger beroep'],14-09-2009,2009-09-14T14:16:59Z,gepubliceerd,['Strafrecht'],[],"Bewezenverklaring van tweemaal mensenhandel, tweemaal bedreiging, mishandeling, verkrachting en verboden wapenbezit. Gevangenisstraf voor de duur van zes jaren.","Gerechtshof Arnhem, 14-09-2009, 21-002797-08",ECLI:NL:GHARN:2009:BJ7547,14-09-2009,uitspraak,"[{'Vindplaats': 'Rechtspraak.nl', 'VindplaatsAnnotator': '', 'VindplaatsUrl': ''}]"
ECLI-NL-RBDHA-2020-3544,http://deeplink.rechtspraak.nl/uitspraak?id=ECLI:NL:RBDHA:2020:3544,uitspraak,De publicatie van de uitspraak staat gepland op 17-04-2020 om 13:56 uur,https://uitspraken.rechtspraak.nl/inziendocument?id=ECLI:NL:RBDHA:2020:3544&showbutton=true&keyword=mensenhandel,0.0,"['Eerste aanleg - enkelvoudig', 'Voorlopige voorziening']",17-04-2020,2020-04-17T13:56:29Z,gepubliceerd,['Bestuursrecht; Vreemdelingenrecht'],[],"Intrekking verblijfsvergunning mensenhandel op basis van wettelijke regeling dus V hoeft geen belangenafweging te maken. Beroep ongegrond, vovo afgewezen.","Rechtbank Den Haag, 09-04-2020, AWB 19/9533 en AWB 19/9536",ECLI:NL:RBDHA:2020:3544,09-04-2020,uitspraak,"[{'Vindplaats': 'Rechtspraak.nl', 'VindplaatsAnnotator': '', 'VindplaatsUrl': ''}]"
ECLI-NL-RBAMS-2020-2080,http://deeplink.rechtspraak.nl/uitspraak?id=ECLI:NL:RBAMS:2020:2080,uitspraak,De publicatie van de uitspraak staat gepland op 02-04-2020 om 13:36 uur,https://uitspraken.rechtspraak.nl/inziendocument?id=ECLI:NL:RBAMS:2020:2080&showbutton=true&keyword=mensenhandel,0.0,['Eerste aanleg - meervoudig'],02-04-2020,2020-04-02T13:36:19Z,gepubliceerd,['Strafrecht'],[],Een 55-jarige vrouw is veroordeeld tot 2 jaar gevangenisstraf vanwege het medeplegen van mensenhandel in Amsterdam en Hongarije.,"Rechtbank Amsterdam, 02-04-2020, 13/731022-17 (Promis)",ECLI:NL:RBAMS:2020:2080,02-04-2020,uitspraak,"[{'Vindplaats': 'Rechtspraak.nl', 'VindplaatsAnnotator': '', 'VindplaatsUrl': ''}]"
ECLI-NL-RBAMS-2019-981,http://deeplink.rechtspraak.nl/uitspraak?id=ECLI:NL:RBAMS:2019:981,uitspraak,De publicatie van de uitspraak staat gepland op 15-02-2019 om 14:20 uur,https://uitspraken.rechtspraak.nl/inziendocument?id=ECLI:NL:RBAMS:2019:981&showbutton=true&keyword=mensenhandel,0.0,['Eerste aanleg - meervoudig'],15-02-2019,2019-02-15T14:20:03Z,gepubliceerd,['Strafrecht; Materieel strafrecht'],[],Mensenhandel plegen en medeplegen. plegen ten aanzien van de dreiging met geweld. GS 10 maanden waarvan 3 maanden voorwaardelijk.,"Rechtbank Amsterdam, 04-02-2019, 13/730032-17",ECLI:NL:RBAMS:2019:981,04-02-2019,uitspraak,"[{'Vindplaats': 'Rechtspraak.nl', 'VindplaatsAnnotator': '', 'VindplaatsUrl': ''}]"
ECLI-NL-RBDHA-2015-11105,http://deeplink.rechtspraak.nl/uitspraak?id=ECLI:NL:RBDHA:2015:11105,uitspraak,De publicatie van de uitspraak staat gepland op 24-09-2015 om 15:26 uur,https://uitspraken.rechtspraak.nl/inziendocument?id=ECLI:NL:RBDHA:2015:11105&showbutton=true&keyword=mensenhandel,0.0,['Eerste aanleg - enkelvoudig'],24-09-2015,2015-09-24T15:26:52Z,gepubliceerd,['Bestuursrecht; Vreemdelingenrecht'],[],"slachtoffer mensenhandel, sepot, 4:84 van de Awb, artikel 24 van het Europees Sociaal Handvest, artikel 8 van het EVRM.","Rechtbank Den Haag, 10-09-2015, 15/6974",ECLI:NL:RBDHA:2015:11105,10-09-2015,uitspraak,"[{'Vindplaats': 'Rechtspraak.nl', 'VindplaatsAnnotator': '', 'VindplaatsUrl': ''}]"
ECLI-NL-RBAMS-2013-CA3742,http://deeplink.rechtspraak.nl/uitspraak?id=ECLI:NL:RBAMS:2013:CA3742,uitspraak,De publicatie van de uitspraak staat gepland op 19-06-2013 om 13:07 uur,https://uitspraken.rechtspraak.nl/inziendocument?id=ECLI:NL:RBAMS:2013:CA3742&showbutton=true&keyword=mensenhandel,0.0,['Eerste aanleg - meervoudig'],19-06-2013,2013-06-19T13:07:17Z,gepubliceerd,['Strafrecht'],[],"De rechtbank heeft verdachte veroordeeld tot een gevangenisstraf van 15 maanden met aftrek wegens mensenhandel, wederrechtelijke vrijheidsberoving en witwassen.","Rechtbank Amsterdam, 17-06-2013, 13/708013-12",ECLI:NL:RBAMS:2013:CA3742,17-06-2013,uitspraak,"[{'Vindplaats': 'Rechtspraak.nl', 'VindplaatsAnnotator': '', 'VindplaatsUrl': ''}]"
ECLI-NL-RBONE-2013-BY9732,http://deeplink.rechtspraak.nl/uitspraak?id=ECLI:NL:RBONE:2013:BY9732,uitspraak,De publicatie van de uitspraak staat gepland op 28-01-2013 om 16:13 uur,https://uitspraken.rechtspraak.nl/inziendocument?id=ECLI:NL:RBONE:2013:BY9732&showbutton=true&keyword=mensenhandel,0.0,['Eerste aanleg - meervoudig'],28-01-2013,2013-01-28T16:13:19Z,gepubliceerd,['Strafrecht'],[],"Mensenhandel, gebruik van een uitbuitingssituatie als bedoeld in artikel 273 lid 1 sub 4 van het Wetboek van Strafrecht.","Rechtbank Oost-Nederland, 28-01-2013, 07.663144-12",ECLI:NL:RBONE:2013:BY9732,28-01-2013,uitspraak,"[{'Vindplaats': 'Rechtspraak.nl', 'VindplaatsAnnotator': '', 'VindplaatsUrl': ''}]"
ECLI-NL-RBONE-2013-BY9733,http://deeplink.rechtspraak.nl/uitspraak?id=ECLI:NL:RBONE:2013:BY9733,uitspraak,De publicatie van de uitspraak staat gepland op 28-01-2013 om 16:17 uur,https://uitspraken.rechtspraak.nl/inziendocument?id=ECLI:NL:RBONE:2013:BY9733&showbutton=true&keyword=mensenhandel,0.0,['Eerste aanleg - meervoudig'],28-01-2013,2013-01-28T16:17:20Z,gepubliceerd,['Strafrecht'],[],"Mensenhandel, gebruik van een uitbuitingssituatie als bedoeld in artikel 273 lid 1 sub 4 van het Wetboek van Strafrecht.","Rechtbank Oost-Nederland, 28-01-2013, 07.663142-12",ECLI:NL:RBONE:2013:BY9733,28-01-2013,uitspraak,"[{'Vindplaats': 'Rechtspraak.nl', 'VindplaatsAnnotator': '', 'VindplaatsUrl': ''}]"
ECLI-NL-RBONE-2013-BY9736,http://deeplink.rechtspraak.nl/uitspraak?id=ECLI:NL:RBONE:2013:BY9736,uitspraak,De publicatie van de uitspraak staat gepland op 28-01-2013 om 16:12 uur,https://uitspraken.rechtspraak.nl/inziendocument?id=ECLI:NL:RBONE:2013:BY9736&showbutton=true&keyword=mensenhandel,0.0,['Eerste aanleg - meervoudig'],28-01-2013,2013-01-28T16:12:35Z,gepubliceerd,['Strafrecht'],[],"Mensenhandel, gebruik van een uitbuitingssituatie als bedoeld in artikel 273 lid 1 sub 4 van het Wetboek van Strafrecht.","Rechtbank Oost-Nederland, 28-01-2013, 07.663143-12",ECLI:NL:RBONE:2013:BY9736,28-01-2013,uitspraak,"[{'Vindplaats': 'Rechtspraak.nl', 'VindplaatsAnnotator': '', 'VindplaatsUrl': ''}]"
ECLI-NL-RBONE-2013-BY9738,http://deeplink.rechtspraak.nl/uitspraak?id=ECLI:NL:RBONE:2013:BY9738,uitspraak,De publicatie van de uitspraak staat gepland op 28-01-2013 om 16:31 uur,https://uitspraken.rechtspraak.nl/inziendocument?id=ECLI:NL:RBONE:2013:BY9738&showbutton=true&keyword=mensenhandel,0.0,['Eerste aanleg - meervoudig'],28-01-2013,2013-01-28T16:31:44Z,gepubliceerd,['Strafrecht'],[],"Mensenhandel, gebruik van een uitbuitingssituatie als bedoeld in artikel 273 lid 1 sub 4 van het Wetboek van Strafrecht.","Rechtbank Oost-Nederland, 28-01-2013, 07.663141-12",ECLI:NL:RBONE:2013:BY9738,28-01-2013,uitspraak,"[{'Vindplaats': 'Rechtspraak.nl', 'VindplaatsAnnotator': '', 'VindplaatsUrl': ''}]"
ECLI-NL-RBSHE-2012-BX9522,http://deeplink.rechtspraak.nl/uitspraak?id=ECLI:NL:RBSHE:2012:BX9522,uitspraak,De publicatie van de uitspraak staat gepland op 10-10-2012 om 13:56 uur,https://uitspraken.rechtspraak.nl/inziendocument?id=ECLI:NL:RBSHE:2012:BX9522&showbutton=true&keyword=mensenhandel,0.0,['Eerste aanleg - meervoudig'],10-10-2012,2012-10-10T13:56:10Z,gepubliceerd,['Strafrecht'],[],"Verdachte wordt terzake mensenhandel [dwingen tot prostitutie] en witwassen meermalen gepleegd, veroordeeld tot een onvoorwaardelijke gevangenisstraf van 24 maanden.","Rechtbank 's-Hertogenbosch, 10-10-2012, 01/92403-12",ECLI:NL:RBSHE:2012:BX9522,10-10-2012,uitspraak,"[{'Vindplaats': 'Rechtspraak.nl', 'VindplaatsAnnotator': '', 'VindplaatsUrl': ''}]"
ECLI-NL-RBUTR-2009-BK1473,http://deeplink.rechtspraak.nl/uitspraak?id=ECLI:NL:RBUTR:2009:BK1473,uitspraak,De publicatie van de uitspraak staat gepland op 28-10-2009 om 15:51 uur,https://uitspraken.rechtspraak.nl/inziendocument?id=ECLI:NL:RBUTR:2009:BK1473&showbutton=true&keyword=mensenhandel,0.0,['Eerste aanleg - meervoudig'],28-10-2009,2009-10-28T15:51:11Z,gepubliceerd,['Strafrecht'],[],De rechtbank acht twee maal poging moord en een poging mensenhandel bewezen. Verdachte wordt veroordeelt tot 8 jaar gevangenisstraf.,"Rechtbank Utrecht, 28-10-2009, 08/963004-08",ECLI:NL:RBUTR:2009:BK1473,28-10-2009,uitspraak,"[{'Vindplaats': 'Rechtspraak.nl', 'VindplaatsAnnotator': '', 'VindplaatsUrl': ''}]"
ECLI-NL-GHLEE-2009-BJ9385,http://deeplink.rechtspraak.nl/uitspraak?id=ECLI:NL:GHLEE:2009:BJ9385,uitspraak,De publicatie van de uitspraak staat gepland op 07-10-2009 om 15:15 uur,https://uitspraken.rechtspraak.nl/inziendocument?id=ECLI:NL:GHLEE:2009:BJ9385&showbutton=true&keyword=mensenhandel,0.0,['Hoger beroep'],07-10-2009,2009-10-07T15:15:42Z,gepubliceerd,['Strafrecht'],"[{'RelatieOmschrijving': 'Cassatie: ', 'LinkTekst': 'ECLI:NL:HR:2011:BQ6691', 'Postfix': ', (Gedeeltelijke) vernietiging en zelf afgedaan', 'WebAdres': 'https://uitspraken.rechtspraak.nl/inziendocument?id=ECLI:NL:HR:2011:BQ6691&showbutton=true&keyword=mensenhandel'}, {'RelatieOmschrijving': 'Conclusie in cassatie: ', 'LinkTekst': 'ECLI:NL:PHR:2011:BQ6691', 'Postfix': None, 'WebAdres': 'https://uitspraken.rechtspraak.nl/inziendocument?id=ECLI:NL:PHR:2011:BQ6691&showbutton=true&keyword=mensenhandel'}]",Verdachte (hulpverlener) is voor uitbuiting van een cliënte wegens mensenhandel veroordeeld tot twee jaren gevangenisstraf. Begrip overige uitbuiting. Hulpverleningsrelatie.,"Gerechtshof Leeuwarden, 06-10-2009, 24-000436-09",ECLI:NL:GHLEE:2009:BJ9385,06-10-2009,uitspraak,"[{'Vindplaats': 'NJFS 2009, 269', 'VindplaatsAnnotator': '', 'VindplaatsUrl': ''}, {'Vindplaats': 'GJ 2010/12', 'VindplaatsAnnotator': '', 'VindplaatsUrl': ''}, {'Vindplaats': 'Rechtspraak.nl', 'VindplaatsAnnotator': '', 'VindplaatsUrl': ''}]"
ECLI-NL-RBUTR-2009-BJ3087,http://deeplink.rechtspraak.nl/uitspraak?id=ECLI:NL:RBUTR:2009:BJ3087,uitspraak,De publicatie van de uitspraak staat gepland op 20-07-2009 om 12:33 uur,https://uitspraken.rechtspraak.nl/inziendocument?id=ECLI:NL:RBUTR:2009:BJ3087&showbutton=true&keyword=mensenhandel,0.0,['Eerste aanleg - meervoudig'],20-07-2009,2009-07-20T12:33:12Z,gepubliceerd,['Strafrecht'],[],Veroordeling wegens mensenhandel. Gedurende een periode van 7 dagen is een meisje gedwongen om in de prostitutie te werken.,"Rechtbank Utrecht, 16-07-2009, 16/500176-08 [P]",ECLI:NL:RBUTR:2009:BJ3087,16-07-2009,uitspraak,"[{'Vindplaats': 'Rechtspraak.nl', 'VindplaatsAnnotator': '', 'VindplaatsUrl': ''}]"
ECLI-NL-RBGEL-2019-5720,http://deeplink.rechtspraak.nl/uitspraak?id=ECLI:NL:RBGEL:2019:5720,uitspraak,De publicatie van de uitspraak staat gepland op 11-12-2019 om 11:05 uur,https://uitspraken.rechtspraak.nl/inziendocument?id=ECLI:NL:RBGEL:2019:5720&showbutton=true&keyword=mensenhandel,0.0,['Eerste aanleg - meervoudig'],11-12-2019,2019-12-11T11:05:09Z,gepubliceerd,['Strafrecht'],[],"Partiële nietigheid van de dagvaarding ten aanzien van mensenhandel. 
Niet-ontvankelijkheid van het Openbaar Ministerie met betrekking tot afdreiging en mishandeling. 
Vrijspraak van mensenhandel, oplichtingen, dwang, afpersing en afdreiging. Veroordeling tot 30 maanden gevangenisstraf wegens meerdere (gekwalificeerde) diefstallen, poging tot oplichting, identiteitsfraude, wederspannigheid, vernieling, opzetheling, verboden wapenbezit en poging tot doodslag op twee agenten. Tevens is TBS met dwangverpleging opgelegd.","Rechtbank Gelderland, 10-12-2019, 05/881721-17, 05/062616-18, 06/113068-18, 05/780009-19 en 05/880193-19",ECLI:NL:RBGEL:2019:5720,10-12-2019,uitspraak,"[{'Vindplaats': 'Rechtspraak.nl', 'VindplaatsAnnotator': '', 'VindplaatsUrl': ''}]"
ECLI-NL-RBOVE-2014-6586,http://deeplink.rechtspraak.nl/uitspraak?id=ECLI:NL:RBOVE:2014:6586,uitspraak,De publicatie van de uitspraak staat gepland op 11-12-2014 om 09:42 uur,https://uitspraken.rechtspraak.nl/inziendocument?id=ECLI:NL:RBOVE:2014:6586&showbutton=true&keyword=mensenhandel,0.0,['Eerste aanleg - meervoudig'],11-12-2014,2014-12-11T09:42:20Z,gepubliceerd,['Strafrecht'],[],"De rechtbank Overijssel veroordeelt een man uit Bulgarije tot 3 jaar gevangenisstraf voor mensenhandel gepleegd jegens drie Bulgaarse vrouwen. De vrouwen moesten in de prostitutie werken in onder meer Utrecht en Groningen. Mensenhandel, een vorm van moderne slavernij, is een ernstig strafbaar feit. Daarnaast heeft verdachte zich schuldig gemaakt aan het belemmeren van de verklaringsvrijheid bij één van de vrouwen.","Rechtbank Overijssel, 25-11-2014, 08.963516-14",ECLI:NL:RBOVE:2014:6586,25-11-2014,uitspraak,"[{'Vindplaats': 'Rechtspraak.nl', 'VindplaatsAnnotator': '', 'VindplaatsUrl': ''}]"
ECLI-NL-RBNHO-2014-5863,http://deeplink.rechtspraak.nl/uitspraak?id=ECLI:NL:RBNHO:2014:5863,uitspraak,De publicatie van de uitspraak staat gepland op 25-06-2014 om 12:02 uur,https://uitspraken.rechtspraak.nl/inziendocument?id=ECLI:NL:RBNHO:2014:5863&showbutton=true&keyword=mensenhandel,0.0,['Eerste aanleg - meervoudig'],25-06-2014,2014-06-25T12:02:14Z,gepubliceerd,['Strafrecht'],[],"Onderzoek Zwaluw. Veroordeling voor mensenhandel en deelneming aan een criminele organisatie (mensenhandel); uitbuiting van Roemeense vrouwen die al dan niet onder valse voorwendselen naar Nederland worden gebracht om te werken in de prostitutie. 
Beroep op niet-ontvankelijkheid Openbaar Ministerie wegens onzorgvuldig vooronderzoek verworpen. 
Verweren met betrekking tot betrouwbaarheid verklaringen aangeefsters en getuigen verworpen.
Verweren met betrekking tot het ontbreken van rechtsmacht verworpen.","Rechtbank Noord-Holland, 28-04-2014, 15/743002-13",ECLI:NL:RBNHO:2014:5863,28-04-2014,uitspraak,"[{'Vindplaats': 'Rechtspraak.nl', 'VindplaatsAnnotator': '', 'VindplaatsUrl': ''}]"
ECLI-NL-GHARN-2012-BY6854,http://deeplink.rechtspraak.nl/uitspraak?id=ECLI:NL:GHARN:2012:BY6854,uitspraak,De publicatie van de uitspraak staat gepland op 21-12-2012 om 11:48 uur,https://uitspraken.rechtspraak.nl/inziendocument?id=ECLI:NL:GHARN:2012:BY6854&showbutton=true&keyword=mensenhandel,0.0,['Hoger beroep'],21-12-2012,2012-12-21T11:48:25Z,gepubliceerd,['Strafrecht'],[],"Veroordeling ter zake vijf feiten betreffende mensenhandel en één mishandeling. 

Verdachte is veroordeeld tot een onvoorwaardelijke gevangenisstraf voor de duur van vijf jaar. Dit onder andere gelet op het aantal vrouwen dat verdachte financieel heeft uitgebuit, de lange periode waarin de verdachte zich heeft schuldig gemaakt aan mensenhandel, het tegen de vrouwen uitgeoefende geweld en het aanzetten tot een abortus.","Gerechtshof Arnhem, 21-11-2012, 21-003893-11",ECLI:NL:GHARN:2012:BY6854,21-11-2012,uitspraak,"[{'Vindplaats': 'Rechtspraak.nl', 'VindplaatsAnnotator': '', 'VindplaatsUrl': ''}]"
ECLI-NL-GHSHE-2010-BN7217,http://deeplink.rechtspraak.nl/uitspraak?id=ECLI:NL:GHSHE:2010:BN7217,uitspraak,De publicatie van de uitspraak staat gepland op 17-09-2010 om 10:25 uur,https://uitspraken.rechtspraak.nl/inziendocument?id=ECLI:NL:GHSHE:2010:BN7217&showbutton=true&keyword=mensenhandel,0.0,['Hoger beroep'],17-09-2010,2010-09-17T10:25:05Z,gepubliceerd,['Strafrecht'],[],"Vrijspraak mensenhandel in restaurant. Het hof acht de verklaring van de verdachte – dat hij in het restaurant werkzaam was als kok, maar dat hij niets te maken had met het in dienst nemen van personeel en evenmin een leidinggevende functie had – niet onaannemelijk, zodat het hof niet de overtuiging heeft bekomen dat de verdachte kan worden aangemerkt als medepleger van mensenhandel.","Gerechtshof 's-Hertogenbosch, 17-09-2010, 20-003937-09",ECLI:NL:GHSHE:2010:BN7217,17-09-2010,uitspraak,"[{'Vindplaats': 'Rechtspraak.nl', 'VindplaatsAnnotator': '', 'VindplaatsUrl': ''}]"
ECLI-NL-GHARN-2001-AD8991,http://deeplink.rechtspraak.nl/uitspraak?id=ECLI:NL:GHARN:2001:AD8991,uitspraak,De publicatie van de uitspraak staat gepland op 11-10-2004 om 12:09 uur,https://uitspraken.rechtspraak.nl/inziendocument?id=ECLI:NL:GHARN:2001:AD8991&showbutton=true&keyword=mensenhandel,0.0,['Hoger beroep'],11-10-2004,2004-10-11T12:09:47Z,gepubliceerd,['Strafrecht'],[],"Medeplegen mensenhandel in vereniging meermalen gepleegd. Deelneming aan een organisatie die tot oogmerk heeft het plegen van misdrijven. Medeplegen van voorbereiding van mensenhandel in vereniging.
Verwerping beroep op partiële nietigheid van de dagvaarding en op de niet-ontvankelijkheid van het O.M.. Verwerping bewijsverweer van de verdediging t.a.v. de betrouwbaarheid van de vertalingen van telefoongesprekken.
5 jaar gevangenisstraf.","Gerechtshof Arnhem, 03-07-2001, 21-001567-99",ECLI:NL:GHARN:2001:AD8991,03-07-2001,uitspraak,"[{'Vindplaats': 'Rechtspraak.nl', 'VindplaatsAnnotator': '', 'VindplaatsUrl': ''}]"
ECLI-NL-RBAMS-2018-4378,http://deeplink.rechtspraak.nl/uitspraak?id=ECLI:NL:RBAMS:2018:4378,uitspraak,De publicatie van de uitspraak staat gepland op 22-06-2018 om 14:29 uur,https://uitspraken.rechtspraak.nl/inziendocument?id=ECLI:NL:RBAMS:2018:4378&showbutton=true&keyword=mensenhandel,0.0,"['Eerste aanleg - meervoudig', 'Op tegenspraak']",22-06-2018,2018-06-22T14:29:24Z,gepubliceerd,['Strafrecht'],[],"Opmerking(en):	mensenhandel, seksuele uitbuiting van minderjarig slachtoffer en het plegen van ontuchtige handelingen met dit minderjarige slachtoffer door verdachte","Rechtbank Amsterdam, 21-06-2018, 13/650275-17",ECLI:NL:RBAMS:2018:4378,21-06-2018,uitspraak,"[{'Vindplaats': 'Rechtspraak.nl', 'VindplaatsAnnotator': '', 'VindplaatsUrl': ''}]"
ECLI-NL-GHARN-2012-BY7730,http://deeplink.rechtspraak.nl/uitspraak?id=ECLI:NL:GHARN:2012:BY7730,uitspraak,De publicatie van de uitspraak staat gepland op 03-01-2013 om 15:49 uur,https://uitspraken.rechtspraak.nl/inziendocument?id=ECLI:NL:GHARN:2012:BY7730&showbutton=true&keyword=mensenhandel,0.0,['Hoger beroep'],03-01-2013,2013-01-03T15:49:51Z,gepubliceerd,['Strafrecht'],"[{'RelatieOmschrijving': 'Eerste aanleg: ', 'LinkTekst': 'ECLI:NL:RBARN:2012:BV9434', 'Postfix': ', (Gedeeltelijke) vernietiging en zelf afgedaan', 'WebAdres': 'https://uitspraken.rechtspraak.nl/inziendocument?id=ECLI:NL:RBARN:2012:BV9434&showbutton=true&keyword=mensenhandel'}]","Veroordeling terzak 2x mensenhandel, witwassen, valheid in geschrift en uitkeringsfraude tot een gevangenisstraf voor de duur van 20 maanden.","Gerechtshof Arnhem, 14-12-2012, 21-001445-12",ECLI:NL:GHARN:2012:BY7730,14-12-2012,uitspraak,"[{'Vindplaats': 'Rechtspraak.nl', 'VindplaatsAnnotator': '', 'VindplaatsUrl': ''}]"
ECLI-NL-RBSGR-2012-BW4647,http://deeplink.rechtspraak.nl/uitspraak?id=ECLI:NL:RBSGR:2012:BW4647,uitspraak,De publicatie van de uitspraak staat gepland op 02-05-2012 om 15:18 uur,https://uitspraken.rechtspraak.nl/inziendocument?id=ECLI:NL:RBSGR:2012:BW4647&showbutton=true&keyword=mensenhandel,0.0,['Eerste aanleg - meervoudig'],02-05-2012,2012-05-02T15:18:12Z,gepubliceerd,['Strafrecht'],[],"Vrijspraak van ten laste gelegde mensenhandel en opzettelijke vrijheidsberoving. Zie ook LJN BE4616, BW4630 en BW4642 (medeverdachten).","Rechtbank 's-Gravenhage, 27-04-2012, 09/754009-12",ECLI:NL:RBSGR:2012:BW4647,27-04-2012,uitspraak,"[{'Vindplaats': 'Rechtspraak.nl', 'VindplaatsAnnotator': '', 'VindplaatsUrl': ''}]"
ECLI-NL-RBAMS-2009-BK5293,http://deeplink.rechtspraak.nl/uitspraak?id=ECLI:NL:RBAMS:2009:BK5293,uitspraak,De publicatie van de uitspraak staat gepland op 15-12-2009 om 16:04 uur,https://uitspraken.rechtspraak.nl/inziendocument?id=ECLI:NL:RBAMS:2009:BK5293&showbutton=true&keyword=mensenhandel,0.0,['Eerste aanleg - meervoudig'],15-12-2009,2009-12-15T16:04:42Z,gepubliceerd,['Strafrecht'],[],"Mensenhandel, opzetheling, gewoonteheling, witwassen, handel/voorhanden hebben van cocaïne en het voorhanden hebben van skimapparatuur. Veroordeling tot 4 jaar gevangenisstraf.","Rechtbank Amsterdam, 13-11-2009, 13/527256-08 (PROMIS)",ECLI:NL:RBAMS:2009:BK5293,13-11-2009,uitspraak,"[{'Vindplaats': 'Rechtspraak.nl', 'VindplaatsAnnotator': '', 'VindplaatsUrl': ''}]"
ECLI-NL-RBDHA-2021-1525,http://deeplink.rechtspraak.nl/uitspraak?id=ECLI:NL:RBDHA:2021:1525,uitspraak,De publicatie van de uitspraak staat gepland op 24-02-2021 om 14:25 uur,https://uitspraken.rechtspraak.nl/inziendocument?id=ECLI:NL:RBDHA:2021:1525&showbutton=true&keyword=mensenhandel,0.0,['Eerste aanleg - enkelvoudig'],24-02-2021,2021-02-24T14:25:04.569Z,gepubliceerd,['Bestuursrecht; Vreemdelingenrecht'],[],"Dublinverordening, slachtofferschap mensenhandel, gescheiden procedures
Samenvatting:
In lijn met jurisprudentie van de Afdeling is de rechtbank van oordeel dat in de Dublinprocedure de vraag of iemand in aanmerking komt voor een reguliere verblijfsvergunning op grond van slachtofferschap van mensenhandel geen rol speelt bij de beoordeling van de rechtmatigheid van het bestreden besluit. In de Dublinprocedure dient te worden beoordeeld welk land op grond van de Dublinverordening verantwoordelijk is voor de asielaanvraag van eiser. Een (eventuele) aangifte van mensenhandel van eiser heeft mogelijk gevolgen voor het verblijfsrecht van eiser in Nederland, maar dit maakt de vaststelling van de verantwoordelijke lidstaat voor de asielaanvraag van eiser niet anders.","Rechtbank Den Haag, 24-02-2021, NL21.1275",ECLI:NL:RBDHA:2021:1525,24-02-2021,uitspraak,"[{'Vindplaats': 'Rechtspraak.nl', 'VindplaatsAnnotator': '', 'VindplaatsUrl': ''}]"
ECLI-NL-RBNNE-2018-1589,http://deeplink.rechtspraak.nl/uitspraak?id=ECLI:NL:RBNNE:2018:1589,uitspraak,De publicatie van de uitspraak staat gepland op 01-05-2018 om 14:43 uur,https://uitspraken.rechtspraak.nl/inziendocument?id=ECLI:NL:RBNNE:2018:1589&showbutton=true&keyword=mensenhandel,0.0,"['Eerste aanleg - meervoudig', 'Op tegenspraak']",01-05-2018,2018-05-01T14:43:38Z,gepubliceerd,['Strafrecht'],[],"Veroordeling voor mensenhandel tot een deels voorwaardelijke gevangenisstraf.
Verdachte heeft zich schuldig gemaakt aan mensenhandel. Het slachtoffer, een jonge Bulgaarse vrouw, is door verdachte dusdanig onder druk gezet dat zij haar werkzaamheden in de prostitutie, die zij aanvankelijk op vrijwillige basis zou gaan verrichten, voor hem ging uitvoeren, waarbij zij haar verdiensten onder druk en dwang aan hem moest afstaan. Verder heeft verdachte zich ten aanzien van dit slachtoffer, samen met een andere, tevens schuldig gemaakt aan mensenhandel, sub 3. Het slachtoffer is door zijn mededader naar Nederland gebracht, met het doel haar in Nederland prostitutiewerkzaamheden te laten verrichten, wetende dat zij zich in een uitbuitingssituatie bevond.","Rechtbank Noord-Nederland, 26-04-2018, 18/730215-15",ECLI:NL:RBNNE:2018:1589,26-04-2018,uitspraak,"[{'Vindplaats': 'Rechtspraak.nl', 'VindplaatsAnnotator': '', 'VindplaatsUrl': ''}]"
ECLI-NL-RBNNE-2018-1585,http://deeplink.rechtspraak.nl/uitspraak?id=ECLI:NL:RBNNE:2018:1585,uitspraak,De publicatie van de uitspraak staat gepland op 30-04-2018 om 14:18 uur,https://uitspraken.rechtspraak.nl/inziendocument?id=ECLI:NL:RBNNE:2018:1585&showbutton=true&keyword=mensenhandel,0.0,"['Eerste aanleg - meervoudig', 'Op tegenspraak']",30-04-2018,2018-04-30T14:18:27Z,gepubliceerd,['Strafrecht'],[],"Veroordeling voor mensenhandel tot een deels voorwaardelijke gevangenisstraf.
Verdachte heeft zich schuldig gemaakt aan mensenhandel. Het slachtoffer, een jonge Bulgaarse vrouw, is door verdachte dusdanig onder druk gezet dat zij haar werkzaamheden in de prostitutie, die zij aanvankelijk op vrijwillige basis verrichtte, voor hem ging uitvoeren, waarbij zij haar verdiensten onder druk en dwang aan hem moest afstaan. Verder heeft verdachte zich ten aanzien van dit slachtoffer en een andere Bulgaarse samen met een ander, tevens schuldig gemaakt aan mensenhandel, sub 3. De slachtoffers zijn door verdachte en zijn mededader naar Nederland gebracht, met het doel hen in Nederland prostitutiewerkzaamheden te laten verrichten, wetende dat zij zich in een uitbuitingssituatie bevonden.","Rechtbank Noord-Nederland, 26-04-2018, 18/730152-15",ECLI:NL:RBNNE:2018:1585,26-04-2018,uitspraak,"[{'Vindplaats': 'Rechtspraak.nl', 'VindplaatsAnnotator': '', 'VindplaatsUrl': ''}]"
ECLI-NL-RBHAA-2011-BR3148,http://deeplink.rechtspraak.nl/uitspraak?id=ECLI:NL:RBHAA:2011:BR3148,uitspraak,De publicatie van de uitspraak staat gepland op 27-07-2011 om 10:46 uur,https://uitspraken.rechtspraak.nl/inziendocument?id=ECLI:NL:RBHAA:2011:BR3148&showbutton=true&keyword=mensenhandel,0.0,['Eerste aanleg - meervoudig'],27-07-2011,2011-07-27T10:46:58Z,gepubliceerd,['Strafrecht'],[],"Onderzoek Maas: Onderzoek gericht op mensenhandel (loverboy praktijken) in Purmerend.
De rechtbank heeft bewezen verklaard dat verdachte zich wat betreft twee jonge vrouwen heeft schuldig gemaakt aan mensenhandel. Verdachte wordt veroordeeld tot een gevangenisstraf voor de duur van twee jaren. Aan verdachte wordt een lagere straf dan zijn medeverdachte opgelegd, gelet op zijn kleinere en minder gewelddadige rol in het geheel en gelet op zijn gezondheidstoestand.
Bewijsoverwegingen, waarbij aandacht wordt besteed aan het toetsingskader bij mensenhandel (artikel 273f van het Wetboek van Strafrecht) en de betrouwbaarheid en de geloofwaardigheid van (de verklaringen van) de slachtoffers in deze zaak.
Beslissing op de vordering van de benadeelde partij.","Rechtbank Haarlem, 21-07-2011, 15/700828-10",ECLI:NL:RBHAA:2011:BR3148,21-07-2011,uitspraak,"[{'Vindplaats': 'Rechtspraak.nl', 'VindplaatsAnnotator': '', 'VindplaatsUrl': ''}]"
ECLI-NL-RBNNE-2021-3967,http://deeplink.rechtspraak.nl/uitspraak?id=ECLI:NL:RBNNE:2021:3967,uitspraak,De publicatie van de uitspraak staat gepland op 16-09-2021 om 12:36 uur,https://uitspraken.rechtspraak.nl/inziendocument?id=ECLI:NL:RBNNE:2021:3967&showbutton=true&keyword=mensenhandel,0.0,"['Eerste aanleg - meervoudig', 'Op tegenspraak']",16-09-2021,2021-09-16T12:36:19.81Z,gepubliceerd,['Strafrecht'],[],"Ontneming van wederrechtelijk verkregen voordeel € 4.000.00 mensenhandel (uitbuiting in de prostitutie).

Zie ook: ECLI:NL:RBNNE:2021:3966.","Rechtbank Noord-Nederland, 14-09-2021, 18/222131-20 ontneming",ECLI:NL:RBNNE:2021:3967,14-09-2021,uitspraak,"[{'Vindplaats': 'Rechtspraak.nl', 'VindplaatsAnnotator': '', 'VindplaatsUrl': ''}]"
ECLI-NL-RBROT-2020-7730,http://deeplink.rechtspraak.nl/uitspraak?id=ECLI:NL:RBROT:2020:7730,uitspraak,De publicatie van de uitspraak staat gepland op 03-09-2020 om 09:00 uur,https://uitspraken.rechtspraak.nl/inziendocument?id=ECLI:NL:RBROT:2020:7730&showbutton=true&keyword=mensenhandel,0.0,['Eerste aanleg - meervoudig'],03-09-2020,2020-09-03T09:00:32Z,gepubliceerd,['Strafrecht'],[],"mensenhandel, ontucht en kinderporno. 30 maanden gevangenisstraf, waarvan 6 maanden voorwaardelijk met een proeftijd van 3 jaar en met bijzondere voorwaarden.","Rechtbank Rotterdam, 02-09-2020, 10/750498-19",ECLI:NL:RBROT:2020:7730,02-09-2020,uitspraak,"[{'Vindplaats': 'Rechtspraak.nl', 'VindplaatsAnnotator': '', 'VindplaatsUrl': ''}]"
ECLI-NL-RBGEL-2020-3183,http://deeplink.rechtspraak.nl/uitspraak?id=ECLI:NL:RBGEL:2020:3183,uitspraak,De publicatie van de uitspraak staat gepland op 30-06-2020 om 12:33 uur,https://uitspraken.rechtspraak.nl/inziendocument?id=ECLI:NL:RBGEL:2020:3183&showbutton=true&keyword=mensenhandel,0.0,['Eerste aanleg - meervoudig'],30-06-2020,2020-06-30T12:33:57Z,gepubliceerd,['Strafrecht'],[],"Veroordeling tot 9 maanden gevangenisstraf, waarvan 6 maanden voorwaardelijk, wegens mensenhandel en kinderpornografie met betrekking tot een meisje van 16 jaar.","Rechtbank Gelderland, 29-06-2020, 05/881188-18",ECLI:NL:RBGEL:2020:3183,29-06-2020,uitspraak,"[{'Vindplaats': 'Rechtspraak.nl', 'VindplaatsAnnotator': '', 'VindplaatsUrl': ''}]"
ECLI-NL-GHAMS-2020-179,http://deeplink.rechtspraak.nl/uitspraak?id=ECLI:NL:GHAMS:2020:179,uitspraak,De publicatie van de uitspraak staat gepland op 07-02-2020 om 16:18 uur,https://uitspraken.rechtspraak.nl/inziendocument?id=ECLI:NL:GHAMS:2020:179&showbutton=true&keyword=mensenhandel,0.0,['Hoger beroep'],07-02-2020,2020-02-07T16:18:54Z,gepubliceerd,['Strafrecht'],[],Mensenhandel art. 250ter Sr (oud). Veroordeling na terugwijzing door de Hoge Raad. Lagere straf wegens overschrijding van de redelijke termijn.,"Gerechtshof Amsterdam, 31-01-2020, 23-001037-19",ECLI:NL:GHAMS:2020:179,31-01-2020,uitspraak,"[{'Vindplaats': 'Rechtspraak.nl', 'VindplaatsAnnotator': '', 'VindplaatsUrl': ''}]"
ECLI-NL-GHAMS-2020-662,http://deeplink.rechtspraak.nl/uitspraak?id=ECLI:NL:GHAMS:2020:662,uitspraak,De publicatie van de uitspraak staat gepland op 09-03-2020 om 14:02 uur,https://uitspraken.rechtspraak.nl/inziendocument?id=ECLI:NL:GHAMS:2020:662&showbutton=true&keyword=mensenhandel,0.0,['Hoger beroep'],09-03-2020,2020-03-09T14:02:58Z,gepubliceerd,['Strafrecht'],[],"Profijtontneming, mensenhandel door arbeidsuitbuiting en mensensmokkel. Besparing op de kosten van personeel door het tewerkstellen van illegaal in Nederland verblijvende personen.","Gerechtshof Amsterdam, 24-01-2020, 23-000845-18",ECLI:NL:GHAMS:2020:662,24-01-2020,uitspraak,"[{'Vindplaats': 'Rechtspraak.nl', 'VindplaatsAnnotator': '', 'VindplaatsUrl': ''}]"
ECLI-NL-RBDHA-2019-9041,http://deeplink.rechtspraak.nl/uitspraak?id=ECLI:NL:RBDHA:2019:9041,uitspraak,De publicatie van de uitspraak staat gepland op 05-09-2019 om 16:23 uur,https://uitspraken.rechtspraak.nl/inziendocument?id=ECLI:NL:RBDHA:2019:9041&showbutton=true&keyword=mensenhandel,0.0,['Eerste aanleg - enkelvoudig'],05-09-2019,2019-09-05T16:23:42Z,gepubliceerd,['Bestuursrecht; Vreemdelingenrecht'],[],"Dublin Italie, nog geen aangifte van mensenhandel in Nederland kunnen doen, beroep is ongegrond verklaard en de voorlopige voorziening is afgewezen","Rechtbank Den Haag, 12-07-2019, NL19.13110 & NL19.13111",ECLI:NL:RBDHA:2019:9041,12-07-2019,uitspraak,"[{'Vindplaats': 'Rechtspraak.nl', 'VindplaatsAnnotator': '', 'VindplaatsUrl': ''}]"
ECLI-NL-HR-2018-2383,http://deeplink.rechtspraak.nl/uitspraak?id=ECLI:NL:HR:2018:2383,uitspraak,De publicatie van de uitspraak staat gepland op 20-12-2018 om 11:39 uur,https://uitspraken.rechtspraak.nl/inziendocument?id=ECLI:NL:HR:2018:2383&showbutton=true&keyword=mensenhandel,0.0,"['Cassatie', 'Artikel 80a RO-zaken']",20-12-2018,2018-12-20T11:39:19Z,gepubliceerd,['Strafrecht'],[],"Mensenhandel, gekwalificeerde diefstal en deelneming aan criminele organisatie. Geen middelen ingediend, verdachte n-o. Samenhang met 17/03013 en 17/03087.","Hoge Raad, 18-12-2018, 17/03187",ECLI:NL:HR:2018:2383,18-12-2018,uitspraak,"[{'Vindplaats': 'Rechtspraak.nl', 'VindplaatsAnnotator': '', 'VindplaatsUrl': ''}]"
ECLI-NL-RBLIM-2017-3317,http://deeplink.rechtspraak.nl/uitspraak?id=ECLI:NL:RBLIM:2017:3317,uitspraak,De publicatie van de uitspraak staat gepland op 13-04-2017 om 15:00 uur,https://uitspraken.rechtspraak.nl/inziendocument?id=ECLI:NL:RBLIM:2017:3317&showbutton=true&keyword=mensenhandel,0.0,['Eerste aanleg - meervoudig'],13-04-2017,2017-04-13T15:00:01Z,gepubliceerd,['Strafrecht'],[],"Veroordeling wegens mensenhandel, zware mishandeling en ontucht met een minderjarige. Toepassing volwassenenstrafrecht. Gevangenisstraf van 20 maanden, met aftrek van het voorarrest.","Rechtbank Limburg, 13-04-2017, 03/659019-14",ECLI:NL:RBLIM:2017:3317,13-04-2017,uitspraak,"[{'Vindplaats': 'PS-Updates.nl 2017-0392', 'VindplaatsAnnotator': '', 'VindplaatsUrl': ''}, {'Vindplaats': 'Rechtspraak.nl', 'VindplaatsAnnotator': '', 'VindplaatsUrl': ''}]"
ECLI-NL-GHDHA-2016-2247,http://deeplink.rechtspraak.nl/uitspraak?id=ECLI:NL:GHDHA:2016:2247,uitspraak,De publicatie van de uitspraak staat gepland op 26-07-2016 om 12:05 uur,https://uitspraken.rechtspraak.nl/inziendocument?id=ECLI:NL:GHDHA:2016:2247&showbutton=true&keyword=mensenhandel,0.0,['Hoger beroep'],26-07-2016,2016-07-26T12:05:03Z,gepubliceerd,['Strafrecht'],[],Het hof verklaart niet bewezen dat de verdachte het ten laste gelegde (mensenhandel) heeft begaan en spreekt de verdachte daarvan vrij.,"Gerechtshof Den Haag, 23-06-2016, 22-004559-15",ECLI:NL:GHDHA:2016:2247,23-06-2016,uitspraak,"[{'Vindplaats': 'Rechtspraak.nl', 'VindplaatsAnnotator': '', 'VindplaatsUrl': ''}]"
ECLI-NL-GHDHA-2016-3990,http://deeplink.rechtspraak.nl/uitspraak?id=ECLI:NL:GHDHA:2016:3990,uitspraak,De publicatie van de uitspraak staat gepland op 04-01-2017 om 11:42 uur,https://uitspraken.rechtspraak.nl/inziendocument?id=ECLI:NL:GHDHA:2016:3990&showbutton=true&keyword=mensenhandel,0.0,['Hoger beroep'],04-01-2017,2017-01-04T11:42:53Z,gepubliceerd,['Strafrecht'],[],Het hof verklaart niet bewezen dat de verdachte het ten laste gelegde(mensenhandel) heeft begaan en spreekt de verdachte daarvan vrij.,"Gerechtshof Den Haag, 23-06-2016, 22-004558-15",ECLI:NL:GHDHA:2016:3990,23-06-2016,uitspraak,"[{'Vindplaats': 'Rechtspraak.nl', 'VindplaatsAnnotator': '', 'VindplaatsUrl': ''}]"
ECLI-NL-RBDHA-2015-5326,http://deeplink.rechtspraak.nl/uitspraak?id=ECLI:NL:RBDHA:2015:5326,uitspraak,De publicatie van de uitspraak staat gepland op 08-05-2015 om 15:21 uur,https://uitspraken.rechtspraak.nl/inziendocument?id=ECLI:NL:RBDHA:2015:5326&showbutton=true&keyword=mensenhandel,0.0,['Eerste aanleg - meervoudig'],08-05-2015,2015-05-08T15:21:36Z,gepubliceerd,['Strafrecht'],[],Vrijspraak van mensenhandel wegens het ontbreken van wettig en overtuigend bewijs met betrekking tot de ten laste gelegde handelingen en dwangmiddelen.,"Rechtbank Den Haag, 01-05-2015, 09/711508-12",ECLI:NL:RBDHA:2015:5326,01-05-2015,uitspraak,"[{'Vindplaats': 'Rechtspraak.nl', 'VindplaatsAnnotator': '', 'VindplaatsUrl': ''}]"
ECLI-NL-RBGRO-2010-BO0437,http://deeplink.rechtspraak.nl/uitspraak?id=ECLI:NL:RBGRO:2010:BO0437,uitspraak,De publicatie van de uitspraak staat gepland op 14-10-2010 om 14:41 uur,https://uitspraken.rechtspraak.nl/inziendocument?id=ECLI:NL:RBGRO:2010:BO0437&showbutton=true&keyword=mensenhandel,0.0,['Eerste aanleg - meervoudig'],14-10-2010,2010-10-14T14:41:03Z,gepubliceerd,['Strafrecht'],[],"Veroordeling ter zake van mensenhandel (artikel 273f, eerste lid, sub 3, Sr) en mensensmokkel (artikel 197a, eerste lid, Sr).","Rechtbank Groningen, 14-10-2010, 18/670028-10",ECLI:NL:RBGRO:2010:BO0437,14-10-2010,uitspraak,"[{'Vindplaats': 'Rechtspraak.nl', 'VindplaatsAnnotator': '', 'VindplaatsUrl': ''}]"
ECLI-NL-RBGRO-2010-BO0435,http://deeplink.rechtspraak.nl/uitspraak?id=ECLI:NL:RBGRO:2010:BO0435,uitspraak,De publicatie van de uitspraak staat gepland op 14-10-2010 om 14:37 uur,https://uitspraken.rechtspraak.nl/inziendocument?id=ECLI:NL:RBGRO:2010:BO0435&showbutton=true&keyword=mensenhandel,0.0,['Eerste aanleg - meervoudig'],14-10-2010,2010-10-14T14:37:11Z,gepubliceerd,['Strafrecht'],[],"Veroordeling ter zake van mensenhandel (artikel 273f, eerste lid, sub 3, Sr) en mensensmokkel (artikel 197a, eerste lid, Sr).","Rechtbank Groningen, 14-10-2010, 18/670027-10",ECLI:NL:RBGRO:2010:BO0435,14-10-2010,uitspraak,"[{'Vindplaats': 'Rechtspraak.nl', 'VindplaatsAnnotator': '', 'VindplaatsUrl': ''}]"
ECLI-NL-RBOBR-2020-1044,http://deeplink.rechtspraak.nl/uitspraak?id=ECLI:NL:RBOBR:2020:1044,uitspraak,De publicatie van de uitspraak staat gepland op 20-02-2020 om 14:16 uur,https://uitspraken.rechtspraak.nl/inziendocument?id=ECLI:NL:RBOBR:2020:1044&showbutton=true&keyword=mensenhandel,0.0,['Eerste aanleg - meervoudig'],20-02-2020,2020-02-20T14:16:24Z,gepubliceerd,['Strafrecht'],[],"Veroordeling voor:
-het medeplegen van witwassen 
-eendaadse samenloop van
-handel in cocaïne
-bezit van cocaïne

Vrijspraak voor medeplegen van mensenhandel omdat geen sprake is van een materiele en intellectuele bijdrage van voldoende gewicht.

Vrijspraak voor artikel 231b Wetboek van Strafrecht.

Opgelegd wordt een gevangenisstraf voor de duur 4 maanden met aftrek.

De benadeelde partij wordt niet-ontvankelijk verklaard ivm de vrijspraak voor mensenhandel.","Rechtbank Oost-Brabant, 20-02-2020, 01/879102-19",ECLI:NL:RBOBR:2020:1044,20-02-2020,uitspraak,"[{'Vindplaats': 'Rechtspraak.nl', 'VindplaatsAnnotator': '', 'VindplaatsUrl': ''}]"
ECLI-NL-GHDHA-2017-2587,http://deeplink.rechtspraak.nl/uitspraak?id=ECLI:NL:GHDHA:2017:2587,uitspraak,De publicatie van de uitspraak staat gepland op 08-09-2017 om 15:29 uur,https://uitspraken.rechtspraak.nl/inziendocument?id=ECLI:NL:GHDHA:2017:2587&showbutton=true&keyword=mensenhandel,0.0,['Hoger beroep'],08-09-2017,2017-09-08T15:29:45Z,gepubliceerd,['Strafrecht'],[],"art. 273f van het Wetboek van Strafrecht. Mensenhandel. De verdachte heeft zich schuldig gemaakt aan mensenhandel door uitbuiting van een minderjarig slachtoffer. Toen het slachtoffer meerderjarig was, heeft hij opzettelijk voordeel getrokken uit die uitbuiting via misbruik van de kwetsbare positie van het slachtoffer. 
Het hof veroordeelt de verdachte tot een gevangenisstraf voor de duur van 2 (twee) jaren, met aftrek van voorarrest.","Gerechtshof Den Haag, 31-08-2017, 2200018815",ECLI:NL:GHDHA:2017:2587,31-08-2017,uitspraak,"[{'Vindplaats': 'Rechtspraak.nl', 'VindplaatsAnnotator': '', 'VindplaatsUrl': ''}]"
ECLI-NL-RBLIM-2015-9905,http://deeplink.rechtspraak.nl/uitspraak?id=ECLI:NL:RBLIM:2015:9905,uitspraak,De publicatie van de uitspraak staat gepland op 27-11-2015 om 14:30 uur,https://uitspraken.rechtspraak.nl/inziendocument?id=ECLI:NL:RBLIM:2015:9905&showbutton=true&keyword=mensenhandel,0.0,['Eerste aanleg - meervoudig'],27-11-2015,2015-11-27T14:30:19Z,gepubliceerd,['Strafrecht'],[],"De rechtbank heeft verdachte, die in Nederland optrad als chauffeur voor meerderjarige, uit Hongarije afkomstige prostituees, vrijgesproken van mensenhandel. Verdachte heeft geen bijdrage geleverd aan de beknotting van de vrijheid van de prostituees, met als gevolg dat niet van mensenhandel kan worden gesproken. Veroordeling voor het opzettelijk aanwezig hebben van 7 tabletten MDMA en 0,45 gram cocaïne. Oplegging van een geldboete ter hoogte van € 200,-.","Rechtbank Limburg, 27-11-2015, 03/721321-13",ECLI:NL:RBLIM:2015:9905,27-11-2015,uitspraak,"[{'Vindplaats': 'Rechtspraak.nl', 'VindplaatsAnnotator': '', 'VindplaatsUrl': ''}]"
ECLI-NL-RBNNE-2013-CA1275,http://deeplink.rechtspraak.nl/uitspraak?id=ECLI:NL:RBNNE:2013:CA1275,uitspraak,De publicatie van de uitspraak staat gepland op 29-05-2013 om 12:52 uur,https://uitspraken.rechtspraak.nl/inziendocument?id=ECLI:NL:RBNNE:2013:CA1275&showbutton=true&keyword=mensenhandel,0.0,['Eerste aanleg - meervoudig'],29-05-2013,2013-05-29T12:52:44Z,gepubliceerd,['Strafrecht'],[],"Vrijspraak voor poging tot mensenhandel. De rechtbank acht het enkel plaatsen van advertenties, zonder dat er op enige manier contact is geweest met een of meer specifieke vrouwen die mogelijk in de prostitutie zouden willen werken, onvoldoende om te kunnen spreken van een begin van uitvoering van de in artikel 273f, eerste lid, aanhef en onder 3, van het Wetboek van Strafrecht omschreven vorm van mensenhandel.","Rechtbank Noord-Nederland, 21-05-2013, 17/925061-11 VEV",ECLI:NL:RBNNE:2013:CA1275,21-05-2013,uitspraak,"[{'Vindplaats': 'Rechtspraak.nl', 'VindplaatsAnnotator': '', 'VindplaatsUrl': ''}]"
ECLI-NL-RBUTR-2012-BX0204,http://deeplink.rechtspraak.nl/uitspraak?id=ECLI:NL:RBUTR:2012:BX0204,uitspraak,De publicatie van de uitspraak staat gepland op 05-07-2012 om 11:39 uur,https://uitspraken.rechtspraak.nl/inziendocument?id=ECLI:NL:RBUTR:2012:BX0204&showbutton=true&keyword=mensenhandel,0.0,['Eerste aanleg - meervoudig'],05-07-2012,2012-07-05T11:39:07Z,gepubliceerd,['Strafrecht'],"[{'RelatieOmschrijving': 'Hoger beroep: ', 'LinkTekst': 'ECLI:NL:GHARL:2015:2049', 'Postfix': ', Meerdere afhandelingswijzen', 'WebAdres': 'https://uitspraken.rechtspraak.nl/inziendocument?id=ECLI:NL:GHARL:2015:2049&showbutton=true&keyword=mensenhandel'}]","Verdachte wordt veroordeeld voor mensenhandel ([slachtoffer 4]) feit 4, ten aanzien van [slachtoffer 8] en [slachtoffer 9] : medeplegen van mensenhandel; feit 5: deelneming aan een organisatie die tot oogmerk heeft het plegen van misdrijven. De rechtbank is van oordeel dat aan veroordeelde de verplichting moet worden opgelegd tot betaling aan de Staat ter ontneming van wederrechtelijk verkregen voordeel van een bedrag van € 807.615,-.","Rechtbank Utrecht, 02-07-2012, 08/963005-07",ECLI:NL:RBUTR:2012:BX0204,02-07-2012,uitspraak,"[{'Vindplaats': 'Rechtspraak.nl', 'VindplaatsAnnotator': '', 'VindplaatsUrl': ''}]"
ECLI-NL-RBUTR-2008-BC9917,http://deeplink.rechtspraak.nl/uitspraak?id=ECLI:NL:RBUTR:2008:BC9917,uitspraak,De publicatie van de uitspraak staat gepland op 18-04-2008 om 16:05 uur,https://uitspraken.rechtspraak.nl/inziendocument?id=ECLI:NL:RBUTR:2008:BC9917&showbutton=true&keyword=mensenhandel,0.0,['Eerste aanleg - meervoudig'],18-04-2008,2008-04-18T16:05:44Z,gepubliceerd,['Strafrecht'],[],"Vrijspraak verdenking mensenhandel. Wettig bewijs aanwezig, geen overtuiging bij de rechtbank. Bepalend acht de rechtbank de rol van betrokken vrouw, die geen aangifte deed van mensenhandel. Ze heeft uit volle overtuiging verklaard dat ze zich bewust was van de aard van het prostitutiewerk dat zij verrichtte en dat de omstandigheden waaronder dat werk door haar werd verricht niet als een uitbuitingssituatie kan worden aangemerkt.","Rechtbank Utrecht, 18-04-2008, 16-711168-07",ECLI:NL:RBUTR:2008:BC9917,18-04-2008,uitspraak,"[{'Vindplaats': 'Rechtspraak.nl', 'VindplaatsAnnotator': '', 'VindplaatsUrl': ''}]"
ECLI-NL-RBNNE-2021-3966,http://deeplink.rechtspraak.nl/uitspraak?id=ECLI:NL:RBNNE:2021:3966,uitspraak,De publicatie van de uitspraak staat gepland op 16-09-2021 om 12:09 uur,https://uitspraken.rechtspraak.nl/inziendocument?id=ECLI:NL:RBNNE:2021:3966&showbutton=true&keyword=mensenhandel,0.0,"['Eerste aanleg - meervoudig', 'Op tegenspraak']",16-09-2021,2021-09-16T12:09:43Z,gepubliceerd,['Strafrecht'],[],"Veroordeling wegens mensenhandel (uitbuiting in de prostitutie) tot een gevangenisstraf van 14 maanden.

Zie ook ontneming: ECLI:NL:RBNNE:2021:3967.","Rechtbank Noord-Nederland, 14-09-2021, 18/222131-20",ECLI:NL:RBNNE:2021:3966,14-09-2021,uitspraak,"[{'Vindplaats': 'Rechtspraak.nl', 'VindplaatsAnnotator': '', 'VindplaatsUrl': ''}]"
ECLI-NL-GHARL-2020-1655,http://deeplink.rechtspraak.nl/uitspraak?id=ECLI:NL:GHARL:2020:1655,uitspraak,De publicatie van de uitspraak staat gepland op 26-02-2020 om 15:45 uur,https://uitspraken.rechtspraak.nl/inziendocument?id=ECLI:NL:GHARL:2020:1655&showbutton=true&keyword=mensenhandel,0.0,['Hoger beroep'],26-02-2020,2020-02-26T15:45:16Z,gepubliceerd,['Strafrecht'],"[{'RelatieOmschrijving': 'Eerste aanleg: ', 'LinkTekst': 'ECLI:NL:RBOVE:2019:702', 'Postfix': ', (Gedeeltelijke) vernietiging en zelf afgedaan', 'WebAdres': 'https://uitspraken.rechtspraak.nl/inziendocument?id=ECLI:NL:RBOVE:2019:702&showbutton=true&keyword=mensenhandel'}]","Mensenhandel, ontucht en kinderporno met betrekking tot een minderjarige. 36 maanden gevangenisstraf. Verbeurdverklaring van auto waarmee verdachte haar voor de prostitutiewerkzaamheden vervoerde.","Gerechtshof Arnhem-Leeuwarden, 26-02-2020, 21-001263-19",ECLI:NL:GHARL:2020:1655,26-02-2020,uitspraak,"[{'Vindplaats': 'Rechtspraak.nl', 'VindplaatsAnnotator': '', 'VindplaatsUrl': ''}]"
ECLI-NL-GHAMS-2020-180,http://deeplink.rechtspraak.nl/uitspraak?id=ECLI:NL:GHAMS:2020:180,uitspraak,De publicatie van de uitspraak staat gepland op 10-02-2020 om 10:07 uur,https://uitspraken.rechtspraak.nl/inziendocument?id=ECLI:NL:GHAMS:2020:180&showbutton=true&keyword=mensenhandel,0.0,['Hoger beroep'],10-02-2020,2020-02-10T10:07:39Z,gepubliceerd,['Strafrecht'],[],Ontneming van het wederrechtelijk (door mensenhandel) verkregen voordeel. Korting van 10% op het te betalen bedrag wegens overschrijding van de redelijke termijn.,"Gerechtshof Amsterdam, 31-01-2020, 23-004048-18",ECLI:NL:GHAMS:2020:180,31-01-2020,uitspraak,"[{'Vindplaats': 'Rechtspraak.nl', 'VindplaatsAnnotator': '', 'VindplaatsUrl': ''}]"
ECLI-NL-RBAMS-2019-1623,http://deeplink.rechtspraak.nl/uitspraak?id=ECLI:NL:RBAMS:2019:1623,uitspraak,De publicatie van de uitspraak staat gepland op 20-03-2019 om 14:57 uur,https://uitspraken.rechtspraak.nl/inziendocument?id=ECLI:NL:RBAMS:2019:1623&showbutton=true&keyword=mensenhandel,0.0,['Eerste aanleg - meervoudig'],20-03-2019,2019-03-20T14:57:59Z,gepubliceerd,['Strafrecht'],[],Vrijspraak mensenhandel. Arbeidsuitbuiting in de komkommerkassen. Verdachte leende personeel in via het uitzendbureau van medeverdachte. Verdachte had (nog) geen oogmerk van uitbuiting.,"Rechtbank Amsterdam, 07-03-2019, 13/993027-16",ECLI:NL:RBAMS:2019:1623,07-03-2019,uitspraak,"[{'Vindplaats': 'Rechtspraak.nl', 'VindplaatsAnnotator': '', 'VindplaatsUrl': ''}]"
ECLI-NL-GHSHE-2017-1786,http://deeplink.rechtspraak.nl/uitspraak?id=ECLI:NL:GHSHE:2017:1786,uitspraak,De publicatie van de uitspraak staat gepland op 25-04-2017 om 11:00 uur,https://uitspraken.rechtspraak.nl/inziendocument?id=ECLI:NL:GHSHE:2017:1786&showbutton=true&keyword=mensenhandel,0.0,"['Hoger beroep', 'Op tegenspraak']",25-04-2017,2017-04-25T11:00:07Z,gepubliceerd,['Strafrecht'],"[{'RelatieOmschrijving': 'Eerste aanleg: ', 'LinkTekst': 'ECLI:NL:RBMAA:2012:BV9705', 'Postfix': ', (Gedeeltelijke) vernietiging en zelf afgedaan', 'WebAdres': 'https://uitspraken.rechtspraak.nl/inziendocument?id=ECLI:NL:RBMAA:2012:BV9705&showbutton=true&keyword=mensenhandel'}]",Vrijspraak ter zake van mensenhandel in de zin van artikel 273f van het Wetboek van Strafrecht en het bezit van kinderporno.,"Gerechtshof 's-Hertogenbosch, 25-04-2017, 20-001401-12",ECLI:NL:GHSHE:2017:1786,25-04-2017,uitspraak,"[{'Vindplaats': 'Rechtspraak.nl', 'VindplaatsAnnotator': '', 'VindplaatsUrl': ''}]"
ECLI-NL-GHAMS-2016-5236,http://deeplink.rechtspraak.nl/uitspraak?id=ECLI:NL:GHAMS:2016:5236,uitspraak,De publicatie van de uitspraak staat gepland op 12-12-2016 om 12:14 uur,https://uitspraken.rechtspraak.nl/inziendocument?id=ECLI:NL:GHAMS:2016:5236&showbutton=true&keyword=mensenhandel,0.0,['Hoger beroep'],12-12-2016,2016-12-12T12:14:52Z,gepubliceerd,['Strafrecht'],"[{'RelatieOmschrijving': 'Cassatie: ', 'LinkTekst': 'ECLI:NL:HR:2018:1941', 'Postfix': ', Bekrachtiging/bevestiging', 'WebAdres': 'https://uitspraken.rechtspraak.nl/inziendocument?id=ECLI:NL:HR:2018:1941&showbutton=true&keyword=mensenhandel'}]","mensenhandel (artikel 273f lid 1 sub 9) vrijspraak voordeel trekken uit prostitutie, nu impliciet ingelezen bestanddeel uitbuiting niet kan worden bewezen","Gerechtshof Amsterdam, 08-12-2016, 23-1709-16",ECLI:NL:GHAMS:2016:5236,08-12-2016,uitspraak,"[{'Vindplaats': 'Rechtspraak.nl', 'VindplaatsAnnotator': '', 'VindplaatsUrl': ''}]"
ECLI-NL-RBMNE-2014-3911,http://deeplink.rechtspraak.nl/uitspraak?id=ECLI:NL:RBMNE:2014:3911,uitspraak,De publicatie van de uitspraak staat gepland op 05-09-2014 om 14:16 uur,https://uitspraken.rechtspraak.nl/inziendocument?id=ECLI:NL:RBMNE:2014:3911&showbutton=true&keyword=mensenhandel,0.0,['Eerste aanleg - meervoudig'],05-09-2014,2014-09-05T14:16:05Z,gepubliceerd,['Strafrecht'],[],"De rechtbank veroordeelt een man tot 18 maanden gevangenisstraf voor mensenhandel, mishandeling en handelen in strijd met de Wet wapens en munitie.","Rechtbank Midden-Nederland, 05-09-2014, 16.701103-13 (P)",ECLI:NL:RBMNE:2014:3911,05-09-2014,uitspraak,"[{'Vindplaats': 'Rechtspraak.nl', 'VindplaatsAnnotator': '', 'VindplaatsUrl': ''}]"
ECLI-NL-GHARL-2014-3062,http://deeplink.rechtspraak.nl/uitspraak?id=ECLI:NL:GHARL:2014:3062,uitspraak,De publicatie van de uitspraak staat gepland op 15-04-2014 om 14:30 uur,https://uitspraken.rechtspraak.nl/inziendocument?id=ECLI:NL:GHARL:2014:3062&showbutton=true&keyword=mensenhandel,0.0,['Hoger beroep'],15-04-2014,2014-04-15T14:30:12Z,gepubliceerd,['Strafrecht'],"[{'RelatieOmschrijving': 'Eerste aanleg: ', 'LinkTekst': 'ECLI:NL:RBZUT:2012:BV2105', 'Postfix': ', Meerdere afhandelingswijzen', 'WebAdres': 'https://uitspraken.rechtspraak.nl/inziendocument?id=ECLI:NL:RBZUT:2012:BV2105&showbutton=true&keyword=mensenhandel'}]","bewezenverklaring van mensenhandel ten aanzien van een minderjarige en voorts bewezenverklaring van artikel 273f sub 3 Sr, voor het overige vrijspraak.","Gerechtshof Arnhem-Leeuwarden, 15-04-2014, 21-000540-12",ECLI:NL:GHARL:2014:3062,15-04-2014,uitspraak,"[{'Vindplaats': 'Rechtspraak.nl', 'VindplaatsAnnotator': '', 'VindplaatsUrl': ''}]"
ECLI-NL-RBAMS-2014-367,http://deeplink.rechtspraak.nl/uitspraak?id=ECLI:NL:RBAMS:2014:367,uitspraak,De publicatie van de uitspraak staat gepland op 13-02-2014 om 10:00 uur,https://uitspraken.rechtspraak.nl/inziendocument?id=ECLI:NL:RBAMS:2014:367&showbutton=true&keyword=mensenhandel,0.0,['Eerste aanleg - meervoudig'],13-02-2014,2014-02-13T10:00:34Z,gepubliceerd,['Strafrecht'],[],"veroordeling tot een gevangenisstraf van tien jaren wegens mensenhandel door twee of meer verenigde personen, meermalen gepleegd, en het medeplegen van gewoontewitwassen","Rechtbank Amsterdam, 31-01-2014, Parketnummer 13-708165-11",ECLI:NL:RBAMS:2014:367,31-01-2014,uitspraak,"[{'Vindplaats': 'Rechtspraak.nl', 'VindplaatsAnnotator': '', 'VindplaatsUrl': ''}]"
ECLI-NL-RBAMS-2014-366,http://deeplink.rechtspraak.nl/uitspraak?id=ECLI:NL:RBAMS:2014:366,uitspraak,De publicatie van de uitspraak staat gepland op 13-02-2014 om 10:21 uur,https://uitspraken.rechtspraak.nl/inziendocument?id=ECLI:NL:RBAMS:2014:366&showbutton=true&keyword=mensenhandel,0.0,['Eerste aanleg - meervoudig'],13-02-2014,2014-02-13T10:21:33Z,gepubliceerd,['Strafrecht'],[],"veroordeling tot een gevangenisstraf van zes jaren wegens mensenhandel door twee of meer verenigde personen, meermalen gepleegd, en het medeplegen van gewoontewitwassen","Rechtbank Amsterdam, 31-01-2014, Parketnummer 13-708004-12",ECLI:NL:RBAMS:2014:366,31-01-2014,uitspraak,"[{'Vindplaats': 'Rechtspraak.nl', 'VindplaatsAnnotator': '', 'VindplaatsUrl': ''}]"
ECLI-NL-RBLIM-2013-4244,http://deeplink.rechtspraak.nl/uitspraak?id=ECLI:NL:RBLIM:2013:4244,uitspraak,De publicatie van de uitspraak staat gepland op 16-07-2013 om 11:24 uur,https://uitspraken.rechtspraak.nl/inziendocument?id=ECLI:NL:RBLIM:2013:4244&showbutton=true&keyword=mensenhandel,0.0,['Eerste aanleg - meervoudig'],16-07-2013,2013-07-16T11:24:18Z,gepubliceerd,['Strafrecht'],[],"Mensenhandel: uitleg artikel 273f lid 1 sub 3. Achtergrond strafbaarstelling. Enkel vervoeren is onvoldoende om te spreken van ""brengen tot"" prostitutie.","Rechtbank Limburg, 09-07-2013, 04/860412-12",ECLI:NL:RBLIM:2013:4244,09-07-2013,uitspraak,"[{'Vindplaats': 'NJFS 2013/199', 'VindplaatsAnnotator': '', 'VindplaatsUrl': ''}, {'Vindplaats': 'Rechtspraak.nl', 'VindplaatsAnnotator': '', 'VindplaatsUrl': ''}]"
ECLI-NL-RBZWB-2013-BZ6551,http://deeplink.rechtspraak.nl/uitspraak?id=ECLI:NL:RBZWB:2013:BZ6551,uitspraak,De publicatie van de uitspraak staat gepland op 08-04-2013 om 13:00 uur,https://uitspraken.rechtspraak.nl/inziendocument?id=ECLI:NL:RBZWB:2013:BZ6551&showbutton=true&keyword=mensenhandel,0.0,['Eerste aanleg - meervoudig'],08-04-2013,2013-04-08T13:00:05Z,gepubliceerd,['Strafrecht'],"[{'RelatieOmschrijving': 'Hoger beroep: ', 'LinkTekst': 'ECLI:NL:GHSHE:2014:637', 'Postfix': ', (Gedeeltelijke) vernietiging en zelf afgedaan', 'WebAdres': 'https://uitspraken.rechtspraak.nl/inziendocument?id=ECLI:NL:GHSHE:2014:637&showbutton=true&keyword=mensenhandel'}]","Mensenhandel, bedreiging met feitelijkheid, misbruik van uit feitelijke omstandigheden voortvloeiend overwicht, misbruik van een kwestbare positie, drugsverslaafd, prostitutie, psychische problematiek, gevangenisstraf, reclasseringstoezicht.","Rechtbank Zeeland-West-Brabant, 08-04-2013, 12/700376-10",ECLI:NL:RBZWB:2013:BZ6551,08-04-2013,uitspraak,"[{'Vindplaats': 'Rechtspraak.nl', 'VindplaatsAnnotator': '', 'VindplaatsUrl': ''}]"
ECLI-NL-RBUTR-2010-BN5110,http://deeplink.rechtspraak.nl/uitspraak?id=ECLI:NL:RBUTR:2010:BN5110,uitspraak,De publicatie van de uitspraak staat gepland op 26-08-2010 om 16:41 uur,https://uitspraken.rechtspraak.nl/inziendocument?id=ECLI:NL:RBUTR:2010:BN5110&showbutton=true&keyword=mensenhandel,0.0,['Eerste aanleg - meervoudig'],26-08-2010,2010-08-26T16:41:33Z,gepubliceerd,['Strafrecht'],[],"De rechtbank veroordeelt verdachte tot een gevangenisstraf voor de duur van 4 jaren. Dit voor onder andere mensenhandel en mishandeling, meermalen gepleegd.","Rechtbank Utrecht, 14-07-2010, 16-600690-09",ECLI:NL:RBUTR:2010:BN5110,14-07-2010,uitspraak,"[{'Vindplaats': 'Rechtspraak.nl', 'VindplaatsAnnotator': '', 'VindplaatsUrl': ''}]"
ECLI-NL-RBZUT-2004-AP1883,http://deeplink.rechtspraak.nl/uitspraak?id=ECLI:NL:RBZUT:2004:AP1883,uitspraak,De publicatie van de uitspraak staat gepland op 28-06-2004 om 11:10 uur,https://uitspraken.rechtspraak.nl/inziendocument?id=ECLI:NL:RBZUT:2004:AP1883&showbutton=true&keyword=mensenhandel,0.0,['Eerste aanleg - meervoudig'],28-06-2004,2004-06-28T11:10:59Z,gepubliceerd,['Strafrecht'],[],lid van een criminele organisatie die zich bezighoudt met mensensmokkel en mensenhandel vanuit Nigeria veroordeeld tot 4 jaren en 6 maanden gevangenisstraf.,"Rechtbank Zutphen, 11-06-2004, 06/080325-02",ECLI:NL:RBZUT:2004:AP1883,11-06-2004,uitspraak,"[{'Vindplaats': 'Rechtspraak.nl', 'VindplaatsAnnotator': '', 'VindplaatsUrl': ''}]"
ECLI-NL-RBROE-2011-BQ1114,http://deeplink.rechtspraak.nl/uitspraak?id=ECLI:NL:RBROE:2011:BQ1114,uitspraak,De publicatie van de uitspraak staat gepland op 13-04-2011 om 15:27 uur,https://uitspraken.rechtspraak.nl/inziendocument?id=ECLI:NL:RBROE:2011:BQ1114&showbutton=true&keyword=mensenhandel,0.0,['Eerste aanleg - meervoudig'],13-04-2011,2011-04-13T15:27:09Z,gepubliceerd,['Strafrecht'],[],"Vrijspraak mensenhandel
Bewezen is dat de slachtoffers diverse mobiele telefoonabonnementen voor verdachte hebben afgesloten, hem geld hebben geleend (dat hij vervolgens niet terugbetaalde) en een auto voor hem hebben gehuurd. Vrijspraak mensenhandel omdat de tenlastegelegde dwang, bedreiging en misbruik van omstandigheden, voor zover deze al heeft plaatsgevonden, niet in causaal verband staat tot het aangaan van voornoemde overeenkomsten door de slachtoffers. De subsidiair tenlastegelegde oplichting is wel bewezen.
Ook het gedurende een langdurige relatie verstrekken van gelden aan verdachte voor de aankoop van softdrugs teneinde de lieve vrede te bewaren maakt niet dat er sprake is van mensenhandel.
Vrijspraak stalking omdat aangeefster in die periode op vrijwillige basis de nodige contacten met verdachte onderhield.","Rechtbank Roermond, 13-04-2011, 04/800011-10",ECLI:NL:RBROE:2011:BQ1114,13-04-2011,uitspraak,"[{'Vindplaats': 'Rechtspraak.nl', 'VindplaatsAnnotator': '', 'VindplaatsUrl': ''}]"
ECLI-NL-RBSGR-2008-BC6098,http://deeplink.rechtspraak.nl/uitspraak?id=ECLI:NL:RBSGR:2008:BC6098,uitspraak,De publicatie van de uitspraak staat gepland op 07-03-2008 om 18:36 uur,https://uitspraken.rechtspraak.nl/inziendocument?id=ECLI:NL:RBSGR:2008:BC6098&showbutton=true&keyword=mensenhandel,0.0,['Eerste aanleg - meervoudig'],07-03-2008,2008-03-07T18:36:25Z,gepubliceerd,['Strafrecht'],[],"Mensenhandel. Art. 273f  Wetboek van Strafrecht. Verdachte heeft zich samen met zijn medeverdachten gedurende korte tijd schuldig gemaakt aan mensenhandel. Met elkaar hebben zij twee vrouwen uit Brazilië gehaald en in Nederland in de prostitutie laten werken. Weliswaar is niet vast komen te staan dat dit alles onder dwang of geweld is gebeurd, maar verdachte en zijn medeverdachten hebben beide slachtoffers niettemin in een situatie gebracht waarin zij overgeleverd waren aan verdachte en zijn mededaders. Mensenhandel is een ernstig strafbaar feit, terwijl verdachte in dit geval een initiërende rol had. Ter terechtzitting heeft verdachte geen blijk heeft gegeven van enig inzicht in de strafwaardigheid van zijn gedrag. Zie ook LJN BC6099 en BC6100 (medeverdachten).","Rechtbank 's-Gravenhage, 07-03-2008, 09/753597-07",ECLI:NL:RBSGR:2008:BC6098,07-03-2008,uitspraak,"[{'Vindplaats': 'NJFS 2008, 120', 'VindplaatsAnnotator': '', 'VindplaatsUrl': ''}, {'Vindplaats': 'Rechtspraak.nl', 'VindplaatsAnnotator': '', 'VindplaatsUrl': ''}]"
ECLI-NL-GHARL-2021-3635,http://deeplink.rechtspraak.nl/uitspraak?id=ECLI:NL:GHARL:2021:3635,uitspraak,De publicatie van de uitspraak staat gepland op 15-04-2021 om 10:21 uur,https://uitspraken.rechtspraak.nl/inziendocument?id=ECLI:NL:GHARL:2021:3635&showbutton=true&keyword=mensenhandel,0.0,['Hoger beroep'],15-04-2021,2021-04-15T10:21:58.86Z,gepubliceerd,['Strafrecht'],[],"Mensenhandel. Veroordeling art. 273f lid 1 sub 1, 3, 4, 6 en 9 Sr. GS 33 maanden m.a. Schending redelijke termijn.","Gerechtshof Arnhem-Leeuwarden, 14-04-2021, 21-005587-16",ECLI:NL:GHARL:2021:3635,14-04-2021,uitspraak,"[{'Vindplaats': 'Rechtspraak.nl', 'VindplaatsAnnotator': '', 'VindplaatsUrl': ''}]"
ECLI-NL-RBDHA-2020-15098,http://deeplink.rechtspraak.nl/uitspraak?id=ECLI:NL:RBDHA:2020:15098,uitspraak,De publicatie van de uitspraak staat gepland op 20-09-2021 om 13:24 uur,https://uitspraken.rechtspraak.nl/inziendocument?id=ECLI:NL:RBDHA:2020:15098&showbutton=true&keyword=mensenhandel,0.0,['Voorlopige voorziening+bodemzaak'],20-09-2021,2021-09-20T13:24:06.261Z,gepubliceerd,['Bestuursrecht; Vreemdelingenrecht'],[],Verblijfsvergunning regulier ogv aangifte mensenhandel. Bericht OM dat aanwezigheid eiser in NL niet langer vereist is. Van tweede aangifte is niet gebleken. Ongegrond.,"Rechtbank Den Haag, 07-12-2020, AWB 20_2237",ECLI:NL:RBDHA:2020:15098,07-12-2020,uitspraak,"[{'Vindplaats': 'Rechtspraak.nl', 'VindplaatsAnnotator': '', 'VindplaatsUrl': ''}]"
ECLI-NL-RBDHA-2020-8107,http://deeplink.rechtspraak.nl/uitspraak?id=ECLI:NL:RBDHA:2020:8107,uitspraak,De publicatie van de uitspraak staat gepland op 26-08-2020 om 16:13 uur,https://uitspraken.rechtspraak.nl/inziendocument?id=ECLI:NL:RBDHA:2020:8107&showbutton=true&keyword=mensenhandel,0.0,['Eerste aanleg - meervoudig'],26-08-2020,2020-08-26T16:13:11Z,gepubliceerd,['Strafrecht'],[],"Ontnemingsvordering ter zake van mensenhandel, waarbij wordt afgeweken van de uitgangspunten die zijn gehanteerd bij de toekenning van de vorderingen van de benadeelden.","Rechtbank Den Haag, 26-08-2020, 09/767189-16",ECLI:NL:RBDHA:2020:8107,26-08-2020,uitspraak,"[{'Vindplaats': 'Rechtspraak.nl', 'VindplaatsAnnotator': '', 'VindplaatsUrl': ''}]"
ECLI-NL-RBDHA-2020-8646,http://deeplink.rechtspraak.nl/uitspraak?id=ECLI:NL:RBDHA:2020:8646,uitspraak,De publicatie van de uitspraak staat gepland op 04-09-2020 om 09:25 uur,https://uitspraken.rechtspraak.nl/inziendocument?id=ECLI:NL:RBDHA:2020:8646&showbutton=true&keyword=mensenhandel,0.0,['Voorlopige voorziening+bodemzaak'],04-09-2020,2020-09-04T09:25:11Z,gepubliceerd,['Bestuursrecht'],[],"Slachtoffer mensenhandel, beleidswijziging WBV 2019/10, bedenktijd, Richtlijn 2004/81/EG, artikel 8 en artikel 6 van de richtlijn onjuist geïmplementeerd, rechtstreekse toetsing.","Rechtbank Den Haag, 20-07-2020, AMS 19 / 9949 en AMS 20 / 1060",ECLI:NL:RBDHA:2020:8646,20-07-2020,uitspraak,"[{'Vindplaats': 'Rechtspraak.nl', 'VindplaatsAnnotator': '', 'VindplaatsUrl': ''}]"
ECLI-NL-RBDHA-2019-6470,http://deeplink.rechtspraak.nl/uitspraak?id=ECLI:NL:RBDHA:2019:6470,uitspraak,De publicatie van de uitspraak staat gepland op 02-07-2019 om 13:20 uur,https://uitspraken.rechtspraak.nl/inziendocument?id=ECLI:NL:RBDHA:2019:6470&showbutton=true&keyword=mensenhandel,0.0,"['Bodemzaak', 'Eerste aanleg - enkelvoudig']",02-07-2019,2019-07-02T13:20:43Z,gepubliceerd,['Bestuursrecht; Vreemdelingenrecht'],[],Dublin Italië. Geen aanhouding vanwege aangifte mensenhandel. Interstatelijk vertrouwensbeginsel. Medische zorg. SFH/OSAR 8 mei 2019. C.K.-arrest. Tarakhel-arrest. Beroep ongegrond.,"Rechtbank Den Haag, 12-06-2019, NL19.11484",ECLI:NL:RBDHA:2019:6470,12-06-2019,uitspraak,"[{'Vindplaats': 'Rechtspraak.nl', 'VindplaatsAnnotator': '', 'VindplaatsUrl': ''}]"
ECLI-NL-GHAMS-2017-2889,http://deeplink.rechtspraak.nl/uitspraak?id=ECLI:NL:GHAMS:2017:2889,uitspraak,De publicatie van de uitspraak staat gepland op 20-07-2017 om 18:04 uur,https://uitspraken.rechtspraak.nl/inziendocument?id=ECLI:NL:GHAMS:2017:2889&showbutton=true&keyword=mensenhandel,0.0,['Hoger beroep'],20-07-2017,2017-07-20T18:04:38Z,gepubliceerd,['Strafrecht'],"[{'RelatieOmschrijving': 'Cassatie: ', 'LinkTekst': 'ECLI:NL:HR:2018:2011', 'Postfix': ', Bekrachtiging/bevestiging', 'WebAdres': 'https://uitspraken.rechtspraak.nl/inziendocument?id=ECLI:NL:HR:2018:2011&showbutton=true&keyword=mensenhandel'}]","Mensenhandel, het beginsel van non-prosecution/non-punishment, psychische overmacht en artikel 9a Sr, betrouwbaarheid aangeefsters, gewoontewitwassen van de opbrengst en strafmaat","Gerechtshof Amsterdam, 20-07-2017, 23-000272-14",ECLI:NL:GHAMS:2017:2889,20-07-2017,uitspraak,"[{'Vindplaats': 'Rechtspraak.nl', 'VindplaatsAnnotator': '', 'VindplaatsUrl': ''}]"
ECLI-NL-RBMNE-2014-6501,http://deeplink.rechtspraak.nl/uitspraak?id=ECLI:NL:RBMNE:2014:6501,uitspraak,De publicatie van de uitspraak staat gepland op 09-12-2014 om 14:36 uur,https://uitspraken.rechtspraak.nl/inziendocument?id=ECLI:NL:RBMNE:2014:6501&showbutton=true&keyword=mensenhandel,0.0,['Eerste aanleg - meervoudig'],09-12-2014,2014-12-09T14:36:20Z,gepubliceerd,['Strafrecht'],[],"Ontneming mensenhandel. De rechtbank legt de verplichting op tot betaling aan de Staat van  € 412.650,-- ter ontneming van het wederrechtelijk verkregen voordeel.","Rechtbank Midden-Nederland, 09-12-2014, 16/711877-11 (ontneming)",ECLI:NL:RBMNE:2014:6501,09-12-2014,uitspraak,"[{'Vindplaats': 'Rechtspraak.nl', 'VindplaatsAnnotator': '', 'VindplaatsUrl': ''}]"
ECLI-NL-RBNNE-2014-6190,http://deeplink.rechtspraak.nl/uitspraak?id=ECLI:NL:RBNNE:2014:6190,uitspraak,De publicatie van de uitspraak staat gepland op 10-12-2014 om 11:34 uur,https://uitspraken.rechtspraak.nl/inziendocument?id=ECLI:NL:RBNNE:2014:6190&showbutton=true&keyword=mensenhandel,0.0,"['Eerste aanleg - meervoudig', 'Op tegenspraak']",10-12-2014,2014-12-10T11:34:30Z,gepubliceerd,['Strafrecht'],[],Medeplegen van mensenhandel ten aanzien van een 15-jarig meisje uit Bulgarije. Oplegging van een onvoorwaardelijke gevangenisstraf voor de duur van 24 maanden.,"Rechtbank Noord-Nederland, 08-12-2014, 18.730572-13",ECLI:NL:RBNNE:2014:6190,08-12-2014,uitspraak,"[{'Vindplaats': 'Rechtspraak.nl', 'VindplaatsAnnotator': '', 'VindplaatsUrl': ''}]"
ECLI-NL-RBNNE-2014-6193,http://deeplink.rechtspraak.nl/uitspraak?id=ECLI:NL:RBNNE:2014:6193,uitspraak,De publicatie van de uitspraak staat gepland op 10-12-2014 om 14:43 uur,https://uitspraken.rechtspraak.nl/inziendocument?id=ECLI:NL:RBNNE:2014:6193&showbutton=true&keyword=mensenhandel,0.0,"['Eerste aanleg - meervoudig', 'Op tegenspraak']",10-12-2014,2014-12-10T14:43:54Z,gepubliceerd,['Strafrecht'],[],Medeplichtigheid aan mensenhandel ten aanzien van een 15-jarig meisje uit Bulgarije. Oplegging van een onvoorwaardelijke gevangenisstraf voor de duur van 6 maanden.,"Rechtbank Noord-Nederland, 08-12-2014, 18.730583-13",ECLI:NL:RBNNE:2014:6193,08-12-2014,uitspraak,"[{'Vindplaats': 'Rechtspraak.nl', 'VindplaatsAnnotator': '', 'VindplaatsUrl': ''}]"
ECLI-NL-RBNNE-2014-6194,http://deeplink.rechtspraak.nl/uitspraak?id=ECLI:NL:RBNNE:2014:6194,uitspraak,De publicatie van de uitspraak staat gepland op 10-12-2014 om 16:41 uur,https://uitspraken.rechtspraak.nl/inziendocument?id=ECLI:NL:RBNNE:2014:6194&showbutton=true&keyword=mensenhandel,0.0,"['Eerste aanleg - meervoudig', 'Op tegenspraak']",10-12-2014,2014-12-10T16:41:53Z,gepubliceerd,['Strafrecht'],[],Medeplegen van mensenhandel ten aanzien van een 15-jarig meisje uit Bulgarije. Oplegging van een onvoorwaardelijke gevangenisstraf voor de duur van 24 maanden.,"Rechtbank Noord-Nederland, 08-12-2014, 18.730571-13",ECLI:NL:RBNNE:2014:6194,08-12-2014,uitspraak,"[{'Vindplaats': 'Rechtspraak.nl', 'VindplaatsAnnotator': '', 'VindplaatsUrl': ''}]"
ECLI-NL-RBROT-2014-5669,http://deeplink.rechtspraak.nl/uitspraak?id=ECLI:NL:RBROT:2014:5669,uitspraak,De publicatie van de uitspraak staat gepland op 10-07-2014 om 14:25 uur,https://uitspraken.rechtspraak.nl/inziendocument?id=ECLI:NL:RBROT:2014:5669&showbutton=true&keyword=mensenhandel,0.0,['Eerste aanleg - meervoudig'],10-07-2014,2014-07-10T14:25:33Z,gepubliceerd,['Strafrecht'],[],"De rechtbank veroordeelt verdachte wegens het medeplegen van een poging tot mensenhandel ten aanzien van haar achtjarige dochter, koppelarij en betrokkenheid bij kinderporno.","Rechtbank Rotterdam, 10-07-2014, 11/860346-11",ECLI:NL:RBROT:2014:5669,10-07-2014,uitspraak,"[{'Vindplaats': 'Rechtspraak.nl', 'VindplaatsAnnotator': '', 'VindplaatsUrl': ''}]"
ECLI-NL-RBLIM-2013-4158,http://deeplink.rechtspraak.nl/uitspraak?id=ECLI:NL:RBLIM:2013:4158,uitspraak,De publicatie van de uitspraak staat gepland op 11-07-2013 om 11:53 uur,https://uitspraken.rechtspraak.nl/inziendocument?id=ECLI:NL:RBLIM:2013:4158&showbutton=true&keyword=mensenhandel,0.0,['Eerste aanleg - meervoudig'],11-07-2013,2013-07-11T11:53:46Z,gepubliceerd,['Strafrecht'],[],Mensenhandel. Misbruik kwetsbare positie 10 Poolse werknemers in champignonkwekerij. Verwerping verweer onbetrouwbaarheid verklaring mededader. Voorwaardelijke gevangenisstraf en taakstraf in verband met lange tijdsverloop.,"Rechtbank Limburg, 03-07-2013, 04/9900002-06",ECLI:NL:RBLIM:2013:4158,03-07-2013,uitspraak,"[{'Vindplaats': 'Rechtspraak.nl', 'VindplaatsAnnotator': '', 'VindplaatsUrl': ''}]"
ECLI-NL-RBUTR-2012-BX6100,http://deeplink.rechtspraak.nl/uitspraak?id=ECLI:NL:RBUTR:2012:BX6100,uitspraak,De publicatie van de uitspraak staat gepland op 30-08-2012 om 11:39 uur,https://uitspraken.rechtspraak.nl/inziendocument?id=ECLI:NL:RBUTR:2012:BX6100&showbutton=true&keyword=mensenhandel,0.0,['Eerste aanleg - meervoudig'],30-08-2012,2012-08-30T11:39:21Z,gepubliceerd,['Strafrecht'],[],"Verdachte wordt vrijgesproken terzake mensenhandel. Opgenomen en afgeluisterde telefoongesprekken zijn multi-interpretabel, doch ondersteunen de verklaring van het vermeende slachtoffer op belangrijke punten.","Rechtbank Utrecht, 21-08-2012, 16/804812-11 [P]",ECLI:NL:RBUTR:2012:BX6100,21-08-2012,uitspraak,"[{'Vindplaats': 'Rechtspraak.nl', 'VindplaatsAnnotator': '', 'VindplaatsUrl': ''}]"
ECLI-NL-RBUTR-2011-BQ6884,http://deeplink.rechtspraak.nl/uitspraak?id=ECLI:NL:RBUTR:2011:BQ6884,uitspraak,De publicatie van de uitspraak staat gepland op 01-06-2011 om 17:30 uur,https://uitspraken.rechtspraak.nl/inziendocument?id=ECLI:NL:RBUTR:2011:BQ6884&showbutton=true&keyword=mensenhandel,0.0,['Eerste aanleg - meervoudig'],01-06-2011,2011-06-01T17:30:22Z,gepubliceerd,['Strafrecht'],"[{'RelatieOmschrijving': 'Hoger beroep: ', 'LinkTekst': 'ECLI:NL:GHARL:2013:8522', 'Postfix': ', Meerdere afhandelingswijzen', 'WebAdres': 'https://uitspraken.rechtspraak.nl/inziendocument?id=ECLI:NL:GHARL:2013:8522&showbutton=true&keyword=mensenhandel'}]",De rechtbank acht verdachte schuldig aan onder meer mensenhandel. De rechtbank veroordeelt verdachte tot een gevangenisstraf van acht jaren. Toewijzing vorderingen benadeelde partijen.,"Rechtbank Utrecht, 01-06-2011, 16/711010-10",ECLI:NL:RBUTR:2011:BQ6884,01-06-2011,uitspraak,"[{'Vindplaats': 'Rechtspraak.nl', 'VindplaatsAnnotator': '', 'VindplaatsUrl': ''}]"
ECLI-NL-GHSHE-2011-BQ5633,http://deeplink.rechtspraak.nl/uitspraak?id=ECLI:NL:GHSHE:2011:BQ5633,uitspraak,De publicatie van de uitspraak staat gepland op 23-05-2011 om 13:11 uur,https://uitspraken.rechtspraak.nl/inziendocument?id=ECLI:NL:GHSHE:2011:BQ5633&showbutton=true&keyword=mensenhandel,0.0,['Hoger beroep'],23-05-2011,2011-05-23T13:11:26Z,gepubliceerd,['Strafrecht'],[],Het gerechtshof legt een gevangenisstraf van 6 maanden op voor mensenhandel bestaande uit het bewegen tot bevoordeling uit de opbrengst van seksuele handelingen.,"Gerechtshof 's-Hertogenbosch, 13-05-2011, 20-000686-09",ECLI:NL:GHSHE:2011:BQ5633,13-05-2011,uitspraak,"[{'Vindplaats': 'Rechtspraak.nl', 'VindplaatsAnnotator': '', 'VindplaatsUrl': ''}]"
ECLI-NL-GHSHE-2010-BL5492,http://deeplink.rechtspraak.nl/uitspraak?id=ECLI:NL:GHSHE:2010:BL5492,uitspraak,De publicatie van de uitspraak staat gepland op 24-02-2010 om 15:43 uur,https://uitspraken.rechtspraak.nl/inziendocument?id=ECLI:NL:GHSHE:2010:BL5492&showbutton=true&keyword=mensenhandel,0.0,['Hoger beroep'],24-02-2010,2010-02-24T15:43:21Z,gepubliceerd,['Strafrecht'],"[{'RelatieOmschrijving': 'Eerste aanleg: ', 'LinkTekst': 'ECLI:NL:RBSHE:2008:BD8599', 'Postfix': ', (Gedeeltelijke) vernietiging en zelf afgedaan', 'WebAdres': 'https://uitspraken.rechtspraak.nl/inziendocument?id=ECLI:NL:RBSHE:2008:BD8599&showbutton=true&keyword=mensenhandel'}]","Mensenhandel en mensensmokkel; Hof geeft uitleg aan begrippen ""misbruik"" en ""oogmerk van uitbuiting""; ontoelaatbaar handelen van verhorende politieambtenaren; 359a Sv; geen rechtgevolgen.","Gerechtshof 's-Hertogenbosch, 19-02-2010, 20-002964-08",ECLI:NL:GHSHE:2010:BL5492,19-02-2010,uitspraak,"[{'Vindplaats': 'Rechtspraak.nl', 'VindplaatsAnnotator': '', 'VindplaatsUrl': ''}]"
ECLI-NL-RBNNE-2019-580,http://deeplink.rechtspraak.nl/uitspraak?id=ECLI:NL:RBNNE:2019:580,uitspraak,De publicatie van de uitspraak staat gepland op 18-02-2019 om 11:43 uur,https://uitspraken.rechtspraak.nl/inziendocument?id=ECLI:NL:RBNNE:2019:580&showbutton=true&keyword=mensenhandel,0.0,"['Eerste aanleg - meervoudig', 'Op tegenspraak']",18-02-2019,2019-02-18T11:43:20Z,gepubliceerd,['Strafrecht'],"[{'RelatieOmschrijving': 'Hoger beroep: ', 'LinkTekst': 'ECLI:NL:GHARL:2020:2419', 'Postfix': None, 'WebAdres': 'https://uitspraken.rechtspraak.nl/inziendocument?id=ECLI:NL:GHARL:2020:2419&showbutton=true&keyword=mensenhandel'}]","Veroordeling voor mensenhandel tot een gevangenisstraf van 20 maanden.
Verdachte heeft zich gedurende een periode van bijna 10 maanden schuldig gemaakt aan mensenhandel ten aanzien van een jonge Roemeense vrouw. Het slachtoffer was verliefd op verdachte en is door hem op dusdanige wijze gemanipuleerd en onder druk gezet dat zij in haar angst hem te verliezen, bereid was prostitutiewerkzaamheden voor hem te verrichten en haar verdiensten aan hem af te staan.","Rechtbank Noord-Nederland, 08-02-2019, 18/730043-18",ECLI:NL:RBNNE:2019:580,08-02-2019,uitspraak,"[{'Vindplaats': 'Rechtspraak.nl', 'VindplaatsAnnotator': '', 'VindplaatsUrl': ''}]"
ECLI-NL-RBDHA-2018-12549,http://deeplink.rechtspraak.nl/uitspraak?id=ECLI:NL:RBDHA:2018:12549,uitspraak,De publicatie van de uitspraak staat gepland op 26-10-2018 om 14:16 uur,https://uitspraken.rechtspraak.nl/inziendocument?id=ECLI:NL:RBDHA:2018:12549&showbutton=true&keyword=mensenhandel,0.0,['Eerste aanleg - meervoudig'],26-10-2018,2018-10-26T14:16:59Z,gepubliceerd,['Strafrecht'],[],"Mensenhandel - Arbeidsuitbuiting 

Bij de beoordeling of in een bepaalde situatie sprake was van (arbeids)uitbuiting moet aan de hand van de in het Chinese horeca-arrest geformuleerde criteria worden onderzocht of sprake was van een situatie waarin moet worden geconcludeerd dat sprake was van mensonterende omstandigheden waarbij mensenrechten fundamenteel werden geschonden. Door deze graadmeter valt niet elk misbruik in een arbeids- of dienstrelatie onder het bereik van mensenhandel.","Rechtbank Den Haag, 19-10-2018, 09/767338-16",ECLI:NL:RBDHA:2018:12549,19-10-2018,uitspraak,"[{'Vindplaats': 'Rechtspraak.nl', 'VindplaatsAnnotator': '', 'VindplaatsUrl': ''}]"
ECLI-NL-CRVB-2017-3673,http://deeplink.rechtspraak.nl/uitspraak?id=ECLI:NL:CRVB:2017:3673,uitspraak,De publicatie van de uitspraak staat gepland op 30-10-2017 om 11:25 uur,https://uitspraken.rechtspraak.nl/inziendocument?id=ECLI:NL:CRVB:2017:3673&showbutton=true&keyword=mensenhandel,0.0,['Voorlopige voorziening'],30-10-2017,2017-10-30T11:25:16Z,gepubliceerd,['Bestuursrecht; Socialezekerheidsrecht'],[],"Afwijzing verzoek om voorlopige voorziening. Gesteld rechtmatig verblijf op basis van Richtlijn  (PB 2004 L 261) t.b.v. slachtoffers van mensenhandel. Geen zelfstandig recht aan Richtlijn te ontlenen. Verzoekster heeft ten onrechte geen onderzoek gedaan naar de mogelijkheid dat haar in Spanje (het land van onderzoek naar mensenhandel) een verblijfstitel en een voorziening in het bestaan toekomt, terwijl een en ander naar voorlopig oordeel wel op haar weg ligt.","Centrale Raad van Beroep, 03-10-2017, 17/5279 PW-VV",ECLI:NL:CRVB:2017:3673,03-10-2017,uitspraak,"[{'Vindplaats': 'RSV 2017/246', 'VindplaatsAnnotator': '', 'VindplaatsUrl': ''}, {'Vindplaats': 'Rechtspraak.nl', 'VindplaatsAnnotator': '', 'VindplaatsUrl': ''}]"
ECLI-NL-HR-2015-1504,http://deeplink.rechtspraak.nl/uitspraak?id=ECLI:NL:HR:2015:1504,uitspraak,De publicatie van de uitspraak staat gepland op 10-06-2015 om 09:58 uur,https://uitspraken.rechtspraak.nl/inziendocument?id=ECLI:NL:HR:2015:1504&showbutton=true&keyword=mensenhandel,0.0,['Cassatie'],10-06-2015,2015-06-10T09:58:21Z,gepubliceerd,['Strafrecht'],"[{'RelatieOmschrijving': 'Conclusie: ', 'LinkTekst': 'ECLI:NL:PHR:2015:840', 'Postfix': ', Gevolgd', 'WebAdres': 'https://uitspraken.rechtspraak.nl/inziendocument?id=ECLI:NL:PHR:2015:840&showbutton=true&keyword=mensenhandel'}, {'RelatieOmschrijving': 'In cassatie op : ', 'LinkTekst': 'ECLI:NL:GHARL:2013:BZ8892', 'Postfix': ', Bekrachtiging/bevestiging', 'WebAdres': 'https://uitspraken.rechtspraak.nl/inziendocument?id=ECLI:NL:GHARL:2013:BZ8892&showbutton=true&keyword=mensenhandel'}]","OM-cassatie. Mensenhandel, art. 273f Sr. HR herhaalt relevante overweging uit ECLI:NL:HR:2004:AO5061. ’s Hofs motivering van de vrijspraak moet aldus worden verstaan dat voor een bewezenverklaring van mensenhandel moet komen vast te staan dat zowel sprake is van misbruik en/of uitbuiting als van (voorwaardelijk) opzet op de tlgl. deelneming daaraan. Dat oordeel getuigt niet van een onjuiste rechtsopvatting en is toereikend gemotiveerd.","Hoge Raad, 09-06-2015, 13/03572",ECLI:NL:HR:2015:1504,09-06-2015,uitspraak,"[{'Vindplaats': 'RvdW 2015/764', 'VindplaatsAnnotator': '', 'VindplaatsUrl': ''}, {'Vindplaats': 'NBSTRAF 2015/159', 'VindplaatsAnnotator': '', 'VindplaatsUrl': ''}, {'Vindplaats': 'SR-Updates.nl 2015-0273', 'VindplaatsAnnotator': '', 'VindplaatsUrl': ''}, {'Vindplaats': 'NbSr 2015/159', 'VindplaatsAnnotator': '', 'VindplaatsUrl': ''}, {'Vindplaats': 'Rechtspraak.nl', 'VindplaatsAnnotator': '', 'VindplaatsUrl': ''}]"
ECLI-NL-RBNNE-2015-2312,http://deeplink.rechtspraak.nl/uitspraak?id=ECLI:NL:RBNNE:2015:2312,uitspraak,De publicatie van de uitspraak staat gepland op 13-05-2015 om 16:05 uur,https://uitspraken.rechtspraak.nl/inziendocument?id=ECLI:NL:RBNNE:2015:2312&showbutton=true&keyword=mensenhandel,0.0,"['Eerste aanleg - meervoudig', 'Op tegenspraak']",13-05-2015,2015-05-13T16:05:36Z,gepubliceerd,['Strafrecht'],[],"De rechtbank Noord-Nederland heeft op 13 mei 2015 een 28-jarige vrouw uit Wormer wegens medeplichtigheid aan mensenhandel veroordeeld tot een gevangenisstraf voor de duur van 4 maanden, waarvan 2 maanden voorwaardelijk. De rechtbank acht bewezen dat de vrouw behulpzaam is geweest bij het in de prostitutie brengen van een 16-jarige meisje dat was weggelopen uit een jeugdrichting. De rechtbank sprak de vrouw vrij van het medeplegen van mensenhandel.","Rechtbank Noord-Nederland, 13-05-2015, 18.850079-14",ECLI:NL:RBNNE:2015:2312,13-05-2015,uitspraak,"[{'Vindplaats': 'Rechtspraak.nl', 'VindplaatsAnnotator': '', 'VindplaatsUrl': ''}]"
ECLI-NL-PHR-2015-840,http://deeplink.rechtspraak.nl/uitspraak?id=ECLI:NL:PHR:2015:840,conclusie,De publicatie van de uitspraak staat gepland op 10-06-2015 om 09:58 uur,https://uitspraken.rechtspraak.nl/inziendocument?id=ECLI:NL:PHR:2015:840&showbutton=true&keyword=mensenhandel,0.0,[],10-06-2015,2015-06-10T09:58:51Z,gepubliceerd,['Strafrecht'],"[{'RelatieOmschrijving': 'Arrest Hoge Raad: ', 'LinkTekst': 'ECLI:NL:HR:2015:1504', 'Postfix': ', Gevolgd', 'WebAdres': 'https://uitspraken.rechtspraak.nl/inziendocument?id=ECLI:NL:HR:2015:1504&showbutton=true&keyword=mensenhandel'}]","OM-cassatie. Mensenhandel, art. 273f Sr. HR herhaalt relevante overweging uit ECLI:NL:HR:2004:AO5061. ’s Hofs motivering van de vrijspraak moet aldus worden verstaan dat voor een bewezenverklaring van mensenhandel moet komen vast te staan dat zowel sprake is van misbruik en/of uitbuiting als van (voorwaardelijk) opzet op de tlgl. deelneming daaraan. Dat oordeel getuigt niet van een onjuiste rechtsopvatting en is toereikend gemotiveerd.","Parket bij de Hoge Raad, 07-04-2015, 13/03572",ECLI:NL:PHR:2015:840,07-04-2015,conclusie,"[{'Vindplaats': 'Rechtspraak.nl', 'VindplaatsAnnotator': '', 'VindplaatsUrl': ''}]"
ECLI-NL-GHARL-2014-2256,http://deeplink.rechtspraak.nl/uitspraak?id=ECLI:NL:GHARL:2014:2256,uitspraak,De publicatie van de uitspraak staat gepland op 20-03-2014 om 15:27 uur,https://uitspraken.rechtspraak.nl/inziendocument?id=ECLI:NL:GHARL:2014:2256&showbutton=true&keyword=mensenhandel,0.0,['Hoger beroep'],20-03-2014,2014-03-20T15:27:38Z,gepubliceerd,['Strafrecht'],[],"Onderzoek Boerdijk: Ontvankelijkheid OM/incompleet dossier/359a Sv/6EVRM. Mensenhandel. Witwassen/vermogen BV niet ‘besmet’. Valsheid in geschrifte. Criminele organisatie/duurzaam gestructureerd samenwerkingsverband onderneming. 
Onzorgvuldige en onvolledige dossiervorming/hersteld in appelfase/strafcompensatie
Vrijspraak ter zake mensenhandel, criminele organisatie en witwassen.
Veroordeling ter zake een poging tot afpersing, het voorhanden hebben van een wapen en van valsheid in geschrift tot een gevangenisstraf voor de duur van 5 maanden m.a.","Gerechtshof Arnhem-Leeuwarden, 18-03-2014, ks 21-001425-13",ECLI:NL:GHARL:2014:2256,18-03-2014,uitspraak,"[{'Vindplaats': 'Rechtspraak.nl', 'VindplaatsAnnotator': '', 'VindplaatsUrl': ''}]"
ECLI-NL-GHARL-2013-BZ8892,http://deeplink.rechtspraak.nl/uitspraak?id=ECLI:NL:GHARL:2013:BZ8892,uitspraak,De publicatie van de uitspraak staat gepland op 26-04-2013 om 14:46 uur,https://uitspraken.rechtspraak.nl/inziendocument?id=ECLI:NL:GHARL:2013:BZ8892&showbutton=true&keyword=mensenhandel,0.0,['Hoger beroep'],26-04-2013,2013-04-26T14:46:27Z,gepubliceerd,['Strafrecht'],"[{'RelatieOmschrijving': 'Eerste aanleg: ', 'LinkTekst': 'ECLI:NL:RBUTR:2011:BV0759', 'Postfix': ', (Gedeeltelijke) vernietiging en zelf afgedaan', 'WebAdres': 'https://uitspraken.rechtspraak.nl/inziendocument?id=ECLI:NL:RBUTR:2011:BV0759&showbutton=true&keyword=mensenhandel'}, {'RelatieOmschrijving': 'Cassatie: ', 'LinkTekst': 'ECLI:NL:HR:2015:1504', 'Postfix': ', Bekrachtiging/bevestiging', 'WebAdres': 'https://uitspraken.rechtspraak.nl/inziendocument?id=ECLI:NL:HR:2015:1504&showbutton=true&keyword=mensenhandel'}]","Mensenhandel. Vrijspraak. Verdachte heeft mogelijkerwijs enigszins opportunistisch gehandeld in de wereld van de (legale) prostitutie. Dat opportunisme reikte echter niet zo ver dat hij opzet had op, of willens en wetens de aanmerkelijke kans nam dat, hij als medepleger van het misbruik kan worden aangemerkt, noch dat hij opzettelijk voordeel trok uit uitbuiting. Beide factoren dienen wel vast te staan, wil er sprake kunnen zijn van een bewezenverklaring van mensenhandel.","Gerechtshof Arnhem-Leeuwarden, 26-04-2013, 21-005060-11",ECLI:NL:GHARL:2013:BZ8892,26-04-2013,uitspraak,"[{'Vindplaats': 'Rechtspraak.nl', 'VindplaatsAnnotator': '', 'VindplaatsUrl': ''}]"
ECLI-NL-RVS-2020-2289,http://deeplink.rechtspraak.nl/uitspraak?id=ECLI:NL:RVS:2020:2289,uitspraak,De publicatie van de uitspraak staat gepland op 30-09-2020 om 10:32 uur,https://uitspraken.rechtspraak.nl/inziendocument?id=ECLI:NL:RVS:2020:2289&showbutton=true&keyword=mensenhandel,0.0,['Hoger beroep'],30-09-2020,2020-09-30T10:32:06Z,gepubliceerd,['Bestuursrecht; Vreemdelingenrecht'],"[{'RelatieOmschrijving': 'Eerste aanleg: ', 'LinkTekst': 'ECLI:NL:RBAMS:2020:1252', 'Postfix': ', Niet bevoegd', 'WebAdres': 'https://uitspraken.rechtspraak.nl/inziendocument?id=ECLI:NL:RBAMS:2020:1252&showbutton=true&keyword=mensenhandel'}]","Op 7 september 2019 heeft de korpschef van Afdeling Vreemdelingenpolitie, Identificatie en Mensenhandel in Amsterdam het paspoort van de vreemdeling tijdelijk in bewaring genomen.","Raad van State, 28-09-2020, 202001598/1/V3",ECLI:NL:RVS:2020:2289,28-09-2020,uitspraak,"[{'Vindplaats': 'Rechtspraak.nl', 'VindplaatsAnnotator': '', 'VindplaatsUrl': ''}]"
ECLI-NL-RBDHA-2020-7467,http://deeplink.rechtspraak.nl/uitspraak?id=ECLI:NL:RBDHA:2020:7467,uitspraak,De publicatie van de uitspraak staat gepland op 06-08-2020 om 15:30 uur,https://uitspraken.rechtspraak.nl/inziendocument?id=ECLI:NL:RBDHA:2020:7467&showbutton=true&keyword=mensenhandel,0.0,['Eerste aanleg - enkelvoudig'],06-08-2020,2020-08-06T15:30:53Z,gepubliceerd,['Bestuursrecht; Vreemdelingenrecht'],[],"Dublin, art. 17 DVO, gestelde minderjarigheid niet aannemelijk gemaakt, niet onderbouwd dat informatie in EU-vis niet juist is, wens aangifte mensenhandel, beroep ongegrond.","Rechtbank Den Haag, 03-07-2020, NL20.8260",ECLI:NL:RBDHA:2020:7467,03-07-2020,uitspraak,"[{'Vindplaats': 'Rechtspraak.nl', 'VindplaatsAnnotator': '', 'VindplaatsUrl': ''}]"
ECLI-NL-GHARL-2020-1656,http://deeplink.rechtspraak.nl/uitspraak?id=ECLI:NL:GHARL:2020:1656,uitspraak,De publicatie van de uitspraak staat gepland op 26-02-2020 om 15:45 uur,https://uitspraken.rechtspraak.nl/inziendocument?id=ECLI:NL:GHARL:2020:1656&showbutton=true&keyword=mensenhandel,0.0,['Hoger beroep'],26-02-2020,2020-02-26T15:45:11Z,gepubliceerd,['Strafrecht'],"[{'RelatieOmschrijving': 'Eerste aanleg: ', 'LinkTekst': 'ECLI:NL:RBMNE:2018:738', 'Postfix': ', (Gedeeltelijke) vernietiging en zelf afgedaan', 'WebAdres': 'https://uitspraken.rechtspraak.nl/inziendocument?id=ECLI:NL:RBMNE:2018:738&showbutton=true&keyword=mensenhandel'}, {'RelatieOmschrijving': 'Cassatie: ', 'LinkTekst': 'ECLI:NL:HR:2021:774', 'Postfix': None, 'WebAdres': 'https://uitspraken.rechtspraak.nl/inziendocument?id=ECLI:NL:HR:2021:774&showbutton=true&keyword=mensenhandel'}]","Mensenhandel. Loverboyachtige manier van handelen. Misleiding en misbruik van een kwetsbare positie. 12 maanden gevangenisstraf, waarvan 4 maanden voorwaardelijk. Vordering benadeelde partij deels toegewezen.","Gerechtshof Arnhem-Leeuwarden, 26-02-2020, 21-001497-18",ECLI:NL:GHARL:2020:1656,26-02-2020,uitspraak,"[{'Vindplaats': 'Rechtspraak.nl', 'VindplaatsAnnotator': '', 'VindplaatsUrl': ''}]"
ECLI-NL-GHAMS-2020-666,http://deeplink.rechtspraak.nl/uitspraak?id=ECLI:NL:GHAMS:2020:666,uitspraak,De publicatie van de uitspraak staat gepland op 30-03-2020 om 12:56 uur,https://uitspraken.rechtspraak.nl/inziendocument?id=ECLI:NL:GHAMS:2020:666&showbutton=true&keyword=mensenhandel,0.0,['Hoger beroep'],30-03-2020,2020-03-30T12:56:15Z,gepubliceerd,['Strafrecht'],[],"Mensenhandel in vereniging, meermalen gepleegd, en medeplegen van gewoontewitwassen. Verweren betrouwbaarheid verklaringen medeverdachte m.b.t. jegens aangeefster toegepast geweld en dwangmiddel ‘geweld’ verworpen.","Gerechtshof Amsterdam, 07-02-2020, 23-002447-17",ECLI:NL:GHAMS:2020:666,07-02-2020,uitspraak,"[{'Vindplaats': 'Rechtspraak.nl', 'VindplaatsAnnotator': '', 'VindplaatsUrl': ''}]"
ECLI-NL-RBROT-2020-826,http://deeplink.rechtspraak.nl/uitspraak?id=ECLI:NL:RBROT:2020:826,uitspraak,De publicatie van de uitspraak staat gepland op 04-02-2020 om 11:15 uur,https://uitspraken.rechtspraak.nl/inziendocument?id=ECLI:NL:RBROT:2020:826&showbutton=true&keyword=mensenhandel,0.0,['Eerste aanleg - meervoudig'],04-02-2020,2020-02-04T11:15:45Z,gepubliceerd,['Strafrecht'],[],Ontneming van wederrechtelijk verkregen voordeel uit mensenhandel. Overweging over schatting gemiddelde inkomsten per dag uit prostitutiewerkzaamheden. ZIE OOK ECLI:NL:RBROT:2020:825,"Rechtbank Rotterdam, 03-02-2020, 10/750541-18 (ontneming)",ECLI:NL:RBROT:2020:826,03-02-2020,uitspraak,"[{'Vindplaats': 'Rechtspraak.nl', 'VindplaatsAnnotator': '', 'VindplaatsUrl': ''}]"
ECLI-NL-RBDHA-2019-8689,http://deeplink.rechtspraak.nl/uitspraak?id=ECLI:NL:RBDHA:2019:8689,uitspraak,De publicatie van de uitspraak staat gepland op 23-08-2019 om 14:21 uur,https://uitspraken.rechtspraak.nl/inziendocument?id=ECLI:NL:RBDHA:2019:8689&showbutton=true&keyword=mensenhandel,0.0,"['Conservatoire maatregel', 'Eerste aanleg - enkelvoudig']",23-08-2019,2019-08-23T14:21:54Z,gepubliceerd,['Bestuursrecht; Vreemdelingenrecht'],[],"Dublin Italie, uitgaan van interstatelijk vertrouwensbeginsel, eiser wenst aangifte te doen van mensenhandel, doet een beroep op het arrest Tarakhel en het arrest Jawo","Rechtbank Den Haag, 02-05-2019, NL19.7126",ECLI:NL:RBDHA:2019:8689,02-05-2019,uitspraak,"[{'Vindplaats': 'Rechtspraak.nl', 'VindplaatsAnnotator': '', 'VindplaatsUrl': ''}]"
ECLI-NL-RBDHA-2018-1785,http://deeplink.rechtspraak.nl/uitspraak?id=ECLI:NL:RBDHA:2018:1785,uitspraak,De publicatie van de uitspraak staat gepland op 17-03-2020 om 10:54 uur,https://uitspraken.rechtspraak.nl/inziendocument?id=ECLI:NL:RBDHA:2018:1785&showbutton=true&keyword=mensenhandel,0.0,['Eerste aanleg - meervoudig'],17-03-2020,2020-03-17T10:54:25Z,gepubliceerd,['Strafrecht'],[],De verdachte heeft zich schuldig gemaakt aan mensenhandel. De rechtbank heeft de verdachte derhalve veroordeeld tot een gevangenisstraf voor de duur van 18 maanden.,"Rechtbank Den Haag, 09-02-2018, 09/837034-16",ECLI:NL:RBDHA:2018:1785,09-02-2018,uitspraak,"[{'Vindplaats': 'Rechtspraak.nl', 'VindplaatsAnnotator': '', 'VindplaatsUrl': ''}]"
ECLI-NL-GHAMS-2017-4259,http://deeplink.rechtspraak.nl/uitspraak?id=ECLI:NL:GHAMS:2017:4259,uitspraak,De publicatie van de uitspraak staat gepland op 24-10-2017 om 11:12 uur,https://uitspraken.rechtspraak.nl/inziendocument?id=ECLI:NL:GHAMS:2017:4259&showbutton=true&keyword=mensenhandel,0.0,['Hoger beroep'],24-10-2017,2017-10-24T11:12:28Z,gepubliceerd,['Strafrecht'],"[{'RelatieOmschrijving': 'Cassatie: ', 'LinkTekst': 'ECLI:NL:HR:2019:1452', 'Postfix': ', Bekrachtiging/bevestiging', 'WebAdres': 'https://uitspraken.rechtspraak.nl/inziendocument?id=ECLI:NL:HR:2019:1452&showbutton=true&keyword=mensenhandel'}]",Mega 13Natur. Mensenhandel; veroordeling voor het faciliteren van prostitutie door een minderjarig meisje en het profiteren daarvan. Overwegingen over het ‘oogmerk van uitbuiting’.,"Gerechtshof Amsterdam, 13-10-2017, 23-001776-15",ECLI:NL:GHAMS:2017:4259,13-10-2017,uitspraak,"[{'Vindplaats': 'NJFS 2017/206', 'VindplaatsAnnotator': '', 'VindplaatsUrl': ''}, {'Vindplaats': 'Rechtspraak.nl', 'VindplaatsAnnotator': '', 'VindplaatsUrl': ''}]"
ECLI-NL-HR-2017-2540,http://deeplink.rechtspraak.nl/uitspraak?id=ECLI:NL:HR:2017:2540,uitspraak,De publicatie van de uitspraak staat gepland op 03-10-2017 om 14:12 uur,https://uitspraken.rechtspraak.nl/inziendocument?id=ECLI:NL:HR:2017:2540&showbutton=true&keyword=mensenhandel,0.0,"['Artikel 81 RO-zaken', 'Cassatie']",03-10-2017,2017-10-03T14:12:45Z,gepubliceerd,['Strafrecht'],"[{'RelatieOmschrijving': 'Conclusie: ', 'LinkTekst': 'ECLI:NL:PHR:2017:1006', 'Postfix': ', Gevolgd', 'WebAdres': 'https://uitspraken.rechtspraak.nl/inziendocument?id=ECLI:NL:PHR:2017:1006&showbutton=true&keyword=mensenhandel'}, {'RelatieOmschrijving': 'In cassatie op : ', 'LinkTekst': 'ECLI:NL:GHDHA:2016:930', 'Postfix': ', Bekrachtiging/bevestiging', 'WebAdres': 'https://uitspraken.rechtspraak.nl/inziendocument?id=ECLI:NL:GHDHA:2016:930&showbutton=true&keyword=mensenhandel'}]",Mensenhandel. Falende unus testis klachten en andere bewijsmotiveringsklachten. Falend middel b.p. over n-o verklaring door het Hof. HR: art. 81.1 RO.,"Hoge Raad, 03-10-2017, 16/02372",ECLI:NL:HR:2017:2540,03-10-2017,uitspraak,"[{'Vindplaats': 'RvdW 2017/1089', 'VindplaatsAnnotator': '', 'VindplaatsUrl': ''}, {'Vindplaats': 'PS-Updates.nl 2017-0811', 'VindplaatsAnnotator': '', 'VindplaatsUrl': ''}, {'Vindplaats': 'Rechtspraak.nl', 'VindplaatsAnnotator': '', 'VindplaatsUrl': ''}]"
ECLI-NL-PHR-2017-1006,http://deeplink.rechtspraak.nl/uitspraak?id=ECLI:NL:PHR:2017:1006,conclusie,De publicatie van de uitspraak staat gepland op 03-10-2017 om 14:19 uur,https://uitspraken.rechtspraak.nl/inziendocument?id=ECLI:NL:PHR:2017:1006&showbutton=true&keyword=mensenhandel,0.0,[],03-10-2017,2017-10-03T14:19:15Z,gepubliceerd,['Strafrecht'],"[{'RelatieOmschrijving': 'Arrest Hoge Raad: ', 'LinkTekst': 'ECLI:NL:HR:2017:2540', 'Postfix': ', Gevolgd', 'WebAdres': 'https://uitspraken.rechtspraak.nl/inziendocument?id=ECLI:NL:HR:2017:2540&showbutton=true&keyword=mensenhandel'}]",Mensenhandel. Falende unus testis klachten en andere bewijsmotiveringsklachten. Falend middel b.p. over n-o verklaring door het Hof. HR: art. 81.1 RO.,"Parket bij de Hoge Raad, 04-07-2017, 16/02372",ECLI:NL:PHR:2017:1006,04-07-2017,conclusie,"[{'Vindplaats': 'Rechtspraak.nl', 'VindplaatsAnnotator': '', 'VindplaatsUrl': ''}]"
ECLI-NL-GHAMS-2016-3981,http://deeplink.rechtspraak.nl/uitspraak?id=ECLI:NL:GHAMS:2016:3981,uitspraak,De publicatie van de uitspraak staat gepland op 06-10-2016 om 14:27 uur,https://uitspraken.rechtspraak.nl/inziendocument?id=ECLI:NL:GHAMS:2016:3981&showbutton=true&keyword=mensenhandel,0.0,['Hoger beroep'],06-10-2016,2016-10-06T14:27:03Z,gepubliceerd,['Strafrecht'],[],"Mensenhandel: toetsingskader, toetsing betrouwbaarheid verklaringen aangever (en anderen), misbruik kwetsbare positie en van uit feitelijke omstandigheden voortvloeiend overwicht, vordering benadeelde partij (deels onevenredige belasting).","Gerechtshof Amsterdam, 05-10-2016, 23-005430-13",ECLI:NL:GHAMS:2016:3981,05-10-2016,uitspraak,"[{'Vindplaats': 'Rechtspraak.nl', 'VindplaatsAnnotator': '', 'VindplaatsUrl': ''}]"
ECLI-NL-GHDHA-2016-931,http://deeplink.rechtspraak.nl/uitspraak?id=ECLI:NL:GHDHA:2016:931,uitspraak,De publicatie van de uitspraak staat gepland op 06-04-2016 om 15:33 uur,https://uitspraken.rechtspraak.nl/inziendocument?id=ECLI:NL:GHDHA:2016:931&showbutton=true&keyword=mensenhandel,0.0,['Hoger beroep'],06-04-2016,2016-04-06T15:33:21Z,gepubliceerd,['Strafrecht'],[],Het hof verklaart niet bewezen dat de verdachte het ten laste gelegde (mensenhandel) heeft begaan en spreekt de verdachte daarvan in zijn geheel vrij.,"Gerechtshof Den Haag, 10-03-2016, 22-003162-13",ECLI:NL:GHDHA:2016:931,10-03-2016,uitspraak,"[{'Vindplaats': 'Rechtspraak.nl', 'VindplaatsAnnotator': '', 'VindplaatsUrl': ''}]"
ECLI-NL-GHARL-2015-6877,http://deeplink.rechtspraak.nl/uitspraak?id=ECLI:NL:GHARL:2015:6877,uitspraak,De publicatie van de uitspraak staat gepland op 22-09-2015 om 11:21 uur,https://uitspraken.rechtspraak.nl/inziendocument?id=ECLI:NL:GHARL:2015:6877&showbutton=true&keyword=mensenhandel,0.0,['Hoger beroep'],22-09-2015,2015-09-22T11:21:26Z,gepubliceerd,['Strafrecht'],"[{'RelatieOmschrijving': 'Eerste aanleg: ', 'LinkTekst': 'ECLI:NL:RBGEL:2014:7941', 'Postfix': ', (Gedeeltelijke) vernietiging en zelf afgedaan', 'WebAdres': 'https://uitspraken.rechtspraak.nl/inziendocument?id=ECLI:NL:RBGEL:2014:7941&showbutton=true&keyword=mensenhandel'}]",Veroordeling voor mensenhandel en bezit kinderporno tot een gevangenisstraf van 6 maanden waarvan 3 maanden voorwaardelijk en een taakstraf van 180 uur. Minderjarig slachtoffer.,"Gerechtshof Arnhem-Leeuwarden, 17-09-2015, 21-000030-15",ECLI:NL:GHARL:2015:6877,17-09-2015,uitspraak,"[{'Vindplaats': 'Rechtspraak.nl', 'VindplaatsAnnotator': '', 'VindplaatsUrl': ''}]"
ECLI-NL-RBOBR-2014-1214,http://deeplink.rechtspraak.nl/uitspraak?id=ECLI:NL:RBOBR:2014:1214,uitspraak,De publicatie van de uitspraak staat gepland op 20-03-2014 om 13:14 uur,https://uitspraken.rechtspraak.nl/inziendocument?id=ECLI:NL:RBOBR:2014:1214&showbutton=true&keyword=mensenhandel,0.0,['Eerste aanleg - meervoudig'],20-03-2014,2014-03-20T13:14:07Z,gepubliceerd,['Strafrecht'],[],"Gevangenisstraf voor de duur van 42 maanden, waarvan een deel, groot 12 maanden, voorwaardelijk met een proeftijd van 3 jaren voor mensenhandel (2 x)","Rechtbank Oost-Brabant, 20-03-2014, 01/865006-13",ECLI:NL:RBOBR:2014:1214,20-03-2014,uitspraak,"[{'Vindplaats': 'Rechtspraak.nl', 'VindplaatsAnnotator': '', 'VindplaatsUrl': ''}]"
ECLI-NL-RBZLY-2012-BY5514,http://deeplink.rechtspraak.nl/uitspraak?id=ECLI:NL:RBZLY:2012:BY5514,uitspraak,De publicatie van de uitspraak staat gepland op 07-12-2012 om 15:48 uur,https://uitspraken.rechtspraak.nl/inziendocument?id=ECLI:NL:RBZLY:2012:BY5514&showbutton=true&keyword=mensenhandel,0.0,['Eerste aanleg - meervoudig'],07-12-2012,2012-12-07T15:48:15Z,gepubliceerd,['Strafrecht'],[],"promis, mensenhandel, instemmen met en het betaald krijgen voor het verrichten van seksuele diensten maken niet dat er geen sprake kan zijn van uitbuiting","Rechtbank Zwolle-Lelystad, 15-11-2012, 07-650223-11",ECLI:NL:RBZLY:2012:BY5514,15-11-2012,uitspraak,"[{'Vindplaats': 'Rechtspraak.nl', 'VindplaatsAnnotator': '', 'VindplaatsUrl': ''}]"
ECLI-NL-RBZLY-2012-BY5521,http://deeplink.rechtspraak.nl/uitspraak?id=ECLI:NL:RBZLY:2012:BY5521,uitspraak,De publicatie van de uitspraak staat gepland op 07-12-2012 om 16:15 uur,https://uitspraken.rechtspraak.nl/inziendocument?id=ECLI:NL:RBZLY:2012:BY5521&showbutton=true&keyword=mensenhandel,0.0,['Eerste aanleg - meervoudig'],07-12-2012,2012-12-07T16:15:55Z,gepubliceerd,['Strafrecht'],[],"promis, mensenhandel, instemmen met en het betaald krijgen voor het verrichten van seksuele diensten maken niet dat er geen sprake kan zijn van uitbuiting","Rechtbank Zwolle-Lelystad, 15-11-2012, 07/650224-11",ECLI:NL:RBZLY:2012:BY5521,15-11-2012,uitspraak,"[{'Vindplaats': 'Rechtspraak.nl', 'VindplaatsAnnotator': '', 'VindplaatsUrl': ''}]"
ECLI-NL-RBGRO-2010-BO0439,http://deeplink.rechtspraak.nl/uitspraak?id=ECLI:NL:RBGRO:2010:BO0439,uitspraak,De publicatie van de uitspraak staat gepland op 14-10-2010 om 14:45 uur,https://uitspraken.rechtspraak.nl/inziendocument?id=ECLI:NL:RBGRO:2010:BO0439&showbutton=true&keyword=mensenhandel,0.0,['Eerste aanleg - meervoudig'],14-10-2010,2010-10-14T14:45:47Z,gepubliceerd,['Strafrecht'],[],"Bewezenverklaring inzake mensenhandel (artikel 273f, eerste lid, sub 3, Sr) zonder oplegging van straf of maatregel nu niet van een uitbuitingssituatie is gebleken.","Rechtbank Groningen, 14-10-2010, 18/670192-10",ECLI:NL:RBGRO:2010:BO0439,14-10-2010,uitspraak,"[{'Vindplaats': 'Rechtspraak.nl', 'VindplaatsAnnotator': '', 'VindplaatsUrl': ''}]"
ECLI-NL-RBUTR-2010-BO2835,http://deeplink.rechtspraak.nl/uitspraak?id=ECLI:NL:RBUTR:2010:BO2835,uitspraak,De publicatie van de uitspraak staat gepland op 03-11-2010 om 16:52 uur,https://uitspraken.rechtspraak.nl/inziendocument?id=ECLI:NL:RBUTR:2010:BO2835&showbutton=true&keyword=mensenhandel,0.0,['Eerste aanleg - meervoudig'],03-11-2010,2010-11-03T16:52:49Z,gepubliceerd,"['Civiel recht', 'Strafrecht']",[],"Mensenhandel, de rechtbank veroordeelt verdachte tot een voorwaardelijke gevangenisstraf voor de duur van 6 maanden met aftrek van voorarrest en proeftijd van 2 jaar.","Rechtbank Utrecht, 05-10-2010, 16-710487-07",ECLI:NL:RBUTR:2010:BO2835,05-10-2010,uitspraak,"[{'Vindplaats': 'Rechtspraak.nl', 'VindplaatsAnnotator': '', 'VindplaatsUrl': ''}]"
ECLI-NL-RBDHA-2021-2507,http://deeplink.rechtspraak.nl/uitspraak?id=ECLI:NL:RBDHA:2021:2507,uitspraak,De publicatie van de uitspraak staat gepland op 18-03-2021 om 14:48 uur,https://uitspraken.rechtspraak.nl/inziendocument?id=ECLI:NL:RBDHA:2021:2507&showbutton=true&keyword=mensenhandel,0.0,['Eerste aanleg - enkelvoudig'],18-03-2021,2021-03-18T14:48:26.306Z,gepubliceerd,['Bestuursrecht; Vreemdelingenrecht'],[],"VK, beroep ongegrond en vovo afgewezen, aanvraag humanitair tijdelijk ivm mensenhandel, verweerder mag uitgaan van sepotbeslissing OM, art. 3.48, lid 1 sub a Vb","Rechtbank Den Haag, 08-03-2021, AWB 20/7549 en AWB 20/7550",ECLI:NL:RBDHA:2021:2507,08-03-2021,uitspraak,"[{'Vindplaats': 'Rechtspraak.nl', 'VindplaatsAnnotator': '', 'VindplaatsUrl': ''}]"
ECLI-NL-RBZWB-2019-2072,http://deeplink.rechtspraak.nl/uitspraak?id=ECLI:NL:RBZWB:2019:2072,uitspraak,De publicatie van de uitspraak staat gepland op 09-05-2019 om 14:15 uur,https://uitspraken.rechtspraak.nl/inziendocument?id=ECLI:NL:RBZWB:2019:2072&showbutton=true&keyword=mensenhandel,0.0,['Op tegenspraak'],09-05-2019,2019-05-09T14:15:35Z,gepubliceerd,['Strafrecht'],"[{'RelatieOmschrijving': 'Hoger beroep: ', 'LinkTekst': 'ECLI:NL:GHSHE:2021:44', 'Postfix': ', Overig', 'WebAdres': 'https://uitspraken.rechtspraak.nl/inziendocument?id=ECLI:NL:GHSHE:2021:44&showbutton=true&keyword=mensenhandel'}]","36 diefstallen uit (kampeer)auto’s, strooptocht langs de kust, pinopnames met gestolen bankpas, voorhanden hebben vervalste identiteitsbewijzen, schakelbewijs, vrijspraak mensenhandel en deelname criminele organisatie, straftoemeting","Rechtbank Zeeland-West-Brabant, 09-05-2019, 02-700168-18",ECLI:NL:RBZWB:2019:2072,09-05-2019,uitspraak,"[{'Vindplaats': 'Rechtspraak.nl', 'VindplaatsAnnotator': '', 'VindplaatsUrl': ''}]"
ECLI-NL-RBZWB-2019-1352,http://deeplink.rechtspraak.nl/uitspraak?id=ECLI:NL:RBZWB:2019:1352,uitspraak,De publicatie van de uitspraak staat gepland op 03-04-2019 om 10:16 uur,https://uitspraken.rechtspraak.nl/inziendocument?id=ECLI:NL:RBZWB:2019:1352&showbutton=true&keyword=mensenhandel,0.0,['Op tegenspraak'],03-04-2019,2019-04-03T10:16:27Z,gepubliceerd,['Strafrecht'],[],Loverboy. Medeplegen van mensenhandel en uitlokking van ontucht. Geen eendaadse samenloop. Veroordeling. Oplegging onvoorwaardelijke PIJ-maatregel in afwijking van advies deskundigen. Wachtlijstproblematiek. Gebieds- en contactverbod.,"Rechtbank Zeeland-West-Brabant, 02-04-2019, 02-820337-18",ECLI:NL:RBZWB:2019:1352,02-04-2019,uitspraak,"[{'Vindplaats': 'Rechtspraak.nl', 'VindplaatsAnnotator': '', 'VindplaatsUrl': ''}]"
ECLI-NL-RBDHA-2019-1996,http://deeplink.rechtspraak.nl/uitspraak?id=ECLI:NL:RBDHA:2019:1996,uitspraak,De publicatie van de uitspraak staat gepland op 05-04-2019 om 10:10 uur,https://uitspraken.rechtspraak.nl/inziendocument?id=ECLI:NL:RBDHA:2019:1996&showbutton=true&keyword=mensenhandel,0.0,['Eerste aanleg - enkelvoudig'],05-04-2019,2019-04-05T10:10:00Z,gepubliceerd,['Bestuursrecht; Vreemdelingenrecht'],[],"Statushouder Griekenland. Verweerder mag van interstatelijk vertrouwensbeginsel uitgaan. Niet gebleken van bijzondere omstandigheden. Aankomend traject aangifte mensenhandel niet relevant, geen verband met afwijzingsgrond. Beroep ongegrond.","Rechtbank Den Haag, 28-02-2019, NL 19.2561",ECLI:NL:RBDHA:2019:1996,28-02-2019,uitspraak,"[{'Vindplaats': 'Rechtspraak.nl', 'VindplaatsAnnotator': '', 'VindplaatsUrl': ''}]"
ECLI-NL-RBGEL-2018-3530,http://deeplink.rechtspraak.nl/uitspraak?id=ECLI:NL:RBGEL:2018:3530,uitspraak,De publicatie van de uitspraak staat gepland op 13-08-2018 om 14:17 uur,https://uitspraken.rechtspraak.nl/inziendocument?id=ECLI:NL:RBGEL:2018:3530&showbutton=true&keyword=mensenhandel,0.0,['Eerste aanleg - meervoudig'],13-08-2018,2018-08-13T14:17:25Z,gepubliceerd,['Strafrecht'],"[{'RelatieOmschrijving': 'Hoger beroep: ', 'LinkTekst': 'ECLI:NL:GHARL:2019:6411', 'Postfix': ', (Gedeeltelijke) vernietiging en zelf afgedaan', 'WebAdres': 'https://uitspraken.rechtspraak.nl/inziendocument?id=ECLI:NL:GHARL:2019:6411&showbutton=true&keyword=mensenhandel'}]","Veroordeling van een 33-jarige man tot een gevangenisstraf van 7 jaren voor mensenhandel, gepleegd tegen drie vrouwen, wederrechtelijke vrijheidsberoving en overtreding van de Opiumwet.","Rechtbank Gelderland, 13-08-2018, 05/881859-17",ECLI:NL:RBGEL:2018:3530,13-08-2018,uitspraak,"[{'Vindplaats': 'PS-Updates.nl 2018-0646', 'VindplaatsAnnotator': '', 'VindplaatsUrl': ''}, {'Vindplaats': 'Rechtspraak.nl', 'VindplaatsAnnotator': '', 'VindplaatsUrl': ''}]"
ECLI-NL-HR-2017-2648,http://deeplink.rechtspraak.nl/uitspraak?id=ECLI:NL:HR:2017:2648,uitspraak,De publicatie van de uitspraak staat gepland op 18-10-2017 om 10:35 uur,https://uitspraken.rechtspraak.nl/inziendocument?id=ECLI:NL:HR:2017:2648&showbutton=true&keyword=mensenhandel,0.0,"['Artikel 81 RO-zaken', 'Cassatie']",18-10-2017,2017-10-18T10:35:10Z,gepubliceerd,['Strafrecht'],"[{'RelatieOmschrijving': 'Conclusie: ', 'LinkTekst': 'ECLI:NL:PHR:2017:1074', 'Postfix': ', Gevolgd', 'WebAdres': 'https://uitspraken.rechtspraak.nl/inziendocument?id=ECLI:NL:PHR:2017:1074&showbutton=true&keyword=mensenhandel'}, {'RelatieOmschrijving': 'In cassatie op : ', 'LinkTekst': 'ECLI:NL:GHAMS:2016:710', 'Postfix': ', (Gedeeltelijke) vernietiging en zelf afgedaan', 'WebAdres': 'https://uitspraken.rechtspraak.nl/inziendocument?id=ECLI:NL:GHAMS:2016:710&showbutton=true&keyword=mensenhandel'}]","Mensenhandel, art. 273f Sr. HR: art. 81.1 RO. Samenhang met 16/02801; 16/02802; 16/02803 en 17/00192 (niet gepubliceerd, geen middelen).","Hoge Raad, 17-10-2017, 16/00758",ECLI:NL:HR:2017:2648,17-10-2017,uitspraak,"[{'Vindplaats': 'RvdW 2017/1159', 'VindplaatsAnnotator': '', 'VindplaatsUrl': ''}, {'Vindplaats': 'Rechtspraak.nl', 'VindplaatsAnnotator': '', 'VindplaatsUrl': ''}]"
ECLI-NL-HR-2017-2649,http://deeplink.rechtspraak.nl/uitspraak?id=ECLI:NL:HR:2017:2649,uitspraak,De publicatie van de uitspraak staat gepland op 18-10-2017 om 10:37 uur,https://uitspraken.rechtspraak.nl/inziendocument?id=ECLI:NL:HR:2017:2649&showbutton=true&keyword=mensenhandel,0.0,"['Artikel 81 RO-zaken', 'Cassatie']",18-10-2017,2017-10-18T10:37:40Z,gepubliceerd,['Strafrecht'],"[{'RelatieOmschrijving': 'Conclusie: ', 'LinkTekst': 'ECLI:NL:PHR:2017:1075', 'Postfix': ', Gevolgd', 'WebAdres': 'https://uitspraken.rechtspraak.nl/inziendocument?id=ECLI:NL:PHR:2017:1075&showbutton=true&keyword=mensenhandel'}]","Mensenhandel, art. 273f Sr. HR: art. 81.1 RO. Samenhang met 16/00758; 16/02802; 16/02803 en 17/00192 (niet gepubliceerd, geen middelen).","Hoge Raad, 17-10-2017, 16/02801",ECLI:NL:HR:2017:2649,17-10-2017,uitspraak,"[{'Vindplaats': 'RvdW 2017/1162', 'VindplaatsAnnotator': '', 'VindplaatsUrl': ''}, {'Vindplaats': 'Rechtspraak.nl', 'VindplaatsAnnotator': '', 'VindplaatsUrl': ''}]"
ECLI-NL-HR-2017-2650,http://deeplink.rechtspraak.nl/uitspraak?id=ECLI:NL:HR:2017:2650,uitspraak,De publicatie van de uitspraak staat gepland op 18-10-2017 om 10:39 uur,https://uitspraken.rechtspraak.nl/inziendocument?id=ECLI:NL:HR:2017:2650&showbutton=true&keyword=mensenhandel,0.0,"['Artikel 81 RO-zaken', 'Cassatie']",18-10-2017,2017-10-18T10:39:10Z,gepubliceerd,['Strafrecht'],"[{'RelatieOmschrijving': 'Conclusie: ', 'LinkTekst': 'ECLI:NL:PHR:2017:1076', 'Postfix': ', Gevolgd', 'WebAdres': 'https://uitspraken.rechtspraak.nl/inziendocument?id=ECLI:NL:PHR:2017:1076&showbutton=true&keyword=mensenhandel'}]","Mensenhandel, art. 273f Sr. HR: art. 81.1 RO. Samenhang met 16/00758; 16/02801; 16/02803 en 17/00192 (niet gepubliceerd, geen middelen).","Hoge Raad, 17-10-2017, 16/02802",ECLI:NL:HR:2017:2650,17-10-2017,uitspraak,"[{'Vindplaats': 'RvdW 2017/1163', 'VindplaatsAnnotator': '', 'VindplaatsUrl': ''}, {'Vindplaats': 'Rechtspraak.nl', 'VindplaatsAnnotator': '', 'VindplaatsUrl': ''}]"
ECLI-NL-HR-2017-2651,http://deeplink.rechtspraak.nl/uitspraak?id=ECLI:NL:HR:2017:2651,uitspraak,De publicatie van de uitspraak staat gepland op 18-10-2017 om 10:41 uur,https://uitspraken.rechtspraak.nl/inziendocument?id=ECLI:NL:HR:2017:2651&showbutton=true&keyword=mensenhandel,0.0,"['Artikel 81 RO-zaken', 'Cassatie']",18-10-2017,2017-10-18T10:41:10Z,gepubliceerd,['Strafrecht'],"[{'RelatieOmschrijving': 'Conclusie: ', 'LinkTekst': 'ECLI:NL:PHR:2017:1077', 'Postfix': ', Gevolgd', 'WebAdres': 'https://uitspraken.rechtspraak.nl/inziendocument?id=ECLI:NL:PHR:2017:1077&showbutton=true&keyword=mensenhandel'}]","Mensenhandel, art. 273f Sr. HR: art. 81.1 RO. Samenhang met 16/00758; 16/02801; 16/02802 en 17/00192 (niet gepubliceerd, geen middelen).","Hoge Raad, 17-10-2017, 16/02803",ECLI:NL:HR:2017:2651,17-10-2017,uitspraak,"[{'Vindplaats': 'RvdW 2017/1164', 'VindplaatsAnnotator': '', 'VindplaatsUrl': ''}, {'Vindplaats': 'Rechtspraak.nl', 'VindplaatsAnnotator': '', 'VindplaatsUrl': ''}]"
ECLI-NL-PHR-2017-1074,http://deeplink.rechtspraak.nl/uitspraak?id=ECLI:NL:PHR:2017:1074,conclusie,De publicatie van de uitspraak staat gepland op 18-10-2017 om 10:48 uur,https://uitspraken.rechtspraak.nl/inziendocument?id=ECLI:NL:PHR:2017:1074&showbutton=true&keyword=mensenhandel,0.0,[],18-10-2017,2017-10-18T10:48:40Z,gepubliceerd,['Strafrecht'],"[{'RelatieOmschrijving': 'Arrest Hoge Raad: ', 'LinkTekst': 'ECLI:NL:HR:2017:2648', 'Postfix': ', Gevolgd', 'WebAdres': 'https://uitspraken.rechtspraak.nl/inziendocument?id=ECLI:NL:HR:2017:2648&showbutton=true&keyword=mensenhandel'}]","Mensenhandel, art. 273f Sr. HR: art. 81.1 RO. Samenhang met 16/02801; 16/02802; 16/02803 en 17/00192 (niet gepubliceerd, geen middelen).","Parket bij de Hoge Raad, 05-09-2017, 16/00758",ECLI:NL:PHR:2017:1074,05-09-2017,conclusie,"[{'Vindplaats': 'Rechtspraak.nl', 'VindplaatsAnnotator': '', 'VindplaatsUrl': ''}]"
ECLI-NL-PHR-2017-1075,http://deeplink.rechtspraak.nl/uitspraak?id=ECLI:NL:PHR:2017:1075,conclusie,De publicatie van de uitspraak staat gepland op 18-10-2017 om 10:48 uur,https://uitspraken.rechtspraak.nl/inziendocument?id=ECLI:NL:PHR:2017:1075&showbutton=true&keyword=mensenhandel,0.0,[],18-10-2017,2017-10-18T10:48:40Z,gepubliceerd,['Strafrecht'],"[{'RelatieOmschrijving': 'Arrest Hoge Raad: ', 'LinkTekst': 'ECLI:NL:HR:2017:2649', 'Postfix': ', Gevolgd', 'WebAdres': 'https://uitspraken.rechtspraak.nl/inziendocument?id=ECLI:NL:HR:2017:2649&showbutton=true&keyword=mensenhandel'}]","Mensenhandel, art. 273f Sr. HR: art. 81.1 RO. Samenhang met 16/00758; 16/02802; 16/02803 en 17/00192 (niet gepubliceerd, geen middelen).","Parket bij de Hoge Raad, 05-09-2017, 16/02801",ECLI:NL:PHR:2017:1075,05-09-2017,conclusie,"[{'Vindplaats': 'Rechtspraak.nl', 'VindplaatsAnnotator': '', 'VindplaatsUrl': ''}]"
ECLI-NL-PHR-2017-1076,http://deeplink.rechtspraak.nl/uitspraak?id=ECLI:NL:PHR:2017:1076,conclusie,De publicatie van de uitspraak staat gepland op 18-10-2017 om 10:48 uur,https://uitspraken.rechtspraak.nl/inziendocument?id=ECLI:NL:PHR:2017:1076&showbutton=true&keyword=mensenhandel,0.0,[],18-10-2017,2017-10-18T10:48:10Z,gepubliceerd,['Strafrecht'],"[{'RelatieOmschrijving': 'Arrest Hoge Raad: ', 'LinkTekst': 'ECLI:NL:HR:2017:2650', 'Postfix': ', Gevolgd', 'WebAdres': 'https://uitspraken.rechtspraak.nl/inziendocument?id=ECLI:NL:HR:2017:2650&showbutton=true&keyword=mensenhandel'}]","Mensenhandel, art. 273f Sr. HR: art. 81.1 RO. Samenhang met 16/00758; 16/02801; 16/02803 en 17/00192 (niet gepubliceerd, geen middelen).","Parket bij de Hoge Raad, 05-09-2017, 16/02802",ECLI:NL:PHR:2017:1076,05-09-2017,conclusie,"[{'Vindplaats': 'Rechtspraak.nl', 'VindplaatsAnnotator': '', 'VindplaatsUrl': ''}]"
ECLI-NL-PHR-2017-1077,http://deeplink.rechtspraak.nl/uitspraak?id=ECLI:NL:PHR:2017:1077,conclusie,De publicatie van de uitspraak staat gepland op 18-10-2017 om 10:47 uur,https://uitspraken.rechtspraak.nl/inziendocument?id=ECLI:NL:PHR:2017:1077&showbutton=true&keyword=mensenhandel,0.0,[],18-10-2017,2017-10-18T10:47:40Z,gepubliceerd,['Strafrecht'],"[{'RelatieOmschrijving': 'Arrest Hoge Raad: ', 'LinkTekst': 'ECLI:NL:HR:2017:2651', 'Postfix': ', Gevolgd', 'WebAdres': 'https://uitspraken.rechtspraak.nl/inziendocument?id=ECLI:NL:HR:2017:2651&showbutton=true&keyword=mensenhandel'}]","Mensenhandel, art. 273f Sr. HR: art. 81.1 RO. Samenhang met 16/00758; 16/02801; 16/02802 en 17/00192 (niet gepubliceerd, geen middelen).","Parket bij de Hoge Raad, 05-09-2017, 16/02803",ECLI:NL:PHR:2017:1077,05-09-2017,conclusie,"[{'Vindplaats': 'Rechtspraak.nl', 'VindplaatsAnnotator': '', 'VindplaatsUrl': ''}]"
ECLI-NL-RBOBR-2015-3559,http://deeplink.rechtspraak.nl/uitspraak?id=ECLI:NL:RBOBR:2015:3559,uitspraak,De publicatie van de uitspraak staat gepland op 22-06-2015 om 15:27 uur,https://uitspraken.rechtspraak.nl/inziendocument?id=ECLI:NL:RBOBR:2015:3559&showbutton=true&keyword=mensenhandel,0.0,['Eerste aanleg - meervoudig'],22-06-2015,2015-06-22T15:27:47Z,gepubliceerd,['Strafrecht'],[],"Veroordeling voor mensenhandel en bedreiging.
Opgelegd wordt een gevangenisstraf voor de duur van 12 maanden met aftrek van voorarrest en TBS met voorwaarden (2 jaar).","Rechtbank Oost-Brabant, 22-06-2015, 01/865092-14 en 01/845491-14 (ter terechtzitting gevoegd) ",ECLI:NL:RBOBR:2015:3559,22-06-2015,uitspraak,"[{'Vindplaats': 'Rechtspraak.nl', 'VindplaatsAnnotator': '', 'VindplaatsUrl': ''}]"
ECLI-NL-GHARL-2014-2644,http://deeplink.rechtspraak.nl/uitspraak?id=ECLI:NL:GHARL:2014:2644,uitspraak,De publicatie van de uitspraak staat gepland op 04-04-2014 om 15:06 uur,https://uitspraken.rechtspraak.nl/inziendocument?id=ECLI:NL:GHARL:2014:2644&showbutton=true&keyword=mensenhandel,0.0,['Hoger beroep'],04-04-2014,2014-04-04T15:06:02Z,gepubliceerd,['Strafrecht'],"[{'RelatieOmschrijving': 'Eerste aanleg: ', 'LinkTekst': 'ECLI:NL:RBMNE:2013:2014', 'Postfix': ', Meerdere afhandelingswijzen', 'WebAdres': 'https://uitspraken.rechtspraak.nl/inziendocument?id=ECLI:NL:RBMNE:2013:2014&showbutton=true&keyword=mensenhandel'}]","Hof spreekt verdachte (op één onderdeel na, te weten sub 3) vrij van mensenhandel ten aanzien van drie vrouwen wegens gebrek aan voldoende ondersteunend bewijsmateriaal.","Gerechtshof Arnhem-Leeuwarden, 04-04-2014, 21-004720-13",ECLI:NL:GHARL:2014:2644,04-04-2014,uitspraak,"[{'Vindplaats': 'Rechtspraak.nl', 'VindplaatsAnnotator': '', 'VindplaatsUrl': ''}]"
ECLI-NL-RBGRO-2007-BB7190,http://deeplink.rechtspraak.nl/uitspraak?id=ECLI:NL:RBGRO:2007:BB7190,uitspraak,De publicatie van de uitspraak staat gepland op 06-11-2007 om 13:19 uur,https://uitspraken.rechtspraak.nl/inziendocument?id=ECLI:NL:RBGRO:2007:BB7190&showbutton=true&keyword=mensenhandel,0.0,['Eerste aanleg - meervoudig'],06-11-2007,2007-11-06T13:19:55Z,gepubliceerd,['Strafrecht'],[],Veroordeling wegens medeplegen van mensenhandel. Ontvankelijkheid O.M.; bewijs medeplegen; groot aantal slachtoffers; lange periode; overschrijding redelijke termijn; strafoplegging 17maanden gevangenisstraf waarvan 3  voorwaardelijk.,"Rechtbank Groningen, 06-11-2007, 18/070552-03 en 18/655491-06",ECLI:NL:RBGRO:2007:BB7190,06-11-2007,uitspraak,"[{'Vindplaats': 'Rechtspraak.nl', 'VindplaatsAnnotator': '', 'VindplaatsUrl': ''}]"
ECLI-NL-GHDHA-2015-1396,http://deeplink.rechtspraak.nl/uitspraak?id=ECLI:NL:GHDHA:2015:1396,uitspraak,De publicatie van de uitspraak staat gepland op 05-06-2015 om 10:45 uur,https://uitspraken.rechtspraak.nl/inziendocument?id=ECLI:NL:GHDHA:2015:1396&showbutton=true&keyword=mensenhandel,0.0,['Hoger beroep'],05-06-2015,2015-06-05T10:45:15Z,gepubliceerd,['Strafrecht'],[],"De verdachte heeft zich samen met een ander schuldig gemaakt aan mensenhandel.
Bij het bepalen van de op te leggen straf heeft het hof aansluiting gezocht bij de “Richtlijn voor strafvordering mensenhandel in de zin van seksuele uitbuiting” van het openbaar ministerie.
Het hof veroordeelt de verdachte tot een gevangenisstraf voor de duur van 16 (zestien) maanden, met aftrek van voorarrest, waarvan 5 (vijf) maanden voorwaardelijk met een proeftijd van twee jaren.","Gerechtshof Den Haag, 29-04-2015, 2200327612",ECLI:NL:GHDHA:2015:1396,29-04-2015,uitspraak,"[{'Vindplaats': 'Rechtspraak.nl', 'VindplaatsAnnotator': '', 'VindplaatsUrl': ''}]"
ECLI-NL-RBAMS-2013-CA3400,http://deeplink.rechtspraak.nl/uitspraak?id=ECLI:NL:RBAMS:2013:CA3400,uitspraak,De publicatie van de uitspraak staat gepland op 20-06-2013 om 09:46 uur,https://uitspraken.rechtspraak.nl/inziendocument?id=ECLI:NL:RBAMS:2013:CA3400&showbutton=true&keyword=mensenhandel,0.0,['Eerste aanleg - meervoudig'],20-06-2013,2013-06-20T09:46:04Z,gepubliceerd,['Strafrecht'],"[{'RelatieOmschrijving': 'Hoger beroep: ', 'LinkTekst': 'ECLI:NL:GHAMS:2015:5189', 'Postfix': None, 'WebAdres': 'https://uitspraken.rechtspraak.nl/inziendocument?id=ECLI:NL:GHAMS:2015:5189&showbutton=true&keyword=mensenhandel'}]","De rechtbank heeft verdachte veroordeeld tot een gevangenisstraf van vijf jaar met aftrek wegens gijzeling, het opzettelijk beïnvloeden van een persoon om naar waarheid een verklaring af te leggen, medeplichtigheid aan mensenhandel, onttrekking van een vijftienjarig meisje aan het wettig gezag en mensenhandel jegens een persoon beneden de achttien jaar. De rechtbank acht de bewezen verklaarde feiten zo ernstig dat zij een hogere straf heeft opgelegd dan de officier van justitie heeft geëist.","Rechtbank Amsterdam, 17-06-2013, 13/708143-11",ECLI:NL:RBAMS:2013:CA3400,17-06-2013,uitspraak,"[{'Vindplaats': 'Rechtspraak.nl', 'VindplaatsAnnotator': '', 'VindplaatsUrl': ''}]"
ECLI-NL-RBNNE-2018-1598,http://deeplink.rechtspraak.nl/uitspraak?id=ECLI:NL:RBNNE:2018:1598,uitspraak,De publicatie van de uitspraak staat gepland op 01-05-2018 om 15:57 uur,https://uitspraken.rechtspraak.nl/inziendocument?id=ECLI:NL:RBNNE:2018:1598&showbutton=true&keyword=mensenhandel,0.0,"['Eerste aanleg - meervoudig', 'Op tegenspraak']",01-05-2018,2018-05-01T15:57:08Z,gepubliceerd,['Strafrecht'],[],"Veroordeling voor mensenhandel tot een deels voorwaardelijke gevangenisstraf.
Verdachte heeft zich meermalen schuldig gemaakt aan mensenhandel. De slachtoffers, twee jonge Bulgaarse vrouwen, zijn door verdachte dusdanig onder druk gezet dat zij hun werkzaamheden in de prostitutie, die zij aanvankelijk op vrijwillige basis (zouden gaan) verrich(t)ten, voor hem gingen uitvoeren, waarbij zij hun verdiensten onder druk en dwang aan hem moesten afstaan.
Verder heeft verdachte zich ten aanzien van één van deze slachtoffers en twee andere slachtoffers samen met een ander tevens schuldig gemaakt aan mensenhandel (sub 3). De slachtoffers, wederom jonge Bulgaarse vrouwen, zijn door verdachte en zijn mededader naar Nederland gebracht, met het doel hen in Nederland prostitutiewerkzaamheden te laten verrichten, wetende dat zij zich in een uitbuitingssituatie bevonden.","Rechtbank Noord-Nederland, 26-04-2018, 18/730153-15",ECLI:NL:RBNNE:2018:1598,26-04-2018,uitspraak,"[{'Vindplaats': 'Rechtspraak.nl', 'VindplaatsAnnotator': '', 'VindplaatsUrl': ''}]"
ECLI-NL-RBLIM-2015-1269,http://deeplink.rechtspraak.nl/uitspraak?id=ECLI:NL:RBLIM:2015:1269,uitspraak,De publicatie van de uitspraak staat gepland op 17-02-2015 om 08:57 uur,https://uitspraken.rechtspraak.nl/inziendocument?id=ECLI:NL:RBLIM:2015:1269&showbutton=true&keyword=mensenhandel,0.0,['Eerste aanleg - meervoudig'],17-02-2015,2015-02-17T08:57:55Z,gepubliceerd,['Strafrecht'],[],"De rechtbank heeft een 60-jarige Duitse eigenares van een escortbedrijf vrijgesproken van mensenhandel. De vrouw bemiddelde tussen volwassen, Duitse prostituees en Nederlandse en Duitse klanten. De vrouw zorgde er onder meer voor dat een chauffeur de prostituee in Duitsland thuis ophaalde, dat deze de prostituee in Nederland naar de klant bracht, daar op haar wachtte en haar vervolgens weer naar huis bracht. Deze grensoverschrijding wordt gewoonlijk als mensenhandel beschouwd en de rechtbank veroordeelde eerder een van de chauffeurs tot gevangenisstraf. Inmiddels heeft het gerechtshof in ’s-Hertogenbosch geoordeeld dat als door het werk van de verdachte geen bijdrage wordt geleverd aan beknotting van de vrijheid van de prostituee, niet van mensenhandel kan worden gesproken. De rechtbank volgt nu deze lijn van het gerechtshof.","Rechtbank Limburg, 03-02-2015, 04/800315-11",ECLI:NL:RBLIM:2015:1269,03-02-2015,uitspraak,"[{'Vindplaats': 'Rechtspraak.nl', 'VindplaatsAnnotator': '', 'VindplaatsUrl': ''}]"
ECLI-NL-RBSGR-2006-AY8026,http://deeplink.rechtspraak.nl/uitspraak?id=ECLI:NL:RBSGR:2006:AY8026,uitspraak,De publicatie van de uitspraak staat gepland op 15-09-2006 om 13:33 uur,https://uitspraken.rechtspraak.nl/inziendocument?id=ECLI:NL:RBSGR:2006:AY8026&showbutton=true&keyword=mensenhandel,0.0,"['Bodemzaak', 'Eerste aanleg - enkelvoudig', 'Schadevergoedingsuitspraak']",15-09-2006,2006-09-15T13:33:57Z,gepubliceerd,['Bestuursrecht; Vreemdelingenrecht'],[],"Bewaring / slachtoffer mensenhandel / B9-regeling.
Eiseres heeft aangevoerd dat zij op grond van het beleid van verweerder zoals verwoord in de Vc 2000 (binnen 24 uur na aangifte van mensenhandel behoort daarop te worden beslist) eerder een B9-status had moeten krijgen omdat zij reeds op 26 juli 2006 aangifte heeft gedaan van mensenhandel. De rechtbank overweegt dat uit de processtukken blijkt dat verweerder eiseres geen B9-status heeft verleend maar dat eiseres is vrijgelaten omdat zij tegen verweerders weigering beklag heeft ingediend. Mitsdien kan niet worden volgehouden dat haar al op 27 juli 2006 de B9-status had moeten worden verleend en dat mitsdien haar bewaring ook per die datum had behoren te worden opgeheven. Beroep ongegrond, afwijzing verzoek om schadevergoeding.","Rechtbank 's-Gravenhage, 18-08-2006, AWB 06/36725",ECLI:NL:RBSGR:2006:AY8026,18-08-2006,uitspraak,"[{'Vindplaats': 'Rechtspraak.nl', 'VindplaatsAnnotator': '', 'VindplaatsUrl': ''}]"
ECLI-NL-RBMNE-2013-CA2738,http://deeplink.rechtspraak.nl/uitspraak?id=ECLI:NL:RBMNE:2013:CA2738,uitspraak,De publicatie van de uitspraak staat gepland op 11-06-2013 om 14:57 uur,https://uitspraken.rechtspraak.nl/inziendocument?id=ECLI:NL:RBMNE:2013:CA2738&showbutton=true&keyword=mensenhandel,0.0,['Eerste aanleg - enkelvoudig'],11-06-2013,2013-06-11T14:57:44Z,gepubliceerd,['Bestuursrecht'],[],"De exploitatievergunning voor de seksinrichting van verzoekster is ingetrokken, vanwege aanwijzingen van mensenhandel. Verweerder mag afgaan op proces-verbaal van politie. In dit geval bestond dat uit een bestuurlijke rapportage. Uit die rapportage kwamen aanwijzingen naar voren van mensenhandel bij een stichting, waar verzoekster haar beheer had ondergebracht en bij andere exploitanten waar de vennoot van verzoekster beheerder was. Uit de APV blijkt dat het tegengaan van mensenhandel binnen de seksinrichting een essentieel onderdeel vormt van het door de exploitant uit te voeren toezicht op de seksinrichting. Het is de eigen verantwoordelijkheid van een exploitant om er op toe te zien dat de regels worden nageleefd. Dat de exploitanten ervoor hebben gekozen om toezicht deels uit te besteden aan een stichting, ontslaat hen niet van deze verplichting. Zij zijn verder vanwege het beheerderschap ook verantwoordelijk voor wat er in de andere seksinrichtingen gebeurt. Het feit dat bij de stichting en bij de andere exploitanten aanwijzingen waren van mensenhandel kan verzoekster dan ook ten volle worden aangerekend. De gemeente Utrecht heeft de vergunning kunnen intrekken.","Rechtbank Midden-Nederland, 11-06-2013, UTR 13/2656",ECLI:NL:RBMNE:2013:CA2738,11-06-2013,uitspraak,"[{'Vindplaats': 'Rechtspraak.nl', 'VindplaatsAnnotator': '', 'VindplaatsUrl': ''}]"
ECLI-NL-RBHAA-2011-BR2782,http://deeplink.rechtspraak.nl/uitspraak?id=ECLI:NL:RBHAA:2011:BR2782,uitspraak,De publicatie van de uitspraak staat gepland op 22-07-2011 om 16:28 uur,https://uitspraken.rechtspraak.nl/inziendocument?id=ECLI:NL:RBHAA:2011:BR2782&showbutton=true&keyword=mensenhandel,0.0,['Eerste aanleg - meervoudig'],22-07-2011,2011-07-22T16:28:38Z,gepubliceerd,['Strafrecht'],[],"Onderzoek Maas: Onderzoek gericht op mensenhandel (loverboy praktijken) in Purmerend.
De rechtbank heeft bewezen verklaard dat verdachte zich heeft schuldig gemaakt aan mensenhandel. Verdachte wordt veroordeeld tot een gevangenisstraf voor de duur van twee jaren en zes maanden.
Verwerping verweer dat in strijd is gehandeld met de Aanwijzing mensenhandel.
Bewijsoverwegingen, waarbij aandacht wordt besteed aan het toetsingskader bij mensenhandel (artikel 273f van het Wetboek van Strafrecht) en de betrouwbaarheid en de geloofwaardigheid van (de verklaringen van) het slachtoffer in deze zaak.
Strafmotivering: “Verdachte lijkt de vrouw enkel te zien als een object, waarmee veel geld kon worden verdiend. Tekenend in dat verband acht de rechtbank dat verdachte op zijn hand een tatoeage heeft met de letters “mob” hetgeen naar de rechtbank begrijpt, betekent “money over bitches”. Verdachte heeft zich bij de bewezen verklaarde feiten kennelijk puur laten leiden door het oogmerk van snel en eenvoudig financieel gewin ten koste van een ander. De rechtbank neemt hem dit zeer kwalijk.”
Beslissing op de vordering van de benadeelde partij.","Rechtbank Haarlem, 21-07-2011, 15/741374-10",ECLI:NL:RBHAA:2011:BR2782,21-07-2011,uitspraak,"[{'Vindplaats': 'Rechtspraak.nl', 'VindplaatsAnnotator': '', 'VindplaatsUrl': ''}]"
ECLI-NL-RBHAA-2004-AQ5790,http://deeplink.rechtspraak.nl/uitspraak?id=ECLI:NL:RBHAA:2004:AQ5790,uitspraak,De publicatie van de uitspraak staat gepland op 28-07-2004 om 13:20 uur,https://uitspraken.rechtspraak.nl/inziendocument?id=ECLI:NL:RBHAA:2004:AQ5790&showbutton=true&keyword=mensenhandel,0.0,['Eerste aanleg - meervoudig'],28-07-2004,2004-07-28T13:20:39Z,gepubliceerd,['Bestuursrecht'],[],"De rechtbank is, anders dan verweerder, met eiseres van oordeel dat in dit geval, gelet op de specifieke regeling van de hier aan de orde zijnde verblijfsvergunning, aan het relativiteitsvereiste is voldaan. De onderhavige voor mensenhandel opgestelde regeling als is vastgelegd in hoofdstuk B9 van de Vreemdelingencirculaire 2000 (hierna: circulaire), beoogt specifieke belangen van de vreemdeling die slachtoffer is van mensenhandel, te beschermen. Deze belangen zijn gelegen in het bieden van opvang en bescherming van de slachtoffers van mensenhandel gedurende onder meer de periode van opsporing, vervolging en berechting in feitelijk aanleg na aangifte van mensenhandel. Onder opvang en bescherming verstaat verweerder, blijkens de circulaire, tevens de kosten van levensonderhoud en medische hulp en bijstand. Bovendien heeft de minister van Sociale Zaken en Werkgelegenheid mede namens de staatssecretaris van Justitie bij de beantwoording van kamervragen (vergaderjaar 1995-1996, nr. 447) inzake slachtoffers van vrouwenhandel het volgende aangegeven:
[........]
Gelet op de aldus omschreven specifieke bescherming die is beoogd slachtoffers van mensenhandel te bieden, valt niet in te zien dat de in dit geval geschonden norm niet mede strekt tot bescherming tegen de schade, die eiseres stelt te hebben geleden, te weten aanspraak met terugwerkende kracht op een uitkering krachtens de Algemene bijstandswet, alsmede vergoeding van door haar gemaakte ziektekosten. De desbetreffende grief van eiseres treft derhalve doel.","Rechtbank Haarlem, 19-07-2004, 03-1770",ECLI:NL:RBHAA:2004:AQ5790,19-07-2004,uitspraak,"[{'Vindplaats': 'Rechtspraak.nl', 'VindplaatsAnnotator': '', 'VindplaatsUrl': ''}]"
ECLI-NL-RBDHA-2020-709,http://deeplink.rechtspraak.nl/uitspraak?id=ECLI:NL:RBDHA:2020:709,uitspraak,De publicatie van de uitspraak staat gepland op 03-02-2020 om 11:50 uur,https://uitspraken.rechtspraak.nl/inziendocument?id=ECLI:NL:RBDHA:2020:709&showbutton=true&keyword=mensenhandel,0.0,"['Bodemzaak', 'Eerste aanleg - enkelvoudig']",03-02-2020,2020-02-03T11:50:40Z,gepubliceerd,['Bestuursrecht; Vreemdelingenrecht'],[],Intrekking verblijfsvergunning regulier vanwege aangifte mensenhandel. Ontvankelijkheid gelet op bezit asielvergunning. Bekendmaking van de sepotbeslissing. Relevantie van een mogelijke klachtprocedure ex art. 12 Sv. Beroep ongegrond.,"Rechtbank Den Haag, 23-01-2020, AWB 18 / 8200",ECLI:NL:RBDHA:2020:709,23-01-2020,uitspraak,"[{'Vindplaats': 'Rechtspraak.nl', 'VindplaatsAnnotator': '', 'VindplaatsUrl': ''}]"
ECLI-NL-GHARL-2019-11296,http://deeplink.rechtspraak.nl/uitspraak?id=ECLI:NL:GHARL:2019:11296,uitspraak,De publicatie van de uitspraak staat gepland op 30-01-2020 om 13:01 uur,https://uitspraken.rechtspraak.nl/inziendocument?id=ECLI:NL:GHARL:2019:11296&showbutton=true&keyword=mensenhandel,0.0,['Hoger beroep'],30-01-2020,2020-01-30T13:01:04Z,gepubliceerd,['Strafrecht'],[],Deelvrijspraken ten aanzien van de tenlastegelegde mensenhandel. Veroordeling wegens mishandeling en verkrachting (ex-)partners. Oplegging gevangenisstraf van acht jaren. Geen oplegging van de maatregel van terbeschikkingstelling.,"Gerechtshof Arnhem-Leeuwarden, 07-06-2019, 21-005549-17",ECLI:NL:GHARL:2019:11296,07-06-2019,uitspraak,"[{'Vindplaats': 'Rechtspraak.nl', 'VindplaatsAnnotator': '', 'VindplaatsUrl': ''}]"
ECLI-NL-RBROT-2015-4092,http://deeplink.rechtspraak.nl/uitspraak?id=ECLI:NL:RBROT:2015:4092,uitspraak,De publicatie van de uitspraak staat gepland op 12-06-2015 om 14:21 uur,https://uitspraken.rechtspraak.nl/inziendocument?id=ECLI:NL:RBROT:2015:4092&showbutton=true&keyword=mensenhandel,0.0,['Eerste aanleg - meervoudig'],12-06-2015,2015-06-12T14:21:21Z,gepubliceerd,['Strafrecht'],[],Verdachte schuldig aan mensenhandel in vereniging. Gelet op de beperkte duur wordt de verdachte veroordeeld tot een voorwaardelijke gevangenisstraf en een taakstraf voor de maximale duur.,"Rechtbank Rotterdam, 12-06-2015, 10/750141-14",ECLI:NL:RBROT:2015:4092,12-06-2015,uitspraak,"[{'Vindplaats': 'Rechtspraak.nl', 'VindplaatsAnnotator': '', 'VindplaatsUrl': ''}]"
ECLI-NL-RBAMS-2013-BZ9115,http://deeplink.rechtspraak.nl/uitspraak?id=ECLI:NL:RBAMS:2013:BZ9115,uitspraak,De publicatie van de uitspraak staat gepland op 01-05-2013 om 11:05 uur,https://uitspraken.rechtspraak.nl/inziendocument?id=ECLI:NL:RBAMS:2013:BZ9115&showbutton=true&keyword=mensenhandel,0.0,['Eerste aanleg - meervoudig'],01-05-2013,2013-05-01T11:05:24Z,gepubliceerd,['Strafrecht'],[],De rechtbank acht bewezen dat er sprake is van een voortgezette handeling van mensenhandel door twee of meer verenigde personen. De rechtbank acht verdachte hiervoor strafbaar.,"Rechtbank Amsterdam, 18-03-2013, 13/845013-10 (Promis)",ECLI:NL:RBAMS:2013:BZ9115,18-03-2013,uitspraak,"[{'Vindplaats': 'Rechtspraak.nl', 'VindplaatsAnnotator': '', 'VindplaatsUrl': ''}]"
ECLI-NL-RBAMS-2013-BZ9117,http://deeplink.rechtspraak.nl/uitspraak?id=ECLI:NL:RBAMS:2013:BZ9117,uitspraak,De publicatie van de uitspraak staat gepland op 01-05-2013 om 11:09 uur,https://uitspraken.rechtspraak.nl/inziendocument?id=ECLI:NL:RBAMS:2013:BZ9117&showbutton=true&keyword=mensenhandel,0.0,['Eerste aanleg - meervoudig'],01-05-2013,2013-05-01T11:09:12Z,gepubliceerd,['Strafrecht'],[],De rechtbank acht bewezen dat er sprake is van een voortgezette handeling van mensenhandel door twee of meer verenigde personen. De rechtbank acht verdachte hiervoor strafbaar.,"Rechtbank Amsterdam, 18-03-2013, 13/845012-10 (Promis)",ECLI:NL:RBAMS:2013:BZ9117,18-03-2013,uitspraak,"[{'Vindplaats': 'Rechtspraak.nl', 'VindplaatsAnnotator': '', 'VindplaatsUrl': ''}]"
ECLI-NL-RBZLY-2010-BO7662,http://deeplink.rechtspraak.nl/uitspraak?id=ECLI:NL:RBZLY:2010:BO7662,uitspraak,De publicatie van de uitspraak staat gepland op 03-01-2011 om 15:12 uur,https://uitspraken.rechtspraak.nl/inziendocument?id=ECLI:NL:RBZLY:2010:BO7662&showbutton=true&keyword=mensenhandel,0.0,['Eerste aanleg - meervoudig'],03-01-2011,2011-01-03T15:12:55Z,gepubliceerd,['Strafrecht'],"[{'RelatieOmschrijving': 'Hoger beroep: ', 'LinkTekst': 'ECLI:NL:GHARN:2012:BV0005', 'Postfix': ', (Gedeeltelijke) vernietiging en zelf afgedaan', 'WebAdres': 'https://uitspraken.rechtspraak.nl/inziendocument?id=ECLI:NL:GHARN:2012:BV0005&showbutton=true&keyword=mensenhandel'}]",Het aanzetten van het slachtoffer tot prostitutie na en tijdens de relatie met verdachte levert ingevolge artikel 273a van het Wetboek van Strafrecht mensenhandel op.,"Rechtbank Zwolle-Lelystad, 10-12-2010, 07.660045-10",ECLI:NL:RBZLY:2010:BO7662,10-12-2010,uitspraak,"[{'Vindplaats': 'Rechtspraak.nl', 'VindplaatsAnnotator': '', 'VindplaatsUrl': ''}]"
ECLI-NL-RBZLY-2010-BO9639,http://deeplink.rechtspraak.nl/uitspraak?id=ECLI:NL:RBZLY:2010:BO9639,uitspraak,De publicatie van de uitspraak staat gepland op 03-01-2011 om 16:31 uur,https://uitspraken.rechtspraak.nl/inziendocument?id=ECLI:NL:RBZLY:2010:BO9639&showbutton=true&keyword=mensenhandel,0.0,['Eerste aanleg - meervoudig'],03-01-2011,2011-01-03T16:31:52Z,gepubliceerd,['Strafrecht'],[],Het aanzetten van het slachtoffer tot prostiutie na en tijdens de relatie met verdachte levert ingevolge artikel 273a van het Wetboek van Strafrecht mensenhandel op.,"Rechtbank Zwolle-Lelystad, 10-12-2010, 07.620272-09",ECLI:NL:RBZLY:2010:BO9639,10-12-2010,uitspraak,"[{'Vindplaats': 'Rechtspraak.nl', 'VindplaatsAnnotator': '', 'VindplaatsUrl': ''}]"
ECLI-NL-GHARL-2021-6398,http://deeplink.rechtspraak.nl/uitspraak?id=ECLI:NL:GHARL:2021:6398,uitspraak,De publicatie van de uitspraak staat gepland op 30-06-2021 om 15:13 uur,https://uitspraken.rechtspraak.nl/inziendocument?id=ECLI:NL:GHARL:2021:6398&showbutton=true&keyword=mensenhandel,0.0,['Hoger beroep'],30-06-2021,2021-06-30T15:13:48Z,gepubliceerd,['Strafrecht'],"[{'RelatieOmschrijving': 'Eerste aanleg: ', 'LinkTekst': 'ECLI:NL:RBNNE:2018:5199', 'Postfix': None, 'WebAdres': 'https://uitspraken.rechtspraak.nl/inziendocument?id=ECLI:NL:RBNNE:2018:5199&showbutton=true&keyword=mensenhandel'}]","Onderzoek IJsland. Veroordeling wegens het verkopen van hennep, verboden wapenbezit, beïnvloeding van getuigen en mensenhandel tot een gevangenisstraf voor de duur van 23 maanden. Schending redelijke termijn.","Gerechtshof Arnhem-Leeuwarden, 30-06-2021, 21-000036-19",ECLI:NL:GHARL:2021:6398,30-06-2021,uitspraak,"[{'Vindplaats': 'Rechtspraak.nl', 'VindplaatsAnnotator': '', 'VindplaatsUrl': ''}]"
ECLI-NL-GHAMS-2021-1867,http://deeplink.rechtspraak.nl/uitspraak?id=ECLI:NL:GHAMS:2021:1867,uitspraak,De publicatie van de uitspraak staat gepland op 02-07-2021 om 10:07 uur,https://uitspraken.rechtspraak.nl/inziendocument?id=ECLI:NL:GHAMS:2021:1867&showbutton=true&keyword=mensenhandel,0.0,['Hoger beroep'],02-07-2021,2021-07-02T10:07:09Z,gepubliceerd,['Strafrecht'],[],"Mensenhandel. Art. 273f Sr. Uitbuiting minderjarige kinderen door familieleden, door hen te laten stelen en hen te gebruiken bij pogingen tot diefstal d.m.v. wisseltruc.","Gerechtshof Amsterdam, 28-06-2021, 23-002598-19",ECLI:NL:GHAMS:2021:1867,28-06-2021,uitspraak,"[{'Vindplaats': 'Rechtspraak.nl', 'VindplaatsAnnotator': '', 'VindplaatsUrl': ''}]"
ECLI-NL-GHAMS-2021-1868,http://deeplink.rechtspraak.nl/uitspraak?id=ECLI:NL:GHAMS:2021:1868,uitspraak,De publicatie van de uitspraak staat gepland op 02-07-2021 om 12:44 uur,https://uitspraken.rechtspraak.nl/inziendocument?id=ECLI:NL:GHAMS:2021:1868&showbutton=true&keyword=mensenhandel,0.0,['Hoger beroep'],02-07-2021,2021-07-02T12:44:26Z,gepubliceerd,['Strafrecht'],[],"Mensenhandel. Art. 273f Sr. Uitbuiting minderjarige kinderen door familieleden, door hen te laten stelen en hen te gebruiken bij pogingen tot diefstal d.m.v. wisseltruc.","Gerechtshof Amsterdam, 28-06-2021, 23-002600-19",ECLI:NL:GHAMS:2021:1868,28-06-2021,uitspraak,"[{'Vindplaats': 'Rechtspraak.nl', 'VindplaatsAnnotator': '', 'VindplaatsUrl': ''}]"
ECLI-NL-GHAMS-2021-1870,http://deeplink.rechtspraak.nl/uitspraak?id=ECLI:NL:GHAMS:2021:1870,uitspraak,De publicatie van de uitspraak staat gepland op 02-07-2021 om 13:07 uur,https://uitspraken.rechtspraak.nl/inziendocument?id=ECLI:NL:GHAMS:2021:1870&showbutton=true&keyword=mensenhandel,0.0,['Hoger beroep'],02-07-2021,2021-07-02T13:07:20Z,gepubliceerd,['Strafrecht'],[],"Mensenhandel. Art. 273f Sr. Uitbuiting minderjarige kinderen door familieleden, door hen te laten stelen en hen te gebruiken bij pogingen tot diefstal d.m.v. wisseltruc.","Gerechtshof Amsterdam, 28-06-2021, 23-002599-19",ECLI:NL:GHAMS:2021:1870,28-06-2021,uitspraak,"[{'Vindplaats': 'Rechtspraak.nl', 'VindplaatsAnnotator': '', 'VindplaatsUrl': ''}]"
ECLI-NL-RBDHA-2019-9950,http://deeplink.rechtspraak.nl/uitspraak?id=ECLI:NL:RBDHA:2019:9950,uitspraak,De publicatie van de uitspraak staat gepland op 23-09-2019 om 09:56 uur,https://uitspraken.rechtspraak.nl/inziendocument?id=ECLI:NL:RBDHA:2019:9950&showbutton=true&keyword=mensenhandel,0.0,['Eerste aanleg - enkelvoudig'],23-09-2019,2019-09-23T09:56:50Z,gepubliceerd,['Bestuursrecht; Vreemdelingenrecht'],[],AA - Dublin Italië - geen aangifte mensenhandel binnen drie maanden - wel op wachtlijst - par B8/3.1. Vc - Dublinprocedure niet ten onrechte niet opgeschort - interstatelijk vertrouwensbeginsel - ongegrond,"Rechtbank Den Haag, 29-08-2019, NL19.18746",ECLI:NL:RBDHA:2019:9950,29-08-2019,uitspraak,"[{'Vindplaats': 'Rechtspraak.nl', 'VindplaatsAnnotator': '', 'VindplaatsUrl': ''}]"
ECLI-NL-GHAMS-2018-3573,http://deeplink.rechtspraak.nl/uitspraak?id=ECLI:NL:GHAMS:2018:3573,uitspraak,De publicatie van de uitspraak staat gepland op 11-10-2018 om 13:21 uur,https://uitspraken.rechtspraak.nl/inziendocument?id=ECLI:NL:GHAMS:2018:3573&showbutton=true&keyword=mensenhandel,0.0,"['Hoger beroep', 'Op tegenspraak']",11-10-2018,2018-10-11T13:21:04Z,gepubliceerd,['Strafrecht'],[],Mega 13Bandama. Vrijspraak mensenhandel en (gewoonte)witwassen. Onvoldoende (steun)bewijs. Verweer strekkende tot niet-ontvankelijkheid OM ivm uitbreiding pleegperiode ná uitvaardigen Europees Aanhoudingsbevel (EAB) feitelijke grondslag,"Gerechtshof Amsterdam, 28-09-2018, 23-005296-15",ECLI:NL:GHAMS:2018:3573,28-09-2018,uitspraak,"[{'Vindplaats': 'Rechtspraak.nl', 'VindplaatsAnnotator': '', 'VindplaatsUrl': ''}]"
ECLI-NL-HR-2018-1004,http://deeplink.rechtspraak.nl/uitspraak?id=ECLI:NL:HR:2018:1004,uitspraak,De publicatie van de uitspraak staat gepland op 27-06-2018 om 12:16 uur,https://uitspraken.rechtspraak.nl/inziendocument?id=ECLI:NL:HR:2018:1004&showbutton=true&keyword=mensenhandel,0.0,"['Artikel 81 RO-zaken', 'Cassatie']",27-06-2018,2018-06-27T12:16:54Z,gepubliceerd,['Strafrecht'],"[{'RelatieOmschrijving': 'Conclusie: ', 'LinkTekst': 'ECLI:NL:PHR:2018:433', 'Postfix': None, 'WebAdres': 'https://uitspraken.rechtspraak.nl/inziendocument?id=ECLI:NL:PHR:2018:433&showbutton=true&keyword=mensenhandel'}, {'RelatieOmschrijving': 'In cassatie op : ', 'LinkTekst': 'ECLI:NL:GHSHE:2015:1128', 'Postfix': ', Bekrachtiging/bevestiging', 'WebAdres': 'https://uitspraken.rechtspraak.nl/inziendocument?id=ECLI:NL:GHSHE:2015:1128&showbutton=true&keyword=mensenhandel'}]","Mensenhandel door slachtoffer te bewegen zich beschikbaar te stellen voor prostitutie, art. 273f Sr. Misbruik gemaakt van kwetsbare positie van slachtoffer? HR: art. 81.1 RO.","Hoge Raad, 26-06-2018, 15/01912",ECLI:NL:HR:2018:1004,26-06-2018,uitspraak,"[{'Vindplaats': 'RvdW 2018/800', 'VindplaatsAnnotator': '', 'VindplaatsUrl': ''}, {'Vindplaats': 'Rechtspraak.nl', 'VindplaatsAnnotator': '', 'VindplaatsUrl': ''}]"
ECLI-NL-RBGEL-2018-2791,http://deeplink.rechtspraak.nl/uitspraak?id=ECLI:NL:RBGEL:2018:2791,uitspraak,De publicatie van de uitspraak staat gepland op 25-06-2018 om 13:41 uur,https://uitspraken.rechtspraak.nl/inziendocument?id=ECLI:NL:RBGEL:2018:2791&showbutton=true&keyword=mensenhandel,0.0,['Eerste aanleg - meervoudig'],25-06-2018,2018-06-25T13:41:00Z,gepubliceerd,['Strafrecht'],"[{'RelatieOmschrijving': 'Hoger beroep: ', 'LinkTekst': 'ECLI:NL:GHARL:2020:6496', 'Postfix': ', (Gedeeltelijke) vernietiging en zelf afgedaan', 'WebAdres': 'https://uitspraken.rechtspraak.nl/inziendocument?id=ECLI:NL:GHARL:2020:6496&showbutton=true&keyword=mensenhandel'}]",Verdachte is vrijgesproken van mensenhandel (seksuele en criminele uitbuiting). De rechtbank heeft niet de overtuiging bekomen dat verdachte aangeefster daadwerkelijk in de prostitutie en criminaliteit wilde brengen.,"Rechtbank Gelderland, 25-06-2018, 05/780002-18",ECLI:NL:RBGEL:2018:2791,25-06-2018,uitspraak,"[{'Vindplaats': 'Rechtspraak.nl', 'VindplaatsAnnotator': '', 'VindplaatsUrl': ''}]"
ECLI-NL-GHARL-2013-8827,http://deeplink.rechtspraak.nl/uitspraak?id=ECLI:NL:GHARL:2013:8827,uitspraak,De publicatie van de uitspraak staat gepland op 22-11-2013 om 15:18 uur,https://uitspraken.rechtspraak.nl/inziendocument?id=ECLI:NL:GHARL:2013:8827&showbutton=true&keyword=mensenhandel,0.0,['Hoger beroep'],22-11-2013,2013-11-22T15:18:20Z,gepubliceerd,['Strafrecht'],"[{'RelatieOmschrijving': 'Eerste aanleg: ', 'LinkTekst': 'ECLI:NL:RBALM:2011:186', 'Postfix': ', Meerdere afhandelingswijzen', 'WebAdres': 'https://uitspraken.rechtspraak.nl/inziendocument?id=ECLI:NL:RBALM:2011:186&showbutton=true&keyword=mensenhandel'}, {'RelatieOmschrijving': 'Cassatie: ', 'LinkTekst': 'ECLI:NL:HR:2015:2467', 'Postfix': ', Bekrachtiging/bevestiging', 'WebAdres': 'https://uitspraken.rechtspraak.nl/inziendocument?id=ECLI:NL:HR:2015:2467&showbutton=true&keyword=mensenhandel'}]",Uitspraak Sneep 2. Veroordeling mensenhandel en criminele organisatie. Interpretatie artikel 273f eerste lid aanhef sub 6 Sr (Opzettelijk voordeel trekken uit de uitbuiting van een ander).,"Gerechtshof Arnhem-Leeuwarden, 22-11-2013, 21-000878-11",ECLI:NL:GHARL:2013:8827,22-11-2013,uitspraak,"[{'Vindplaats': 'Rechtspraak.nl', 'VindplaatsAnnotator': '', 'VindplaatsUrl': ''}]"
ECLI-NL-GHARL-2013-8818,http://deeplink.rechtspraak.nl/uitspraak?id=ECLI:NL:GHARL:2013:8818,uitspraak,De publicatie van de uitspraak staat gepland op 22-11-2013 om 14:30 uur,https://uitspraken.rechtspraak.nl/inziendocument?id=ECLI:NL:GHARL:2013:8818&showbutton=true&keyword=mensenhandel,0.0,['Hoger beroep'],22-11-2013,2013-11-22T14:30:20Z,gepubliceerd,['Strafrecht'],"[{'RelatieOmschrijving': 'Eerste aanleg: ', 'LinkTekst': 'ECLI:NL:RBALM:2011:184', 'Postfix': ', Meerdere afhandelingswijzen', 'WebAdres': 'https://uitspraken.rechtspraak.nl/inziendocument?id=ECLI:NL:RBALM:2011:184&showbutton=true&keyword=mensenhandel'}, {'RelatieOmschrijving': 'Cassatie: ', 'LinkTekst': 'ECLI:NL:HR:2015:2472', 'Postfix': ', Niet ontvankelijk', 'WebAdres': 'https://uitspraken.rechtspraak.nl/inziendocument?id=ECLI:NL:HR:2015:2472&showbutton=true&keyword=mensenhandel'}]",Uitspraak Sneep 2. Veroordeling mensenhandel. Vrijspraak criminele organisatie. Interpretatie artikel 273f eerste lid aanhef sub 6 Sr (Opzettelijk voordeel trekken uit de uitbuiting van een ander).,"Gerechtshof Arnhem-Leeuwarden, 22-11-2013, 21-002567-11",ECLI:NL:GHARL:2013:8818,22-11-2013,uitspraak,"[{'Vindplaats': 'Rechtspraak.nl', 'VindplaatsAnnotator': '', 'VindplaatsUrl': ''}]"
ECLI-NL-RBSGR-2010-BM2120,http://deeplink.rechtspraak.nl/uitspraak?id=ECLI:NL:RBSGR:2010:BM2120,uitspraak,De publicatie van de uitspraak staat gepland op 28-04-2010 om 12:30 uur,https://uitspraken.rechtspraak.nl/inziendocument?id=ECLI:NL:RBSGR:2010:BM2120&showbutton=true&keyword=mensenhandel,0.0,['Eerste aanleg - meervoudig'],28-04-2010,2010-04-28T12:30:29Z,gepubliceerd,['Strafrecht'],[],"Mensenhandel (en verkrachting, wederrechtelijk vrijheidsberoving, heling, diefstal met geweld en mishandeling). De rechtbank overweegt uitgebreid waarom zij de verklaringen van de slachtoffers betrouwbaar acht. Gevangenisstraf 6 jaar.","Rechtbank 's-Gravenhage, 22-04-2010, 09/535062-09 EN 09/660487-08",ECLI:NL:RBSGR:2010:BM2120,22-04-2010,uitspraak,"[{'Vindplaats': 'Rechtspraak.nl', 'VindplaatsAnnotator': '', 'VindplaatsUrl': ''}]"
ECLI-NL-RBNNE-2019-538,http://deeplink.rechtspraak.nl/uitspraak?id=ECLI:NL:RBNNE:2019:538,uitspraak,De publicatie van de uitspraak staat gepland op 18-02-2019 om 10:51 uur,https://uitspraken.rechtspraak.nl/inziendocument?id=ECLI:NL:RBNNE:2019:538&showbutton=true&keyword=mensenhandel,0.0,"['Eerste aanleg - meervoudig', 'Op tegenspraak']",18-02-2019,2019-02-18T10:51:19Z,gepubliceerd,['Strafrecht'],[],"Veroordeling voor mensenhandel tot een gevangenisstraf van 30 maanden.
Verdachte heeft zich gedurende een periode van ruim drie en een half jaar schuldig gemaakt aan mensenhandel ten aanzien van twee jonge Roemeense vrouwen. Beide slachtoffers waren verliefd op verdachte en zijn door hem op dusdanige wijze misleid en tegen elkaar uitgespeeld dat zij in hun angst hem (aan die ander) te verliezen, bereid waren prostitutiewerkzaamheden voor hem te verrichten en hun verdiensten aan hem af te staan.","Rechtbank Noord-Nederland, 08-02-2019, 18/730030-18",ECLI:NL:RBNNE:2019:538,08-02-2019,uitspraak,"[{'Vindplaats': 'Rechtspraak.nl', 'VindplaatsAnnotator': '', 'VindplaatsUrl': ''}]"
ECLI-NL-GHARL-2019-11294,http://deeplink.rechtspraak.nl/uitspraak?id=ECLI:NL:GHARL:2019:11294,uitspraak,De publicatie van de uitspraak staat gepland op 30-01-2020 om 12:20 uur,https://uitspraken.rechtspraak.nl/inziendocument?id=ECLI:NL:GHARL:2019:11294&showbutton=true&keyword=mensenhandel,0.0,['Hoger beroep'],30-01-2020,2020-01-30T12:20:04Z,gepubliceerd,['Strafrecht'],[],"Mensenhandel. Verdachte heeft zich schuldig gemaakt aan mensenhandel door zijn minderjarige vriendin ertoe te brengen tweemaal betaalde seks te hebben. Strafmaatoverweging. 

Alles afwegend, in het bijzonder de omstandigheid dat uit de informatie die het hof ter beschikking staat, kan worden opgemaakt dat een onvoorwaardelijke gevangenisstraf in dit geval juist niet in het belang van slachtoffer is, is het hof van oordeel dat een voorwaardelijke gevangenisstraf en een taakstraf van na te melden duur passend en geboden is.","Gerechtshof Arnhem-Leeuwarden, 30-01-2019, 21-007110-17",ECLI:NL:GHARL:2019:11294,30-01-2019,uitspraak,"[{'Vindplaats': 'Rechtspraak.nl', 'VindplaatsAnnotator': '', 'VindplaatsUrl': ''}]"
ECLI-NL-GHAMS-2016-2436,http://deeplink.rechtspraak.nl/uitspraak?id=ECLI:NL:GHAMS:2016:2436,uitspraak,De publicatie van de uitspraak staat gepland op 28-06-2016 om 10:01 uur,https://uitspraken.rechtspraak.nl/inziendocument?id=ECLI:NL:GHAMS:2016:2436&showbutton=true&keyword=mensenhandel,0.0,['Hoger beroep'],28-06-2016,2016-06-28T10:01:36Z,gepubliceerd,['Strafrecht'],[],"Mensenhandel. Officier van justitie niet-ontvankelijk ter zake van tenlastegelegde mensenhandel door vreemdeling in buitenland ten aanzien van buitenlands meisje in periode januari– april 2007, nu de verdachte niet op enig moment een vaste woon- of verblijfplaats in Nederland had. Artikel 5a (oud) Sr. Niet gebleken van afstand door verdachte van recht beroep te doen op specialiteitsbeginsel. Betrouwbaarheid verklaring slachtoffer. Geconstateerd vormverzuim nu getuige zonder aanwezigheid verdediging door politie is gehoord voor verhoor door rechter-commissaris.","Gerechtshof Amsterdam, 15-06-2016, 23-000590-14",ECLI:NL:GHAMS:2016:2436,15-06-2016,uitspraak,"[{'Vindplaats': 'Rechtspraak.nl', 'VindplaatsAnnotator': '', 'VindplaatsUrl': ''}]"
ECLI-NL-RBOBR-2015-4436,http://deeplink.rechtspraak.nl/uitspraak?id=ECLI:NL:RBOBR:2015:4436,uitspraak,De publicatie van de uitspraak staat gepland op 23-07-2015 om 13:55 uur,https://uitspraken.rechtspraak.nl/inziendocument?id=ECLI:NL:RBOBR:2015:4436&showbutton=true&keyword=mensenhandel,0.0,['Eerste aanleg - meervoudig'],23-07-2015,2015-07-23T13:55:12Z,gepubliceerd,['Strafrecht'],[],"Mensenhandel ten aanzien van drie minderjarige meisjes en een poging daartoe en ontucht met een van die meisjes (Schijndel, Gilze-Rijen, Sint-Michielsgestel). Vrijspraak van twee mensenhandel-delicten en een delict ex artikel 248a Sr.
Verdachte is verminderd toerekeningsvatbaar te achten.
Opgelegd wordt een gevangenisstraf voor de duur van 5 jaren met aftrek van voorarrest. (de eis van de officier van justitie was 8 jaar)
Niet-ontvankelijkverklaring van de benadeelde partij (in verband met vrijspraak van dat feit).","Rechtbank Oost-Brabant, 23-07-2015, 01/879330-13",ECLI:NL:RBOBR:2015:4436,23-07-2015,uitspraak,"[{'Vindplaats': 'Rechtspraak.nl', 'VindplaatsAnnotator': '', 'VindplaatsUrl': ''}]"
ECLI-NL-RBOBR-2013-6653,http://deeplink.rechtspraak.nl/uitspraak?id=ECLI:NL:RBOBR:2013:6653,uitspraak,De publicatie van de uitspraak staat gepland op 02-12-2013 om 13:47 uur,https://uitspraken.rechtspraak.nl/inziendocument?id=ECLI:NL:RBOBR:2013:6653&showbutton=true&keyword=mensenhandel,0.0,['Eerste aanleg - meervoudig'],02-12-2013,2013-12-02T13:47:19Z,gepubliceerd,['Strafrecht'],[],"Een gevangenisstraf van 48 maanden met aftrek voorarrest voor mensenhandel met betrekking tot twee vrouwen uit Roemenië, waaronder een 16-jarig meisje, en uit feitelijke verhoudingen voortvloeiend overwicht een persoon jonger dan 18 jaren opzettelijk bewegen tot het plegen of dulden van ontuchtige handelingen. Opheffing van de schorsing van de voorlopige hechtenis.
Toewijzing vordering benadeelde partij terzake immateriële schade en materiële schade betreffende gedwongen afgedragen inkomsten. 
De rechtbank beschouwt verdachte als de intitiatiefnemer van de mensenhandel.","Rechtbank Oost-Brabant, 02-12-2013, 01/849357-12",ECLI:NL:RBOBR:2013:6653,02-12-2013,uitspraak,"[{'Vindplaats': 'Rechtspraak.nl', 'VindplaatsAnnotator': '', 'VindplaatsUrl': ''}]"
ECLI-NL-RBSGR-2009-BH7646,http://deeplink.rechtspraak.nl/uitspraak?id=ECLI:NL:RBSGR:2009:BH7646,uitspraak,De publicatie van de uitspraak staat gepland op 25-03-2009 om 10:23 uur,https://uitspraken.rechtspraak.nl/inziendocument?id=ECLI:NL:RBSGR:2009:BH7646&showbutton=true&keyword=mensenhandel,0.0,['Eerste aanleg - meervoudig'],25-03-2009,2009-03-25T10:23:05Z,gepubliceerd,['Strafrecht'],[],"Mensenhandel. Verdachte heeft zich samen met een ander schuldig gemaakt aan mensenhandel. Verdachte heeft samen met zijn medeverdachte een meisje, dat de leeftijd van achttien jaar nog niet had bereikt, vervoerd voor werk in de prostitutie met als doel de uitbuiting van dit meisje. Daarnaast heeft hij voordeel getrokken uit de seksuele diensten die door het slachtoffer zijn verricht. Gevangenisstraf van 9 maanden met aftrek, waarvan 3 maanden voorwaardelijk met een proeftijd van 2 jaar. Zie ook BH6934.","Rechtbank 's-Gravenhage, 23-03-2009, 09/758513-08",ECLI:NL:RBSGR:2009:BH7646,23-03-2009,uitspraak,"[{'Vindplaats': 'Rechtspraak.nl', 'VindplaatsAnnotator': '', 'VindplaatsUrl': ''}]"
ECLI-NL-GHAMS-2021-1575,http://deeplink.rechtspraak.nl/uitspraak?id=ECLI:NL:GHAMS:2021:1575,uitspraak,De publicatie van de uitspraak staat gepland op 07-06-2021 om 11:20 uur,https://uitspraken.rechtspraak.nl/inziendocument?id=ECLI:NL:GHAMS:2021:1575&showbutton=true&keyword=mensenhandel,0.0,['Hoger beroep'],07-06-2021,2021-06-07T11:20:05Z,gepubliceerd,['Strafrecht'],[],Tewerkstelling arbeidsmigrant als kok. Vrijspraak mensenhandel nu (het oogmerk van) uitbuiting niet bewezen kan worden. Vrijspraak oplichting. Veroordeling medeplegen diefstal van het salaris van aangever en medeplegen witwassen.,"Gerechtshof Amsterdam, 07-01-2021, 23-001243-18",ECLI:NL:GHAMS:2021:1575,07-01-2021,uitspraak,"[{'Vindplaats': 'Rechtspraak.nl', 'VindplaatsAnnotator': '', 'VindplaatsUrl': ''}]"
ECLI-NL-HR-2019-772,http://deeplink.rechtspraak.nl/uitspraak?id=ECLI:NL:HR:2019:772,uitspraak,De publicatie van de uitspraak staat gepland op 21-05-2019 om 17:17 uur,https://uitspraken.rechtspraak.nl/inziendocument?id=ECLI:NL:HR:2019:772&showbutton=true&keyword=mensenhandel,0.0,"['Artikel 81 RO-zaken', 'Cassatie']",21-05-2019,2019-05-21T17:17:10Z,gepubliceerd,['Strafrecht'],"[{'RelatieOmschrijving': 'Conclusie: ', 'LinkTekst': 'ECLI:NL:PHR:2019:273', 'Postfix': None, 'WebAdres': 'https://uitspraken.rechtspraak.nl/inziendocument?id=ECLI:NL:PHR:2019:273&showbutton=true&keyword=mensenhandel'}]",Mensenhandel. Bewijsklacht dwangmiddelen a.b.i. 273f Sr en klachten over verwerping verweren m.b.t. (omvang) (im)materiële schade b.p. HR: art. 81.1 RO.,"Hoge Raad, 21-05-2019, 17/02561",ECLI:NL:HR:2019:772,21-05-2019,uitspraak,"[{'Vindplaats': 'RvdW 2019/652', 'VindplaatsAnnotator': '', 'VindplaatsUrl': ''}, {'Vindplaats': 'Rechtspraak.nl', 'VindplaatsAnnotator': '', 'VindplaatsUrl': ''}]"
ECLI-NL-RBAMS-2019-1418,http://deeplink.rechtspraak.nl/uitspraak?id=ECLI:NL:RBAMS:2019:1418,uitspraak,De publicatie van de uitspraak staat gepland op 06-03-2019 om 13:54 uur,https://uitspraken.rechtspraak.nl/inziendocument?id=ECLI:NL:RBAMS:2019:1418&showbutton=true&keyword=mensenhandel,0.0,"['Eerste aanleg - meervoudig', 'Op tegenspraak']",06-03-2019,2019-03-06T13:54:42Z,gepubliceerd,['Strafrecht'],[],Mensenhandel. Uitbuiting van illegale werknemers in wasserij/stomerij. Vonnis hersteld m.b.t. een kennelijke verschrijving ten aanzien van de beslissing op de vordering van een benadeelde partij.,"Rechtbank Amsterdam, 25-01-2019, 13-845156-15",ECLI:NL:RBAMS:2019:1418,25-01-2019,uitspraak,"[{'Vindplaats': 'Rechtspraak.nl', 'VindplaatsAnnotator': '', 'VindplaatsUrl': ''}]"
ECLI-NL-RBAMS-2019-1413,http://deeplink.rechtspraak.nl/uitspraak?id=ECLI:NL:RBAMS:2019:1413,uitspraak,De publicatie van de uitspraak staat gepland op 11-03-2019 om 10:17 uur,https://uitspraken.rechtspraak.nl/inziendocument?id=ECLI:NL:RBAMS:2019:1413&showbutton=true&keyword=mensenhandel,0.0,['Eerste aanleg - meervoudig'],11-03-2019,2019-03-11T10:17:28Z,gepubliceerd,['Strafrecht'],[],Mensenhandel. Uitbuiting van illegale werknemers in wasserij/stomerij. Vonnis hersteld m.b.t. een kennelijke verschrijving ten aanzien van de beslissing op de vordering van een benadeelde partij.,"Rechtbank Amsterdam, 25-01-2019, 13-993065-15",ECLI:NL:RBAMS:2019:1413,25-01-2019,uitspraak,"[{'Vindplaats': 'Rechtspraak.nl', 'VindplaatsAnnotator': '', 'VindplaatsUrl': ''}]"
ECLI-NL-RBNHO-2017-7507,http://deeplink.rechtspraak.nl/uitspraak?id=ECLI:NL:RBNHO:2017:7507,uitspraak,De publicatie van de uitspraak staat gepland op 07-09-2017 om 15:55 uur,https://uitspraken.rechtspraak.nl/inziendocument?id=ECLI:NL:RBNHO:2017:7507&showbutton=true&keyword=mensenhandel,0.0,['Eerste aanleg - meervoudig'],07-09-2017,2017-09-07T15:55:45Z,gepubliceerd,['Strafrecht'],[],"Vrijspraak mensenhandel, nu niet is bewezen dat verdachte het oogmerk had van (seksuele) uitbuiting. Veroordeling voor het in bezit hebben van een kinderpornografische afbeelding en een dierenpornografische afbeelding.","Rechtbank Noord-Holland, 07-09-2017, 1587128216",ECLI:NL:RBNHO:2017:7507,07-09-2017,uitspraak,"[{'Vindplaats': 'Rechtspraak.nl', 'VindplaatsAnnotator': '', 'VindplaatsUrl': ''}]"
ECLI-NL-GHAMS-2016-3153,http://deeplink.rechtspraak.nl/uitspraak?id=ECLI:NL:GHAMS:2016:3153,uitspraak,De publicatie van de uitspraak staat gepland op 03-08-2016 om 14:32 uur,https://uitspraken.rechtspraak.nl/inziendocument?id=ECLI:NL:GHAMS:2016:3153&showbutton=true&keyword=mensenhandel,0.0,['Hoger beroep'],03-08-2016,2016-08-03T14:32:04Z,gepubliceerd,['Strafrecht'],"[{'RelatieOmschrijving': 'Cassatie: ', 'LinkTekst': 'ECLI:NL:HR:2018:1942', 'Postfix': ', Bekrachtiging/bevestiging', 'WebAdres': 'https://uitspraken.rechtspraak.nl/inziendocument?id=ECLI:NL:HR:2018:1942&showbutton=true&keyword=mensenhandel'}]",Mensenhandel van Chinese kok. (Oogmerk van) uitbuiting bewezen nu sprake was van een ernstige inbreuk op de lichamelijke en geestelijke integriteit en de persoonlijke vrijheid van het slachtoffer.,"Gerechtshof Amsterdam, 29-07-2016, 23-001632-13",ECLI:NL:GHAMS:2016:3153,29-07-2016,uitspraak,"[{'Vindplaats': 'Rechtspraak.nl', 'VindplaatsAnnotator': '', 'VindplaatsUrl': ''}]"
ECLI-NL-RBMNE-2015-5642,http://deeplink.rechtspraak.nl/uitspraak?id=ECLI:NL:RBMNE:2015:5642,uitspraak,De publicatie van de uitspraak staat gepland op 13-08-2015 om 11:50 uur,https://uitspraken.rechtspraak.nl/inziendocument?id=ECLI:NL:RBMNE:2015:5642&showbutton=true&keyword=mensenhandel,0.0,['Eerste aanleg - meervoudig'],13-08-2015,2015-08-13T11:50:35Z,gepubliceerd,['Strafrecht'],[],Gevangenisstraf van 12 mnd waarvan 3 mnd voorwaardelijk voor diefstallen en mensenhandel. Verdachte zette jonge kinderen in voor het plegen van winkeldiefstallen en trok hier financieel voordeel uit.,"Rechtbank Midden-Nederland, 28-07-2015, 16-040515-14",ECLI:NL:RBMNE:2015:5642,28-07-2015,uitspraak,"[{'Vindplaats': 'Rechtspraak.nl', 'VindplaatsAnnotator': '', 'VindplaatsUrl': ''}]"
ECLI-NL-RBOBR-2015-604,http://deeplink.rechtspraak.nl/uitspraak?id=ECLI:NL:RBOBR:2015:604,uitspraak,De publicatie van de uitspraak staat gepland op 05-02-2015 om 13:48 uur,https://uitspraken.rechtspraak.nl/inziendocument?id=ECLI:NL:RBOBR:2015:604&showbutton=true&keyword=mensenhandel,0.0,['Eerste aanleg - meervoudig'],05-02-2015,2015-02-05T13:48:55Z,gepubliceerd,['Strafrecht'],[],"Veroordeling voor mensenhandel gedurende 4 maanden en mishandeling van hetzelfde slachtoffer, gepleegd in Geldrop.
Opgelegd wordt een gevangenisstraf voor de duur van 18 maanden met aftrek van voorarrest.","Rechtbank Oost-Brabant, 05-02-2015, 01/825496-12",ECLI:NL:RBOBR:2015:604,05-02-2015,uitspraak,"[{'Vindplaats': 'Rechtspraak.nl', 'VindplaatsAnnotator': '', 'VindplaatsUrl': ''}]"
ECLI-NL-GHARL-2014-2258,http://deeplink.rechtspraak.nl/uitspraak?id=ECLI:NL:GHARL:2014:2258,uitspraak,De publicatie van de uitspraak staat gepland op 20-03-2014 om 15:28 uur,https://uitspraken.rechtspraak.nl/inziendocument?id=ECLI:NL:GHARL:2014:2258&showbutton=true&keyword=mensenhandel,0.0,['Hoger beroep'],20-03-2014,2014-03-20T15:28:37Z,gepubliceerd,['Strafrecht'],[],"Onderzoek Boerdijk: Ontvankelijkheid OM/incompleet dossier/359a Sv/6EVRM. Mensenhandel. Criminele organisatie/duurzaam gestructureerd samenwerkingsverband onderneming. 
Onzorgvuldige en onvolledige dossiervorming/hersteld in appelfase.
Vrijspraak criminele organisatie.","Gerechtshof Arnhem-Leeuwarden, 18-03-2014, ks 21-000833-13",ECLI:NL:GHARL:2014:2258,18-03-2014,uitspraak,"[{'Vindplaats': 'Rechtspraak.nl', 'VindplaatsAnnotator': '', 'VindplaatsUrl': ''}]"
ECLI-NL-RBROT-2013-8588,http://deeplink.rechtspraak.nl/uitspraak?id=ECLI:NL:RBROT:2013:8588,uitspraak,De publicatie van de uitspraak staat gepland op 09-01-2014 om 11:49 uur,https://uitspraken.rechtspraak.nl/inziendocument?id=ECLI:NL:RBROT:2013:8588&showbutton=true&keyword=mensenhandel,0.0,['Eerste aanleg - meervoudig'],09-01-2014,2014-01-09T11:49:37Z,gepubliceerd,['Strafrecht'],[],Mensenhandel. Partiële nietigheid dagvaarding. In vereniging faciliteren prostitutie twee minderjarige meisjes en bezit cocaïne. Overschrijding redelijke termijn gecompenseerd door vermindering op te leggen straf. Gevangenisstraf gelijk aan voorarrest.,"Rechtbank Rotterdam, 24-10-2013, 10/750109-11",ECLI:NL:RBROT:2013:8588,24-10-2013,uitspraak,"[{'Vindplaats': 'NJFS 2014/89', 'VindplaatsAnnotator': '', 'VindplaatsUrl': ''}, {'Vindplaats': 'Rechtspraak.nl', 'VindplaatsAnnotator': '', 'VindplaatsUrl': ''}]"
ECLI-NL-RBOBR-2013-CA3422,http://deeplink.rechtspraak.nl/uitspraak?id=ECLI:NL:RBOBR:2013:CA3422,uitspraak,De publicatie van de uitspraak staat gepland op 19-06-2013 om 14:12 uur,https://uitspraken.rechtspraak.nl/inziendocument?id=ECLI:NL:RBOBR:2013:CA3422&showbutton=true&keyword=mensenhandel,0.0,['Eerste aanleg - meervoudig'],19-06-2013,2013-06-19T14:12:59Z,gepubliceerd,['Strafrecht'],[],"Een gevangenisstraf van twee jaren voor mensenhandel en opzetheling. Toewijzing vordering benadeelde partij tot een bedrag van € 109.460,-- in verband met immateriële schade en verdiensten uit prostitutie.","Rechtbank Oost-Brabant, 19-06-2013, 01/839657-10",ECLI:NL:RBOBR:2013:CA3422,19-06-2013,uitspraak,"[{'Vindplaats': 'Rechtspraak.nl', 'VindplaatsAnnotator': '', 'VindplaatsUrl': ''}]"
ECLI-NL-RBLIM-2013-CA0286,http://deeplink.rechtspraak.nl/uitspraak?id=ECLI:NL:RBLIM:2013:CA0286,uitspraak,De publicatie van de uitspraak staat gepland op 16-05-2013 om 12:39 uur,https://uitspraken.rechtspraak.nl/inziendocument?id=ECLI:NL:RBLIM:2013:CA0286&showbutton=true&keyword=mensenhandel,0.0,['Eerste aanleg - meervoudig'],16-05-2013,2013-05-16T12:39:21Z,gepubliceerd,['Strafrecht'],[],"Veroordeling tot (onvoorwaardelijke) gevangenisstraf van 20 maanden voor mensenhandel: uitbuiting van twee slachtoffers acht de rechtbank bewezen, ondanks het ontbreken van een aangifte van een van de slachtoffers.","Rechtbank Limburg, 07-05-2013, 03-700214-11",ECLI:NL:RBLIM:2013:CA0286,07-05-2013,uitspraak,"[{'Vindplaats': 'Rechtspraak.nl', 'VindplaatsAnnotator': '', 'VindplaatsUrl': ''}]"
ECLI-NL-RBUTR-2012-BW2290,http://deeplink.rechtspraak.nl/uitspraak?id=ECLI:NL:RBUTR:2012:BW2290,uitspraak,De publicatie van de uitspraak staat gepland op 13-04-2012 om 12:46 uur,https://uitspraken.rechtspraak.nl/inziendocument?id=ECLI:NL:RBUTR:2012:BW2290&showbutton=true&keyword=mensenhandel,0.0,['Eerste aanleg - meervoudig'],13-04-2012,2012-04-13T12:46:44Z,gepubliceerd,['Strafrecht'],[],"Poging tot zware mishandeling en medeplegen van mensenhandel. De rechtbank veroordeelt verdachte tot een gevangenisstraf van 20 maanden, waarvan 4 maanden voorwaardelijk met een proeftijd van twee jaar.","Rechtbank Utrecht, 06-04-2012, 16-600658-11",ECLI:NL:RBUTR:2012:BW2290,06-04-2012,uitspraak,"[{'Vindplaats': 'Rechtspraak.nl', 'VindplaatsAnnotator': '', 'VindplaatsUrl': ''}]"
ECLI-NL-GHSGR-2011-BR5629,http://deeplink.rechtspraak.nl/uitspraak?id=ECLI:NL:GHSGR:2011:BR5629,uitspraak,De publicatie van de uitspraak staat gepland op 25-08-2011 om 10:16 uur,https://uitspraken.rechtspraak.nl/inziendocument?id=ECLI:NL:GHSGR:2011:BR5629&showbutton=true&keyword=mensenhandel,0.0,['Hoger beroep'],25-08-2011,2011-08-25T10:16:39Z,gepubliceerd,['Strafrecht'],"[{'RelatieOmschrijving': 'Eerste aanleg: ', 'LinkTekst': 'ECLI:NL:RBSGR:2010:BL8022', 'Postfix': ', (Gedeeltelijke) vernietiging en zelf afgedaan', 'WebAdres': 'https://uitspraken.rechtspraak.nl/inziendocument?id=ECLI:NL:RBSGR:2010:BL8022&showbutton=true&keyword=mensenhandel'}]","Veroordeling, onder meer ter zake van mensenhandel.
OM deels niet-ontvankelijk in de vervolging i.v.m. “ne bis in idem"".
Gevangenisstraf 36 maanden, met aftrek van voorarrest..","Gerechtshof 's-Gravenhage, 25-08-2011, 22-001954-10 ",ECLI:NL:GHSGR:2011:BR5629,25-08-2011,uitspraak,"[{'Vindplaats': 'NJFS 2011/268', 'VindplaatsAnnotator': '', 'VindplaatsUrl': ''}, {'Vindplaats': 'Rechtspraak.nl', 'VindplaatsAnnotator': '', 'VindplaatsUrl': ''}]"
ECLI-NL-RBDHA-2019-7315,http://deeplink.rechtspraak.nl/uitspraak?id=ECLI:NL:RBDHA:2019:7315,uitspraak,De publicatie van de uitspraak staat gepland op 19-07-2019 om 11:33 uur,https://uitspraken.rechtspraak.nl/inziendocument?id=ECLI:NL:RBDHA:2019:7315&showbutton=true&keyword=mensenhandel,0.0,['Voorlopige voorziening'],19-07-2019,2019-07-19T11:33:12Z,gepubliceerd,['Bestuursrecht; Vreemdelingenrecht'],[],"Voorlopige voorziening connex aan bezwaar tegen de feitelijke overdracht aan Duitsland. De overdracht vindt plaats voordat verzoeker de mogelijkheid heeft gehad om aangifte te doen van mensenhandel. Het verzoek wordt afgewezen. 
De uitkomst in de Dublinprocedure staat voorop. 

Verweerder mag, indien de vreemdeling in Nederland niet tijdig voor zijn overdracht aangifte van mensenhandel heeft kunnen doen, er op grond van het interstatelijk vertrouwensbeginsel, zoals dat in het kader van de Dublinprocedure in rechte is komen vast te staan, op vertrouwen dat Duitsland zijn Unierechtelijke en (andere) internationale verplichtingen zal nakomen, ook ten opzichte van verzoeker, en dat hieruit volgt dat verweerder ervan uit mag gaan dat verzoeker in Duitsland alsnog in de gelegenheid zal worden gesteld om aangifte te doen van mensenhandel. De belangen van verzoeker zijn in zoverre ook bij die verantwoordelijke lidstaat gewaarborgd.","Rechtbank Den Haag, 17-07-2019, AWB 19/5384",ECLI:NL:RBDHA:2019:7315,17-07-2019,uitspraak,"[{'Vindplaats': 'Rechtspraak.nl', 'VindplaatsAnnotator': '', 'VindplaatsUrl': ''}]"
ECLI-NL-RBMNE-2013-3037,http://deeplink.rechtspraak.nl/uitspraak?id=ECLI:NL:RBMNE:2013:3037,uitspraak,De publicatie van de uitspraak staat gepland op 29-07-2013 om 10:54 uur,https://uitspraken.rechtspraak.nl/inziendocument?id=ECLI:NL:RBMNE:2013:3037&showbutton=true&keyword=mensenhandel,0.0,['Voorlopige voorziening'],29-07-2013,2013-07-29T10:54:30Z,gepubliceerd,['Bestuursrecht'],[],"Voorlopige voorziening over sluiting van seksinrichting. Het zwaartepunt in deze procedure ligt, mede gelet op het korte tijdsbestek, op de vraag of er binnen de seksinrichting aanwijzingen zijn voor mensenhandel. Dit is een lichte bewijsmaatstaf. In het besluit en de bestuurlijke rapportage worden indicatoren van mensenhandel genoemd. Verzoekster moet alert zijn op het signaleren van deze indicatoren. Bij verzoekster werkten twee managers. De voorzieningenrechter is van oordeel dat het gedrag van deze managers voor rekening van verzoekster komt.
Uit de rapportage en de (deels) geheime onderliggende stukken blijkt dat de managers extra betalingen voor de huur van kamers hebben aangenomen. Dit is een indicatie van mensenhandel. Verder heeft verweerder melding gemaakt van zes onderzoeken naar mensenhandel die tot vijf veroordelingen hebben geleid. Omdat in ieder geval enige elementen tot verzoekster herleidbaar zijn, hecht de voorzieningenrechter geloof aan de verklaring ter zitting van verweerder dat al deze vonnissen en mensenhandelonderzoeken in relatie tot verzoekster staan. Dat betekent dat er binnen de organisatie van verzoekster aanwijzingen van mensenhandel zijn. Die hadden moeten worden voorkomen of, als het gaat om derden, hadden moeten worden gemeld aan de gemeente en/of de politie. Gelet op het systeem van de APV en de Handhavingsstrategie Seksinrichtingen van de gemeente Utrecht leidt dit ertoe dat verweerder maar één ding kan beslissen en dat is intrekking van de lopende vergunningen en weigering van nieuwe vergunningen van deze exploitant. In de belangenafweging die de voorzieningenrechter moet maken tussen aan de ene kant de keuze dat de ramen nog enige tijd mogen worden geëxploiteerd totdat op het bezwaar van verzoekster is beslist, met alle belangen die de organisatie en de vrouwen daarbij hebben, en aan de andere kant de keuze dat de ramen per 25 juli 2013 moeten sluiten, met de openbare belangen in verband met mensenhandel die de gemeente behartigt, geven die laatste belangen de doorslag","Rechtbank Midden-Nederland, 24-07-2013, : UTR 13/3639 UTR 13/3641",ECLI:NL:RBMNE:2013:3037,24-07-2013,uitspraak,"[{'Vindplaats': 'Rechtspraak.nl', 'VindplaatsAnnotator': '', 'VindplaatsUrl': ''}]"
ECLI-NL-RBSGR-2006-AX6793,http://deeplink.rechtspraak.nl/uitspraak?id=ECLI:NL:RBSGR:2006:AX6793,uitspraak,De publicatie van de uitspraak staat gepland op 09-06-2006 om 10:58 uur,https://uitspraken.rechtspraak.nl/inziendocument?id=ECLI:NL:RBSGR:2006:AX6793&showbutton=true&keyword=mensenhandel,0.0,"['Bodemzaak', 'Eerste aanleg - enkelvoudig', 'Schadevergoedingsuitspraak']",09-06-2006,2006-06-09T10:58:15Z,gepubliceerd,['Bestuursrecht; Vreemdelingenrecht'],[],"Bewaring / mensenhandel / aanbieden procedure B9 na inbewaringstelling.
Op grond van onderdeel B9 Vc 2000 wordt aan vermoedelijke slachtoffers van mensenhandel een periode gegund van maximaal drie maanden waarbinnen zij een beslissing moeten nemen of zij aangifte willen doen van mensenhandel of dat zij hiervan afzien. Gedurende die periode wordt hun verwijdering uit Nederland opgeschort en houden zij rechtmatig verblijf in Nederland op grond van artikel 8, onder k, Vw 2000. Reeds bij een geringe aanwijzing dat er sprake is van mensenhandel dient de betrokken korpschef de vreemdeling die het betreft te wijzen op de mogelijkheid tot het doen van aangifte. Uit de stukken blijkt dat eiser de B9-procedure is aangeboden nadat hij in bewaring is gesteld. Anders dan eiser heeft betoogd, is in het hiervoor geschetste samenstel van rechtsregels naar het oordeel van de rechtbank geen aanknopingspunt te vinden voor de juistheid van het standpunt dat verweerder niet tot inbewaringstelling mocht overgaan alvorens de B9-procedure aan te bieden. Dat op het moment van aantreffen van eiser reeds een aanwijzing bestond dat hij slachtoffer was van mensenhandel doet hier niet aan af. Dit feit zegt op zichzelf niets over het moment waarop verweerder de B9-procedure dient aan te bieden. Daarbij acht de rechtbank van belang dat ook mogelijke slachtoffers van mensenhandel een eigen verantwoordelijkheid hebben ten aanzien van de – illegale - status van hun verblijf. De B9-procedure staat hen daarbij ten dienste. Verder is onweersproken gebleven dat eiser zich op het moment dat hij werd aangetroffen illegaal in Nederland bevond. Tenslotte heeft verweerder ter zitting medegedeeld dat eiser op het moment dat hem de procedure werd aangeboden onmiddellijk te kennen heeft gegeven geen aangifte te willen doen. Van de zijde van eiser is dit niet betwist. Beroep ongegrond, afwijzing verzoek om schadevergoeding.","Rechtbank 's-Gravenhage, 24-05-2006, AWB 06/22950",ECLI:NL:RBSGR:2006:AX6793,24-05-2006,uitspraak,"[{'Vindplaats': 'JV 2006/302', 'VindplaatsAnnotator': '', 'VindplaatsUrl': ''}, {'Vindplaats': 'Rechtspraak.nl', 'VindplaatsAnnotator': '', 'VindplaatsUrl': ''}]"
ECLI-NL-RBDHA-2019-6206,http://deeplink.rechtspraak.nl/uitspraak?id=ECLI:NL:RBDHA:2019:6206,uitspraak,De publicatie van de uitspraak staat gepland op 20-06-2019 om 09:57 uur,https://uitspraken.rechtspraak.nl/inziendocument?id=ECLI:NL:RBDHA:2019:6206&showbutton=true&keyword=mensenhandel,0.0,['Voorlopige voorziening'],20-06-2019,2019-06-20T09:57:51Z,gepubliceerd,['Bestuursrecht; Vreemdelingenrecht'],[],"Nieuwe handelwijze verweerder –  geen verzet tegen toewijzen verzoek om voorlopige voorziening in verband met het doen van aangifte mensenhandel tijdens de Dublin-procedure.

Tijdens de behandeling ter zitting op 18 juni 2019 is door verweerder aangegeven dat er inmiddels een nieuwe handelwijze is met betrekking tot de overdracht van vreemdelingen die aangifte willen doen van mensenhandel. Indien de vreemdeling te kennen geeft aangifte te willen doen van mensenhandel, maar daartoe (nog) niet de mogelijkheid heeft omdat de politie te weinig menskracht heeft om de aangifte op te kunnen nemen, zal verweerder niet tot de feitelijke overdracht overgaan zolang de vreemdeling niet in de gelegenheid is gesteld om daadwerkelijk aangifte te doen. 
 De rechtbank begrijpt de uitleg van verweerder ter zitting aldus dat deze handelwijze alleen wordt toegepast als de vreemdeling van aanvang af en serieus te kennen heeft gegeven daadwerkelijk aangifte te willen doen van mensenhandel. Voor zover de vreemdeling enkel aangeeft hierover te willen nadenken of eerst nadat de aanvraag buiten behandeling is gesteld omdat een andere lidstaat verantwoordelijk is gebleken voor de behandeling van de asielaanvraag de wens om naar de politie te gaan uit, zal de dublin-procedure wel worden voortgezet en zal verweerder zich verzetten tegen toewijzing van het verzoek om een voorlopige voorziening.
De nieuwe handelwijze van verweerder ziet er op dat onder omstandigheden, ondanks dat verweerder zich hiertoe juridisch niet gehouden acht, de bereidheid bestaat om de vreemdeling in staat te stellen om aangifte te doen van mensenhandel (…).","Rechtbank Den Haag, 18-06-2019, NL19.12053",ECLI:NL:RBDHA:2019:6206,18-06-2019,uitspraak,"[{'Vindplaats': 'Rechtspraak.nl', 'VindplaatsAnnotator': '', 'VindplaatsUrl': ''}]"
